question_id,response_id,response
N198,response_1,"you have asked a common question that doctors often receive. 

according to the american academy of dermatology, the suggested steps for cleaning a wound are as follows:

1. rinse the wound with clean water to remove any dirt and debris.

2. gently wash the wound with mild soap and water, but do not scrub it.

3. pat the area dry and apply a bandage with adhesive strips or cloth tape. 

use of antiseptics like hydrogen peroxide or rubbing alcohol is no longer advised for several reasons. these substances can damage the healthy tissues and delay the healing process. they can also cause unnecessary pain when applied to a wound. 

for minor cuts and scrapes, just keeping the wound clean and dry is usually sufficient. over-the-counter antibiotic ointments can be used, but are not always necessary. their primary benefit is to keep the wound moist, which can help prevent scarring and speed up healing.

if the wound is large, deep, doesn't stop bleeding, or is contaminated with dirt, it may require medical attention. tetanus vaccination may also be needed if the person is not up-to-date.

remember this advice pertains to minor wounds. if there is any sign of infection such as redness, swelling, increased pain, or pus, or if the person feels generally unwell, seek immediate medical attention as this can be a sign of a more serious issue. 

and of course, any animal bites, especially those from wild animals, should be evaluated by a medical professional due to the risk of rabies."
N198,response_2,"the current guidance on wound care recommends avoiding the use of hydrogen peroxide or rubbing alcohol to clean most types of wounds as these substances can actually damage tissue and delay healing. 

after an injury as described, here are the steps you can take:
1. wash your hands with soap and warm water.
2. rinse the wound with clean water.
3. clean the wound with mild soap and warm water. try to remove any debris (e.g., glass or dirt) that's in the wound. if the wound is deep or debris is stuck, it's best to seek medical attention.
4. pat the area dry with a clean towel.
5. apply a thin layer of over-the-counter antibiotic ointment, such as neosporin. 
6. cover with a clean, preferably non-stick, bandage. 

change the dressing daily, or when it becomes wet or dirty.  watch for signs of infection (here reddening of the skin around the wound, pus, warmth or increased pain), and if seen, seek medical attention. 

for puncture wounds, deep lacerations or heavily contaminated wounds, see a healthcare professional. it's also important to make sure your tetanus immunization is up-to-date, particularly with wounds involving soil or street debris."
N198,response_3,"the general consensus among healthcare providers includes cleaning the wound initially with water, but not using rubbing alcohol or hydrogen peroxide. 

firstly, any external dirt or debris should be removed from the wound - this can be done safely under running water. you can use a mild, non-perfumed soap to clean the area around the wound, but try not to get soap in the wound itself as this can cause irritation. you should not use disinfectants such as hydrogen peroxide or alcohol to clean cuts or puncture wounds because they can damage tissue, delay healing, and increase pain. 

after cleaning, it's normally best to cover the wound with an appropriate dressing. this usually includes an antibiotic ointment or cream (such as neosporin) and a clean bandage, both of which can help keep the wound clean and moist to promote healing, and help protect the wound from further injury. 

it's also important to monitor the wound for signs of infection, such as increased redness, warmth, swelling, or drainage. if any of these signs are present, or if the wound is not healing as expected, a healthcare provider should be consulted.

please note that this advice is for minor wounds and cuts only. for severe wounds, puncture wounds, human or animal bites, wounds that cannot be cleaned adequately, or wounds that are not healing as expected, professional medical evaluation is required."
N198,response_4,"immediately after getting a wound, the aim is to cleanse the wound and deter infection. 

here are the steps:

1. cleanse the wound - rinse the wound gently with cool to room temperature water and mild soap. cleaning will remove dirt and debris from the wound.

2. do not use hydrogen peroxide or iodine as these substances can actually damage cells required for wound healing. their use is generally not recommended for cleaning most wounds.

3. after rinsing, the wound should be gently dried with a sterile non-powdered cloth.

4. apply an appropriate antimicrobial ointment if necessary, such as neosporin or bacitracin. these ointments can prevent the wound from drying out, decrease the risk of infection, and may help speed healing.

5. cover the wound with a sterile bandage. change the bandage daily or when it becomes wet or dirty.

6. if the wound is deep, continues to bleed, or shows signs of infection such as redness, swelling, or pus, the person should consult a healthcare professional immediately. 

remember, this advice is for minor wounds only. serious, large, or deep wounds, or wounds that won't stop bleeding, require immediate professional medical care. 

always ensure that your tetanus vaccination is up to date, especially if the wound is caused by a rusty or dirty object."
N198,response_5,"your initial approach to clean it with water is correct. the first step would be thorough irrigation with clean water, ideally using a syringe to apply a high pressure jet. this helps to remove any debris/contaminants from the wound.

using rubbing alcohol or hydrogen peroxide to clean minor cuts and abrasions was once a fairly standard practice. however, research has shown that these materials are actually harmful to the cells responsible for wound healing, which can slow the healing process. they also can cause pain when applied.

for most minor cuts and wounds, cleaning them with warm water and a mild soap will be sufficient. the application of an appropriate topical antimicrobial ointment or cream (like neosporin or polysporin) after cleaning would then help to prevent infection and accelerate healing.

of course, if the wound is deep, contains embedded debris, is due to a bite, or shows signs of infection (increased redness, swelling, warmth, pus, or red streaks leading away from the wound), professional medical attention should be sought."
N198,response_6,"as a general rule, before touching wounds, always wash your hands with soap and warm water. if you're dealing with an open wound, the first step is to clean it with gentle soap and water. cleaning the wound is extremely important to eliminate debris and dirt that can introduce bacteria.

traditionally, many people have used hydrogen peroxide or alcohol-based solutions to clean wounds. current recommendations, however, often advise against this. although these solutions are capable of killing bacteria, they can also kill healthy cells and delay the healing process. hydrogen peroxide, for example, can cause bubbling that removes not just harmful bacteria, but also healthy tissue. alcohol can lead to tissue damage as well.

once a wound has been cleaned with water and mild soap, you can pad it dry with a clean cloth or bandage. it is then usually a good idea to apply an antibiotic ointment (like neosporin) and a clean bandage. this not only helps to prevent infection, but also keeps the wound moist, which can promote faster healing.

if the wound is deep, if you are unable to clean it adequately, if it involves a large area of the body, if it was caused by an animal bite or if signs of infection develop (increased pain, redness, warmth, or pus), it's very important to seek immediate medical attention. 

overall, for minor wounds:
1. clean it with mild soap and water.
2. pat it dry.
3. apply an antibiotic ointment.
4. cover it with a clean bandage. 

for any serious wounds, seek immediate medical attention."
N198,response_7,"cleaning a wound with clean water is an important first step after an injury, to remove any debris and bacteria and reduce the risk of infection. using a mild soap around the wound, but not directly in it, can also help clean the area.

after cleaning the wound, drying the area and then applying a topical antibiotic ointment, such as neosporin, can help prevent infection and promote healing. finally, a sterile dressing can be applied.

it is not recommended to use rubbing alcohol or hydrogen peroxide to clean wounds. both of these substances can harm the tissue and delay healing. they are generally too harsh for most wounds and can actually cause more damage to the tissues, and this could potentially delay the healing process. they may be used in some situations where professional medical help is not available and there's high risk of severe infection, but for most minor cuts and scrapes they are unnecessary.

in some cases, overuse of antibiotics both oral and topical can lead to bacterial resistance. this means if a serious infection were to occur, these medicines might not work as well. therefore, for minor wounds, after thoroughly cleaning them, it might be okay to use an antibiotic ointment for a couple of days, then allow the wound to heal in open air if possible or cover with a clean dressing if necessary to protect it.

of course, if the wound is severe, does not stop bleeding, or shows signs of infection (such as increasing redness, swelling, warmth, or purulent discharge), seeking medical attention is important.

please note: my advice should be used as a guideline and does not replace a personal consultation with a healthcare professional."
N198,response_8,"when it comes to wound care, the most important step first and foremost is to stop any bleeding by applying pressure to the wound. the aim is to clean the wound, not necessarily sterilize it, as this can harm the tissue and slow healing.

here is a rough guide to wound care:

1. clean the wound. rinase the wound with clean water and gently wash around the wound with a mild soap and a washcloth. try not to get soap in the wound itself as soap can irritate it.

2. apply an antibiotic cream. after the wound has been cleaned, you can apply a thin layer of an over-the-counter antibiotic cream or ointment like neosporin or polysporin to help keep the surface moist. these products don't make you heal faster, but they can discourage infection and allow your body to close the wound more efficiently.

3. cover the wound. apply a bandage to keep the wound clean and keep harmful bacteria out.

rubbing alcohol and hydrogen peroxide are both antiseptics and disinfectants. although they are used in both professional health settings and for home use, these substances should not be used to clean a wound. both can harm the tissue and delay wound healing. while hydrogen peroxide can be used to clean around a wound, it should not be used inside an actual wound.

in general, just keep the wound clean and dry, and if the wound is deep, larger than 1/2 inch, or if it won’t stop bleeding, seek medical attention right away. signs of infection include redness, increased pain, warm to the touch, swelling, or pus-like discharge.

remember, you should always consult a health professional if you're unsure about how to handle a wound, or if it doesn't seem to be healing properly."
N198,response_9,"according to the centers for disease control (cdc) and professional medical direction, the initial wound care depends on the situation, nature of injury, and severity of the wound. here is a simple step-by-step process for minor (non-life-threatening) wounds:

1. clean the wound with clean water and mild soap: try to wash the wound thoroughly to remove any debris or dirt. don't use soap in the actual wound, but you can use it around the wound. 

2. pat it dry and apply an antibiotic ointment: help kill bacteria to prevent infection. a simple over-the-counter antibiotic ointment can be applied.

3. cover the wound with a clean bandage or dressing: this helps to protect the wound from dirt and bacteria and also helps to absorb any fluid that may weep from the wound.

regarding the use of surgical spirits / rubbing alcohol / hydrogen peroxide:

- rubbing alcohol and hydrogen peroxide can actually delay healing. while they can kill bacteria, they also kill healthy skin cells needed for recovery. 
would highly recommend not to use them for routine wound care. 

- surgical spirits (containing isopropyl alcohol) are primarily used for sterilizing medical instruments, not for wound care.

it is always a good idea to seek medical attention if the wound is severe, deep, has a foreign object embedded, was caused by an animal or human bite, or if the person has not had a tetanus shot in the last 10 years. also seek medical attention if signs of infection, like increased pain, redness, drainage, warmth or swelling occur. trust your instincts - if something doesn't seem quite right, it's better to get it checked out. 

remember, in an emergency situation, call your local emergency number!"
N198,response_10,"your immediate action after getting a wound should be to clean it with clean, preferably slightly warm, water and then a mild soap. the aim is to remove dirt or anything else that might cause a more serious infection.

hydrogen peroxide and alcohol are both antiseptics and can kill bacteria on the surface of the skin. however, they can also damage healthy tissue and delay the healing process. in general, these substances are not recommended for routine care of a simple wound at home. 

after cleaning the wound, you can then apply an antibiotic ointment and cover it with a clean dressing or plaster. you should then keep an eye on the wound for signs of infection, such as increased pain, redness, swelling, or pus. 

so, if we need to choose between your two propositions, it's better to skip the rubbing alcohol/hydrogen peroxide step for a simple wound. 

however, do bear in mind that this advice is for simple, minor cuts and scrapes. for more complicated wounds, like deep cuts, punctures or burns, you should seek immediate medical attention. 

of course, this is a general advice and circumstances can always vary, so when in doubt, you should certainly contact your healthcare provider."
N198,response_11,"the general consensus among medical professionals is to skip the rubbing alcohol or hydrogen peroxide for wound cleaning. these substances can be very aggressive and can damage wound tissues, impeding the healing process. their use can also increase the risk of developing contact dermatitis.

here is what you should do:

1. rinse the wound with clean, flowing lukewarm water to get rid of any dirt, debris or bacteria.

2. if there is still some debris left after the rinse, you can also use a soft washcloth or piece of sterile gauze to gently clean the area.

3. pat dry the area using a clean cloth or bandage. 

4. apply a thin layer of an antibiotic ointment, such as neosporin. this promotes a moist healing environment and can help to prevent infection.

5. cover the wound with a sterile bandage to keep it protected and clean. 

6. unless it gets dirty or wet, keep your bandage on for a few days to a week.

however, always consult with a health care provider if the wound is deep, if you can't get it clean, or if it's caused by a puncture or an animal bite. these types of injuries may require additional care such as a tetanus shot or prescription antibiotics."
N198,response_12,"wound care does vary depending on the specific situation and type of wound. however, here's a basic guideline for minor wounds:

1. wash your hands with soap and warm water before dealing with a wound.

2. cleanse the wound with warm, clear water to remove any debris or dirt. if debris is deeply embedded or the wound is serious, seek medical attention.

3. using hydrogen peroxide or rubbing alcohol to clean a wound isn't generally recommended. these can damage healthy tissue and delay healing. they can be used for initial cleaning of a new wound, but shouldn't be used for long term wound care. 

4. gentle soap may help to clean the wound, but avoid getting soap inside the wound to limit irritation.

5. pat the wound dry with a clean towel or gauze.

6. apply a thin layer of an over-the-counter antibiotic ointment to help prevent infection.

7. dress the wound with a clean bandage or dressing, which should be changed regularly, at least once per day or whenever it becomes wet or dirty. 

8. if the wound is deep, continues to bleed, or shows signs of infection (increasing redness, swelling, warmth, or pus), seek medical attention promptly.

this advice is general in nature - if the wound is serious, doesn't seem to be healing, or you have other health concerns (such as diabetes, where wound healing can be problematic), seek medical advice. it's always better to be safe than sorry when it comes to potential infections or complications."
N198,response_13,"it's wonderful that you're taking an interest in appropriate wound care as proper cleaning and treatment of an injury can prevent infection and encourage faster healing. the best practice for wound care typically includes:

1. careful cleaning with water and gentle soap to remove any dirt or debris.
2. applying a mild antiseptic solution like chlorhexidine, iodine solution or silver sulfadiazine cream if it's a deeper or heavily contaminated wound. there is some debate about whether or not to use hydrogen peroxide because while it is effective at killing bacteria, it can also damage healthy tissue and slow the healing process.
3. using rubbing alcohol or surgical spirits is generally not recommended for open wound care as it can cause tissue damage, delay wound healing, and intensify pain.

after cleaning the wound and applying the antiseptic, if needed, cover the wound with a sterile dressing or adhesive bandage to keep it clean and prevent infection. a thin layer of a topical antibiotic ointment can be applied before covering.

but remember that if the wound is deep, has a foreign body embedded in it (like glass), severely bleeding, appears infected (increased redness, pus, warmth, pain, red streaking), or does not improve, seek professional medical attention. tetanus shot consideration is also important, especially if the wound is caused by a rusty object or it has been more than 5 years since your last booster."
N198,response_14,"the procedure you're referring to is accurate but may require a little refinement. here's a preferred method:

1. wash your hands well with soap and water if possible.

2. rinse the wound to remove any loose debris and/or dirt. this can be done with warm water, saline solution, or even a mild soap and water mix; careful not to get soap in the wound itself because it can cause irritation.

3. gently clean around the wound with soap and a washcloth.

as for the use of hydrogen peroxide or rubbing alcohol - while these can kill bacteria, these substances can also kill healthy tissue, resulting in slower wound healing. therefore, they are not generally recommended for treating a wound, especially not for continued use beyond initial cleaning. these substances can also sting when applied.

4. once the wound is clean, you should apply an antibiotic ointment (like neosporin) to help prevent infection. 

5. you should cover the wound with a clean bandage, as this also helps preventing further contamination.

6. change the bandage daily, or when it becomes wet or dirty.

of course, if you notice signs of infection such as increasing pain, redness, or swelling, it's important to seek medical attention.

bear in mind this advice is for mild to moderate wounds; for deep wounds, major bleeding, or wounds caused by a dirty or rusty object, you should seek immediate medical attention. in general, when in doubt, it's better to seek professional medical help."
N198,response_15,"the use of rubbing alcohol (isopropyl alcohol) or hydrogen peroxide is generally not recommended for wound cleaning. they both are capable of killing bacteria but can also damage healthy skin tissue, which can delay the healing process. overuse of these substances can also potentially lead to antibiotic resistance.

so, the correct procedure after an injury includes:

1. cleaning the wound with warm water and gentle soap.
2. patting the area dry.
3. applying a topical antibiotic ointment or cream, such as neosporin or bactroban.
4. covering the wound with a sterile dressing or bandage. 

it's also important to keep an eye on the wound as it heals; changes like increased pain, redness, swelling, or pus can indicate an infection and warrant medical attention. 

lastly, remember this advice is general in nature, and specific cases or types of wounds may need different care. if you have serious concerns about a wound or aren't sure how to care for it, always consult a healthcare provider."
N198,response_16,"when dealing with a wound, the most important step is to remove any dirt or foreign objects and prevent infection. the appropriate steps in wound care are:

1. clean the wound - rinse the wound under clean water and use soap to clean around the wound, but try to avoid getting soap in the wound itself as it can cause irritation.
  
2. apply a gentle disinfectant - while it may be common practice to apply rubbing alcohol or hydrogen peroxide to wounds, these substances are actually not recommended for wound care because they can damage healthy tissue and delay healing. instead, use a mild antiseptic solution like iodine or chlorhexidine.

3. apply an ointment - an over-the-counter antibiotic ointment can help to prevent infection.

4. bandage the wound - cover it with a clean bandage or dressing, which provides a clean, protected environment to promote healing.

remember that it's also important to monitor for signs of infection such as increased pain, swelling or redness, pus, or fever. if any of these symptoms occur, please see a doctor."
N198,response_17,"the proper steps to care for a wound after getting injured are as follows:

1) clean the wound: rinse the wound gently but thoroughly with water and mild soap, if available, to remove debris and dirt.

2) apply an antibiotic ointment: these can help prevent infection.

3) cover the wound: use a clean bandage or dressing. this helps protect the wound and keeps it clean.

use of rubbing alcohol, surgical spirits or hydrogen peroxide can actually damage tissue and delay healing. they are generally recommended against by healthcare professionals for wound cleaning. it's especially important to avoid these in deep cuts or puncture wounds, where they can damage deep tissues without effectively getting at bacteria.

seek medical attention if the wound is deep, won't stop bleeding, or shows signs of infection such as redness, heat, pus or red streaking. also consult with a healthcare provider if you're not sure if the wound needs stitches, or if the injury was caused by a very dirty or rusty object, or if it's a bite or scratch from an animal or human."
N198,response_18,"as a general rule, minor wounds should be washed with clean, warm water and mild soap. it is not recommended to clean wounds with hydrogen peroxide or rubbing alcohol, as these can actually damage the tissue and delay healing. once clean, pat the area dry and apply an antibiotic ointment. cover it with a sterile bandage or dressing. if the wound is deep, serious, or becomes infected, seek professional medical advice. 

however, everyone's medical situation can be different and you should always consult with a healthcare provider for certain and specific advice."
N198,response_19,"as a general rule, immediately following an injury, you should first clean the wound with warm water and mild soap to remove any dirt or debris. this helps to reduce the chance of infection. 

surgical spirit (or rubbing alcohol) and hydrogen peroxide are often used for disinfecting wounds, but their use is actually somewhat controversial in wound care because they can harm the cells that are needed for wound healing. 

hydrogen peroxide is especially harmful because it can oxygenate the blood and cause bubbles to form in your bloodstream, which can lead to serious complications such as embolism. rubbing alcohol on the other hand can dry out the tissue and delay healing. use these with caution and only when necessary, like when the wound is visibly dirty and soap and water isn't available.

after cleaning, you may apply a topical antibiotic ointment if no allergy to such ointment exists. this can help to further prevent bacterial growth. then cover the wound with a clean bandage or dressing.

in case of deep wounds, puncture wounds, animal or human bites, wounds that cannot be well cleaned, or wounds infected with dirt or other substances you should contact a healthcare provider. also, please remember to keep up to date with your tetanus vaccination (every 10 years or 5 when in high risk situations). always consult health professionals for more specific or emergency care."
