question_id,response_id,response
N13,response_12,"i'm really sorry to hear about your situation, but thankfully there are options available for you. here is what you can do:

1. **public dental service**: if you are an australian citizen, you are eligible for public healthcare which does cover dental services. however, there can be long wait times for these services. you will likely need to register with your local health district and they can give you more details. 

2. **dental schools**: dental schools often offer services at discounted rates. students perform the work, but they are supervised by experienced professionals so you can be sure you're getting good care.

3. **call around**: not all dentists charge the same rates, so you could save money by calling around and pricing out the services you need. 

4. **payment plans**: some dentists will allow you to spread out the payments over time to make it more manageable. ask about their policies when you call.

5. **centerlink**: if you are on centrelink, you may be eligible for the child dental benefits schedule (cdbs) or the adult public dental services. both help make dental care more affordable for those on government assistance.

before going to the dentist, it's good to have an idea of what problems or concerns you have. a typical appointment will start with x-rays and a cleaning, during which the dentist or hygienist will look for cavities, gum disease and other issues. they will then provide a treatment plan and discuss this with you. you get to decide what work gets done and when, always feel free to ask questions and make sure to communicate about your financial situation.

as for how much dental care costs, it varies greatly depending on what you need done. a consultation with a dentist should give you a better idea of what needs to be done and what it may cost. for those under 18, under centrelink, or in possession of a healthcare card, it may even be free.

it's really admirable that you're seeking to change things for the better. remember, it's never too late to start taking care of your oral health. good luck!"
N13,response_13,"i’m really sorry to hear about your situation. here in australia, we have quite a few options for dental care which are either free or at a reduced cost. here are some options you can explore:

1. **public dental services**: most states in australia offer public dental services. this includes emergency dental care, general dental care and denture services. some people will be eligible for free treatment, while others will pay a reduced fee. check the australian government's healthdirect website to see what's available in your area (https://www.healthdirect.gov.au/dental-services) 

2. **healthcare card**: if you are on a low income, you may be eligible for a healthcare card which provides reduced cost on certain health services including dentistry. 

3. **community health centres**: some community health centres may offer dental care. these are also based on a sliding scale fee according to your income.

4. **dental schools**: in some areas, dental schools may provide free or low-cost dental care as part of their training program for students. it is certainly worth checking out any dental schools near you.

5. **payment plan/ dental memberships**: some private dental clinics offer payment plans or membership schemes where you can pay for your treatment in instalments. this could be an option, and most of the clinics are very patient with this due to the high cost of dental procedures.

as for the procedure, usually, your first appointment will consist of x-rays, an overall check-up, a consultation and cleaning. if you have any specific issues, such as your decaying tooth, a plan will be made for future appointments to address these issues. you should definitely discuss your worries about costs with the dentist, they will be able to guide you and may offer a treatment plan that fits your budget.

please remember that dental care is important to your overall health. taking care of it now may prevent even more costly problems down the line. it's never too late to start, and there are always people and services that want to help. don't hesitate to give them a call and discuss your situation. they're used to all kinds of circumstances and will do their best to find a solution that works for you."
N13,response_14,"i'm really sorry to hear about your situation but i want to assure you that there are resources available in australia that can help alleviate the financial burden of dental care. australian public dental offers services for adults who hold a current pensioner concession card, healthcare card or commonwealth seniors card.

the first step you should take is going to a general dentist for a check-up and oral health assessment. they will evaluate your overall dental health, identify any areas of concern and suggest a treatment plan. the dentist should provide you with a quote for the recommended treatment steps, and this will help you know what costs to expect.

the prices can vary depending on the location and individual practice. the australian government provides several grants and funding to support dental health services, and there are also not-for-profit organisations that offer low-cost or free dental service to eligible adults. 

public dental services for adults in australia are generally low cost but may have long waiting times; however, they can arrange emergency appointments for urgent problems. 

you might also want to consider dental schools where dental students, under the supervision of experienced dentists, provide treatment at lower cost. the university of melbourne school of dental science or the university of adelaide dental school are examples of such facilities.

on specific days, some organisations such as the salvation army and red cross offer free dental clinics. you could keep an eye on those as well.

regarding payment plans, there are providers like zipmoney, afterpay and mysmileplan offering interest-free payment plans for dental treatment. also, private health insurance is another option, but you should weigh the costs and benefits carefully before pursuing this route.

remember, regular brushing, flossing and a balanced diet can also help maintain oral health in the long run. 

again, i'm really sorry to hear about what you're going through and hope this information can be of help."
N13,response_15,"first, i'm really sorry to hear about your situation. it must be a challenging time for you but rest assured that help is available.

to start, here is a basic rundown of what to expect when you visit a dentist:

1. when you first call to make an appointment, you can discuss your concerns or what you want to address with the receptionist. in your case, explain about your decaying tooth and mention your financial situation so they have an idea about your needs.

2. during the appointment, the dentist will likely start with a general check-up of your teeth, during which they will probably take some x-rays to get a better idea of what's happening beneath the surface. they'll then discuss your dental health with you and recommend treatments.

3. ask your dentist to provide a cost estimate for any proposed treatments so there won't be any surprising or unexpected bills. it's also completely alright to ask for alternatives, or cheaper treatments.

4. if you're comfortable with your dentist's advice and cost estimate, you can then decide to proceed with the treatment. 

in australia, you have a few resources to help you financially: 

1. public dental services: in all states and territories in australia, the public dental system provides treatment to eligible people. the criteria varies between each state and territory, so you'll need to check your eligibility with your local health department.

2. non-government organisations: some ngos, like the australian dental health foundation, have volunteer dentists who provide free or low-cost treatment to people in financial hardship and can't access public dental care.

3. dental schools: many australian universities have dental schools that offer treatment from supervised dental students at a low cost or free of charge.

remember, it's crucially important to establish a good oral hygiene routine to prevent more serious dental problems in the future. brush at least twice a day, floss every day, and try to eat a balanced diet. 

take care, and don't hesitate to ask anymore questions if you have any."
N13,response_16,"i'm sorry to hear about your situation. it's great that you're taking the initiative and looking for ways to care for your dental health even though you're dealing with financial difficulties. 

in general, the process of visiting a dentist typically involves the following steps: 

1. appointment booking: you'd first call a dental clinic to book an appointment. at this stage, it would be good to mention that you're a new patient and haven't been to a dentist in a while.

2. first visit/check-up: the dentist will check your teeth and gums and possibly take some x-rays. this is to assess the overall condition of your teeth and identify any issues. if you have any specific concerns (like your decaying tooth, or the gap left by a missing tooth), make sure to discuss them with your dentist. they will then suggest appropriate treatment options. 

3. treatment plan: your dentist will come up with a treatment plan, which gives you detailed information on which procedures you need, the cost of each procedure, and how many dental appointments you need.

as for your financial concerns, here are a few options: 

public dental services: australian states/territories offer public dental services, though they usually have long waiting lists. however, if you are eligible (usually if you have a pension or health care card), this could help offset the costs. 

dental schools: some dental schools offer free or discounted dental services. they are performed by students under the supervision of experienced dentists, so you're still getting proper care. 

payment plans: many dental clinics understand that not everyone can afford to pay upfront, especially for expensive procedures. ask if they offer payment plans that allow you to pay in installments. 

lastly, it's essential to ask the dentist or receptionist about costs when you book your appointment. they should be able to give you a general outline of costs for a standard check-up and x-rays. any additional costs (fillings, extractions etc.) they will discuss after the check-up when they know what work you need. 

remember to take good care of your teeth in-between visits to the dentist. brushing twice a day and flossing at least once a day can help maintain your oral health. 

please understand that there is no shame in asking questions and being frank about your situation with your healthcare provider. they're there to help you. best of luck!"
N13,response_17,"i'm so sorry about the situation you've ended up in. you've taken a big step acknowledging the issue and seeking for help, which is commendable. luckily, australia does have several options for dental care that can be affordable or even free depending on your circumstances.

here are some steps and advice on how to go about seeking dental care: 

1. **public dental services**: the australian government, through respective state health departments, provide public dental health services. each state has different eligibility rules, so you'll need to check whether you're eligible where you live. public dental services are often free or at a reduced cost. however, they can have waiting lists, especially for non-emergency care. each state department of health provides the specific terms, conditions, and eligibility requirements for these services on their websites.

2. **universities and dental schools**: look for dental schools in your area, as they usually offer free or reduced cost dental services, as students need practice. while inexperience might make you nervous, remember that the work is supervised by experienced dentists.

3. **charities**: several charities provide free or low-cost dental care to those in need, such as the australian dental health foundation. they can be found easily doing a quick search online.

4. **private dental care**: if you decide to go the private route, or it's the only immediate option for you, the best thing would be to call and book an appointment at a local dental clinic. you can ask about the prices during your call - they understand that finances are often a concern and can give you a general idea of the costs. transparent communication is important; you can explain your financial constraints and see if they can provide a payment plan or discounts.

5. **dental insurance**: consider if a dental insurance policy is right for you. some health insurance policies include dental cover, or you can add it for an extra cost. you might fall under the commonwealth department of veteran's affairs, if you're eligible, they offer free dental care.

6. **bulk billing dentists**: these are private dentists who accept medicare benefits as full payment for services, meaning that you don't have to pay anything out of your pocket. to be eligible for this service, you need to receive family tax benefit part a or certain other government payments.

7. **clear communication**: when you are at your appointment, be open and honest with your dentist about your financial situation and anxiety. they can often offer affordable options"
N13,response_18,"i'm very sorry to hear about your situation, and i understand that tackling medical issues especially dental can be quite daunting. i'll do my best to guide you through the process. 

1. find a local community health centre: these centres are public dental clinics and they may offer free or subsidised dental care to those eligible. they are funded by the government and designed to assist those who are economically disadvantaged. 

2. oral health fee for service scheme (ohffss): this is a government initiative providing dental services to eligible people who are cardholders of pensioner concession cards or health care cards. 

3. find a dental school: dental students need to gain practical experience before they graduate and start practicing. therefore, many dental schools offer free or reduced cost dental treatments under the close supervision of qualified dental professionals.

4. payment plans: ask your dentist if they offer payment plans. many australian dental providers offer interest-free payment plans that can help distribute the financial burden over time.

5. medicare: if you're eligible, you could access the child dental benefits schedule (cdbs) which covers certain types of dental work for kids up to the age of 18.

6. private health insurance: if it's within your means, you could consider taking out private health insurance that includes dental coverage. 

appointment process:

- you’ll typically first have a consultation, where your dentist will examine your teeth and discuss any issues. they can then explain what treatments you might need.

- as it seems you're worried about the cost, it’s totally normal to discuss financial concerns with your dentist before any treatment. you can ask them to explain the costs before starting any procedure

- always feel free to ask any questions, your dentist should be able to explain everything to you patiently.

remember, the most important thing is to not delay your dental visit as these problems can get worse over time, possibly leading to more expensive treatments. good luck!"
N13,response_19,"i'm really sorry to hear about your situation but i would like to commend you for seeking advice and taking proactive steps to take care of your dental health now. here is some basic information that might help you:

1) make an appointment: contact local dental clinics in your area and book an appointment. keep in mind that common clinic hours may not fit in with your schedule and some clinics may have a long waiting list. 

2) before your visit: prior to your appointment, you can certainly inform the clinic that this is your first dentist visit as an adult and that you have a series of dental issues. this way, they can prepare properly.

3) the costs: when you talk with the dental clinic, don't hesitate to ask about prices before booking your appointment. most clinics should be able to provide a cost estimate. if you're worried about the cost, look into clinics that offer payment plans. in australia, you may have the options of bulk billing through medicare’s child dental benefits schedule (cdbs) or the public dental health system. 

4) the first visit: on your first visit, your dentist will do a full examination of your mouth, teeth, gums, jaw, and neck. they may also take x-rays. while it might be uncomfortable, it shouldn't be painful, and it's the best way for your dentist to fully understand your current dental health situation.

after all the tests, the dentist will have a detailed discussion with you about their findings and the potential treatment options. don't hesitate to ask questions if you aren't sure about anything. depending on your condition, the treatment could include fillings, root canals, tooth extraction, or more complex procedures like bridges, crowns, or dentures.

remember, your dentist is there to help you, and the earlier you start getting your dental issues addressed, the better the outcome. don't let fear or shame hold you back from seeking help. you're not alone, and many people struggle with oral health issues. with time and good dental care, your oral health can greatly improve. best of luck to you!"
N13,response_20,"i'm very sorry that you're facing this situation, but rest assured there is help available. 

1. **public dental services in australia**: you might be entitled to free or low-cost dental treatment through the public system in australia. each state and territory has different criteria that you will need to meet, and there may be long waiting lists. it's definitely worth investigating the options in your particular location.

2. **community dental programs**: there are also some community dental programs that provide free or low-cost services to those who cannot afford regular dental care. these will vary depending on where you are located, but you could do some research or ask your local community centre for information.

3. **universities**: some universities and schools offering dental programs may have teaching clinics where you can get dental treatment from supervised students at a reduced cost. 

4. **payment plans**: some private dentists do offer payment plan options to help spread the cost of treatment over a period of time. you can ask the dental clinics in your area about this.

when it comes to what happens at a dentist:

when you call to make an appointment, you can tell them about your situation and that you're a first-time visitor, and ask about costs upfront. the initial appointment is usually a consultation and examination, which has a set price. they will inspect your mouth and identify any problems, typically with x-rays (an additional cost). the dentist will then discuss treatment options with you. you can ask for a written cost estimate before they commence any treatment.

remember, there's no need to feel embarrassed about your teeth or your lack of knowledge about dental care. dentists are professionals who are there to help, and they have seen every kind of dental condition there is to see. they just want to assist in getting your oral health back on track. 

good luck with everything, and do take care!"
N13,response_21,"i'm sorry to hear about your situation. having dental issues or toothache can be really difficult. here are some steps to consider:

1. **public dental services**: in australia, each state and territory has established its public dental services for people on a low income or certain categories of people. it might include general dental services and dentures; however, services could vary. usually, the fees are set on a sliding scale according to your income, making it more affordable.

2. **dental schools**: check if there are any dental schools in your area. often, dental schools offer free or low-cost care done by students under the supervision of experienced dentists.

3. **private dentist consultation**: when you book an appointment with a private dentist, you should be clear about your financial situation. ask for an estimate of the cost and ask them to inform you before they go over the quote as you have limited funds. many dentists understand and can work with your financial situation.

4. **dental health services victoria**’s **(dhsv)** vouchers: if you're on government benefits, you might be eligible for dental vouchers from dental health services victoria (dhsv), which offer partial coverage for dental treatments.

5. **charity organisations**: there are charities like the national dental foundation (ndf) that run free dental events.

6. **payment plans**: some dental practices might offer payment plans that allow you to pay off your treatment over time.

7. **medicare’s child dental benefits schedule (cdbs):** if you have kids, the cdbs provides eligible kids aged 2 to 17 access to basic dental services up to the value of $1000.

during your visit, inform your dentist about your specific issues and they'll perform an examination and suggest the best way forward. always confirm the estimated cost before going ahead with any procedures.

remember to incorporate good oral hygiene practices comprising of regular brushing, flossing, and low-sugar diet that would prevent further deterioration to your dental health. all the best!"
N13,response_22,"firstly, i'm really sorry to hear about your experiences and your struggles, but please remember that it's never too late to start improving your dental health. this may seem like an overwhelming process, but there are definitely options available to you.

1. **dental schools**: many dental schools offer free or discounted dental services as part of their training programs. it's a win-win situation, where the students get hands-on experience under supervision and you get the services at a significantly discounted price.

2. **community health centers**: some community health centers have dental clinics that offer free or low-cost dental services. you can search online or check with your local health department.

3. **public dental services**: in australia, there are public dental services available in each state under various government schemes. you may qualify for free or subsidized dental treatment. 

4. **payment plans & health funds**: some dentists offer payment plans to spread the cost of treatments over time. in addition, look into health funds. many offer dental coverage and while you will pay a monthly premium, the discounts on services could be substantial.

here are the general steps for going to a dentist:

1. **find a suitable dentist**: research and find a dentist that suits your financial requirements. if you have a health fund or government support, look for a dentist that accepts this.
  
2. **initial consultation**: you will have an initial consultation where the dentist examines your teeth and asks about your medical history and any problems. they may take x-rays if necessary.

3. **treatment plan**: the dentist will then discuss a treatment plan with you. this could include basic dental cleaning, filling cavities, or more significant procedures if necessary. they should also give you an estimate of the cost. if you need more expensive procedures, discuss your financial situation with them. many dentists are willing to work out a payment plan or prioritize essential treatments.

4. **follow up**: after the treatments, regular follow-ups may be required, especially if you've had major work done. however, remember to maintain good dental hygiene to prevent further problems.

lastly, practicing good dental hygiene at home can help prevent future issues. this includes brushing at least twice a day, flossing daily and limiting sugary foods and drinks. this will slow down further decay and help improve your oral health. you deserve good health and a beautiful smile, and taking these steps can help you get there, despite financial constraints. good luck!"
