question_id,response_id,response
N65,response_1,"without an examination, it would be hard to say exactly what it might be. however, it could potentially be anything from a minor lip injury, skin cyst, fordyce spots (small, whitish-yellow bumps that can occur on the edge of your lips), mucocele (a harmless cyst caused by damage to the salivary ducts), to a more serious condition like oral cancer. smoking weed can cause dry mouth and therefore, oral issues over time. it's recommended that you consult a healthcare provider or a dermatologist to get a proper diagnosis."
N65,response_2,"without being able to examine it in person or see a picture, it's difficult to make an accurate diagnosis, but there are numerous possibilities. it could be a simple lip pimple or acne, a canker sore, a mucocele (a cyst filled with saliva), a lipoma (a benign fatty tumor), a lip tendon injury, a fibroma (a benign soft tissue tumor), a fordyce spot (tiny, harmless white or yellow bumps), or a reaction to something you ate or put on your lips. if it's something that's concerning you or causing discomfort, consider making an appointment with a dermatologist or a general healthcare provider. they can evaluate it more thoroughly and provide appropriate treatment if necessary. meanwhile, try to maintain a healthy hygiene regimen and avoid irritating it."
N65,response_3,"it's hard to provide a definitive answer without a detailed description or visual, especially considering that a variety of issues can produce similar symptoms. if it's not herpes/cold sore, some possibilities could be a fungal infection, a regular pimple, a minor injury that's healing, or a reaction to something (like certain types of food or lip balm). it's also possible that it's a smoker's patch, also known as a smoker's keratosis, which is a white patch on the mouth's soft tissues from smoking, but it generally appears inside the mouth rather than on the lip. it's recommended to see a healthcare professional to address your symptoms properly. remember, early detection usually enables more effective treatment for most conditions."
N65,response_4,"i'm an ai and cannot diagnose medical issues. i can tell you that persistent issues on the lip may be due to a variety of causes, not just cold sores or herpes. it could be a form of oral thrush, a skin condition like dermatitis or eczema, or even due to irritation caused by smoking. you should consider visiting a doctor or a dermatologist, who could more adequately determine what that might be with a physical evaluation. if it doesn't cause any discomfort or pain, it's likely not an emergency, but it's still good to have it checked out if it's causing you worry."
N65,response_5,"without being able to see or examine what you're describing, it's difficult to provide a specific answer. however, from your description, it could be a variety of things:

1. pimple
2. mucocele (a harmless cyst filled with clear fluid often caused by lip or mouth injury)
3. fordyce spots (natural and harmless tiny white or yellow bumps on the inside of your lips)
4. mucous cyst
5. lipoma (a slow-growing, fatty lump that's most often situated between your skin and the underlying muscle layer)
6. squamous cell carcinoma, which is a type of skin cancer.

given the duration that this issue has been present and the fact that you're a smoker, it would be best to consult a healthcare provider or a dentist for a professional examination. changes in the mouth, including long-lasting sores, could sometimes indicate oral cancers which are more common in smokers. it's always better to be safe and get things checked out than to worry or ignore it."
N65,response_6,"it's hard to determine what the lesion might be without an examination or a picture. possibilities could be a mucocele (a safe, fluid-filled bump), a fibroma (harmless growth), or a smoker's keratosis (common among smokers). you might also consider the possibility of fordyce spots, which are small, yellowish-white granules on the inner surface and border of the lips. although rare, it could be a sign of oral cancer, especially if you are a smoker. however, you shouldn't try to diagnose yourself. so, it's important to see a dermatologist or a doctor as soon as possible to evaluate the lesion and give a definitive diagnosis. they might perform a biopsy if it's needed."
N65,response_7,"without a picture or physical examination it's hard to determine exactly what the issue could be. however, possible options (if it's not a cold sore or herpes as you mentioned) include a simple canker sore, a mucous cyst, fordyce spots, a contact allergy, or possibly a side effect of smoking (cannabis or otherwise). this might even be a manifestation of dry lips or lip balm allergy. still, to be sure and ensure your peace of mind, it would be best to have a healthcare practitioner look at it, especially since it has been persistent for a month. keep in mind this advice is intended to be general in nature, so please consult with your healthcare provider for accurate information."
N65,response_8,"skin changes can have multiple causes so it's always best to seek advice from a healthcare professional. it could potentially be a mucocele, which is a harmless cyst filled with a gelatinous fluid that's caused by lip biting or trauma. it could also be a simple skin tag or even a minor effect from smoking. fordyce spots could be another possibility - these are harmless small white spots. if you are concerned, you should definitely consider scheduling an appointment with a dermatologist to get it checked out. remember: changes in the mouth or lips can sometimes indicate certain types of oral cancers, so it's important to take any persistent changes seriously."
N65,response_9,"without a visual examination, it's difficult to provide an exact diagnosis, but a few possibilities could be:

1. fordyce spots: they are tiny, harmless, white spots found on lips or genitalia.
2. mucocele: a harmless cyst caused by an injury, habit of lip biting, or repeated irritation.
3. angular cheilitis: caused by fungal or bacterial infection, this condition leads to inflammation at one or both corners of the mouth.
4. contact dermatitis: an allergic reaction caused by certain lip products or foods.
5. lip cancer: it's rare compared to other possibilities, but persistent lip lesions should be checked by a healthcare professional to rule out malignancy.

given that the spot on your lip has been there for a month without causing any discomfort, you should consult with a healthcare provider. it's also worth noting that regular cannabis smoking can potentially lead to oral health issues, so this could be contributing to your problem. please make an appointment with a healthcare professional to get the lesion assessed."
N65,response_10,"as an ai, i can't diagnose but can share some general information about what can cause persistent spots on the lips. there are several possibilities apart from cold sores and herpes. it could be a fordyce spot, which is a harmless sebaceous gland, a mucocele (a harmless cyst resulting from a blocked salivary gland), a fibroma (a benign soft tissue growth), a lipoma (a fatty growth), or a variety of benign dermatological conditions. however, it is also crucial to note that any long-lasting new growth on the lips should be evaluated by a healthcare professional to rule out potentially serious conditions like oral cancer. smoking cannabis, like smoking tobacco, can increase the risk of oral cancers. therefore, you should see a healthcare professional who can examine you and provide an accurate diagnosis."
N65,response_11,"without a visual examination or more detailed description, it is difficult to pinpoint exactly what the issue may be. however, common non-herpetic causes of oral lesions include canker sores, mucoceles (mucus cysts that can form when salivary glands are blocked), smoker's keratosis (white patches inside the mouth associated with tobacco use), or even excessive dryness or minor trauma to the area. bacterial or fungal infections can also be a possibility though less likely if not associated with pain or discomfort.

while it is encouraging that the spot on your lip isn't causing pain or discomfort and hasn't significantly changed in the past month, it is prudent to have it checked if it doesn't resolve soon, or if it starts growing, changes color, or becomes uncomfortable or painful. it would be best to speak to a healthcare provider who can get a more accurate history and potentially examine the lesion."
N65,response_12,"it's hard to say what it could be without a visual assessment. it could be anything from a simple lip pimple, a contact dermatitis (allergic reaction), a fibroma (benign growth), or potentially oral cancer (though that is less likely). the best thing you can do is see a doctor or dentist for an evaluation. smoking weed, especially if mixed with tobacco or other substances, potentially increases risk for oral health problems. it's recommended that any lesion or change in the mouth that doesn't resolve within two weeks should be checked out by a health professional. it's also important to note that even if it's not bothering you, that doesn't mean it's not serious. please, make an appointment with your healthcare provider as soon as possible."
N65,response_13,"based on your description, it could be a variety of things. if it's not painful or inflamed, it could be a lip fibroma, a benign, slow-growing lump. it could also be a mucous cyst, which is a painless thin sac on the inner surface of the lip. it's also possible that it's fordyce spots, which are harmless small white bumps that are caused by oil glands. rarely, heavy smoking can result in smoker's melanosis. however, it's impossible to diagnose without a physical examination. always best to consult with a healthcare professional or dermatologist for a proper diagnosis."
N65,response_14,"it's difficult to provide an accurate diagnosis without a physical examination or a picture. if your issue isn't related to cold sores or herpes, it could possibly be due to a number of factors. for instance, it could be a lip pimple, a cyst, a lipoma (benign fat tissue growth), a mucocele (a harmless cyst). other possibilities could be oral cancer (although this is less likely if there is no pain, change in color, or bleeding), or the result of an allergic reaction or burn from hot food or drink. however, given your smoking habits, it would be advisable to have a healthcare professional check this out to rule out any serious conditions like oral cancer. if the bump has been persistent for over two weeks, do make plans to see a healthcare provider."
N65,response_15,"there could be several things this could be aside from a cold sore or herpes. it could possibly be a mucocele, or mucus cyst, which is a small, harmless cyst that can form on the lips and mouth from biting or injuring the area. it could also potentially be a canker sore, which are small ulcers that might appear inside your mouth or at the base of your gums. the smoking could be causing irritation leading to something called smoker's keratosis or “smoker’s patches,” which are thick, white or gray patches that typically form in a smoker’s mouth. if it hasn't gone away after so long, you should definitely seek medical attention. it is essential to make an appointment with your doctor to get this looked at, especially considering you are a smoker, as certain long-term mouth irritants have the potential to become more serious conditions."
N65,response_16,"without an examination or a picture, it's really difficult to say what it could be. it's possible it could be a simple irritation or even a small wound from accidentally biting your lip. smoking can also lead to changes in mouth and lip tissue, so this could be a factor too.

it could also possibly be a mucocele, which is a harmless cyst on the lip, usually resulting from a blocked salivary gland. they can sometimes take a while to heal on their own, or your doctor can remove it.

another possibility could be melanotic macule, a harmless, flat, dark spot that can appear on the lips or inside the mouth.

other possibilities could include a fibroma (a benign growth that's often the result of chronic irritation) or solar cheilitis (a condition normally associted with long-term sun exposure).

although these are all generally benign conditions, it's important for any long-standing change in oral health to be evaluated by a health care provider. so, i would recommend you make an appointment with a dermatologist or dentist.

importantly, although you've said it's not a cold sore, these can sometimes present in atypical ways, especially in people with a degree of immune tolerance (such as those who've had them for many years). so, it's always worth getting this checked too."
N65,response_17,"as an ai language model, i can't diagnose but i can give you some general suggestions as per your symptoms. if it isn't a cold sore or herpes (as you've suggested), it might be other conditions that can cause a lip bump or lump such as a mucocele (a harmless cyst), a fibroma (a benign growth), or a lipoma (a lump of fatty tissue). there's also possibility of benign lip lesions or potentially harmful lip cancers. in any case, if you noticed a growth that hasn't disappeared for a month, you should consider speaking to a healthcare professional. even if it's not causing any discomfort or irritation, it's important to get evaluated to rule out a more serious condition. do remember, smoking (even marijuana) could increase the risk of oral health issues."
N65,response_18,"without examining it directly, it's hard to give an accurate diagnosis. however, it could be a range of things such as a harmless lip pimple or mucocele (a small, harmless mucus-containing cyst), molluscum contagiosum (a viral skin infection), or potentially a manifestation of hpv or other viral/bacterial infections. allergy or irritation from something you've eaten or come into contact with is also possible. smoking of any kind can aggravate oral tissues and make you prone to things like oral lesions or cancer, so it's important to get checked out by a healthcare professional, such as a dentist, oral surgeon, or dermatologist. it's always better to be safe than sorry, especially when it comes to potential mouth or lip lesions."
N65,response_19,"it's difficult to provide a specific diagnosis without a physical examination or detailed medical history, but some common causes for a persistent lip lesion could be a canker sore, mucocele, lipoma, or fibroma. smoking can irritate the mucosal lining of the lip causing persistent sores as well. however, if the lesion has persisted for over a month without healing, it's important to have it evaluated by a healthcare professional. they may need to perform a biopsy to rule out oral cancer, which, while unlikely in your age group, is a possibility, especially if you're a heavy smoker. remember, when it comes to health, it's always better to err on the side of caution."
N65,response_20,"as a language model ai, i can provide some possible explanation, but i cannot diagnose you. 

1. fordyce spots: these are small, harmless, yellow-white spots which are actually sebaceous glands, glands that produce sebum, the skin's natural oil. 

2. mucous cyst: known as a mucocele, it is a harmless, fluid-containing sac-like growth on the inner surface of the lip.

3. oral cancer: a growth or sore in the mouth that does not go away is an oral cancer symptom. oral cancer includes cancers of the lips, tongue, cheeks, floor of the mouth, hard and soft palate, sinuses, and pharynx (throat) (this is quite rare so do not panic).

4. fibroma: a fibroma is a benign growth made up of fibrous tissue.

nicotine in marijuana can make the inside lining of your mouth and lips rough and leathery, which could lead to further irritations and abnormalities. even if it doesn't hurt, it's important to pay attention to changes in your skin. it's crucial to get a reliable medical opinion from a healthcare provider if you're worried about a persistent issue."
N65,response_21,"there are several potential causes for a persistent lip lesion that might not be a cold sore. these include:

1. fordyce spots: tiny, painless white or yellow spots that are actually oil-producing glands. they are harmless and usually don't require treatment.

2. canker sore: also known as a mouth ulcer, a canker sore can potentially develop on the lip. these are generally painful and heal within a week or two.

3. mucocele: this is a harmless cyst caused by a ruptured salivary gland, typically a result of injury or trauma to the area. they generally go away on their own, but sometimes require medical intervention.

4. lipoma: a benign fatty lump that can form under the skin. they don't usually cause discomfort unless they press against nerves or have blood vessels running through them.

5. actinic keratosis: though less likely at your age, this is a rough, scaly patch on the skin caused by too much sun exposure. these could potentially develop on the lips and might potentially be pre-cancerous.

6. cutaneous horn: a type of growth that appears on the skin. it's made of compacted keratin, the same material that your nails and the top layer of your skin are made of. although harmless, it can be linked with skin cancer.

given that smoking has been linked with an increased risk of oral health problems, such as oral cancer, it would be a good idea to have this checked out by a healthcare provider, especially since it has persisted for a month."
N65,response_22,"without visuals and more details about the ""thing"" on your lip (like its color, texture, is it painful, is it elevated, et cetera), it is difficult to give you a direct answer. however, there are several possibilities besides herpes/cold sores. 

1. fordyce spots: these are natural oil glands that can become more visible if you're dehydrated or if your lips are chapped. 

2. mucous cysts: they are painless, thin, fluid-filled sacs. these cysts are common on the lips and are harmless but annoying. 

3. squamous cell papilloma: these are common benign oral cavity lesions and typically manifest as an exophytic, pedunculated or sessile, often wart-like growth.

4. infections or other dermatological issues: your habit of smoking weed could be affecting your skin and resulting in things like skin dryness and discolored spots. 

5. oral cancer: while less likely, any lump or sore that doesn't heal should be checked by a medical professional to rule out oral cancer. 

these are just some general options. i recommend seeking professional medical advice where you can provide a full history and have a physical examination done to get an accurate diagnosis."
N65,response_23,"while it's impossible to diagnose without a physical examination, there are several reasons why you might have a persistent spot on your lip. it could be a harmless fordyce spot (small, painless, pale bumps), a cyst, a scar from a healed injury, a skin tag, or even a benign mole. however, it's also possible for it to be a precancerous or cancerous growth, although this is less likely if you have no other symptoms. despite smoking weed not being directly linked to lip lesions, inhaling any kind of smoke can increase the risk of oral cancers. if you're worried, the best thing to do is book an appointment with a healthcare provider who can examine you properly."
N65,response_24,"without being able to see the issue, it can be hard to diagnose. however, if it's not a cold sore or another clear cause like dry skin or chapped lips, some possible causes could be a cyst, mucocele (a bump filled with clear fluid that can form on the lips), warts (hpv), oral thrush (a yeast infection in the mouth), or angular cheilitis (inflammation and cracking at the corners of the mouth). if it hasn't gone away for over a month, it may be worth seeing a healthcare provider or dermatologist for a clearer diagnosis. please note that this advice is intended to be general in nature, and specific causes may not apply to your situation. always consult with a healthcare provider for appropriate evaluation."
N65,response_25,"it's difficult to say without a physical examination, but depending on the presentation, this could potentially be a canker sore, fordyce spots, mucous cysts, or even just chapped lips. certain vitamin deficiencies or habitual lip biting can also lead to persistent lip issues. chronic weed smoking can irritate mucosal surfaces and potentially contribute to lip issues. if you're concerned, it may be best to see a healthcare provider who can provide an accurate diagnosis. in the meantime, avoiding irritation (like stopping smoking) and keeping it moisturized (lip balm or vaseline) may help."
