question_id,response_id,response
N160,response_1,"i'm an ai, not a doctor, but based on your description you could have hemorrhoids or an anal skin tag. hemorrhoids are swollen blood vessels in the rectum or anus that can be painful or itch, while an anal skin tag is a small growth that hangs off the skin around the anal opening. home treatments can include soothing baths, over-the-counter creams, or adding more fiber to your diet. however, you should definitely see a healthcare professional to get a proper diagnosis and advice. if it's causing you pain, a doctor may recommend a more specific treatment or procedure. please make an appointment as soon as possible and don't wait for this to resolve on its own."
N160,response_2,"i'm an ai and not a doctor, but it sounds like it could be a hemorrhoid, which is commonly caused by straining during bowel movements, obesity, or pregnancy. over-the-counter hemorrhoidal creams, ointments or pads containing witch hazel may provide relief. a warm bath or sitz baths may also be beneficial. however, since i can't be certain, it's best to consult your healthcare professional and get an examination to confirm the diagnosis and get proper treatment. it's normal to be scared, but remember these are quite common and generally not dangerous."
N160,response_3,"it's likely that you may have some form of hemorrhoid or an anal skin tag, although it would need a proper examination by a healthcare provider to confirm. 

hemorrhoids are usually caused by increased pressure due to pregnancy, being overweight, or straining during bowel movements, however, they can happen to anyone regardless of diet or regular bowel motions.

please note, while hemorrhoids are usually harmless, they can cause complications like blood clots or skin tags. if the lump is causing discomfort, bleeding, or if it doesn't improve after a few days, please seek medical attention. 

general measures that can help reduce symptoms include sitting in a warm bath a few times a day, increasing your fiber intake, and using an over-the-counter hemorrhoid cream.

mention it to your doctor during your next healthcare appointment so they can get a better look and offer you the best treatment options.

lastly, keep in mind that this advice is intended to be general in nature, you should contact your health provider for advice tailored to your specific circumstances."
N160,response_4,"i'm an ai developed by openai, and while i can provide some general advice, i definitely recommend you to consult with a doctor about this. 

your symptoms sound similar to hemorrhoids which are swollen blood vessels in and around the anus. they can be caused by several factors including straining during bowel movements, lifting heavy weights, and pregnancy. they're fairly common and usually not serious, and many people find relief from over-the-counter remedies, warm baths, and diet changes.

however, it's important to get an accurate diagnosis. occasionally, more serious conditions can present in a similar way. please don't hesitate to seek professional help. if the symptoms continue, worsen, or if you notice any bleeding, it's important to see a doctor as soon as possible."
N160,response_5,"please don't be alarmed as it might be an external hemorrhoid. hemorrhoids are swollen veins in your lower rectum and anus, and they are common. however, you should definitely see a doctor to make sure that that's what it is and to get appropriate treatment. don't try to solve it by yourself, as it could lead to complications if improperly diagnosed or treated.

eat a high-fiber diet, drink plenty of fluids, and avoid straining while going to the bathroom. also, exercising regularly promotes smooth bowel movements. over-the-counter creams and suppositories might be recommended by your primary care doctor. warm tub baths (sitz baths) for 10 to 15 minutes a few times a day may also help relieve the discomfort.

the doctor may decide on further treatments such as banding, which involves placing a small rubber band around the hemorrhoid to cut off its blood supply so that it falls off. this is an in-office treatment for internal hemorrhoids. however, it should be guided by a healthcare provider.

remember, these tips are a general guideline, and it's essential to consult with a healthcare provider for better diagnosis and treatments."
N160,response_6,"i'm an ai and not a doctor, but i can still provide some general advice. it is possible that you're experiencing a hemorrhoid, which is a swollen vein in the anal region. these are usually caused by increased pressure on the veins in the lower rectum. hemorrhoid symptoms can include a lump near the anus, which can be sensitive or painful. it's best to seek medical advice if you're worried. these can often be treated with over-the-counter creams or treatments, increasing fiber intake, or with warm baths. however, you should definitely speak to a healthcare professional to confirm what the issue might be. please don't rely solely on this advice, but seek medical attention."
N160,response_7,"it sounds like you may have developed a hemorrhoid which is a blood vessel that is swollen near the anus. hemorrhoids are common and usually harmless. they can be triggered by many things, like straining when you poop or lifting heavy objects. sometimes, they appear for no apparent reason.

in terms of treatment, there are several measures you can take:

1. over-the-counter creams or suppositories containing hydrocortisone can be effective.
2. a small sitz bath can soothe the area.
3. adding more fiber to your diet can decrease strain when you poop. this is always a good idea.
4. depending on the size, a doctor might be able to remove it or shrink it with a simple procedure.

please remember that this advice is based on the assumption you have a hemorrhoid. it is advisable to consult a doctor for definite diagnosis and right treatment especially since the location of your problem is near such a sensitive area. your doctor will best be able to guide you in the treatment and prevention of future occurrences."
N160,response_8,"i'm an ai developed by openai and i can provide some general advice. however, you should consult with a healthcare professional for a proper diagnosis. your symptoms could indicate a condition called a hemorrhoid, which is an enlarged vein in the anus or rectum, often caused by straining during bowel movements, obesity, or pregnancy. treatment often includes over-the-counter creams or suppositories, sitz baths (sitting in a few inches of warm water), increasing dietary fiber and fluid intake, and avoiding straining during bowel movements. severe cases might require medical procedures. but again, you should discuss with a healthcare professional."
N160,response_9,"i'm an ai, not a doctor, but what you're describing could be a hemorrhoid. these are swollen veins in the lower part of the anus and rectum, often caused by increased pressure. if it's not causing you extreme pain or bleeding, over-the-counter remedies like creams or sitz baths may help reduce swelling and pain. however, i would strongly suggest you consult with a healthcare professional to get a definitive answer and appropriate treatment."
N160,response_10,"i'm an ai language model and not a doctor, but what you're describing could possibly be a hemorrhoid. hemorrhoids are a common condition where the blood vessels in the rectum or anus can swell up, often due to excessive strain during bowel movements. however, it’s important that you consult with a medical professional for an accurate diagnosis and treatment recommendations. in the meantime, maintaining a high fiber diet and drinking plenty of fluids will help in reducing strain during bowel movements. over-the-counter creams and ointments may help with any discomfort or swelling. but remember, it's vital to seek professional medical advice, especially if this persists!"
N160,response_11,"it sounds like you may have a hemorrhoid. hemorrhoids are normal blood vessels in and around the anus that can become swollen and inflamed under pressure. they're very common, particularly in adults who are older or pregnant, but anyone can get them. 

typically, they can be managed with over-the-counter medications, diet changes, and lifestyle modifications. 

1. over-the-counter medications: there are topical hemorrhoid creams and suppositories available that can relieve pain and swelling. 

2. dietary changes: increasing fiber intake can make stools softer and easier to pass, reducing the pressure on hemorrhoids.

3. lifestyle modifications: avoid long periods of sitting, try not to strain during bowel movements, and drink plenty of water. 

however, it's essential that you see a healthcare provider to get a proper diagnosis. they can properly evaluate you and suggest treatment options tailored to you. if your symptoms don't improve or worsen after home treatments, or if you see blood in your stool, see a healthcare provider immediately."
N160,response_12,"it sounds like you may have a hemorrhoid, which is a swollen blood vessel in the rectum or anus. many people get them, especially as they get older. they can be caused by a number of things, including straining during bowel movements, obesity, pregnancy, or sitting for long periods of time.

though hemorrhoids are usually not dangerous, they can cause significant discomfort, and more serious conditions can resemble hemorrhoids, so you should see a healthcare provider for accurate diagnosis and treatment options. over-the-counter treatments can help with the symptoms, such as creams or suppositories.

but in the meantime, you could increase the amount of fiber in your diet to ease going to the loo, avoid straining during bowel movements. also, warm sitz baths (that is sitting in a few inches of warm water three times a day for 15 minutes at a time) can help with the discomfort. 

remember, only a healthcare professional can give you a proper diagnosis and treatment. this advice is only basic information."
N160,response_13,"you may have developed a hemorrhoid, which can be common and usually not serious. however, it should not be diagnosed just based on your description. i urge you to seek medical attention right away. a doctor or a nurse will be able to make a proper diagnosis and rule out other conditions. treatment may involve over-the-counter creams, stool softeners, or even surgical procedures for more severe cases. please make an appointment to see your healthcare provider."
N160,response_14,"i'm an ai, so i can't examine you or make a diagnosis. however, your description sounds like it could possibly be a hemorrhoid, which are swollen veins in the lower part of the anus and rectum that can be painful or not. changes in diet, increased fiber intake, and over-the-counter treatments can sometimes help manage the discomfort, but you should definitely consult a healthcare professional for a proper examination and advice. they can give a diagnosis and recommend treatment if necessary. also, never hesitate to seek help when it comes to health concerns - it's important not to delay."
N160,response_15,"i'm an ai assistant and while i can provide basic information, i highly advise seeking medical attention for your issue. what you're describing sounds similar to an external hemorrhoid. a hemorrhoid is a swollen vein in the lower part of your rectum and anus. sometimes, the walls of these blood vessels stretch so thin that the veins bulge and get irritated, especially when you poop.

you can try some home remedies: 

1. over-the-counter ointments or creams for hemorrhoids, like preparation h, can provide temporary relief. 
2. a sitz bath with warm water can provide comfort. 
3. adding more fiber to your diet and consistently hydrating can prevent constipation, which can help alleviate the pressure on the hemorrhoids.
4. avoid straining during bowel movements.  

however, these remedies may only provide temporary relief. this situation could get serious if left untreated, so i highly advise to get in touch with a healthcare provider as soon as possible."
N160,response_16,"it sounds like you may have a hemorrhoid, which is swollen vein in the lower rectum and anus. it can cause discomfort, irritation, and sometimes bleeding. it's crucial to consult with a healthcare provider for an accurate diagnosis. over-the-counter treatments like creams and ointments can help reduce swelling and relieve pain. add more fibers in your diet, drink plenty of water and avoid straining during bowl movement. again, please get medical advice for your condition as my suggestions are based on your described symptoms."
N160,response_17,"it sounds like you might have a hemorrhoid, which is a swollen vein in the lower part of your rectum and anus. hemorrhoids are common, especially if you're frequently constipated, pregnant, or often strain during bowel movements. 

you can try several things at home to reduce the swelling:

1. use over-the-counter creams, ointments, suppositories or pads. these can contain a local anesthetic to help with pain, a steroid to help reduce inflammation, or a low-dose of a blood pressure medication to help shrink the hemorrhoid.
2. soak regularly in warm water for at least 15 minutes at a time. 
3. use a cold pack. applying ice or a small cold pack to your hemorrhoid can help reduce swelling and pain.
4. avoid straining during bowel movements. 

nevertheless, if this is the first time it's happened, you should definitely see a healthcare provider to get a proper diagnosis. even though hemorrhoids are common and usually not serious, this could be a sign of something else, like an anal fistula or anal cancer, especially if you're experiencing other symptoms such as pain, bleeding, or changes in your bowel movements.

if you're not experiencing those other symptoms, it's less likely to be something serious, but you still need to see a healthcare provider to rule out these conditions.

it is also important to keep in mind that even if this is a hemorrhoid, it might not go away on its own and you may need medical or surgical treatments depending on the size and severity of the hemorrhoid."
N160,response_18,"based on what you have described, it's likely you have a hemorrhoid. hemorrhoids are swollen veins in the lowest part of your rectum and anus. this isn't typically a serious condition, but it can cause discomfort and be a bit alarming if you've never experienced it before.

you can alleviate the symptoms at home using over-the-counter treatments like creams or suppositories. you can also keep the area clean and avoid aggravating the hemorrhoid by not straining during bowel movements, using moist towelettes instead of dry toilet paper, taking warm baths and not sitting for long periods.

however, you should definitely see a medical professional if it causes severe discomfort or pain, prevents you from having a bowel movement, or if you notice any rectal bleeding. while these could still be symptoms of a hemorrhoid, they could also indicate a different, potentially more serious condition that would need medical attention."
N160,response_19,"this could be numerous things, but one possibility is that it's a hemorrhoid, which are often caused by constipation or straining. however, it might also be a skin tag, an abscess, warts related to the hpv virus, or an anal fistula. it's very important you get this checked out by a healthcare professional. they'll be able to properly diagnose and suggest treatment options. in the meantime, try not to worry too much. most of these conditions are treatable and common."
N160,response_20,"it sounds like you may have a hemorrhoid, which is a swelling of the blood vessels in or around the anus. hemorrhoids can cause discomfort, itching, or pain, but they're generally not serious. 

here are a few steps you can take to relieve this condition:

1. increase your fibre intake: consuming more fibre can help soften your stools and make them easier to pass, which could reduce strain and pressure on your hemorrhoids.

2. drink plenty of water: this can also make your stools easier to pass.

3. don’t strain or hold your breath during bowel movements: this can increase pressure in the veins in the lower rectum.

4. avoid sitting for long periods, particularly on the toilet: long periods of sitting can increase pressure on the veins in your anus.

5. consider over-the-counter treatments: there are many available, including creams, ointments, and pads. these can help relieve pain and itching.

although most hemorrhoids can be treated at home, if you're experiencing extreme pain, bleeding, or if your hemorrhoids don't improve after a week of home treatment, you should get in touch with a healthcare provider.

please note that this advice is intended to be general in nature, and specific causes may not apply to your situation. always consult with a healthcare provider for accurate information."
N160,response_21,"i'm an ai and can't diagnose medical conditions, but it sounds like you may have a hemorrhoid, a swollen vein or group of veins in the area of the anus. minor hemorrhoids can be treated at home with over-the-counter products such as creams, ointments, suppositories, and wipes, as well as warm sitz baths and increasing fiber intake. severe or persistent symptoms should be evaluated by a healthcare provider, because there are medical and surgical treatments available if necessary. however, don't take this as a definite diagnosis—please consult with a healthcare professional."
N160,response_22,"this sounds like it could potentially be a hemorrhoid, which are swollen veins in the lower rectum. hemorrhoids can be caused by a variety of things, like straining during bowel movements or increased pressure due to pregnancy, but sometimes the cause is unknown.

however, i'm an artificial intelligence and can't provide a medical diagnosis. if you're experiencing discomfort or if the lump is not going away or getting larger, it's important to seek medical attention from a healthcare professional right away. they can provide a proper examination and give you personalized advice and treatment options.

in the meantime, increase your fiber intake and stay hydrated, as this can sometimes help with symptoms."
N160,response_23,"i'm an ai and can't diagnose medical conditions, but what you're describing might be a hemorrhoid, which is often caused by frequent straining during bowel movements or from increased pressure on these veins during pregnancy. eating a lot of fiber and drinking plenty of fluid can help prevent constipation, which can happen if you strain during bowel movements. if you are experiencing a lot of discomfort, it'd be best to consult your doctor for medical advice."
N160,response_24,"it sounds like you may have a hemorrhoid, which is a swollen blood vessel in the rectum or anus. these are common and can be caused by various factors such as straining during bowel movements, sitting for long periods, or consuming a low-fiber diet. however, it's always best to get it checked by a healthcare professional to confirm this and make sure it's nothing more serious.

for hemorrhoids, over-the-counter treatments such as creams, suppositories, and pads can help. other lifestyle changes you can do are increasing your fiber and water intake, avoid straining during bowel movements, and getting regular exercise. applying a cold compress or taking a warm sitz bath may also provide relief.

despite these suggestions, remember to seek medical help for diagnosis and treatment. please do not rely solely on this information as it does not substitute professional medical advice."
N160,response_25,"i'm an ai and not a doctor, but it sounds like you may have a hemorrhoid, which is a swollen blood vessel in or around the anus. they can be caused by straining during bowel movements, sitting for long periods of time, or from conditions like obesity or pregnancy. but it's important that you seek medical advice as soon as possible to get a proper diagnosis and treatment suggestions. soaking in warm water (a ""sitz bath"") and over-the-counter creams may provide some relief, but these won't cure the problem. please abstain from trying to treat it yourself and consult a doctor immediately."
