question_id,response_id,response
N79,response_1,"diet soda contains artificial sweeteners, which sometimes can cause odd tastes in body secretions if consumed in large quantities. it's not completely unlikely that artificial sweeteners in your soda could contribute to a sweet taste.

however, a sweet tasting vagina can also be a sign of certain health conditions. if you have diabetes, for example, sugar can build up in your urine, making your vagina taste sweet. 

i would not panic, but a check up with your doctor would be appropriate, especially if you have risk factors such as obesity, a family history, or symptoms of diabetes such as frequent urination or excessive thirst. a routine physical and blood tests can help rule out conditions like diabetes. you could also cut out the diet soda and see if that makes a difference. 

additionally, if you have never had a pap smear or gynecological exam, considering your age you should arrange one soon. regular gynecological exams are essential for women's health and can catch any potential problems early. it's also a great opportunity to bring up this concern to a healthcare professional who can provide more insightful advice."
N79,response_2,"increased sweetness in vaginal fluid can be an indicator of various health issues. one of the most common is diabetes. in individuals with diabetes, excess sugar can be present in saliva, sweat, and yes, vaginal fluids. drinking diet sodas might not directly produce the sweetness but it's important to note that diet drinks can disrupt the body's ability to process sugar.

excess sweetness could also indicate a yeast infection. even though yeast infections normally come along with other side effects like itching, burning, and discomfort, everyone's body can react differently. therefore, it's not impossible to have a yeast infection and only notice the sweetness.

diet and overall health can definitely affect the ph and taste of your vaginal fluids but it’s best to consult with a healthcare provider to rule out any potential health concerns. don't ignore it, especially if it remains consistently sweet despite changing diet or if you see other symptoms."
N79,response_3,"there might be a couple of things causing this. firstly, diet soda often contains artificial sweeteners, which can get into your system and potentially affect the smell and taste of your body fluids. it's possible that you're just particularly sensitive to these sweeteners, and that's why you notice a difference.

a second possibility, though more unlikely if you're otherwise healthy, is diabetes. diabetes can cause the body to excrete sugar in the urine, which can also affect the smell and taste of your vaginal fluids.

if you're not experiencing any other symptoms like frequent urination, excessive thirst, unintentional weight loss, feeling tired all the time or blurred vision, it's probably just the diet soda.

but if you're worried or if you have any of these symptoms, you should talk to a healthcare provider. they can run tests to either rule out or confirm diabetes. if you do have diabetes, it's much better to know and start managing it early to prevent complications. 

in the meantime, if the sweet taste is bothering you, try cutting back on the diet soda and see if it makes a difference."
N79,response_4,"firstly, it's important to note that it's normal for the vagina to have a slightly sweet taste due to the presence of glucose, which is a type of sugar that helps feed the healthy bacteria in the vagina. however, an unusually sweet taste could potentially be a sign of an imbalance or a health issue.

one concerning possibility is diabetes - a condition where your body doesn't properly process sugar. however, this condition is typically accompanied by frequent urination, increased hunger or thirst, weight loss, or other symptoms.

it's also possible that the sweet taste could be related to your diet. certain foods and drinks, such as diet soda as you mentioned, could potentially affect the taste of your vaginal secretions. however, it's not clear if this is actually the cause or just a correlation. 

although you've related it to drinking high amounts of diet soda, i would recommend you to consult your doctor or a gynecologist for an accurate diagnosis. they might conduct some tests to check for any possible underlying causes. 

please note that this response is purely an educated guess based on the information provided. it’s always better to consult a health professional for any medical concerns."
N79,response_5,"while changes to the flavour of vaginal secretions can be influenced by diet, it's not entirely clear why diet soda would cause your vagina to taste extremely sweet. 

one possibility is that a sweet taste could be a sign of high blood sugar levels, which can occur in conditions like diabetes. these conditions can cause glucose to spill over into your urine, which could potentially affect your vaginal secretions. if you're experiencing other symptoms such as increased thirst, frequent urination, fatigue, and unexplained weight loss, it could be worth seeing a doctor.

however, this doesn't mean that you definitely have diabetes. every individual is different, and every body can react differently to substances. high amounts of any substance can potentially cause changes in your body, so it may also be that your body is reacting differently to the sweeteners in diet soda. 

in addition, it's worth noting that sweet taste is not typically a sign of infection or other health concerns. however, it's always a good idea to keep an eye on any sudden changes in your body and seek medical advice if you're concerned.

ultimately, if this is causing you distress, it may be worth discussing this with a healthcare provider. they would be able to provide you with accurate information and advice tailored to your specific situation."
N79,response_6,"a sudden change in the taste or smell of your vaginal discharge can sometimes indicate a health issue. a very sweet taste could potentially be a sign of diabetes, as high sugar levels in the blood can lead to sweet-tasting discharge, and excessive urination and thirst are also symptoms. however, since you notice this only after drinking diet soda which does not contain sugar, it might not be diabetes related. it might be a reaction to the artificial sweeteners that are common in diet drinks. 

everyone's body is unique and reacts differently to different things, so what is normal for one person may not be normal for another. however, if you are concerned about this, it may be a good idea to bring it up with your healthcare provider. they can run tests to ensure everything is okay."
N79,response_7,"the vagina often has a slightly sweet, musky, or tangy taste and smell, depending largely on a person's diet, hormonal changes, and overall hygiene. a very sweet or ""candy-like"" taste that you've been noticing can be a sign of changes happening within your body. it may not necessarily indicate a problem, but it could. 

the concern that comes to mind with a very sweet taste or smell from the vagina is diabetes, as high blood sugar can lead to sweet-tasting bodily fluids, including vaginal fluid. this is not a certain diagnosis, but it is something to consider. 

since you've noticed that this happens after you drink high amounts of diet soda, you might try cutting back on diet sodas and seeing if the sweetness decreases. additionally, the artificial sweeteners in diet soda might contribute to changes in your vaginal microbiome, which might affect the taste and smell as well.

it’s always a good idea to talk to a healthcare provider if you notice any changes with your body that concern you. they can provide more specific advice and may want to do further tests if needed."
N79,response_8,"while the vagina does typically have a slightly sweet, acidic taste, extreme sweetness may be cause for concern. unusual taste or smell from one's vagina can often be indicative of a health issue such as a bacterial infection or a dietary intervention. however, oftentimes a change in your vaginal taste may just be because of the consumption of certain foods or drinks, such as your diet soda. 

if this only happens when you consume large amounts of diet soda, it could be that the artificial sweeteners in the drink are being excreted in your bodily fluids including your vaginal secretions.

it's also worth noting that in some cases, a very sweet taste can be a symptom of diabetes. undiagnosed diabetes can cause high levels of glucose in your bodily fluids, leading to this sweet taste. 

the best action is to see a healthcare provider for a consultation if you're concerned. you might want to consider getting tested for diabetes and other similar conditions, just to rule them out."
N79,response_9,"there could be a couple of factors contributing to the ""sweetness"" of your vaginal secretions. 

firstly, what you eat and drink can slightly influence the taste and smell of your bodily secretions including sweat and vaginal fluids. it could be possible that the diet soda you're drinking (which is likely high in artificial sweeteners) has some influence on the taste of your vaginal secretions. 

however, the most concerning possibility is that the sweet taste could indicate high glucose levels in your body secretions, which could be a sign of diabetes. in diabetics, when the blood glucose levels rise, glucose can start to be excreted in all sorts of body fluids such as sweat and urine, and possibly vaginal secretions.

it might be wise to discuss this with a healthcare provider who can perform a simple test for diabetes, just in case. additionally, considering your weight in relation to your height, you may have a higher risk of developing diabetes. 

it's always better to be safe and get checked out. even if it's nothing serious, you could gain some peace of mind."
N79,response_10,"some research has suggested that diet soda can increase glucose levels, which can cause more sugar to be present in your urine. as a result, it's possible that this could also be affecting the taste of your vaginal fluids. however, these effects aren't usually as pronounced as what you're describing.

one important thing to note is that extreme sweetness is sometimes associated with a medical condition called diabetes. when your body can't process sugar properly, it can sometimes end up in unexpected places, such as your vaginal fluids. if you notice extreme thirst or frequent urination alongside the sweetness, it would be worth getting checked out by a doctor just to rule this out.

be sure to maintain healthy hygiene habits and consume a balanced diet. if you're generally healthy otherwise and this doesn't otherwise affect your intimacy, it's probably not a major concern, but a good idea to check with your doctor.

remember, everyone's body chemistry is different."
N79,response_11,"it's not typical for vaginal secretions to taste extremely sweet. however, your diet can certainly influence the taste and smell of your vaginal secretions, similar to how it can impact the smell of your sweat and urine. 

importantly, if your vaginal secretions are tasting extremely sweet it may point to elevated level of glucose. this could potentially be a sign of diabetes, although it would typically come with other symptoms such as excessive thirst, frequent urination, and unexplained weight loss.

the diet soda may just be a coincidence. the artificial sweeteners used in diet soda (such as aspartame, sucralose, and saccharine) are not metabolized by the body and therefore wouldn't be excreted in noticeable amounts in your vaginal secretions. 

so in conclusion, while it's possible that your observations are entirely due to dietary influence, it would be worth bringing this up with your doctor, who might want to run some tests just to make sure there's nothing more concerning going on."
N79,response_12,"while diet sodas do contain artificial sweeteners, normally they wouldn't affect the taste of vaginal secretions. additionally, vaginal secretions often have a slight acidic taste due to the ph balance that keeps the vagina healthy. however, if you notice a significant change in the taste or odor, it is worth mentioning to a healthcare provider. 

one potential concern with a high level of ""sweetness"" could be due to high blood sugar levels, which is usually associated with diabetes. however, if you aren't experiencing other symptoms associated with diabetes (i.e., excessive thirst, increased urination, unexplained weight loss), it's less likely.

also, artificial sweeteners have been shown to disrupt the balance of ""good"" bacteria in the gut, which could potentially also affect the balance of bacteria in the vagina, leading to an infection like bacterial vaginosis or a yeast infection.

the simple suggestions could be to limit the intake of diet soda and see if there is a decrease in this sweetness or consult with a healthcare provider for a checkup if you are concerned."
N79,response_13,"the taste of vaginal secretions can be influenced by diet, hydration, and overall health. however, the presence of a sweet taste might be an indication of high glucose levels. in some cases, a very sweet or strange smell can be a sign of diabetes. if you're experiencing this consistently, it might be worth talking to a healthcare provider to rule out any potential health problems such as diabetes.

the sweet taste could possibly be a result of the artificial sweeteners in diet soda passing through your system. some studies have suggested that artificial sweeteners can be excreted in urine and therefore potentially in other bodily fluids. however, this is somewhat speculative and more research is needed. 

it's always a good idea to consult with a trusted healthcare provider about any changes or concerns. it's probably nothing to be worried about, but it is best to err on the side of caution when it comes to your health."
N79,response_14,"the change in taste you're noticing could potentially be due to the artificial sweeteners present in diet soda, as they can alter body secretions, including vaginal fluids. it's also possible that diet soda is influencing the composition of your vaginal flora. however, a sweet taste is often associated with high glucose levels, which can be a sign of diabetes. it would be a good idea to get a check-up and discuss this with a healthcare provider."
N79,response_15,"the taste of vaginal secretions can be influenced by diet, hormonal imbalances, and even certain medications. additionally, some artificial sweeteners used in diet sodas can be excreted in urine and potentially influence the taste of vaginal secretions, which might explain the correlation you're noticing with your diet soda consumption. however, a very sweet taste could potentially be an indication of high blood sugar levels, which can be a sign of diabetes. diabetic patients may excrete excess glucose in their urine, which could alter the taste of their vaginal secretions.

however, it's also worth noticing that a sudden change in the way your vaginal secretions smell or taste can be a sign of an underlying infection, like a yeast infection or bacterial vaginosis. both conditions can change the ph level of your vagina and alter the taste and smell of your secretions.

while taste is subjective and experiences can vary greatly between individuals, if you are noticing this change regularly and especially if it's accompanied by other symptoms, it would be worth bringing up with a healthcare professional. 

remember to practice safe sex always, maintain a healthy lifestyle with balanced diet, stay hydrated and make sure to have regular check-ups, especially gynecological - they can help detect any potential abnormalities early on. 

the information provided is intended to be informative and does not replace professional medical advice."
N79,response_16,"diet sodas contain artificial sweeteners that are excreted in the urine, so high amounts of diet soda could theoretically cause a change in the taste of your vaginal secretions. however, it's worth noting that frequent, super sweet vaginal discharge can be a symptom of diabetes. it could be worthwhile getting checked for blood glucose levels or seeing a doctor if you're concerned, especially if you have other symptoms like frequently feeling thirsty, urinating often, feeling hungry even after eating, or unexplained weight loss. 

it's also worth mentioning that what you eat and drink can certainly affect your vaginal health. sugary foods and drinks can contribute to yeast infections, while diets rich in fruits, vegetables, and whole grains can help to maintain a healthy ecosystem in your vagina. 

remember, no question about your body or health is too trivial or silly. if it's something you're worried about, always seek the advice of a doctor or healthcare professional."
N79,response_17,"while a slightly sweet taste can be normal for vaginal secretions due to the presence of glucose, the strength of the sweetness you're describing is not typical and is concerning. additionally, sudden changes in taste, smell, or color can be indicative of an underlying health issue or infection.

there are a few potential reasons for this. one could be bacterial vaginosis, a common vaginal infection that can cause changes in taste and scent, but usually also comes with other symptoms like itchiness or unusual discharge. 

another reason could be due to high blood sugar levels. the fact that this change occurs after you consume diet soda is interesting, as diet sodas often contain artificial sweeteners which have been known to affect the body's insulin response and potentially blood sugar levels. it is known that diabetes and pre-diabetes can cause sweet-tasting urine, but i am unsure if they have the same effect on vaginal secretions. 

it is advised to schedule a visit with a healthcare professional for further investigation. they will be able to perform some simple tests to determine the cause, and suggest suitable treatment plans. your general practitioner, a gynecologist, or a sexual health clinic will all be suitable."
N79,response_18,"some women may notice changes in their vaginal secretions due to diet. if this is happening consistently and specifically after consumption of diet soda, it might have to do with artificial sweeteners altering your body's ph. however, a sweet tasting vagina could also be a symptom of uncontrolled diabetes where excess glucose is excreted in various bodily fluids, including vaginal secretions.

please consult a healthcare professional or gynecologist who can provide you with safe and accurate medical advice. even if it's not bothering you now, having abnormal vaginal secretions can be a sign of an underlying problem. you should not neglect anything unusual that's going on with your body."
N79,response_19,"firstly, it's great that you are making note of changes in your body and seeking advice. regular changes in the vagina's ph, taste, or smell can be affected by various factors including diet, hormonal changes, sexual activity, and hygiene practices.

regarding diet, it is not unheard of for certain foods or beverages to affect the taste of bodily fluids. however, the connection between diet soda and a very sweet taste isn't commonly reported or studied extensively, and usually sugars and other strong flavors (like garlic or spices) are more likely to have noticeable effects.

however, a sweet taste could also be a sign of high glucose levels in the vaginal fluids, possibly due to diabetes. given your increased bmi, it would be wise to get checked for diabetes or pre-diabetes, especially if you also have other symptoms such as frequent urination, excessive thirst, fatigue, etc.

in conclusion, it would be best to discuss this with a healthcare provider. they can perform tests if necessary to rule out any issues that might be causing this change in your body."
N79,response_20,"it's not uncommon for your diet to influence the taste of your bodily fluids including vaginal discharge. however, your body may react differently to diet drinks due to the artificial sweeteners present in them, which could lead to a sweeter taste in your vaginal secretion. as you have pointed out, this only happens when you consume a high amount of diet soda, suggesting a possible correlation.

a healthy vagina is usually described as having a slightly acidic ph and a taste that's slightly acidic, but not sweet. however, everybody’s body is unique and a range of tastes could be normal. as such, a sweet taste isn't necessarily concerning, especially if you aren't experiencing other symptoms like itching, burning, or unusual discharge. 

if this does concern you though, it may be wise to talk to your healthcare provider about your symptoms to rule out anything serious such as bacterial vaginosis, yeast infections, or even diabetes, which could potentially cause a sweet taste."
N79,response_21,"a very sweet taste in genital fluid can sometimes be a sign of high blood sugar or diabetes. if this is a sudden change, it might be a good idea to see a doctor. they can take a blood test to rule out any potential concerns.

however, it might also just be that you're noticing this correlation with diet soda due to timing or coincidence. while certain foods and drinks can have a slight impact on the taste of your genital fluids, it's usually fairly subtle.

as always with health matters like this, it's best to consult a health professional if you have any concerns. make sure you mention all the details you've shared here, as well as any other changes you've noticed in your health or body."
N79,response_22,"unusual body odors or tastes can sometimes be indicative of health problems. in some cases, a ""sweet"" smell could be linked to high sugar levels due to diabetes, however you mention the sweetness is linked to your consumption of diet soda which does not contain real sugar. it's possible that the artificial sweeteners from the soda are being excreted in your vaginal fluids. if you are not experiencing any other symptoms, such as excessive thirst or urination, it may just be a peculiar side effect of your diet soda intake.

nevertheless, it might be a good idea to consult with a healthcare provider to discuss this further. keep in mind that online advice should never replace a visit to a healthcare professional."
N79,response_23,"the sweetness you described is not typically associated with a normal/healthy vagina flavor. generally, the natural taste of a vagina should be slightly acidic, given the healthy vaginal ph is around 3.8 to 4.5. any extreme deviations from this can signify potential health issues. 

one possible explanation could be diabetes but as you're not showing other symptoms (frequent urination, fatigue, unexplained weight loss, etc.), it's less likely. however, as you mentioned, the excessive sweetness does correlate with your consumption of diet soda. it's possible that artificial sweeteners could somehow influence your body's natural taste, but this isn't a well-studied or concrete connection.

it's recommended you see a healthcare provider to get a proper diagnosis. they will likely ask about your medical history, sexual behavior, menstrual cycle, birth control use, diet, hygiene routines etc., and may take a swab for lab tests. if you're sexually active, consider std testing, too, as some can alter vaginal taste or smell. in the meantime, a good guideline is to maintain a balanced diet, sufficient hydration, and good hygiene to contribute to your overall reproductive health."
N79,response_24,"there are a few factors that can affect the taste of your vaginal fluids, including diet, hygiene, and hormonal changes. however, an excessively sweet taste could potentially be a sign of high blood sugar or diabetes. consumption of diet soda can increase the risk of metabolic syndrome and diabetes. even though diet sodas are usually sugar-free, they contain artificial sweeteners like aspartame, cyclamate, saccharin, acesulfame-k or sucralose. now, it's a bit of a stretch and not conclusively proven whether these sweeteners can directly change the taste of your bodily fluids, such as vaginal fluids.

regardless, it would be wise to discuss this with your healthcare provider, considering your weight which might put you in a higher risk category for such conditions as well. they might recommend doing some blood tests, just to rule out any potential issues. it's always better to err on the side of caution when it comes to health matters."
