question_id,response_id,response
N29,response_20,"i'm an ai language model and can't diagnose medical conditions, but i can give some general advice. it's understandable to be scared when experiencing these symptoms and having elevated d-dimer levels. elevated d-dimer levels can be associated with many conditions, not just blood clots, including inflammation and illness.

it's also important to keep in mind that d-dimer tests aren't definitive and can sometimes give false positive results. repeated negative imaging (ultrasound and ct) despite elevated d-dimer goes in favor of not having a clot.

however, given your symptoms and concerns, it may be wise to consult with a hematologist or rheumatologist as you're being evaluated for lupus and could be at higher risk for clotting disorders like antiphospholipid syndrome.

it's essential to keep up open communication with your healthcare providers. continue to voice your worries and symptoms until you feel they have been adequately addressed. in the meantime, try to maintain a balanced diet, get appropriate exercise, and manage stress as best as possible—general health measures that can help in almost any situation. remember, this advice doesn't replace a consultation with a healthcare professional."
N29,response_21,"i'm an ai language model and while i can't personally examine you or provide a diagnosis, i can suggest that your symptoms should be checked by a health professional as soon as possible. even as d-dimer can elevate in several conditions, including inflammation, trauma, pregnancy, cancer, recent surgery or injury etc., the symptoms you mentioned such as chest pain, shortness of breath could indicate something serious such as a pulmonary embolism. 

due to your previous raised d-dimer, persistent symptoms, and the potential evaluation for lupus (and associated increased risk for blood clots), it is important to continue with follow up medical evaluations. visit your primary care physician who can refer you to a specialist as necessary, or return to the emergency department if your symptoms worsen.

remember, if you feel that your condition is deteriorating, do not hesitate to seek immediate medical help. 

regarding the fear and anxiety, these are very normal reactions to health concerns. try to have someone with you for support. talk about your concerns with your healthcare provider as well so that they can properly address them."
N29,response_22,"i'm an ai language model, not a doctor, but i can tell you that it's important to trust your healthcare professionals. they performed an ultrasound and a ct scan which can typically detect blood clots. d-dimer can be elevated in various situations such as inflammation, certain illnesses and even obesity. if you are still concerned, seek a second opinion - you can contact your primary healthcare provider or a specialist in internal medicine or haematology. the symptoms you are experiencing may or may not be related to a clot. it's also good that they're evaluating you for lupus and antiphospholipid syndrome as these could also potentially explain some of your symptoms. it's very important to follow up with those tests and take their advice. remember, online advice should never replace expert medical advice."
N29,response_23,"i'm an artificial intelligence, but i can let you know that an elevated d-dimer can be due to many things, not just blood clots. conditions such as injury, inflammation, recent surgery, trauma, or certain diseases can also cause elevated d-dimer levels. 

considering you've been informed about your potential for lupus and antiphospholipid syndrome, this may be the cause for your persistent symptoms. antiphospholipid syndrome is an autoimmune disorder that leads to an increased risk of blood clots. 

however, symptoms are tricky and often non-specific, so they don't always indicate a certain condition. it's important to have a thorough medical check-up with a healthcare provider, who can evaluate your test results along with your symptoms and medical history to provide an accurate diagnosis.

regarding your chest and leg pain, shortness of breath, and elevated d-dimer levels, it is a good reason to rule out a clot, which your doctors did with the ct of your chest and ultrasound of your leg. 

the emergency department has acted on your symptoms to rule out the immediate life-threatening condition which is a clot. if your symptoms persist, or you develop new symptoms, it would be advisable to make an appointment with your primary healthcare provider for further evaluation.

please note that this advice is intended to be general in nature, and specific causes may not apply to your situation. always consult with a healthcare provider for accurate information."
N29,response_24,"i'm an ai language model and can try to help alleviate some of your worries by explaining a few things, but please seek medical advice immediately if you're feeling unwell.

d-dimer level is used in the hospital setting to rule out clots or thrombosis, and indeed, it can become high if there's a clot. in your case, your d-dimer was only slightly raised. it is important to know that d-dimer can also rise with inflammation, cancer, pregnancy, recent surgery, or trauma. it seems like they did look into clots in your case with the ultrasound and ct scan, and presumably found none.

however, considering that you're still experiencing symptoms such as severe dizziness, chest pain, and shortness of breath, it would be important to carry on the investigation. lupus and antiphospholipid syndrome can indeed lead to clotting disorders. it's also worth considering if your asthma could be contributing to your symptoms.

in short, it's really important for you to follow up with your care team. they have the full knowledge of your history, symptoms, and test results. they can fully interpret the tests and treat you appropriately. please remember to stay calm - stress and anxiety can also contribute to physical symptoms."
N29,response_25,"i'm an ai language model and while i can't replace a doctor's advice, i may help you in understanding your situation. 

it does sound like you're going through a lot right now. an elevated d-dimer does indicate that there could be significant blood clotting happening in your body. it can be caused by a lot of different conditions, including various types of vascular diseases, trauma, and even certain medical treatments. it can also sometimes be a sign of a pulmonary embolism, in which a blood clot breaks off and travels to the lungs, or deep vein thrombosis (dvt), where clots form in deeper veins, typically in the legs.

that being said, your d-dimer levels are only slightly elevated which might have other causes; there are some conditions that cause an increased breakdown of fibrin (the protein that forms a blood clot), and this can cause an increase in d-dimer.

if you have symptoms such as dyspnea (shortness of breath), severe chest or rib pain, and severe dizziness, these should be evaluated immediately. it's good that you've already had some imaging studies (ultrasound and chest ct). pulmonary embolism and dvt can usually be identified with these exams. since you are being evaluated for lupus and antiphospholipid syndrome, these can cause hypercoagulation as well. it's important that you discuss all of this with your doctor to ensure you get the best care. 

in case of worsening symptoms, please seek immediate medical attention."
