question_id,response_id,response
N141,response_1,"it's important to take antibiotics as your dentist or surgeon prescribes them. do not stop them early, even if you're worried about your gut microbiome. if you're concerned about this, you can often mitigate effects on your gut by taking probiotics or eating yoghurt with live cultures. 

antibiotics taken orally get into your bloodstream and are delivered to the site of the infection that way. a lot of the effectiveness of antibiotics comes from their ability to get inside cells, where bacteria often hide. by placing an antibiotic pill directly into the extraction site, you're not going to be able to deliver the drug to where it needs to go as effectively. 

also, crushed pills can have a very strong, unpleasant taste and can cause irritation to the tissues in your mouth. it could also potentially delay healing of the extraction site. 

about your specific situation, both amoxicillin and penicillin are effective against oral bacterial infections. your dentist or surgeon would have prescribed the one they thought was best for you based on your specific situation. as previously stated, it's best to take them as prescribed.

if you believe you have an infection (swelling, pain, pus, fever), you should contact your dentist or surgeon right away. infections post-extraction should not be taken lightly. 

remember this advice is meant for informational purposes and does not replace professional medical advice."
N141,response_2,"placing a broken down amoxicillin or penicillin pill directly on the socket of your wisdom tooth area will unlikely be effective and not advisable. these medications are not formulated for topical applications and isolating them to localized areas will not have the same effect as when they are taken systemically. 

antibiotics are most effective when they can disseminate throughout the body, reaching the sites of an infection through blood and other bodily fluids. their intended usage is to help eradicate an existing infection by killing off the bacteria or stopping them from multiplying. if you have already completed your course of antibiotics, restarting it and adjusting the course without consulting a healthcare professional is not recommended.

both amoxicillin and penicillin can treat dental abscesses and infections. they're both beta-lactam antibiotics, but amoxicillin is an updated version of penicillin that typically lasts longer in the body and can be more effective against a broader range of bacteria.

if you feel that you're at risk for a bacterial infection or you're showing symptoms of an infection (redness, pain, swelling, pus, and fever), it is crucial that you speak with your doctor or dentist about your concerns. they can evaluate your current situation and determine the best course of action. 

while gut health is important, in certain circumstances such as infections, the systemic effect of antibiotics can be life-saving. it's also important to note that the body has the ability to restore its microbiome after antibiotic use. you can also help this process along by eating a probiotic-rich diet or taking probiotic supplements."
N141,response_3,"i'm a language model ai developed by openai and i can provide you some information based on my database. however, you should always consult real healthcare professionals for obtaining medical advice.

penicillin and amoxicillin are two antibiotics which belong to the same class, ""penicillins"". they work similarly and are often used to treat the same types of infections, especially dental related infections. however, from a clinical perspective, i cannot recommend you to crush the pill and place it into your socket.

here are a few reasons:

1. the dose may not be correct. antibiotics and other medication are formulated to be dosed in a particular way. the strength of the antibiotic could be much higher in a concentrated area and could cause local irritation or even a burn in the soft tissues of the mouth.

2. it may not be effective. the infection takes hold inside tissues and in the bloodstream, not on the surface. by placing the antibiotic directly on the exposed surgical area, you may not be targeting the bacteria causing the infection effectively.

3. it needs to be systemically absorbed to target the bacteria. it isn't so significant if the antibiotic damages some gut microbes because those will often recover after antibiotic treatment is finished. but if the microbes causing your infection are not killed then the infection will continue.

discarding prescribed medication on your own could lead to some serious health issues including antibiotic resistance where bacteria become and resistant to antibiotics. in your case, it's best to finish your prescribed course of antibiotics even if you're feeling better. 

if you have questions against your medical treatment or are worried about its side effects, you should contact your healthcare provider and discuss your concerns with them directly. they know your medical history and can best guide you.

please note: this advice is intended to be general in nature, and specific causes may not apply to your situation. always consult with a healthcare provider for accurate information."
N141,response_4,"i'm a medical ai and can provide some general guidance based on available information, but only a licensed healthcare provider can give you a tailor-made advice. 

first, antibiotics like penicillin and amoxicillin should be taken exactly as prescribed by your healthcare provider. that means for the entire duration of the prescription, unless otherwise instructed by the healthcare provider. 

secondly, maintaining gut health is important, but so is ensuring complete resolution of an infection, especially after a surgical procedure like tooth extraction. incomplete antibiotic therapy might lead to antibiotic resistance and potential for a more severe infection.

topically applying an antibiotic pill to a wound site is generally not advisable. antibiotics are typically used for systemic treatment and not for local treatement. locally applied antibiotics may not deliver the intended dosage and can potentially add to risks associated with antibiotic resistance. 

if you're having concerns about continuing your antibiotic regimen or the health of your gut microbiome, i strongly recommend discussing them with a healthcare provider. they can provide evidence-based strategies like probiotic recommendations that won't compromise your current treatment plan.

as for penicillin versus amoxicillin, the choice between the two often depends on the specific type and severity of infection. in general, both can be effective for dental infections, but your healthcare provider would be the best person to advise on this. 

remember that this does not replace a consultation with a healthcare provider."
N141,response_5,"placing antibiotic tablets inside an oral wound is not recommended. the tablets are not designed to be used in that way, and could potentially cause irritation, damage, or even exacerbate an infection.

if you're concerned about an infection, it's better to continue with your prescribed treatment as directed by your healthcare professional.

as for the comparison between amoxicillin and penicillin, both are penicillin antibiotics and are effective against many common bacterial infections. they work in slightly different ways and have slightly different spectrums of activity, but in general terms, both can be effective for the treatment of dental infections.

however, if you are concerned about the potential of side effects from using antibiotics, you should consult with your healthcare provider or a pharmacist. they can provide more personalized advice based on your medical history and current conditions.

for future reference, it is key to note that abrupt discontinuation and irregular use of antibiotics can contribute to the development of drug-resistant bacteria, making infections harder to treat. it's generally recommended to complete the full course of antibiotics as prescribed by your healthcare provider, even if you feel better before it's finished. your health care professional balanced the benefit of treating the infection and risk of antibiotic use while prescribing you medication post dental extraction.

for concerns about gut microbiome, consider utilizing probiotic supplements or consuming fermented foods like yogurt, kimchi, or sauerkraut to help restore healthy bacteria to your gut, if your healthcare provider agrees."
N141,response_6,"i'm a medical language model ai developed by openai to assist the users. i'd strongly discourage you from attempting to apply antibiotics directly to the extraction socket. taking chopped or crushed antibiotics locally in the socket could cause more harm than benefit due to potential irritation or chemical burn to the healing tissue. the systemic effects of oral antibiotic therapy are likewise generally minimized when you finish the prescribed course from your dentist.

that said, your concerns about changes to the gut microbiome are indeed warranted, as antibiotics can cause alterations that are often transient but can occasionally be long-standing. your healthcare provider should have weighed the benefits and risks before prescribing you antibiotics, given the risk for post-operative infections.

if you have symptoms of an infection such as fever, swelling, redness, discharge, or severe pain, it's best that you contact your oral surgeon or dentist promptly instead of self-medicating or altering your medication regimen without professional advice. if you don't have symptoms of an infection, then it's possible that you might not need more antibiotics at this time. 

again, it's best to consult your doctor or dentist for treatment plan confirmation. it's extremely important to take antibiotics as instructed, not just for your own health but also to avoid contributing to antibiotic resistance."
N141,response_7,"i am an ai developed by openai and do not replace professional medical advice or treatment, but i can tell you that breaking an antibiotic tablet and placing it directly on your gums is not a recommended approach and is unlikely to be effective. 

the efficacy of antibiotics is not just about their presence in the region of infection, but also about the concentration of the drug in the body's system and the length of time it remains at the infection site, these two are determined by the drug's pharmacokinetic properties. also, the antibiotic dosage given by your doctor is calculated based on its absorption, distribution, metabolism, and excretion from your body.

using an antibiotic directly on a tooth socket could potentially irritate the gums and may not sufficiently address underlying infection if present. the amount of antibiotic that will get into your system in a useful way from this method would also be unpredictable.

if you are concerned about an infection, you should contact your dentist or oral surgeon. they have the knowledge and skills to make a proper assessment and determine the best course of action. 

as for the choice between penicillin and amoxicillin, it depends on the type of bacteria causing the infection. in many cases, amoxicillin is chosen due to its broader spectrum of activity, but the exact choice would be lead by your surgeon's judgement.

as for your concern surrounding your gut microbiome, you are correct that broad-spectrum antibiotics can disrupt the balance of bacteria in your gut. however, the risk of an untreated infection can far outweigh this. if you have concerns, it might be worth considering a probiotic supplement under the guidance of a healthcare provider once you finish your antibiotics. always discuss such concerns with your healthcare provider. 

in summary, you should reach out to your dental surgeon/doctor if you suspect an infection or have concerns about your medication. they can help guide you in the optimal course of treatment.

finally, never stop any antibiotic treatment prematurely unless under the direction of a healthcare provider. this can lead to antibiotic resistance, which is a severe global health issue."
N141,response_8,"i'm not a dentist, but here are some things to consider. direct application of antibiotics onto the surgical site is less likely to be effective given antibiotics from the oral administration wouldn't only affect your gut, but would get into your bloodstream and target any potential infections throughout your body. crushed antibiotics applied directly to a wound are less likely to be absorbed in the same way, and might not reach the bacteria causing the infection.

as for the antibiotics, amoxicillin and penicillin are both penicillins, and work against many of the same bacteria. however, amoxicillin is sometimes used in place of penicillin for dental infections. 

it's understandable to want to protect your gut microbiome during antibiotic use. however, taking antibiotics as prescribed can be crucial for preventing infection after procedures like these. 

do not stop taking your antibiotics prematurely; this can lead to antibiotic resistance, a global health issue. discuss this with your prescribing dentist to alleviate your concerns and establish the best treatment plan. 

you can also ask about probiotics, diets, and other methods to restore your gut microbiome after antibiotic therapy.

always follow your doctor's or dentist's advice. they have your medical history and specific situation in mind, and can answer your questions better than a general source online."
N141,response_9,"no, putting antibiotic pills directly on the socket wound after tooth extraction will not be effective for preventing or treating an infection.

firstly, antibiotics do not differentiate between bacteria they encounter - they will likely negatively affect the microbiota in your mouth, altering the balance between healthy and harmful bacteria, which could potentially lead to other problems such as oral thrush.

furthermore, antibiotics are formulated to be delivered systemically, meaning they're designed to be absorbed into the bloodstream and distributed throughout the body. trying to apply them locally by breaking a pill and applying it to the socket could irritate the healing tissue and may not provide a sufficient dose to prevent infection.

finally, antibiotic therapy isn't usually necessary after tooth extraction unless there are signs of infection. using antibiotics unnecessarily can lead to antibiotic resistance, making it harder to treat future infections.

as for your question about which antibiotic is better, both amoxicillin and penicillin have similar efficacy in treating dental infections. however, the drug choice would be guided by the type of bacteria involved, and your doctor would be best placed to advise you on appropriate treatment. 

it is important to continue practicing good oral hygiene, rinsing the mouth gently with a warm salt water solution, avoiding smoking, and eating a soft diet to aid the healing process.

if you have any symptoms suggestive of an infection (such as persistent pain, inflammation, fever), it's important to consult your healthcare provider promptly. it is not advisable to self-medicate with leftover antibiotics as it can lead to inappropriate treatment and antibiotic resistance."
N141,response_10,"you should always take a full course of antibiotics as prescribed by your doctor. not doing so could encourage the growth of antibiotic-resistant bacteria. placing an antibiotic pill directly on your tooth socket will likely not be as effective as taking it orally.

antibiotics need to be absorbed into your bloodstream to work. when they're in your blood, they can reach and kill bacteria anywhere in your body, including your tooth socket. oral pills are designed to be absorbed in your digestive tract.

when you simply place a pill on your tooth socket, it may not be absorbed at all. even if some of it is absorbed into your local tissues, it will likely not reach the necessary concentration to be effective against bacteria. 

as for your final question, penicillin or amoxicillin can both be effective for dental infections. the best choice depends on the specific type of bacteria causing your infection, so this decision should be left to your dentist or doctor.
  
remember, antibiotics can only help against bacterial infections. they won't help with inflammation, pain, or other symptoms caused by nonbacterial problems. furthermore, remember that appropriate care, oral hygiene and following post- surgical instructions, are key for preventing infections and promoting healing.

also, regarding your concern about antibiotics and gut microbiome, while it is true that antibiotics can affect gut microbiota, it is necessary sometimes to utilize these medications. after concluding the medication, your gut microbiome will likely recover. eating balanced diet and including fermented foods can help. also, probiotics, with the guidance of a healthcare provider, can be added to your diet. 

finally, anecdotal methods of ""self-medication"" can be dangerous, you should always follow given medical advice and established guidelines regarding antibiotics. it is crucial you speak directly to your health care provider to discuss these concerns and potential options for your treatment."
N141,response_11,"from the medical standpoint, stopping your prescribed antibiotics early and applying it topically is not advised. it might cause resistance.  furthermore, antibiotics are designed to be taken systemically, and crushing and applying it directly to the wound might not increase its effectiveness in preventing infection, but it could increase the risk of irritation or other complications. 

antibiotics like amoxicillin and penicillin are prescribed after a surgical procedure like yours to reduce the risk of a post-operative infection and they should be taken as prescribed by your dentist or surgeon. 

it's also crucial to complete the entire course of antibiotics, even if you feel well, to ensure that all bacteria are killed and to prevent any remaining bacteria from developing resistance to the antibiotic.

about your question of which of the two is better, that is usually patient dependent. one may be preferred over the other due to allergy potential (penicillin allergies are more common), cost effectiveness, and ability to be absorbed in the body. but in most cases, both amoxicillin and penicillin can be effectively used to treat bacterial infections.
  
remember, it's best to express your concerns to your dentist or oral surgeon before making any changes to your prescribed treatment. they can provide the most accurate advice based on your specific case.

disclaimer: this advice is intended to be general in nature, and specific causes may not apply to your situation. always consult with your healthcare provider for appropriate examinations, treatment, testing, and care recommendations."
N141,response_12,"it's important to keep in mind that this advice is not a substitute for advice from your own healthcare team, but i can give some general thoughts.

first, please don't stop antibiotics prematurely, unless your dentist or oral surgeon has told you to. bacteria that are only partially killed by an incomplete round of antibiotics can come back stronger and more resistant to antibiotics, which will make your infection harder to treat. 

if you're worried about your gut microbiome, the best thing you can do is to take a probiotic and eat a diet high in dietary fiber, which feeds the beneficial bacteria in your gut. 

placing an antibiotic pill directly into a wound is not recommended, as it won't distribute the antibiotic in an effective way. also crushed tablets can often cause irritation or even an allergic response.

penicillin and amoxicillin are both members of the same class of antibiotics. they are structurally similar and work the same way, but amoxicillin is usually better absorbed and can often be given on a less frequent dosing schedule due to its pharmacokinetics. 

again, it's recommended to contact your healthcare provider to discuss these concerns. they can give you guidance as to what you should do next and which medication might be the best for your situation considering the specifics of your case."
N141,response_13,"i'm an ai, not a doctor, but generally it's best to follow what your dentist has advised you. unconventional ways of administering medications could harm rather than help your condition. instead of placing medication in the socket, try rinsing with salt water, as it helps to minimize infection risk. if you have concerns about your gut microbiome, you could speak to your dentist or pharmacist, but pharmacokinetics is not something that should be self-adjusted.

as for which antibiotic is better, both do fall under the same class of antibiotics (beta-lactams) and they both are often used for oral infections. it might be best to stick with the one that your dentist prescribed for this specific condition. 

if you still have concerns, reach out to your dentist and discuss your worries about systemic antibiotics so they can guide you further. don't forget that the risks of stopping your antibiotics too soon include getting a worse infection that's harder to treat. always keep in contact with your healthcare provider and talk openly about your concerns."
N141,response_14,"i'm an ai, not a doctor, but based on the information available, you should not be applying oral antibiotics directly to a wound or extraction site. your body will not absorb much of the drug this way, and it can potentially cause irritation or damage to the exposed tissue. as such, there's need to take your antibiotics as prescribed by your healthcare provider. please reach out to your dental surgeon or another healthcare professional for advice on what to do next, especially if you're worried about a potential infection."
N141,response_15,"you should always complete the full course of an antibiotic as directed by your doctor, in order to prevent resistance and recurrence of the infection. discontinuing an antibiotic early can allow some bacteria to survive and potentially cause a new infection that is resistant to the antibiotic. 

regarding your idea of breaking a pill and placing it on the socket to mitigate systemic effects, that is not recommended. most antibiotics are designed and formulated to be taken orally, and using them in a way that they were not designed for could reduce their effectiveness. additionally, the concentration and distribution of the antibiotic in the oral cavity and bloodstream is carefully calibrated to eliminate the infection, and altering the route of administration can disrupt this. 

so it's not about if it's effective or not, but rather about the importance of taking medications as they're designed to be taken. antibiotics are not meant to be used topically unless they are specifically formulated for that purpose. 

as for which antibiotic to use, that decision should be made by your healthcare provider based on your specific situation and the type of bacteria causing the infection. amoxicillin and penicillin are similar drugs, but they can have different effects on different types of bacteria.

do discuss your concerns about gut microbiota with your healthcare provider. they may be able to recommend a probiotic or other strategies to help restore your gut flora after your course of antibiotics. but not taking the full course of antibiotics when they're needed can cause more harm than good. 

**it's important to not self-medicate and always follow the treatment scheme prescribed by a healthcare professional.** if you have any concerns, contact them."
N141,response_16,"no, putting an antibiotic pill in an extraction socket is not recommended and likely would not help prevent an infection. pills are designed to be taken orally, absorbed into your system, and to work throughout your body at a specific dosage. crushing a tablet and putting it into the socket will not give a controlled or sustained release of the drug and the pill ingredients may actually irritate the healing wound.

it is always best to follow the prescription and instructions provided by your healthcare professional. if you have concerns about the impact of medications on your gut microbiome, you should bring it up with your healthcare provider.

taking your antibiotics as prescribed is critical to preventing infection. if you stop taking your antibiotics before you are supposed to, there is a higher chance that the bacteria will not be fully killed and may become resistant to the antibiotics.

penicillin and amoxicillin are both types of penicillin. amoxicillin is a form of penicillin that is often more effective and less likely to result in resistance. however, each person's situation is unique, and your dentist would be the best person to determine which antibiotic is most appropriate for you."
