question_id,response_id,response
N105,response_16,"your tsh (thyroid stimulating hormone) level of 4.9 is slightly elevated. the normal range can depend on the laboratory, but it's typically around 0.4 - 4.5 miu/l. having a high tsh level could indicate hypothyroidism (an underactive thyroid), which can occur at any age, not just in those over 50 years old.

while your level is only slightly elevated, your doctor wants to check a second time to confirm because sometimes, nonspecific factors or transient illness can cause a temporary elevation in tsh. in addition, your doctor may want to see if there are any clinical symptoms of hypothyroidism such as fatigue, weight gain, dry skin, feeling cold, or depression.

your doctor mentioning more protein might not be related to your thyroid issue. your need for protein might be based on your overall dietary intake and nutritional status, exercise routine, any potential malabsorption, or any other medical condition.

as for the psoriasis and lifestyle, there is some data showing that individuals with psoriasis may be at a higher risk of developing thyroid disease, but we don't fully know if the psoriasis directly causes this. the same goes for the indoor lifestyle - lack of sunlight can lead to vitamin d deficiency, which can affect a variety of bodily functions, including potentially the thyroid, but we don't know this causation for certain.

your doctor will be able to give you more tailored advice based on your full medical history and symptoms. you're on the right track in terms of being proactive about your health and getting regular checks. the best course of action now is to go along with the repeat testing and see what the results show."
N105,response_17,"i'm an ai trained in medicine and i'll try to answer your concerns. a tsh level of 4.9 mu/l is considered high-normal. the normal range can vary slightly depending on the lab, but it usually falls within 0.4 to 4.0 mu/l. high levels of tsh suggest that your body is not getting enough thyroid hormone, which can occur in conditions such as hypothyroidism. this condition can affect people of any age, not just those over 50.

your psoriasis and the medications you're taking for it may or may not be related to your tsh level. psoriasis is an autoimmune disease, and people with one autoimmune disease are more likely to develop others, including autoimmune diseases of the thyroid.

your diet and lifestyle might also affect your thyroid. for example, a deficiency in iodine can lead to hypothyroidism. however, iodine deficiency is rare in developed countries because it's added to table salt. protein plays an important role in the body, but it has little to do with thyroid function. 

limited exposure to sunlight can lead to vitamin d deficiency, which some research suggests might be linked to hypothyroidism. however, more research is needed to confirm this connection.

in conclusion, it's hard to determine the exact cause of your slightly elevated tsh level. there are many potential factors and it's often a combination of them. it's important to follow your doctor's advice and do another test to confirm the results. if your tsh level remains high, your doctor might want to test your levels of thyroid hormones (t3 and t4) or check for anti-thyroid antibodies. these tests can help diagnose hypothyroidism or other thyroid disorders."
N105,response_18,"higher tsh can be suggestive of hypothyroidism, which can occur in people of all ages, not just those over 50. hypothyroidism occurs when your thyroid gland doesn't produce enough thyroid hormones. 

symptoms can vary from person to person and can include fatigue, constipation, dry skin, weight gain, thinning hair, depression, slow heart rate, and increased sensitivity to cold. 

your tsh level is only slightly above the normal range (normal range is typically 0.4-4.0 miu/l but this can vary slightly depending on the laboratory) so your doctor rightly wants to confirm with a retest before starting medication.

while autoimmune diseases like psoriasis can increase your risk for other autoimmune conditions such as hypothyroidism, directly linking your psoriasis and your tsh level may not be accurate. 

your diet and lifestyle may play a role, but it's unclear exactly to what extent for you personally. remember that proteins and other nutrients are best obtained from a variety of sources, not just one or two foods. 

keep in mind that overall, maintaining a balanced diet, regular exercise, and ensuring you get enough sunlight (for vitamin d) can contribute to overall health, including the health of your thyroid.

since you are under the care of a doctor, you should discuss these concerns with them as they understand your specific health history and circumstance."
N105,response_19,"tsh (thyroid stimulating hormone) is a hormone released by the pituitary gland that stimulates the thyroid to make and release thyroid hormones into the body. the normal range of tsh can vary on the individual and laboratory but generally, a tsh around 0.4 to 4.0 milli-international units per liter (miu/l) is considered normal.

a tsh of 4.9 is slightly above the normal range, which can indicate that your thyroid is underactive, a condition known as hypothyroidism. this condition can develop at any age, but it's most common in older adults. symptoms can include fatigue, increased sensitivity to cold, constipation, dry skin, weight gain, puffy face, hoarseness, muscle weakness, elevated blood cholesterol level, muscle aches, tenderness and stiffness, pain, stiffness or swelling in your joints, heavier than normal or irregular menstrual periods, thinning hair, slowed heart rate, depression and impaired memory.

hypothyroidism is usually managed with synthetic thyroid hormone replacements (like levothyroxine) to boost your thyroid hormone levels and normalize your tsh.

the metabolism of methotrexate, which you're taking for psoriasis, can be affected by thyroid dysfunction so there is a possible link there. however, your doctor will likely need to rule out other causes first.

about dietary proteins, even if you are eating chicken and eggs daily, your body might not be absorbing all of the nutrients if you have some sort of malabsorption problem or if you are not consuming enough protein. your overall diet, not just your protein intake, could impact tsh levels.

in conclusion, retesting is a good idea as levels can fluctuate and your tsh might be in the normal range next time. if it remains high, your doctor will likely explore other tests to investigate the cause. lifestyle changes and medication could help manage the condition if indeed you have hypothyroidism."
N105,response_20,"a tsh level of 4.9 is slightly elevated, which may indicate that your thyroid gland is working harder than normal to produce thyroid hormones. this condition, known as subclinical hypothyroidism, can occur in young patients. it doesn't mean you necessarily have a full-blown thyroid disease yet.

major causes of hypothyroidism include hashimoto's thyroiditis (a type of autoimmune disease), severe iodine deficiency (which is rare in most developed countries), and damage to the thyroid gland from injury, radiation, or certain medications. psoriasis is also an autoimmune disorder, so there might be a slight connection, but the relationship is not straightforward. 

your indoor lifestyle and lack of sunlight have little to do directly with your tsh levels, though sunlight is important for overall wellbeing and vitamin d synthesis, which plays a role in many bodily functions.

as for protein, you seem to get a good amount. however, protein needs can vary by individual, especially based on factors like body size, activity level, and overall health. so, you may want to calculate your daily protein needs and check this against your usual intake.

remember, this is only an interpretation. a retest and potential therapy should be decided by your doctor based on your overall health condition and symptoms. if your tsh levels remain consistently high, medication may be needed to regulate your thyroid function."
N105,response_21,"a tsh level of 4.9 can be considered to be high normal or slightly elevated, depending on the reference range used by the lab. tsh (thyroid-stimulating hormone) is produced by the pituitary gland in the brain and it stimulates the thyroid gland to produce the hormones thyroxine (t4) and triiodothyronine (t3). these hormones play a crucial role in regulation of body’s metabolism. high levels of tsh often suggest an underactive thyroid gland, also known as hypothyroidism. this can occur at any age and is not strictly limited to people above 50.

while thyroid disorders are more common in older individuals, they can certainly occur in younger adults and even children. certain factors such as family history of thyroid disease, presence of other autoimmune diseases (like your psoriasis), and certain medications (like amiodarone, lithium, interferons etc), can increase one's risk of developing thyroid disorders. 

a high tsh level and slightly high body weight can suggest hypothyroidism, which is also associated with elevated cholesterol levels, fatigue, cold intolerance, constipation, dry skin, and hair loss.

your doctor may have suggested more protein to build muscle, as it is possible to be getting less than ideal protein intake despite the chicken and eggs if you're not intentionally tracking your macronutrient ratios.

however, it is not possible to accurately determine if this is due to your psoriasis, medication, diet or lifestyle without further testing. please keep in mind, this advice is intended to be general in nature, and specific causes may not apply to your situation. always consult with your healthcare provider for accurate information."
N105,response_22,"i'm an ai language model, not a doctor, but i can provide some general insights. your tsh level of 4.9 is just slightly high. the normal range can vary depending on the lab, but it is usually around 0.4-4.0 miu/l. even though it is indeed more common for older individuals to have thyroid issues, younger individuals can also develop them. while your lifestyle can contribute to thyroid function, it is also largely influenced by genetic factors and autoimmune diseases. not getting enough sunlight wouldn't necessarily directly cause a high tsh, but it could potentially contribute to overall health issues as sunlight exposure plays a role in vitamin d synthesis, which is linked to numerous aspects of health. 

psoriasis is indeed linked with a higher risk of other autoimmune diseases, including thyroid disease. that's likely why your doctor is monitoring your tsh levels. 

remember also that protein intake isn't just about eating protein-rich foods like chicken, but also about the total amount you consume. ensure you're eating a balanced diet that meets your macro and micronutrient needs. 

it's important to note that this advice should be taken as general information and not a direct medical advice. always consult with your doctor for your medical concerns."
N105,response_23,"hypothyroidism can impact individuals of all ages, not just those over 50. elevated tsh (thyroid stimulating hormone) levels often suggest that your thyroid isn't producing enough thyroid hormone and your body is trying to stimulate more production. this can lead to hypothyroidism, which may have symptoms such as fatigue, weight gain, depression, and cold intolerance. although common in older populations, it can affect young people too.

it's not completely understood why some people develop thyroid problems, but certain factors can increase risk, including age, female sex, family history of thyroid disease, other autoimmune disorders, past thyroid surgery or radiation, and certain medications.

in terms of your diet, even though you eat a decent amount of protein, you may still be lacking important nutrients if your diet isn't well-rounded. it's not only about how much protein you eat, but also the quality and variety of other foods in your diet.

while psoriasis is an autoimmune disease and having one autoimmune disease can increase likelihood of developing another, it's not necessarily the direct cause of your elevated tsh. but the medication you are taking, methotrexate, can occasionally cause alterations in thyroid function.

an indoor lifestyle with limited sunlight can contribute to vitamin d deficiency, which has been associated with various health issues, including autoimmune diseases. however, there is not direct link established between indoor lifestyle and increased tsh. 

it's good that your doctor is ordering a retest, as it's important to confirm the result before starting anything such as thyroid replacement therapy. discuss with your doctor about your concerns and keep in mind that maintaining a balanced diet and a healthy lifestyle are important not just for your thyroid, but your overall health."
N105,response_24,"the normal tsh range is 0.4-4.0 miu/l, so your level of 4.9 is only slightly elevated. while it's true that thyroid disorders are more common in older adults, they can occur at any age. your elevated tsh might be an early sign of hypothyroidism, a condition in which the thyroid gland doesn't produce enough thyroid hormones. this can cause symptoms like fatigue, weight gain, depression, and dry skin. however, some people with elevated tsh don't experience any symptoms.

your psoriasis and indoor lifestyle might be contributing factors, but it's not clear. psoriasis has been linked to an increased risk of thyroid disease, though the reason for this is not fully understood. vitamin d, which our bodies synthesize from sunlight, plays a crucial role in the immune system and may help control inflammation related to psoriasis. vitamin d deficiency has also been linked to an increased risk of thyroid disease, but more research is needed to understand this relationship.

the advice to eat more protein is probably unrelated to your tsh level. protein is a crucial nutrient for overall health. it supports the growth and repair of tissues, production of hormones and enzymes, and muscle development. while chicken is a great source of protein, a varied diet that includes other high-protein foods like fish, legumes, dairy products, and nuts can provide a broad range of nutrients and potentially improve your health.

your doctor's suggestion to repeat the blood test is a good idea. it will give a better understanding of your hormone levels over time, which can help clarify if there's a problem. if your tsh remains high, your doctor may suggest treatment with thyroid hormone replacement medication. 

in the meantime, it might be helpful to incorporate more varied sources of protein into your diet, try to get a bit more sunlight (or consider a vitamin d supplement after discussing with your doctor), and continue your regular physical activity. 

remember, it's always best to discuss any concerns or symptoms you may be experiencing with your healthcare provider. they know your unique body and situation best."
N105,response_25,"tsh stands for thyroid stimulating hormone and a level of 4.9 is indeed slightly above what is considered the 'normal' range, which is usually between 0.4 and 4.0 miu/l. however, this could be an isolated finding, hence why your doctor wants to recheck it in a month. 

tsh is produced by the pituitary gland in your brain and tells your thyroid gland (located in your neck) to produce and release the thyroid hormones thyroxine (t4) and triiodothyronine (t3), which regulate the body's metabolism. high levels of tsh are often indicative of hypothyroidism, where the thyroid gland isn't producing enough thyroid hormones, but this is not definitive and would usually be associated with a low t4 level.

although hypothyroidism is more common in people over the age of 60, it can occur at any age and can be more common in people with other autoimmune conditions, like psoriasis. 

while sunlight and diet can affect some aspects of our health, they should not directly influence tsh levels. walking 2km per day means you are getting regular exercise which is beneficial for your overall health.

continue to follow your doctor's advice regarding retesting. if the tsh remains high, you may need further tests to determine if you have hypothyroidism. if you do, it is generally easy to treat with daily medication, which can help to restore normal thyroid function and prevent long-term complications."
