question_id,response_id,response
N42,response_15,"yes, your roommate has kissing disease, more officially known as mononucleosis or ""mono."" infectious mononucleosis is typically caused by the epstein-barr virus (ebv) and is spread via saliva, hence its nickname ""kissing disease."" here are some general guidelines on how you can protect yourself:

1. **separate items:** you can use the same shower at different times, but try to avoid sharing eatables, beverages, utensils, toothbrushes, or any item that may have been in contact with their saliva.

2. **hygiene:** good personal hygiene will greatly reduce your risk of contracting the disease. frequently wash your hands, especially before eating and after using the bathroom.

3. **masks:** wearing masks around each other could potentially provide extra protection but isn't typically recommended for mono because it's most often spread by direct contact with infected saliva, not by airborne droplets.

4. **duration:** mono can last anywhere from a few weeks to several months. it may take 4 to 6 weeks for symptoms to appear after you've been exposed to the virus. your roommate should be considered contagious as long as they are experiencing symptoms, and sometimes slightly beyond.

5. **moving rooms:** if it's an option for you, moving into a separate room could be one of the best ways to avoid contracting the virus.

6. **rest and medical advice:** if you start to show symptoms (like fatigue, fever, sore throat), immediately seek medical advice. rest, hydration, and over-the-counter remedies for fever and pain are generally the main elements of treatment.

while your frustration is understandable, it's also a good time to have a conversation with your roommate about healthy habits and boundaries. these are all important life skills, and dealing with this kind of situation can help you both learn how to live respectfully with others."
N42,response_16,"mononucleosis, often referred to as the ""kissing disease,"" is generally spread through saliva, thus the name. you are right though, it can also spread through respiratory droplets. here are answers to your queries:

1. using the same shower: you should be okay to use the same shower as long as you're not using it at the same time and you're not sharing towels or washcloths. mono isn't contracted through the skin, but through the mucus membranes in your mouth and nose.

2. wearing a mask: you're unlikely to catch mono through the air as it's primarily spread via direct contact with saliva, not by sharing breathing space. however, if your roommate sneezes or coughs without covering their mouth, droplets can contain the virus. wearing a mask could add some protection, but it's not a guarantee.

3. precaution duration: symptoms of mono can last for one to two months, but the virus can remain in your saliva for months after the symptoms have ended. this means that your roommate can still pass it on to you even if they're feeling better.

4. moving to a new room: this may be a drastic solution but it can certainly reduce your chances of getting sick. 

5. dealing with roommate: have a conversation with your roommate about cleanliness and hygiene, especially when they are sick. it's vital they understand the importance of their actions to reduce chances of spreading illnesses.

preventing the spread of mono is best done by avoiding close contact, like kissing or sharing drink containers. the virus can also live for several hours in saliva that's outside the body, so avoid sharing things like toothbrushes or eating utensils. 

keep in mind, while it is understandable that you want to avoid getting sick, a large proportion of people have been exposed to mono by adulthood and it doesn't always develop into illness. make sure to rest, maintain good nutrition, and manage stress - these will all help your immune system fight off potential infections. 

if you’re ever unsure, consult with a healthcare professional for advice tailored to your unique situation and potential risk factors."
N42,response_17,"kissing disease, also known as mononucleosis or ""mono"", is usually spread through saliva, hence its name. particularly, it is transmitted through actions such as kissing, sharing utensils, or drinking from the same glass. 

here are some precautions and things to think about:

1. although the disease is not highly contagious, it is still better to avoid sharing personal items such as toothbrushes, eating utensils, and towels. 

2. the virus might indeed be present in water droplets from coughs and sneezes, so maintaining a clean environment and practicing good hand hygiene is essential. 

3. both of you wearing a mask could help in preventing the spread of the virus, especially when you're in close quarters.

4. it's hard to specify an exact period of time for how long you need to take these precautions as the presence of the epstein-barr virus (the main cause of mono) in a person's saliva can vary greatly. it may persist for months, especially if the person has symptoms.

5. moving into a new room could definitely be an option to consider if it's available, particularly since you mentioned getting sick from your roommate before. however, keep in mind that once a person gets mono, they develop immunity to it and won't likely get it again.

6. finally, remember that staying healthy requires a balance of good nutrition, sleep, and exercise. if you are not getting enough sleep or are feeling stressed, your immune system can be compromised, making you more susceptible to infections.

7. it is always advisable to consult with a healthcare professional for personalized advice.

try having an open conversation with your roommate about your concerns. they may also be worried or feeling guilty about potentially passing on an illness to you, and may not have thought about all the ways they could help to prevent it from spreading. a solution that suits both of you could be found if everyone involved is aware of and considers the needs of the others."
N42,response_18,"""kissing disease,"" also known as mononucleosis (or mono), is often transmitted through saliva and close personal contact, hence its nickname. however, it's not as contagious as some infections, such as the common cold.

here are some things you can do or avoid:

1. sharing same shower: there is typically no risk involved with showering in the same shower. mono isn't spread through the airborne route like a cold or influenza. 

2. mask-wearing: it may be a good idea in general, considering your concerns regarding frequent illnesses (this may not be directly related to mono, but other illnesses).

3. how long to take precautions: mono can be contagious from the time symptoms appear until several weeks after symptoms have resolved. sometimes, the virus can be spread for up to 18 months after symptoms disappear. but remember, it's not as easily spread as the common cold or flu.

4. moving rooms: this depends on the level of your concern and the feasibility of switching rooms. if you are constantly getting sick from your roommate and they are not changing their behaviors, it may be worth considering.

it's important to remember that prevention is key. this means not sharing eating utensils, toothbrushes, or drinks. washing your hands regularly, especially before eating, can also help. there isn't a vaccine to protect against mononucleosis.

while there's a chance you could contract the disease from your roommate, it can be avoided with consistent, careful hygiene. 

however, if you are frequently getting sick and it's impacting your quality of life, it might be worth considering talking to your roommate about their habits and possibly seeking another living arrangement if this continues to be a problem. 

lastly, don't hesitate to discuss your concerns with a healthcare professional as they can give personalized advice based on your situation."
N42,response_19,"infectious mononucleosis, also known as ""kissing disease,"" is caused by the epstein-barr virus (ebv) and is transmitted through saliva. you can get it through kissing, but you can also be exposed through a cough or sneeze, or by sharing a glass or food utensils with someone who has mono. so, in general:

1. shower: yes, you can use the same shower. the virus does not live long outside the body and is unlikely to spread from shared bathroom facilities, especially if you're using it at different times. keeping the bathroom area clean would be a good measure to prevent any kind of infections.

2. mask: wearing a mask might help prevent the spread but it would likely be more useful for your roommate to avoid sharing eating utensils, cups, or anything else, which could have their saliva on it.

3. duration: mono illness usually lasts a few weeks but the virus remains in the body. a person can spread the infection to others for many months after symptoms are gone. in rare cases, it can take as long as 18 months before the virus isn't contagious any more.

4. moving out: you could consider moving to another room if possible, just to minimize your risk of exposure.

5. prevention: maintain good hygiene. don't share food, drinks, eating utensils, toothbrushes, or lip products. 

it seems like you and your roommate have different habits that could potentially affect each other's health. it may be a good idea to have an open conversation about your concerns. if you've already gotten sick a couple of times from your roommate, it may be worth discussing other potential housing options with whoever is in charge of your housing arrangements. for all health concerns, consulting a healthcare provider would be best to identify precautions specific to your situation."
N42,response_20,"mononucleosis, commonly referred to as 'the kissing disease', is caused by the epstein-barr virus. it's spread through saliva, hence the nickname, and can also be spread through coughing or sneezing, or by sharing drinks or eating utensils.

1. shower: you can share the same shower but not at the same time. clean the areas you often touch after the infected person has used them. as long as you're not swallowing the water or getting it in your eyes or mouth, you should be fine.

2. masks: it can't hurt for your roommate to wear a mask while they're symptomatic, but it's not necessary for you if you're not in close contact. it's more important for them to avoid sharing utensils or other items that could spread the virus through saliva.

3. duration of precautions: people can be contagious for a long period of time (up to 6 months in some cases), even after symptoms have subsided. however, most people are most contagious during the first 2-4 weeks of symptoms.

4. moving to a new room: this could be a good idea if possible, not only to reduce the likelihood of catching mono, but also to reduce general stress and possible strain on your friendship.

5. as for your general frustration: it sounds like you may also need to have a serious conversation with your roommate about your need for a safe and healthy living environment. if they're regularly putting you at risk for catching illnesses, that's not fair or considerate to you.

remember to wash your hands regularly, try not to touch your face, and avoid sharing food and drinks with your roommate. if you start feeling unwell, contact your doctor right away. 

the best thing you can do for yourself is to keep your immune system strong by eating a healthy diet, getting regular exercise, and ensuring you're getting plenty of sleep. also, if you're not already vaccinated against it, getting a flu vaccine can help to reduce your overall risk of getting sick during this time."
N42,response_21,"infectious mononucleosis (often called ""mono"" or the ""kissing disease"") is usually caused by the epstein-barr virus and is primarily spread through saliva (hence the name ""kissing disease""). it can also be spread through other body fluids or through coughing and sneezing. 

here are some things you can do:

1. avoid directly sharing drinks, food, utensils, or personal items like toothbrushes or towels.
2. maintain good hygiene habits. this includes frequent hand washing and disinfecting shared areas, such as doorknobs and light switches.
3. keep your personal space as clean as possible.

showering separately should be fine, as long as you're not sharing towels or other personal items. the risk of catching mononucleosis from water droplets in a shower is very low.

in regards to wearing masks, it would be beneficial if your roommate is in close proximity with you and is coughing or sneezing. this could potentially reduce the risk of transmission. you might want to consider wearing one yourself as an extra precaution.

the duration of precautions could vary. it's difficult to say how long your roommate will be contagious, but period of highest risk is probably during the early stages of illness. however, the epstein-barr virus can still be present in saliva for months after symptoms have resolved.

moving into a new room might be something to consider if the living situation is causing you stress or if you keep getting sick. it's important to prioritize your own health and well-being.

lastly, communicate with your roommate about your concerns and try to establish some ground rules to keep both of you healthy. if he's not willing to take steps to protect your health, it might be best to separate living situations. you might also consider discussing the situation with your housing provider and see what solutions they can offer. 

always remember to seek professional medical advice regarding these types of situations. the above suggestions are based on what is generally recommended but may not be applicable to every situation."
N42,response_22,"i'm not a doctor, but here are some general tips in dealing with a roommate who has mononucleosis, more commonly known as the kissing disease. mono is caused by the epstein-barr virus and it is indeed spread through saliva and mucus, typically via kissing, sharing drinks or utensils, or being exposed to coughs or sneezes.

1. shared shower: as long as you’re using the shower at different times and you’re not sharing towels, this should be fine. make sure the bathroom is cleaned regularly. 

2. wearing masks: wearing face masks could help prevent the transmission of mono as well as other illnesses. your roommate who is sick should definitely consider wearing one if they're coughing and sneezing often. as the person not sick, wearing a mask couldn't hurt, but it may not be completely necessary if your roommate is careful. 

3. duration of precautions: the infectious period for mono can vary, but symptoms usually appear 4 to 6 weeks after you get infected. even if symptoms disappear, you can still carry the virus in your mouth for up to 18 months. it doesn't necessarily mean you're infectious during this whole time, but it's still good to maintain good hygiene practices.

4. moving to a new room: this might be the best course of action for your situation, especially if this is not the first time you've gotten sick from your roommate's habits. this would reduce your potential exposure to the virus and give you peace of mind.

5. additional precautions: try not to share drinks, utensils, toothbrushes, or any other item that may come in contact with your roommate's saliva. wash your hands regularly.

6. seek medical advice: always reach out to a healthcare professional about specific actions/recommendations for your situation.

remember though, while it's good to take precautions, there's no certain way to prevent getting mono if you're living close to someone who currently has it. but, maintaining good hygiene practices can definitely lower your risk."
N42,response_23,"mononucleosis (the ""kissing disease"") is spread through bodily fluids and can be contagious for weeks or months after symptoms have subsided. it's primarily spread through saliva but can also be spread through a sneeze or cough, or by sharing drinks or food. transmission through water droplets in a shared shower is less likely, but still possible. your concerns are valid, and there are several steps you can take to reduce your risk.

1. **hygiene:** maintain excellent hygiene. this includes frequent hand washing, not sharing personal items (e.g., dishes, utensils, towels), and thoroughly cleaning shared spaces (like the shower) between uses.

2. **mask usage:** if you don't have access to a separate bathroom, having your roommate wear a mask in shared areas, particularly when they're showing symptoms or are known to be contagious, can help reduce the risk of spreading the disease. you should also consider wearing a mask in these instances.

3. **social distancing:** limit your close contact with your roommate as much as possible, especially during acute stages of their illness.

4. **duration of precautions:** your roommate should no longer be contagious about a couple of months after symptoms subside. however, because everyone's body is different, it can take longer. you might want to continue taking precautions until your housing contract ends.

5. **consider moving:** if your roommate continues demonstrating risky behavior, you should certainly consider moving to a new room or other accommodation, if possible.

you should have a honest conversation with your roommate about your concerns. if you express your worries and anxiety, hopefully they'll be understanding and willing to adjust their behavior, or make it easier for you to adapt to the situation.

finally, keep in mind that everyone's immune system is different. while your roommate may have caught mono, that doesn't guarantee you will too, even if you're in close proximity to them. some people are simply more prone to catching infectious diseases. 

always stay in touch with your healthcare provider for personal medical advice."
N42,response_24,"infectious mononucleosis, which is sometimes known as kissing disease, is caused by the epstein barr virus. it is mainly spread by saliva and close contact. this is why it has come to be referred to as the 'kissing disease'. it can be spread through coughing, sneezing, or by sharing a glass or food utensils with someone who has mono. it is unlikely to be spread through shared showers or toilets.

if your roommate has been diagnosed with mono, here are some things you can do:

1. do not share items that can spread the infection. this includes things like drinking glasses, toothbrushes, or eating utensils.

2. maintain good hygiene. wash your hands regularly and use hand sanitizer if soap and water isn't available. 

3. you can use the same shower at different times. the virus doesn't survive long outside the body, and it would be highly unlikely to catch the virus this way.

4. it is probably not necessary for them to wear a mask, but it might be a good idea if they are frequently coughing or sneezing, especially in shared spaces.

5. usually, a person can spread the virus for a few weeks, but sometimes it can be for longer. follow these precautions until your roommate has no symptoms at all.

6. chance of getting infected is relatively low unless you share saliva or have close contact, so a new room may not be necessary unless you guys often share utensils, drinks etc. you might need to reconsider this if you are very concerned about the chance of getting sick.

remember, even though it may be frustrating to get sick because of your roommate's lifestyle choices, infectious illnesses like mono can happen to anyone at any time. it's not specifically because they party or stay up late. they probably caught the virus from someone else who had it. it's always a good idea to practice good hygiene and health habits to avoid getting sick.

be patient with your roommate as mono can make a person feel really unwell and tired. it may be a good opportunity to have a constructive talk about your concerns around shared health and wellness in your living situation."
N42,response_25,"the ""kissing disease,"" or mononucleosis, is majorly spread through saliva and close contact. activities such as kissing, sharing dishes, and eating utensils, can increase your risk of contracting the virus. however, it's not typically not as contagious as some infections, such as the common cold.

1. using the same shower: considering that mono is not generally spread through water droplets, using the same shower should be fine. however, maintain good hygiene practices like not sharing personal items such as face towels, washcloths, toothbrushes, etc. 

2. wearing a mask: ideally, both of you could consider wearing a mask indoors if the person is coughing or sneezing. this will particularly help in preventing other infectious diseases that may be spread through such methods.

3. precautions duration: as far as the duration goes, it's recommended to continue these precautions till your roommate is symptom-free. mono can sometimes last for a few weeks to a few months. 

4. moving to a new room: if you are able to move to another room, it may be a safer option to prevent catching the disease. however, if moving isn't possible, practicing good hygiene and avoiding close contact should largely reduce the risk of transmission.

5. concerns about your roommate's lifestyle: if your roommate's actions are affecting your health regularly, you might want to discuss this issue with him/her, or raise a complaint with your housing admin, to see if there could be some resolution.

remember to wash your hands regularly and avoid touching your face as much as possible. boost your immune system by eating healthily, sleeping well, and regularly exercising. if you feel any symptoms (like fatigue, fever, sore throat, swollen lymph nodes in the neck, etc.) contact your healthcare professional immediately. 
   
keep in mind this advice is general in nature and not as specific as a one-on-one consultation with a doctor. consider seeking professional medical advice if you have any further concerns."
