question_id,response_id,response
N198,response_20,"the most important step in managing a wound is to clean it thoroughly to prevent infection. if it's a minor wound (like a shallow cut or scrape), you can do this yourself. 

here what you should do:

1. rinse the wound with clear water. using a soft washcloth and soap, carefully clean the skin around the wound. don't get soap in the wound as it can cause irritation. 

2. pat the area dry and apply an antibacterial ointment, like neosporin or a similar generic product.

3. after applying the ointment, you should cover the wound with a bandage or sterile dressing to keep it clean and protect it.

now, about the question of using hydrogen peroxide or rubbing alcohol:

most health care professionals recommend avoiding them for wound care because they might delay healing. they can potentially damage tissue and delay the healing process. they are generally used for sterilizing the skin before an procedure but not for treating a wound. they can harm the cells that are essential for wound repair. 

so, you should skip the rubbing alcohol and hydrogen peroxide step for wound cleaning and care. 

please seek immediate medical attention if the wound is deep, large, or caused by a dirty or rusty object, if it's a bite or puncture wound, or if the wound shows signs of infection (like increasing redness, warmth, swelling, constant or increasing pain, or pus). 

however, please remember to always consult with a healthcare professional for any health concerns."
N198,response_21,"wound care is important to prevent possible infection. the general steps to clean a wound are:

1. wash your hands thoroughly with soap and water.
2. rinse the wound gently but thoroughly with clean water. for minor wounds, soapy water can also be used.
3. pat the wound dry gently with a clean dishcloth or paper towel.

using rubbing alcohol or hydrogen peroxide is generally not recommended for several reasons:
- they may delay healing.
- they can damage skin and tissue cells.
- they may cause a painful burning sensation.

after cleaning and drying a wound, you should:
1. apply a topical antibiotic cream or ointment. this helps keep the surface moist and can help prevent infection.
2. cover it with a clean bandage or dressing.

change the dressings at least once a day or whenever it might be soiled or wet. seek medical attention when it's a deep wound, there's a foreign object, when it doesn't stop bleeding, or you develop signs of infection like redness, swelling or increased pain. stay current with your tetanus shots for any wounds that might be dirty or deep."
N198,response_22,"while it is beneficial to clean a fresh wound with water and mild soap to remove dirt and debris, using hydrogen peroxide or rubbing alcohol to clean the wound is not generally recommended. despite their ability to kill bacteria, these substances can harm and delay the wound healing process.

hydrogen peroxide and rubbing alcohol kill not only bacteria but also healthy cells around the wound that are trying to help in the healing process. as such, it's not typically recommended to use these except in certain specific situations and under medical supervision.

once the wound is clean, an over-the-counter antibiotic ointment (like neosporin) can be applied, if desired, to further help prevent infection. following this, the wound can be covered with a clean bandage or dressing. remember that this advice applies to minor wounds; deeper or more serious wounds should be treated by a healthcare professional.

also keep an eye for signs of infection such as increased redness, swelling, pain, or yellowish discharge. if any of these occur, seek medical attention immediately."
N198,response_23,"wound care should be done carefully to prevent infections. the general recommendations are:

1. after getting injured, first, you should wash the wound gently with clean water and mild soap. this can help remove any visible dirt or debris.

2. it's not typically recommended to use rubbing alcohol or hydrogen peroxide to clean wounds. these can actually damage the tissue and delay healing. while they kill bacteria, they also kill the body's own healing cells and might delay wound healing.

3. after cleaning the wound, you can apply an antibiotic cream or ointment. this can help prevent infections.

4. finally, cover the wound with a clean bandage to provide protection.

keep an eye on the wound for any signs of infection, such as redness, swelling, or pus. seek medical attention immediately if you notice any of these signs, or if you're unable to clean the wound well on your own (especially in the case of deep punctures or wounds caused by potentially dirty objects, like a rusty nail or broken glass). in these cases, a tetanus shot may also be necessary if it's been a while since your last one. a healthcare provider can provide a more thorough wound cleaning if needed and can provide further recommendations based on the specific wound and situation."
N198,response_24,"the current advice for cleaning a wound is:

1. wash your hands: this helps avoid infection.
  
2. rinse the wound: use cool water and soap to clean around the injured area. don't use soap on the wound itself because this can cause irritation. 

3. use a soft cloth or a sterile piece of gauze to gently dab the wound. 

there are conflicting opinions on the use of hydrogen peroxide or rubbing alcohol. both are able to clean the wound, but they might also damage tissue and delay healing. for that reason, their general use isn't usually recommended.

finally, after cleaning the wound, apply a sterile dressing or bandage. you can use an antibiotic ointment if desired but it's often unnecessary.

just remember that if the wound is large, deep, caused by a dirty or rusty object, has persisting debris after washing, involves a bite (animal or human), or is on the face or genitalia, seek medical attention as soon as possible. also seek immediate attention if the wounded person is not up-to-date on their tetanus shots.

the final advice is a general guidance. the best course of action may vary based on specific circumstances or person, and therefore if there is any doubt, you should seek medical help."
N198,response_25,"immediately after getting injured, it is crucial to clean it primarily with water and gentle soap to remove any debris and bacteria. this can help prevent an infection.

afterwards, you should apply a topical antibiotic ointment if it's a minor wound. then, cover the wound with a sterile bandage. this helps to protect the wound from any further potential sources of infection.

the use of rubbing alcohol or hydrogen peroxide is generally discouraged for cleaning wounds because they can damage the body's tissue and delay recovery. they are generally used on the skin around the wound as a disinfectant, not directly on the wounds unless in medical supervision.

it's highly recommended if the wound is deep, if it isn't getting better over time, or if any signs of infection such as increased pain, redness, heat, or swelling, to consult a healthcare provider."
