question_id,response_id,response
N169,response_19,"i'm sorry to hear about your situation! please note that it is crucial for you to contact your healthcare provider right away; they are the most equipped to adequately respond to your health concerns. 

in the meantime, here are a few suggestions that may help:
1. take a deep breath in before coughing, and cough in a series of short bursts instead of one large cough. this can sometimes limit the amount of pressure on your pelvic floor.
2. when you feel a cough coming on, lean forward and support your abdomen with your hand or a pillow.
3. try to empty your bladder regularly because a full bladder can worsen a rectocele.
4. kegel exercises can strengthen your pelvic floor muscles, which may help to support your rectocele. however, ensure you talk to your healthcare provider before too, since if done improperly it can worsen your condition.
5. avoid heavy lifting of any kind, including heavy grocery bags, children, or weights.
6. stay well hydrated and ensure a healthy diet full of fiber to prevent constipation, which can exacerbate a rectocele.

regarding the cough and your asthma and covid situation, it's important to manage your asthma during this time by taking your asthma medication as prescribed. speak to your doctor as soon as you can about tanking a more comprehensive approach to manage your symptoms, such as considering a course of steroids, which may help manage the inflammation in your lungs contributing to your cough.

nb: all the advice given here should be accompanied by that of a healthcare professional."
N169,response_20,"i'm really sorry to hear about this difficult experience. it's important to note that while i can provide some general advice, only a doctor who can fully evaluate your situation can provide accurate guidance.

in general, your inhaler should help relax your airways and clear out any excess mucus, reducing the need to cough. make sure you're using it correctly and frequently enough, following your doctor's directions.

you may also want to elevate your head while sleeping to help reduce coughing overnight, drink plenty of fluids to thin out mucus, and consider using a humidifier to add moisture to the air and soothe your throat.

in terms of managing your rectocele, it's important to avoid straining and to reduce pressure on your pelvic floor. gentle exercises such as kegel exercises may help, but it's essential to perform these correctly and safely. you can also try a pelvic support device, such as a pessary, but this should be done under the guidance of a healthcare provider.

another strategy would be finding ways to reduce your coughing, which can reduce the pressure on your pelvic floor. you might try drinking sips of warm liquids or using a warm compress on your chest to help soothe the cough. over-the-counter cough suppressants could be beneficial.

make sure to reach out to a healthcare provider for further advice based on your individual situation. there could be prescription medications or strategies they can offer to help manage your rectocele and alleviate your cough."
N169,response_21,"i'm really sorry to hear that you're dealing with this, it sounds very distressing. as a language model ai developed by openai, i can provide the following advice based on known medical knowledge:

1. training your pelvic floor muscles might help to support the bulging tissue, even at home. this involves isolating and contracting the muscles around the rectum and vagina, similar to when you're trying to stop urinating midstream. you may also consider using a pessary, a device you insert into your vagina that can offer support and maintain the position of your rectum.

2. holding your perineum (the area between your vagina and rectum) when you cough can sometimes offer immediate support, reducing bulging.

3. the way you're coughing can also make a difference. try to engage your core muscles before and during the cough. this bracing action can help to support your pelvic floor. 

4. practicing good bowel habits can help reduce the strain on your rectocele. aim to have soft, formed stools, drink plenty of fluids, eat a high-fiber diet and avoid straining while defecating.

5. avoid heavy lifting or any activities that potentially increase pressure on your pelvic floor. 

please reach out to your healthcare provider for further advice. make sure they are aware of the severity of your symptoms so they can suggest the best strategies for your specific case."
N169,response_22,"i'm really sorry to hear you're having such a hard time. pelvic organ prolapse can indeed be exacerbated by forceful coughing due to the increased pressure. here are a few suggestions that may help:

1) see if you can get a nebulizer at home. this may help to better control your cough, thus reducing the pressure on your pelvic organs. 

2) try ""splinting"" during a cough. this involves applying gentle pressure to the prolapse during a cough to help support the pelvic organs. some women find relief from wearing supportive undergarments.

3) practicing pelvic floor exercises (also known as kegels) may also be useful. you can find guides online on how to do these exercises. however, it's critical these are done correctly otherwise they could potentially do more harm than good.

4) try to avoid constipation as straining during bowel movements can also exacerbate prolapse. stay well-hydrated and eat a fiber-rich diet.

5) experiment with different positions to see if any provide relief. some women find that lying on their side or elevating their hips can help.

6) when you cough, try to do so with your mouth open, this can help decrease the pressure within your chest and abdomen and subsequently on your pelvic floor.

of course, as soon as it's safe for you to do so, please make an appointment with a physical therapist specializing in women's health or a urogynecologist. 

i hope you recover from covid soon and that these suggestions prove helpful! i advise getting in touch with your healthcare provider about your situation if you haven't done so already. they may be able to offer additional suggestions or possible treatments."
N169,response_23,"i'm really sorry you're going through this. a rectocele is when the rectum pushes against and moves the back wall of the vagina, which can get worse with straining or coughing. if you're coughing too much and causing your rectocele to get worse, you should consult your doctor about managing your cough. 

some general advice would be to try coughing in a different way. instead of a sudden, forceful cough, try a more controlled, slower cough. if you have a strong urge to cough, try to take a few deep breaths first, and then release the air slowly. this may reduce the force on the cough on your pelvic floor. 

if you're finding that your inhaler isn't helping enough with your cough, it would be best to reach out to your primary care provider or pulmonologist (lung doctor) if you have one to see if adjustments to your medication are needed. they could provide guidance on whether a nebulizer treatment would be right for you. 

pelvic floor exercises such as kegels might also help in improving your pelvic floor muscle strength. however, it's best to consult with a healthcare professional before starting to do these exercises, particularly if you're dealing with a rectocele.

keep in mind also that hydration is key for bowel regularity, and preventing constipation could help you avoid straining the pelvic floor muscles. 

please take care and remember to consult your healthcare providers regularly on this issue. you're not alone, and there are treatments available that can help improve your symptoms."
N169,response_24,"i'm really sorry to hear you're having these difficulties. unfortunately, it's quite challenging to prevent the worsening of a rectocele due to coughing without medical attention, especially if it's due to something like covid. you can try to do some pelvic floor exercises, known as kegels exercises, to strengthen your pelvic floor muscles. breathing exercises, where you take less deep breaths but more regularly, might also help with the coughing. however, you should definitely contact your physician regarding your situation. they may have more advice on management strategies and can potentially help you expedite getting the nebulizer treatment if needed."
N169,response_25,"i'm sorry to hear you're going through this. the pressure of coughing can indeed intensify the symptoms of a rectocele. 

to begin with, it's important to manage the cough itself: stay hydrated, keep the air moist (for instance with a humidifier), and avoid irritants like smoke. cough suppressants can be tried under consultation with your healthcare provider.

as for coping with your rectocele during episodes of coughing, one thing that might help is to sit down when you feel a coughing fit coming on, or even to lie down on your side. this can alter the pressure dynamics and might help reduce the impact. 

pelvic floor exercises (kegels) might also help to strengthen the area, but it's best to ask your doctor before starting these, especially if you're experiencing these symptoms.

do reach out to your healthcare provider to discuss your symptoms and difficulties further. but do keep in mind that while covid can worsen your rectocele symptoms, it's unlikely to cause permanent damage to your pelvic floor.

also, your condition is not something to be embarrassed about. it is a genuine health concern and many women would undoubtedly be facing similar dilemmas. sharing and discussing about it can help others too."
