question_id,response_id,response
N127,response_18,"smelling salts, also known as ammonia inhalants, can restore consciousness or alertness by triggering an inhalation reflex, causing the muscles that control breathing to work faster. originally, smelling salts were used to revive fainting or unconscious individuals in emergency situations. now, they're more commonly seen in athletics to quickly wake up athletes after minor injuries.

however, relying on smelling salts just to wake up is not recommended. they can cause instant headaches, dizziness, or, if used frequently, routine respiratory problems; they are not designed for regular use and can potentially damage delicate nasal membranes.

instead, it would be healthier to try to remedy your sleeping patterns or mitigate what may be keeping you asleep like a late-night screen use, excessive caffeine, or other factors. establish routines based on consistent waking and sleeping hours. if necessary, request help from your doctor or a sleep specialist who can suggest and oversee an appropriate sleep pattern re-adjustment plan. seeing as you are under academic and probably psychological stress, a therapy or counseling intervention can be helpful to manage these issues which might in turn help establish healthier sleeping patterns. 

very importantly: good luck in your final law exams! future legal matters could be in your hands. take care of your health now to secure the future."
N127,response_19,"smelling salts can aid in waking you up because they irritate the nasal mucosa and stimulate the trigeminal nerve, resulting in an inhalation reflex which affects the pattern of breathing and increases alertness. they were historically used to revive people who fainted.

however, using them on a regular basis, especially to substitute a proper sleep routine, is not recommended. they can cause side effects such as nausea, headaches, and lung damage from repeated use, especially if inhaled deeply or for a prolonged period. the irritation can also possibly lead to long-term inflammation.

additionally, it’s important to note that using smelling salts is just a short-term solution and doesn't fix the root problem — sleep deprivation. lack of sufficient sleep can lead to multiple potential health consequences, including poor mental functioning (which is particularly important given your exams), weakened immunity, increased risk of chronic diseases, and many more.

if you have ongoing difficulties with sleep, it would be good for you to visit a doctor or a sleep specialist. they could identify any potential conditions or issues that may be causing these difficulties and work with you to develop a suitable sleep schedule or provide relaxation techniques to help you fall or stay asleep. a healthy diet, regular exercise, and good sleep hygiene (e.g., dark, quiet room, comfortable bed, no screens before bed etc.) might be beneficial as well."
N127,response_20,"smelling salts are a chemical compound usually containing ammonia, that produce a strong odor and are used to rouse consciousness, particularly in athletes who have received a blow to the head or in people who have fainted. they work by stimulating the nasal membranes to trigger the inhalation reflex, causing the muscles that control breathing to work faster.

however, using smelling salts regularly, especially to wake up from a normal sleep, is not recommended. they're intended for emergency situations, not daily use. even with infrequent use, they can irritate the nose and respiratory tract, damage nasal and lung tissue, worsen existing respiratory issues, and cause dependence.

you should instead look into natural ways to wake yourself up. these could include keeping a regular sleep schedule, using an alarm that requires you to solve a problem or get out of bed to turn it off, or placing your alarm across the room so you have to physically get up to turn it off. 

you might also consider consulting with a healthcare provider or sleep specialist to explore safe and effective options for waking up on time. persistent difficulty with waking up could indicate an underlying sleep disorder that needs proper attention and treatment. a balanced diet and a reasonable amount of physical activity are also significant factors that contribute to good sleep health. and scaling back on caffeine and nicotine towards the end of the day can surprisingly lead to waking up easier and with more energy."
N127,response_21,"smelling salts can indeed jolt the nervous system into alertness due to the ammonia gas they contain. however, their use isn't typically recommended for regular awakening from sleep due to the potential for over-stimulation and possible damage to the mucous membranes in the nose over time. 

there are many alternative ways to help you waking up on time and stay awake without relying on such substances. one of the best strategies is maintaining a regular sleep schedule – even during this time of high-stress exams.  aim to go to bed and wake up at very consistent times. this will help set your internal body clock to habitually wake at the same time each day.

other tips include:
1. avoiding caffeine and alcohol close to bedtime.
2. keep the bedroom environment cool, dark, and quiet.
3. try using an alarm clock that uses light to gradually ""sunrise"" you awake.
4. keep electronics out of the bedroom to avoid stimulating your brain when you should be winding down.

also, it's imperative that you understand the importance of sleep for memory and learning. sleep deprivation can have serious effects on your brain functions, mood, and cognitive abilities, which may hinder your exam performance.

nonetheless, if you think using smelling salts is the option for you, please consult with a healthcare professional before adopting this method."
N127,response_22,"smelling salts can be used to increase alertness momentarily. they work by releasing ammonia gas, which triggers an inhalation reflex by irritating the mucous membranes of the nose and lungs. however, they're usually used for competitions like powerlifting because of the adrenaline surge they provoke. 

for a healthy person like you, it's unlikely to cause harm if used occasionally, but there could potentially be downsides if used regularly, such as causing damage to your respiratory tract, including the nasal and lung mucosa, especially if aggressively inhaled. 

it seems your struggle is about ensuring you wake up and stay awake. instead of using smelling salts, there are better ways to help with this that are safer, healthier, and likely just as effective.

consider these alternative strategies:

1. go to bed and get up at the same time everyday.
2. don't eat large meals close to your bedtime.
3. avoid caffeine and alcohol near bedtime.
4. make your sleep environment as comfortable as possible - quiet, dark, and a comfortable temperature.
5. regular exercise contributes to healthier sleep.

lastly, given your condition, you may want to seek medical advice. even though you're not having a serious issue, a medical professional may be able to provide tips customized to your personal health.

note: this advice is intended to be general in nature, and specific causes may not apply to your situation. always consult with a healthcare provider for appropriate examinations, treatment, testing, and care recommendations."
N127,response_23,"in general, smelling salts could be used as a wake-up aid, but there are more natural ways to deal with your issue that do not possess potential side effects. smelling salts are predominantly used to arouse consciousness due to their strong smell of ammonia, which stimulates the inhalation reflex. that said, prolonged and frequent use may lead to headaches, lung damage, and other issues, especially for those with a pre-existing respiratory condition.

if you're having trouble waking up, consider not only setting an alarm but placing it further away from your bed so that you have to physically get up to turn it off. also, try to establish a consistent sleep schedule where you go to bed and wake up at the same time everyday.

additionally, it’s important to think about the quality of sleep you're getting. caffeine, alcohol, and nicotine can negatively impact your sleep. also, you might need more sleep than you think. the national sleep foundation recommends 7-9 hours of sleep for young adults and adults.

if this continues to be a problem, consider seeking medical advice to be sure it's not caused by a sleep disorder like sleep apnea. 

please note that the advice should not replace a consultation with a medical professional."
N127,response_24,"while smelling salts have been used by athletes and other individuals for a quick revival from light-headedness or fatigue, their consistent use for waking up from sleep is not recommended. they work by releasing small amounts of ammonia gas, which triggers an inhalation reflex by irritating the nasal and lung membranes. long-term continual use and exposure can potentially lead to problems with the respiratory tract, and it could possibly cause dependency over time.

for a healthier alternative, try utilizing several alarms set at different times or placed in different locations to force you to physically get out of bed to turn them off. try to establish a consistent sleep routine. limiting screen time before bed can help, as the light from screens has been found to disrupt the body's natural sleep and wake cycles. light exercise in the morning can also kick start your day.

stimulants like caffeine can help in the morning but should be used in moderation and not too late in the day as it can interfere with your ability to fall asleep at night. 

understanding that this is a stressful time with your exams, it's essential to take care of your overall health too. balanced nutrition, staying hydrated, and allowing some time for relaxation or meditation can also support your academic performance. it is always advisable to consult with a medical professional if sleep issues persist."
N127,response_25,"using smelling salts is generally safe, but it's not necessarily the most pleasant or effective method to wake up. it works by the release of ammonia gas, which triggers an inhalation reflex as it irritates the mucous membranes of your nose and lungs. 

however, consistent use of this method to wake up might cause some issues, such as eye and nose irritation, coughing, and may even induce more fatigue. and remember, smelling salts are generally used to revive or stimulate consciousness so using it when you’re already awake (but sleepy) may not have an intended effect. 

the best approach to waking up on time is consistent sleep hygiene including setting a regular bedtime and sticking to it, avoiding caffeine and large meals before bedtime, and placing your alarm far enough out of reach that you have to physically get out of bed to turn it off. 

lastly, it may be worth considering that law school is inherently stressful, and stress can interfere with both the quality and duration of sleep. if you're finding it hard to get up in the mornings despite getting enough sleep, it might be worth speaking to a healthcare provider to ensure you're not dealing with a sleep disorder or depression. in extreme periods of demanding mental work like law exams, it’s essential to ensure you’re getting enough sleep, as sleep deprivation can adversely affect cognitive function, memory, and mood. 

and remember, this advice is no substitute for seeing a healthcare provider. if you're struggling with sleep or waking up, it might be best to see a physician to talk about these concerns."
