question_id,response_id,response
N169,response_1,"i'm sorry you're going through this. prolonged severe coughing can indeed worsen conditions like rectocele. here are some measures that might help manage symptoms:

1. try to manage your cough as much as possible. keep using your ventolin inhaler as directed by your doctor. consult with your physician about possible treatments to manage your cough. over-the-counter medicines can help, but it's important to discuss with your doctor what is best right now considering your condition and covid-19. 

2. kegel exercises: these can strengthen your pelvic floor muscles and lessen the severity of your rectocele symptoms. however, workouts should be postponed until you become covid-19 negative. 

3. positional changes: changing positions can often help to reduce any discomfort. it could be beneficial to use gravity to your advantage by lying down or standing up to help realign things.

4. you may try a pessary, a device inserted into the vagina to support areas of pelvic organ prolapse. this needs to occur under the direction of a healthcare professional. 

remember that the overstress on your pelvic floor is due to the coughing and will eventually be alleviated once the cough is under control. however, if you're feeling extreme discomfort or if the symptoms persist post your recovery from covid-19, discuss surgical remediation with your physician. keep yourself hydrated and rest as much as you can to allow your body to recover. be sure to consult with a medical provider about these symptoms, and possibly a specialist once you're covid-19 negative."
N169,response_2,"i'm really sorry to hear about the discomfort you're experiencing. it sounds like you're in a challenging situation right now. there are a few things you could try at home to manage the symptoms.

1. pelvic floor exercises: though you mention not being able to see a physiotherapist at present, there are online resources and videos available that might guide you through some exercises aimed at strengthening the pelvic floor. 
2. bathroom habits: try to avoid straining when you go to the bathroom, as this can exacerbate a rectocele. also consider increasing your fiber intake to alleviate symptoms of constipation if this is an issue.
3. change in body positioning: it may be worth exploring different positions when you cough, such as lying on your side, to see if this lessens the symptoms and discomfort.

please remember these are just at-home strategies and should not replace advice from a healthcare provider. also, you're in a unique situation being covid positive and having a rectocele, so some strategies may not fully work for you. if symptoms worsen or persist without improvement, please seek immediate medical attention, even if remotely."
N169,response_3,"i'm sorry you've been having such a rough time, your symptoms sound uncomfortable. as a language model ai developed by open ai, i can advise the following: 

1) coughing technique: there are indeed better ways to cough when dealing with this type of issue. working on a controlled cough can help alleviate some of the pressures generated from a forceful cough. try to exhale as much air as possible before you start hacking. support your pelvic organs by innate corseting or bracing (contract your core muscles as if you’re about to be punched in the stomach), before each cough. 

2) positioning: lying on your side may also help reduce the severity of the cough, thereby reducing pressure on the pelvic floor. 

3) consult your doctor about pessaries: a pessary is a device that's inserted into the vagina to support the pelvic organs.

however, i would advise contacting your healthcare provider or a telehealth service which can provide medical advice under these circumstances. 

remember to take care of your general health - stay hydrated, get plenty of rest, and do gentle exercise when you feel able. this will support your recovery from covid-19."
N169,response_4,"i'm sorry to hear that you're dealing with such discomfort. given your description, it does sound as though coughing because of your covid-19 symptoms may be exacerbating your rectocele. some general advice for managing a rectocele includes avoiding heavy lifting, straining during bowel movements, or anything else that puts pressure on the pelvic area.

in terms of managing your cough and potentially reducing the strain it places on your pelvic floor, there are a few things you could try:

1. staying hydrated: this can help soothe a sore throat and decrease irritation that can trigger coughing. warm liquids, such as tea or soup, might be especially helpful.

2. using a humidifier: this can keep your throat and nasal passages moist and can aid in reducing coughing.

3. rest: getting plenty of sleep could help your body fight off the virus and consequently reduce coughing.

4. trying a different coughing technique: it might be beneficial to try a technique called ""huff coughing,"" where you take a breath slightly deeper than normal and then use your abdominal muscles to force the air out while saying ""huff."" this can sometimes be a gentler way to clear the lungs.

in terms of a nebulizer, it could help administer your asthma medications during severe coughing episodes. however, because they generate aerosols potentially contaminated with covid-19, they should be used with caution and only after discussing it with your doctor. percussive vests used for cystic fibrosis or bronchiectasis can also effectively loosen mucus and make a cough more productive in some patients. 

the biggest takeaway is that you should definitely reach out to your healthcare provider for advice. they might be able to suggest more personalized management strategies or arrange a telehealth appointment with a specialist. i hope you feel better soon!"
N169,response_5,"i'm sorry to hear you're going through this. taking care of a cough can definitely be difficult, even more so in your case due to the rectocele. there are a few things you can try:

1. hydration: drinking lots of liquids can help to thin mucus, making it easier to cough up.

2. humidifiers: they can help keep your throat moist and decrease your urge to cough.

3. honey: it can soothe your throat and decrease coughing.

4. over-the-counter cough suppressants: these medicines can help control your cough. just be sure to follow the dosing instructions.

5. breathing exercises: deep, slow diaphragmatic breathing can help control coughing. simply take a slow deep breath through your nose, hold it for a few seconds, and then slowly breathe out through your mouth.

6. positioning: try laying on your side or prone (on your stomach). these positions can help reduce the pressure on your pelvic floor.

if coughing exacerbates your rectocele, you may want to consider seeing a surgeon about potential repair. this is of course a decision that should be made in consultation with your healthcare provider, and surgery will only be an option once you've recovered from covid-19. additionally, you can do pelvic floor exercises (kegels) right now, but be sure to do them gently.

always reach out to your healthcare provider for individualized advice. stay safe!"
N169,response_6,"i'm really sorry to hear that you're experiencing this. while i'm an ai and can't provide medical advice, i can share some general suggestions that might help you.

1. coughing technique: try using a ""huffing"" technique, where you take a deep breath and exhale forcibly as if you are trying to fog a mirror but with your mouth open. it might help reduce the severity and frequency of coughing.

2. posture: when you feel a cough coming on, try bending slightly forward or sitting down. this may help reduce pressure and strain on the pelvic area.

3. breathing exercises: practice deep breathing and diaphragmatic breathing exercises. this can help control your coughing and improve your lung capacity.

4. hydration: stay well-hydrated. drinking lots of fluids can thin out mucus in your lungs and ease your cough.

5. support: while coughing, try applying gentle upward pressure against the area of your rectocele. this could possibly help prevent it from protruding out.

6. pelvic floor exercises: when you're able, practice pelvic floor exercises like kegel exercises to help strengthen the muscles in your pelvic floor.

ultimately, you should speak with a healthcare professional about your symptoms and concerns. it's important that they're aware of what's happening so they can provide you with the appropriate treatment and support."
N169,response_7,"i'm really sorry to hear about your struggles; it sounds rather uncomfortable. temporary measures that might help include avoiding heavy lifting and straining, using a pessary (a device placed in the vagina to support areas of pelvic organ prolapse), and doing kegel exercises to strengthen your pelvic floor muscles. also, try to manage your cough as much as possible. try to stay well hydrated and use your ventolin as prescribed. if you fell the rectocele is significantly worsening, immediate medical consultation is required to avoid complications. nebulizers at home might help, if recommended by your doctor please follow the instructions and precautions given. it's definitely recommended to coordinate with your healthcare provider over telemedicine before making these decisions.

in some people, rectoceles may improve on their own over time. on the other hand, in those cases where symptoms are severe or are getting worse over time, surgery might also be considered. but this is a measure for consideration only after you've recovered from covid and upon proper study by a specialist.

please note that some of these advices might not be suitable for you, depending on your exact circumstances. be sure to consult with your healthcare provider before making any decisions related to your treatment. it's really important to stay in touch with your healthcare team right now, even if that's virtually. they can provide advice based on your medical history and current situation."
N169,response_8,"i'm sorry that you're going through this, it sounds very uncomfortable. i'm not a doctor, but i can offer some advice based on the information available.

a key management strategy is to prevent constipation, which can increase pressure on the pelvic floor and exacerbate your rectocele symptoms. drink plenty of fluids, eat a high-fiber diet, and engage in regular physical activity to promote good bowel function. over-the-counter bulking agents can help to soften and add volume to stools, making them easier to pass.

start gentle pelvic floor exercises as soon as you can, as these can help to strengthen the muscles supporting the vagina and rectum and minimize bulging. your physical therapist will be invaluable in guiding you through the appropriate exercises once you're able to see them. 

when coughing, try to engage your pelvic floor muscles (similar to if you're trying to stop urine flow) as you cough. 

regarding your coughing and the feeling that you may benefit from a nebulizer, you should definitely discuss this with your physician, who may be able to offer some workarounds or alternatives, or may instruct you to go to the hospital, particularly if your symptoms worsen or you have difficulty breathing. 

again, please consult with a healthcare professional in regard to these issues. it's important to make sure any advice given is specific and safe to your situation. i hope you feel better soon!"
N169,response_9,"i'm really sorry to hear you're going through this. managing a rectocele while suffering from cough related to covid can indeed be challenging. remember, i can only provide general advice online and this shouldn't replace advice from your doctor. 

firstly, try doing kegel exercises throughout the day to strengthen the muscles in your pelvic floor. this might help you regain some control during your coughing episodes. to perform the exercises, just contract the muscles that you would use to stop urinating or having a bowel movement.

secondly, when you cough, try to do it gently and avoid vigorous coughing as much as possible. also, using a pillow or folded blanket to apply slightly firm (but comfortable) pressure on your pelvic area could help support your pelvic floor during coughing episodes.

finally, as you indicated inhaler does help a little, it would be wise to take your asthma medications as prescribed to keep your symptoms under control. regarding the requirement for nebulizer treatment, it's a discussion you need to have with your healthcare provider. 

ultimately it is important to follow up with your doctor or a pelvic floor physical therapist once you are no longer contagious to assess and manage your condition. they can provide specific exercise plans and possibly other non-surgical or surgical treatments that could help improve your condition. 

remember: drink plenty of fluids and rest as much as possible during your recovery from covid. i hope you feel better soon."
N169,response_10,"i'm sorry to hear your symptoms have become so bothersome! here are a few tips which might help you cope until you can get medical treatment:

1. cough technique: try the ""huff coughing"" technique. this is done by taking a breath that's slightly deeper than normal. using your stomach muscles, you make three rapid exhalations with the airway open, making a ""ha, ha, ha"" sound. this type cough can create less pressure on the pelvic floor and might help with your symptoms.

2. pelvic floor exercises: strengthen your pelvic muscles using kegel exercises. while normally you should consult with a physical therapist first, there can be benefits to independently starting kegel exercises. however, it is important to keep in mind that these exercises might not provide immediate relief.

3. other practices: try to empty your bladder before the coughing fits start in the evening. it can also help to cross your legs and squeeze your pelvic muscles before and during each cough.

4. incontinence pads: although this is not a solution, use of incontinence pads can help manage any associated incontinence issues until you can see a healthcare provider.

please consult a healthcare provider for assistance. the healthcare systems have established effective practices to protect non-covid patients from exposure, so don't avoid seeking care if you need it. call your healthcare provider and understand how they can best assist you during this time.
  
finally, if coughing becomes severe and hard to control, check with your healthcare provider immediately as it could be a sign of a worsening condition."
N169,response_11,"i'm really sorry to hear about your discomfort, you must be going through quite a challenging time. it does sound sensible to get the cough under control as a first step, and sometimes a nebulizer can indeed be helpful. contact your primary healthcare provider or a telemedicine physician to discuss this option. 

as for your rectocele and its exacerbation by the cough, there should be a way to mitigate the effects. coughing in a squatting position might help provide some automatic pelvic floor support. an over-the-counter pessary, which is a device to be inserted into the vagina to support the pelvic organs, might be an option to discuss with your healthcare provider.

once you've recovered from covid and able to see a physiotherapist, they can guide you through pelvic floor exercises that can help mild rectocele cases. always reach out to a healthcare professional to discuss your symptoms and options further, as this advice is only meant to be a general suggestion in this troubling situation."
N169,response_12,"i'm sorry to hear you're having such a tough time with coughing due to covid. coughing can indeed worsen issues like a rectocele. there are a few suggestions that might help reduce the stress on your pelvic floor until you can see a physiotherapist.

1. make sure to empty your bladder and bowel before getting into any situation likely to cause coughing. that can reduce the amount of pressure in your abdomen.

2. practice good posture while coughing. try coughing while leaning slightly forward and flexing your hips. this will direct the force of the cough down through your abdomen rather than pushing out on your pelvic organs.

3. tighten your pelvic floor muscles before and during each cough. 

also, drinking plenty of fluids can thin out any mucus, which could decrease the severity of your coughing. 

you may want to talk to your healthcare provider about medications that could help reduce your coughing. they might be able to prescribe something that can decrease the cough and therefore won't exacerbate your rectocele. 

try to take it easy as much as possible. rest can help your body recover from both the virus and the strain caused by coughing. 

given the situation it would be best to consult a primary care physician or a ob/gyn to discuss non-surgical treatment options to manage your rectocele symptoms during this period.

remember these suggestions are only meant for temporary management. it's really important to get professional care after your covid infection resolves.
i hope you find some relief soon!"
N169,response_13,"i'm sorry to hear you're going through this. i can understand this is a distressing time. here are a few suggestions:

1) breathing exercise: try to control your coughing by practicing deep, diaphragmatic breathing. breath in deeply through your nose, let your belly fully expand, hold for a few seconds, then exhale slowly through your mouth. try to make each breath slow, steady and controlled to reduce the force of your cough. 

2) position: try different positions like lying on your side, kneeling, or leaning forward when you cough to manage the pressure on your pelvic area. 

3) hydrate: keep yourself hydrated. this can thin mucus and soothe an irritated throat which can help reduce the intensity of the cough.

4) kegel exercises: while you cannot see a physiotherapist now, you can do kegel exercises at home to strengthen your pelvic floor muscles. 

5) medication: over-the-counter cough suppressants can also help. it would be prudent to consult with a healthcare provider for the appropriate type and dosing for you.

6) support: use a vaginal pessary, this might provide temporary support to the rectocele. the pessary is a device you can insert into your vagina and might help ease some of the symptoms. consult with your gynaecologist about this option. 

remember it's always advised to get guidance from your healthcare professional soon. they'll be able to check that everything's ok, even if it's a 'telephone consultation' rather than a face-to-face visit."
N169,response_14,"i'm sorry you are going through such a difficult experience. given your current situation and the symptoms you describe, you should contact your gp or health professional to discuss your current symptoms and concerns. they may be able to advise on at-home exercises to strengthen your pelvic floor muscles, prescribe a short term muscle relaxant, or refer you to a gynaecologist or specialist.

in terms of coughing, try to add support to your pelvic area while coughing by crossing your legs or pressing gently on the area with your hand. a supportive garment like compression shorts or girdle might also help. 

remember to take slow deep breaths before coughing and to cough hard enough to clear the mucus on the first try to avoid excessive straining. 

for your asthma, a nebulizer might be a good idea to discuss with your doctor. make sure to stay hydrated and rest as much as possible. 

this is a very common issue among women, and you are not alone. it's also something that can be improved, so remember there is hope! stay strong, and i hope you feel better soon."
N169,response_15,"i'm really sorry to hear you're experiencing this discomfort. it may be helpful to try to engage your pelvic muscles before coughing, as if holding back urination, then releasing once you've finished coughing. some women find support garments, like girdles or support underwear, helpful when dealing with a rectocele. you may also find benefit from scheduled toileting, where you go to the bathroom at scheduled points throughout the day to prevent your bowel from becoming overly full and putting pressure on your rectocele. as for your asthma, consider getting in touch with a telehealth respiratory specialist or your primary care provider to discuss nebulizer treatments and to explore other options. always remember to reach out to your doctor or emergency health services if you feel your symptoms are worsening significantly. and remember, as tough as your bout with covid may be, it will pass."
N169,response_16,"i'm sorry to hear about how uncomfortable you're feeling right now. while it's definitely a good idea to get in touch with your doctor for proper medical advice, here are a few things you could try out.

first, when you feel a cough coming on, try to brace your pelvic floor muscles before and during the cough to support the area. imagine you're trying to stop the flow of urine or hold in flatulence – this can help to engage the pelvic floor muscles, which could provide some support to the rectocele. 

deep breathing exercises could also help. if you can catch yourself before you start a coughing fit, try taking in slowly a deep breath through your nose, hold for a couple of seconds and then slowly exhale through your mouth. repeating this a few times as necessary could help to calm the urge to cough. 

you should continue using your ventolin inhaler as directed by your doctor. if you feel it’s not enough, please consult with your healthcare provider for additional treatment options as they understand your health condition better.

supportive undergarments specifically designed for pelvic organ prolapse may provide some relief. you could also look into vaginal pessaries (devices inserted into the vagina to support areas of pelvic organ prolapse). pelvic floor exercises, once you get the go-ahead from your doctor or physiotherapist, could be beneficial as well. 

in any case, it's important to keep up your fluid intake and a balanced diet to help limit constipation, which can put pressure on the rectocele. 

i'm so sorry you're dealing with this, especially while also struggling with covid. i hope some of this advice helps alleviate some of your discomfort. if symptoms persist, please reach out to your healthcare provider for guidance."
N169,response_17,"i'm sorry to hear you're dealing with these symptoms. i'm an ai developed by openai and not a doctor, but here are a few potential suggestions based on what i know about the topic:

you can try the following techniques that can potentially help weakening the force of your coughs:

1. breathing exercises: deep breathing, followed by slow, gentle exhalation rather than allowing it all to escape in a hard cough, can be helpful. 

2. cough suppression: if your doctor agrees, you might try a cough suppressant to reduce your urge to cough.

3. kegel exercises: though they might not be able to help in the short term, kegel exercises can help strengthen the pelvic floor muscles, which can improve symptoms of pelvic floor disorders such as a rectocele. 

4. if possible, trying to lie down when the coughing becomes intense might help, as less pressure is put on the pelvic floor in this position.

however, these tips may or may not be applicable depending on the severity of your rectocele and current level of discomfort. it's also important to discuss your symptoms with a healthcare professional. they can give you the most accurate advice based on your medical history.

finally, it's worth noting that coughing due to covid-19 is a symptom that can last a while but is likely temporary. therefore, your pelvic floor might start to improve once your coughing decreases and covid-19 symptoms recede. please monitor your symptoms and contact a healthcare professional if they worsen."
N169,response_18,"i'm sorry to hear that you're struggling with these symptoms. it must be uncomfortable and distressing. while i should note that you need to consult with a healthcare professional for the most accurate advice, i can provide some possible recommendations. 

firstly, there are some coughing techniques that could help: try to take a deep breath before and after your cough, and lean forward slightly when you cough to give your diaphragm more space to facilitate effective coughing without causing strain. 

secondly, pelvic floor exercises may help to strengthen your muscles and provide more support, even while dealing with the cough. you can do kegel exercises in any position, but try sitting, as it can help you relax your pelvic floor muscles more. 

as it relates to covid, try to rest and stay hydrated as much as possible. it's important to follow all relevant guidelines from local health authorities and seek medical attention if your symptoms worsen.

most importantly, keep in constant communication with your healthcare professionals. they are best equipped to guide you through this difficult time."
