question_id,response_id,response
N92,response_19,"i'm an ai and i cannot deliver a concrete diagnosis or treatment plan, but i can offer some possible suggestions based on the information you've disclosed. 

this reoccurring issue appears symptomatic of a condition called meniere's disease. this is a disorder of the inner ear that can lead to dizzy spells (vertigo) and hearing loss, often in one ear. its symptoms often include a recurring roar or ringing sound (tinnitus), or a feeling of pressure or pain in the affected ear. 

it's important to see an otolaryngologist who can evaluate your symptoms and offer a possibly clear diagnosis. note down any factors that seem to trigger these episodes, such as specific foods, physical activities, or changes in stress levels, this could help in diagnosis and management of your condition. 

please consult your doctor or a healthcare professional regarding these symptoms and do not rely solely on this information for medical advice."
N92,response_20,"the symptoms of tinnitus and vertigo suggest that you might have something wrong with your inner ears where the parts responsible for hearing and balance are found. it could be something like meniere's disease, an inner ear disorder thought to be caused by a buildup of fluid and changing pressure in the ear that can cause episodes of vertigo, tinnitus (ringing in the ear), and hearing loss. high blood pressure can indeed cause tinnitus, but since you mentioned that your bp is normal, it would make sense to investigate other causes. 

some medications can also cause tinnitus. though it doesn't seem likely in your case, it's possible that metoprolol and colchicine might influence your symptoms, so it would be vital to discuss this with your doctor. 

i would suggest an evaluation by a ent (ear, nose, and throat) specialist, who might want to perform specific tests (like a hearing test, balance tests, or imaging of the inner ear) to understand your situation better.

also, try to notice if your episodes are triggered by something specific (like stress, certain food, lack of sleep etc.) - this information could be helpful for your doctors. 

keep in mind that with tinnitus, while it can be extremely bothersome, it's usually not a sign of something serious. certain therapies like cognitive behavioral therapy or sound therapy can help manage this symptom.  

lastly, while familial mediterranean fever (fmf) doesn't typically cause ear-related symptoms, there have been reports of rare neurological manifestations (including sensorineural hearing loss) associated with this condition. it's not clear if there's a connection to your case, but it's worth discussing with your doctors. 

always consult with your healthcare provider for advice."
N92,response_21,"i'm an ai language model and i'm not able to provide a definitive diagnosis, but i can suggest some possibilities you might consider discussing with your healthcare provider. the symptoms you are describing, such as fluctuating hearing loss, tinnitus, and vertigo, may suggest a condition like meniere's disease, characterized by building up of fluid in the inner ear. it's also worth noting that both the medications you are taking -- metoprolol for your pots and colchicine for your fmf -- can have side effects that include tinnitus and dizziness. 

more rarely, autoimmune inner ear disease (aied) could also be responsible for sudden sensorineural hearing loss but this is generally associated with systemic autoimmune conditions. 

you may also want to consult with an ent (ear, nose, throat) specialist, and possibly undergo further tests such as an mri, or auditory tests to investigate other potential causes. 

again, it's important to discuss these possibilities with your healthcare provider who can integrate this information with their understanding of your specific case."
N92,response_22,"i'm sorry that you're dealing with these symptoms; it sounds very difficult. it's quite a complex issue that needs careful investigation. while it's possible that blood pressure could be a contributor, particularly given your diagnosis of pots, it's also plausible that there could be other causes. 

one condition which could potentially explain these symptoms is meniere's disease, a disorder of the inner ear that can cause severe dizziness (vertigo), ringing in the ears (tinnitus), hearing loss, and a feeling of fullness or congestion in the ear. however, this would need to be diagnosed by an ent specialist. 

it also wouldn't be a bad idea to get a consultation with a cardiologist to evaluate your svt and pots, and how they might relate to your symptoms, if at all. 

it could also be possible that the metoprolol (a beta blocker used for high blood pressure and heart issues) could potentially be contributing to or exacerbating the tinnitus; some people report tinnitus as a side effect of beta blockers, although it is not common. 

overall, i would strongly recommend further evaluation by a specialist, given the complexity of your symptoms and diagnoses. this could potentially involve an audiologist for a hearing test, an ent specialist for meniere's or other otological conditions, and a cardiologist to evaluate your pots and svt in greater detail. 

please discuss this with your doctor and don't make any changes to your medications without their advice."
N92,response_23,"i'm sorry to hear about your discomfort. it sounds like you're dealing with a complex situation. your symptoms (tinnitus, temporary hearing loss, vertigo) might suggest meniere's disease, a disorder of the inner ear that can cause you to feel like you're spinning (vertigo) and hearing ringing sounds (tinnitus). however, this disorder typically causes permanent hearing loss, not temporary, so it may not be the cause. 

another possibility is migraine-associated vertigo or vestibular migraine, which can cause issues with balance, vertigo, and sometimes tinnitus. 

high blood pressure can sometimes cause tinnitus, but since your bp was normal, this seems unlikely. 

the heart conditions (svt, pots) you have and the associated medications (like metoprolol) can sometimes cause tinnitus, but again, this seems less likely if the tinnitus is associated with hearing loss.

your doctors will be probably the best people to help you find a solution to prevent this from happening again. it may require seeing a specialist, such as a neurotologist, who specializes in nerve-related disorders of the ear, or a neurologist who specializes in migraines. 

given your complex medical history, there may be other possible causes and this advice can't replace a doctor's visit especially amidst an ongoing issue. please reach out to your healthcare providers as soon as possible."
N92,response_24,"i'm an ai language model and not a doctor, but i can provide some general insights. you have several conditions that can potentially influence the symptoms you're experiencing. vertigo and tinnitus (ringing in the ears) are not uncommon with conditions like postural orthostatic tachycardia syndrome (pots) and may also be related to medications such as metoprolol, which is known to have these side effects in some people. 

however, familiar mediterranean fever (fmf) is usually unrelated to these symptomatology. since this is the third time this is happening, i would recommend seeking a second opinion - maybe from an ent specialist or neurologist, as this seems to be related to either your inner ear or your nervous system. persistent or recurring tinnitus should definitely be looked into more deeply, especially when accompanied by vertigo. these symptoms could be indicative of many things, from meniere's disease to a vestibular migraine or even certain neurological conditions. 

remember, it's essential to discuss these possibilities with a medical professional who can consider your medical history and current medications to reach a more accurate diagnosis. in the meantime, continue to monitor your symptoms and seek immediate medical attention if they worsen."
N92,response_25,"i'm an ai and not a doctor, but i can tell you that you may be experiencing a condition called meniere's disease, which can cause vibration or rumbling sounds in the ears, as well as vertigo and tinnitus. however, this is only a possibility and requires further diagnostic steps by a healthcare provider. sometimes, the symptoms can be triggered or worsened by certain medications, stress, diet or lack of sleep.

familial mediterranean fever (fmf) can also potentially cause issues with inflammation that could impact the ears, causing symptoms like you're experiencing. pots (postural orthostatic tachycardia syndrome) might lead to distinct symptoms like dizziness or lightheadedness, which aren't similar to what you describe.

metoprolol (a beta blocker) is given to treat high blood pressure and heart issues. if your blood pressure is now under control but you're still experiencing these issues, it may not be directly linked to blood pressure. colchicine is used to prevent fmf attacks, reducing inflammation.

these are simply angles from which your problem could be approached. speaking with an ear, nose, and throat specialist who is aware of your general medical history and has been following your case would be the best plan of action. they can further evaluate your symptoms, help with the diagnosis and also potentially guide you in managing your symptoms. do not make any changes to your medications without discussing it with a healthcare provider."
