question_id,response_id,response
N175,response_1,"i'm sorry, but as an ai, i'm not a doctor and i can't provide medical advice. with an injury like a burst eardrum, it's critical to follow up with a healthcare professional right away. please let your parents know and go to an emergency department, urgent care, or your primary care doctor if you haven't already done so. also, avoid any activities that may cause further damage or discomfort, including loud noises or water entering the ear."
N175,response_2,"i'm an ai developed by openai, not a doctor, but i can share general medical advice based on what we know about ruptured eardrums. this injury requires medical attention. you should avoid activities or environmental factors that may cause further harm such as loud noises, water in the ear (so avoid swimming), or inserting anything into the ear, even if you're not feeling pain.

recovery time for a ruptured eardrum typically takes a few weeks, and during that time, it's important that you protect your ear and allow it to heal. by exerting yourself or exposing it to loud noise at your competition, you might risk compromising the healing process and potentially cause more serious injury.

the ringing sound in your ear (tinnitus) is also a symptom that requires attention. it could go away with time, but you should definitely report this to your doctor, as it could be a sign of hearing damage.

keep taking the prescribed medicine and follow-up with your healthcare provider to evaluate your progress. make sure to talk to them about your decision about attending the competition and follow their advice. your health is significantly more important than participating in a competition.
  
remember, it's crucial to talk to a professional healthcare provider for any medical concerns or questions. the information provided here is general and does not replace medical advice."
N175,response_3,"sorry to hear about your situation, but please understand that burst or perforated eardrum requires immediate medical attention. it's essential not to expose the eardrum to potential sources of infection or further trauma while it's trying to heal. this includes avoiding potentially noisy environments like a competition. you may not be feeling pain currently due to the medication, but the constant ringing could be a sign of damage to your inner ear. if you've not already done so, you should definitely get evaluated by a medical professional as soon as possible. they'll be in the best position to advise you on whether attending your event is safe."
N175,response_4,"i'm an ai language model and not a doctor, but it sounds like you should seek immediate medical attention for a ruptured eardrum. it's a serious injury that can lead to hearing loss and potential infection. as much as you want to go to the competition, it is important to rest and let your body heal. if you haven't already, please inform your parents or guardian about your situation and consult with a healthcare professional. complications can occur if not treated appropriately. your health is priority right now."
N175,response_5,"i'm sorry, but i'm an ai and i am unable to provide medical advice. you should contact your healthcare provider immediately if you're experiencing these symptoms. an ruptured eardrum is a serious condition and needs to be treated by a medical professional. please refrain from self-diagnosis or self-treatment and seek immediate medical attention."
N175,response_6,"i'm an ai language model and not a doctor, but i can suggest that the ringing in your ear may be called tinnitus, which sometimes happens with ear injuries. however, you should never ignore or attempt to treat an injury like this yourself, especially if you're suspecting a ruptured eardrum. it is strongly recommended to see a medical professional immediately who can evaluate the situation and advise you on whether or not it is safe to attend your competition. this could prevent an infection, which may potentially cause permanent hearing loss. please take this seriously and seek medical attention."
N175,response_7,"i'm an ai language model and i can't provide medical advice, but a ruptured eardrum is a serious condition that requires medical attention. going to a loud environment like a competition might aggravate your condition. it's strongly advised that you consult with a healthcare professional, like a doctor or a nurse, about this situation. they are in the best position to give you medical advice tailored to your specific circumstances. please don't ignore this and be sure to seek medical help promptly."
N175,response_8,"i'm an ai language model and i can't replace a doctor, but i can suggest you get immediate medical attention, as a burst eardrum is a serious condition. furthermore, exposing yourself to loud noises at a competition might worsen it and may potentially lead to hearing loss. it's crucial that you contact a healthcare professional right away, even if the pain has lessened, for a proper examination and treatment."
N175,response_9,"i'm an ai language model and not a doctor, but this sounds like it could be a serious situation. bursting an ear drum can lead to complications if not properly treated. this definitely needs to be checked by a medical professional as soon as possible. the risk of permanent hearing loss is serious, and the ringing is a cause for concern. you should definitely avoid loud noises, which might make your condition worse. seek medical help immediately."
N175,response_10,"i'm sorry to hear that you're going through this. it's important to protect your hearing and overall health. my advice as an ai, based on general medical knowledge, would be to seek immediate medical attention. 

a burst eardrum is quite a serious injury and there are risks of infections and other complications if not properly managed by a healthcare professional. it's common to experience ringing in the ear (tinnitus) after such an event, which may be a sign that your ear is not yet fully healed.

although your desire to be part of the competition is understandable, it's crucial to prioritize your health first. 

please do reach out to a healthcare professional for an in-person evaluation. they can give you specific advice based on a thorough understanding of your health and injury. 

remember, this advice is based on general medical knowledge and ai doesn't replace a real doctor's advice."
N175,response_11,"i'm an ai language model and not a doctor, but i strongly recommend you seek medical attention immediately if you believe you've burst your eardrum. this could be very serious and could lead to long-term issues like hearing loss if not treated properly. activities that involve loud noises could exacerbate the injury, and so missing the competition may be the best course of action for your long-term health. please contact a healthcare professional as soon as possible."
N175,response_12,"i'm an ai language model and i can't provide direct medical advice, but in general, a ruptured eardrum needs immediate medical attention. it's crucial to protect the ear from further damage, and that might mean avoiding activities, loud noises, or anything else that might strain it more. it's best to consult your doctor or healthcare provider right away and follow their advice. they might even be able to advise on ways to safely participate in your competition. however, listening to your body is very important, if you feel any discomfort or pain, it might be best to take a rest."
N175,response_13,"i'm not a doctor, but it is important you seek immediate medical attention if you believe you've burst your eardrum. from your description, you may have a perforated or ruptured eardrum, which can be due to infection, trauma, foreign objects, or intense pressure changes. if your ear is ringing and you're experiencing hearing loss, it is important to contact a healthcare professional immediately. they can examine your ear, properly clean it, and prescribe the appropriate care. 

though it is understandably disappointing to miss out on events, your health is most important. stressors, such as attending a loud, bustling event like a competition, may aggravate your condition. the risk of permanent damage and hearing loss is significant with untreated ruptured eardrums. while medication may alleviate pain symptoms, it will not treat the underlying issue. following through with the advice of a healthcare professional is crucial. discuss with them about your upcoming events and they may give you appropriate advice based on the severity of your situation. remember not to put anything in your ear, even to clean it, unless instructed by a professional.  

again, seek professional medical attention."
N175,response_14,"i'm an ai developed by openai and although i can't replace a visit to a healthcare professional, i can provide some initial advice. 

experiencing a burst eardrum can be very painful and can lead to temporary or even permanent hearing loss. it's great to hear you've been taking medication and aren't in constant pain, but the persistent ringing is concerning. this can be a symptom of injury to the inner ear, and it's important to rest and avoid strenuous activities that might make your symptoms worse.

to limit the risk of infection, it is advisable to keep your ear as dry as possible. if at all possible, you should see a healthcare professional to assess your eardrum and hearing. depending on the severity of your situation, you might need additional medication or other treatments to promote healing and prevent complications, like antibiotics or a surgery to patch your eardrum.

while it's understandable that you want to attend your competition, it might be in your best interest health-wise to give it a miss, as further strain or loud noises could negatively affect your recovery. discuss your situation with a healthcare professional for personalized advice. remember, your health always comes first, causing irreparable damage now could affect you for the rest of your life."
N175,response_15,"injury to the eardrum is a serious thing, may it be a burst or a rupture. the fact that you have constant ringing (tinnitus) is a cause for concern and may signify more than just a simple burst. you need to see an doctor (ideally an ear, nose, and throat specialist) as soon as possible. even if your ear doesn't hurt, pain is not always a reliable indicator of the severity of an injury. by no means should you participate in any activities that may expose your ear to loud noises or any physical risks (like contact sports, swimming etc.). the complete healing of a ruptured eardrum can take weeks to months and you should avoid any risk of introducing infection till then.

you've already missed out on a football game, which is hard, but missing a competition is a small price to pay to potentially spare yourself from permanent hearing loss. just think about it -- missing out on a few events now could mean you get to experience so much more in the future. it's hard to accept at first, but your health should be your top priority.

remember, you're young and there will be many more games and competitions in the future. it's more important to take care of your body so you can be healthy for all of them. take care!"
N175,response_16,"i'm an ai and not a doctor, but it's typically advised to seek medical attention if you believe you've ruptured your eardrum. the constant ringing and previous symptoms could be signs of serious damage. it's also important to avoid activities that could potentially make it worse, such as swimming or being in a loud environment. always put your health first. but you should definitely speak to a healthcare professional about this. they'll be able to give advice based on your specific situation."
N175,response_17,"based on what you've told me about your eardrum injury, it's important to see a doctor right away. a burst eardrum is a serious condition that needs to be looked at by a professional to prevent further damage or possible infection. the ringing in your ear could be a sign of a more serious problem, and you should definitely have it checked out. even if your ear doesn't hurt, it's still necessary to seek medical advice. doing physical activities can potentially aggravate the injury, so i'd recommend holding off on your competition until a healthcare provider clears you for it. but remember, i'm an ai, not a real doctor. please reach out to your healthcare provider immediately to get the best advice and treatment."
N175,response_18,"i'm sorry to hear you're going through this, but it's important to know that i'm an ai language model and not a doctor. however, i can provide some general advice on the subject. a ruptured eardrum can be a serious injury, and it's important to avoid further stress or possible infection. participating in physical activity or being in noisy environments could exacerbate your situation. it's highly recommended to consult with a healthcare professional before engaging in any major activities. they'll be able to provide you with a more comprehensive assessment and suitable advice."
N175,response_19,"i'm an ai language model and not a doctor, but it's generally recommended to get medical advice following a burst eardrum. even if you're not presently in pain, the constant ringing could be a sign of tinnitus or an ongoing issue. plus, any exposure to loud noises, like at a competition, might potentially aggravate your condition and impede your recovery. it might be best to skip the competition, as disappointing as that may be, and ensure you're taking the steps necessary to recover and avoid further injury. it's crucial to consult with a medical professional about this as soon as possible."
N175,response_20,"i'm an ai language model and not a doctor, but i can suggest that it's critical for you to seek professional medical help immediately. a burst eardrum is a serious condition that can lead to complications like hearing loss or infection. no competition is worth risking your long-term health. your symptoms indicate you might still have an ongoing issue (the constant ringing) and you need further medical advice. going to crowded or loud places might exacerbate the condition. please contact your doctor or a healthcare professional immediately."
N175,response_21,"i'm an ai developed by openai and i'm not a doctor, but it's important to know that you've experienced a serious injury if you've indeed burst your eardrum. do not ignore this even if the pain has somewhat subsided. the ringing in your ear indicates that your ear is still healing. the risk of complications, such as infections or permanent hearing loss, can be high if not properly treated. you should absolutely consult a healthcare provider or even visit an emergency department immediately. they can examine your ear, confirm the diagnosis, and give you appropriate treatments and guidance. please avoid exposing your ear to loud sounds, water, or inserting anything into your ear. it's disappointing to miss out on an event you're excited about, but it's crucial to let your ear heal properly."
N175,response_22,"sorry to hear about your ear. while your desire to participate in today's event is appreciated, it could be risky for your health. a burst eardrum can take a few weeks to heal and in some cases, it may require surgery. you should definitely avoid activities that could potentially cause further harm. activities such as sports can increase the risk of infection and could prolong the healing process. i suggest you rest, keep your ear dry and avoid unnecessary movement. if the ringing continues or gets worse, please visit the doctor urgently as this could be a sign of tinnitus which could lead to hearing loss if not treated."
N175,response_23,"i'm really sorry to hear about your situation, but as an ai model developed by openai, i must urge you to contact a medical professional. bursting an eardrum is a serious injury that could lead to permanent hearing loss if not treated properly. the fact that your ear is constantly ringing might be a symptom of tinnitus, which can occur after loud noises or injuries to the ear like a ruptured eardrum. please seek immediate medical attention. don't ignore this condition even if your ear doesn't hurt anymore and never try treating it without proper medical advice."
N175,response_24,"i'm an ai language model and not a doctor, but i can tell you generally that it's crucial for you to seek medical attention immediately if you believe you've burst your eardrum. signs of a ruptured eardrum can include pain, ringing in the ear, vertigo, and discharge, including blood. if left untreated, it may lead to hearing loss, ear infections, or other complications. while rest and medication can mitigate some symptoms, these are only temporary measures. a ruptured eardrum often heals on its own in a few weeks, but occasionally requires a medical procedure or surgical repair. for health advice or before attending the competition, i recommend you to talk to a healthcare professional who can properly assess your condition on the basis of your symptoms and medical history. remember, this is not a medical advise."
N175,response_25,"i'm an ai developed by openai and not a doctor but i can provide some general advice. a burst eardrum is a serious injury and you should avoid any strenuous physical activity, which could exacerbate the issue. the constant ringing in your ear (tinnitus) is also a concern. please refer to a medical professional before deciding to participate in your competition."
