question_id,response_id,response
N2,response_1,"sneezing can very briefly increase pressure inside the chest which can aggravate any existing heart, lung, or neuromuscular issues. this can potentially manifest as arm pain. if you're feeling this pain on a frequent basis, you should consult a healthcare provider as soon as possible. it could indicate possible conditions like heart disease, herniated disc, pinched nerves, among others, which need to be ruled out. 

furthermore, it is recommended to maintain a balanced diet and regular exercise as your weight is also a risk factor for a number of health conditions. the information included in your post (erratic, sharp pain in arms following sneezing) is worth monitoring and an important detail to share with your provider.

please do not regard this advice as a definitive diagnosis or treatment plan; consult with your primary care provider or appropriate specialist to discuss and address your symptoms properly."
N2,response_2,"it's possible the sensation could be due to nerve irritation or compression when you sneeze, since it involves a sudden, forceful movement. however it could also suggest heart problems. although you're only 28 and it is less common at this age, heart problems could still cause such dysfunctions. if it continues or you are concerned, please consult a healthcare provider. other symptoms to be aware of include chest pain, numbness or weakness in one side of your body, rapid heartbeat, or dizziness. in case you experience these symptoms, seek immediate medical attention. consider regularly exercising and maintaining a healthy diet."
N2,response_3,"i'm an ai language model and cannot provide medical advice, but i can offer information based on what i know. sneezing can sometimes cause strain on nerves in the neck which may radiate out to the arms, or it could be from muscle strain. however, it could also be indicative of more serious conditions, including heart-related issues. since it's impossible to know for certain without a medical examination, it's best to seek advice from a healthcare professional, who can provide a personalized diagnosis based on your symptoms and medical history.

remember, it's always better to seek advice if you're worried, no matter how minor the problem may seem. it's always better to be safe when it comes to your health."
N2,response_4,"i'm an ai developed by openai, i can provide you general advice but can't replace a professional medical consultation. your arm pain may be due to a nerve compression issue in your neck or chest, which might get aggravated during sneezing because of the sudden pressure change. it's also possible that it could be linked to a cardiovascular issue. however, these are just possible reasons and it's important to contact a healthcare professional who can examine and diagnose your condition appropriately. particularly, any type of chest or arm pain should not be ignored considering their potential links to heart disease."
N2,response_5,"while it's possible it's nothing to worry about, it's still important to consult a healthcare provider when you're experiencing a new symptom. chest pain with pain radiating to the arm, even if it's after sneezing, could be a sign of heart disease. other possibilities could include nerve issues or a musculoskeletal problem, as sneezing can cause a sudden, intense movement that may strain muscles or irritate nerves. schedule an appointment with your healthcare provider to discuss these symptoms and assess your overall health. it's especially important if you also have other symptoms, like chest pain, shortness of breath, or a sense of impending doom."
N2,response_6,"arm pain after sneezing can sometimes indicate a nerve compression issue in your spine (pinched nerve) which can occur in conditions such as herniated discs, spinal stenosis, etc. however, it could also be due to muscle strain from the sneeze. while it's possibly not dangerous, it's unusual enough that it could be worth discussing with your doctor or a physical therapist. if you're also having numbness, tingling, weakness, or other concerning symptoms, it's definitely worth getting it checked out soon. however, make sure to get immediate medical help if the pain is severe, comes on suddenly, or it is accompanied by symptoms like chest pain or difficulty breathing, as these can be signs of a heart attack."
N2,response_7,"pain in the arms after sneezing can be due to different reasons. most commonly, it's due to a pinched nerve in the neck or back, exacerbated by the sudden, forceful movement of a sneeze. in rare cases, it can be a sign of heart disease since sneezing increases pressure in the chest, affecting blood flow to the heart. however, given your age and no history of heart disease, it's less likely. 

however, it's important to see a healthcare professional for an accurate diagnosis, especially if the pain is recurring or accompanied by other symptoms. 

lifestyle adjustments such as weight loss, healthy nutrition, and regular exercise can help prevent many health problems, including those that might cause arm pain. 

please keep in mind that this advice is intended to be general in nature, and specific causes may not apply to your situation. always consult with a healthcare provider for accurate information."
N2,response_8,"it's possible that you could be experiencing referred pain from another area in your body, such as your neck or back, when you sneeze. sneezing creates sudden intense pressure in the body and that can stress muscles/nerve pathways causing some discomfort or pain radiating to your arms. although sneezing related pain is generally harmless and due to the reasons just mentioned, it can, in rare cases, indicate something more serious like a heart condition. if the pain persists, gets worse, you experience other symptoms, or have a family history of heart disease, it would be wise to consult your doctor to ensure nothing serious is happening. they may refer you to a physical therapist or a specialist like a cardiologist, if needed."
N2,response_9,"i'm an ai and while i can't definitively diagnose anything, it sounds like it could possibly be related to nerve issues, such as those resulting from a pinched nerve in the neck or upper spine (commonly due to certain neck movements or strains). however, it's also important to consider heart conditions because pain in the arm(s) can sometimes signal a heart issue. it's crucial that you consult a healthcare provider about these symptoms to get a proper diagnosis and treatment if necessary. it's better to address it early and ensure it's nothing serious."
N2,response_10,"pain in arms during or after sneezing might be due to the forceful contraction of muscles while you sneeze. this can lead to a compression of the nerves causing momentarily sharp pain or ache which subsides on its own. it can also be due to a condition known as cervical radiculopathy, where the nerves in the neck get pinched or compressed.

however, while these factors might be causing your issue, it's crucial to check other serious causes as well. for instance, chest or arm pain can be indicative of cardiovascular issues like angina which can lead to heart disease.

given your history as a former smoker and your current weight (which puts you in the obesity category), you're at a higher risk for cardiovascular diseases. please schedule an appointment with your healthcare provider. they can do a more thorough evaluation and perhaps run some tests to make sure nothing more serious is going on."
N2,response_11,"pain in the arms after sneezing can be due to various reasons including muscle strain, heart disease, or nerve compression. usually it is associated with pressure changes in the chest and body during the sneezing process which can trigger discomfort in various areas of the body. however, if this pain is severe or frequent or associated with other symptoms like chest pain, dizziness, or shortness of breath, you should get it checked out by a healthcare professional to rule out serious conditions like heart disease. if the pain is limited to sneezing and does not persist or come on with exercise, it is less likely to be cardiac, but you should still get evaluated."
N2,response_12,"i'm an ai language model and not a doctor, but i can provide some general advice. some people do experience discomfort or pain in their chest, arms, or back after sneezing due to the sudden change in pressure in your body. however, if this pain is serious, recurrent, or associated with other symptoms such as chest pain, shortness of breath, sweating, or heart palpitations, it might indeed be cause for concern, as it could be linked to conditions like heart disease or herniated discs. please consult a healthcare professional for a more accurate diagnosis. it's always better to err on the side of caution when it comes to health concerns."
N2,response_13,"i'm an ai, so i can't directly diagnose you, but i can provide some advice. this kind of pain could be caused by anything from a pinched nerve in your neck which is being aggravated by the jolting movement when you sneeze, to heart trouble (since sneezing can momentarily increase your blood pressure). if you're experiencing frequent or worsening pain, or if you have other symptoms like chest pain, shortness of breath, dizziness, or unusual fatigue, it's crucial to seek medical attention right away. while casual arm pain while sneezing is not necessarily a cause for immediate concern, consistent and intense pain should be referred to a medical professional, who might be able to give you more insight into why this might be happening."
N2,response_14,"arm pain after sneezing isn't generally a cause for concern itself, but it could be a symptom of several conditions, like nerve impingement in the neck or back, herniated disc, or muscle strain. it is best to consult with a healthcare provider to rule out any potential issues. it could be nothing to worry about, but in rare cases, it may be indicative of a more serious condition. remember, it's always better to be safe and get checked out, particularly if the pain is severe, persistent, or accompanied by other symptoms."
N2,response_15,"arm pain after sneezing can be due to nerve irritation or compression in the neck or spine. the high pressure created in the chest and spine during a sneeze can exacerbate this, leading to referred pain in the arms. but, it could also indicate cardiovascular disease.

while the occasional arm pain from sneezing likely isn't a cause for concern, consistent or increasing pain could indicate a more serious problem, such as a herniated disk or some heart conditions. it may be best to consult with your healthcare provider to discuss your symptoms and any potential risk factors for these more serious conditions."
N2,response_16,"pain in the arms after a sneeze could potentially be due to a variety of factors. straining or jerking motions involved in sneezing can cause muscle strain. there could also be nerve involvement if you have any underlying neck/cervical spine issues. rarely, it may suggest a cardiovascular issue. you should consult a healthcare professional if the pain persists or becomes concerning. however, it's also important to remember that everyone's body sometimes has little quirks and not every pain indicates a serious health issue. yet, when in doubt, always check it out."
N2,response_17,"a variety of issues could cause your arms to hurt when you sneeze, which includes strain in the muscle due to the force exerted when you sneeze, or due to a neck or back problem (like a herniated disc). however, there is also a very small chance that this is a sign of heart problems such as angina. although it's not very likely given your age and history, it's always better to be safe and get a check-up. make sure to describe your symptoms accurately to your healthcare provider."
N2,response_18,"arm pain after sneezing is typically not a cause for serious concern. it can be a result of temporarily increased pressure in the chest cavity when you sneeze, which can briefly influence blood flow and nerve activity, leading to a quick, sharp discomfort. however, if this symptom is accompanied by other issues like chest pain, heart palpitations, shortness of breath, or if the pain is severe or persistent, you should seek medical attention immediately. these could indicate more serious conditions such as heart disease. without more details, it's hard to say what could be causing your symptoms. it's best to consult with a healthcare professional who can evaluate your overall health and symptoms. most importantly, remember that online advice is not a substitute for professional medical advice."
N2,response_19,"i'm an ai assistant and while i can provide some general advice, it's always best to consult with a healthcare professional for an accurate evaluation. 

the pain you are experiencing may be due to the sudden pressure exerted during a sneeze that can affect the nerves in your arms. there's a possibility it might be related to some nerve compression or irritation in your neck or upper spine, which sometimes can be worsened by the violent movement of a sneeze.

if the pain intensifies, persists or you notice other worrying symptoms like chest pain, shortness of breath, dizziness, etc., please consult your doctor immediately. remember that frequent and persistent pain, even if related to sneezing, isn't something normal and should be evaluated."
N2,response_20,"this situation must be quite surprising for you. it's possible that the force of a sneeze could potentially pinch a nerve in your neck and cause temporary referred pain down an arm, although this is quite rare. another theory is that the rapid chest movements during a sneeze could cause temporary pain in arm muscles. 

this is not typically something to be worried about. however, it could be a sign of heart disease given that it correlates with sneezing as a result of rapidly increasing intrathoracic pressure affecting the heart's blood supply. any type of repetitive pain associated with the chest and arms, even if it's only indirectly related to the heart like sneezing, should always be checked out.

also, at your current weight you appear to be in the obese category for bmi, which puts you at a higher risk for heart disease. 

you should also know that the pain you're experiencing could be a symptom of something completely unrelated to your heart. for example, conditions that affect the nerves in your neck, like a herniated disc or degenerative disc disease, can cause pain to radiate down your arms.

the bottom line is: it's best to get this checked out by a doctor. you cannot make a diagnosis by yourself and it's always better to err on the safe side when it comes to health. virtual platforms are useful for general questions, but not for diagnosing with specificity. it's your health, and you should protect it with as much care as you give to other areas of your life. try not to panic, and reach out to your doctor as soon as possible. you got this!"
N2,response_21,"pain in your arms after sneezing can happen for a number of reasons, such as tension or strain in the muscles surrounding your chest, neck, shoulders, and arms due to a forceful sneeze. however, it is always recommended to consult with a healthcare professional or a doctor if you feel any discomfort or pain. this could be a symptom of a more serious underlying condition. it's always better to be safe than sorry."
N2,response_22,"i'm an ai language model and while i can provide some general guidance, contacting a healthcare professional is always the best action to take when you're feeling unwell.

the phenomenon you're describing may be related to nerve or muscle strain during a sneeze. sneezing can cause rapid, intense contraction of muscles including those in your chest and upper body, which can result in temporary discomfort or pain. 

however, if the pain is intense, recurrent, associated with specific triggers, or accompanied by other symptoms (like chest pain, shortness of breath, dizziness, etc), you should definitely seek medical advice. although it's less common in younger adults, arm pain can sometimes be a sign of heart-related issues, usually on the left side. 

remember, it's always best to consult with your doctor to discuss any persistent, worsening or unusual symptoms. even though harmful conditions are unlikely, it's not impossible. furthermore, your doctor can provide advice to address your unique medical history and circumstances."
N2,response_23,"i'm an ai and not a doctor, but someday you're experiencing could be due to a strain or pull in the muscles around your neck or back that can radiate down to your arms. this can happen when you sneeze because of the sudden, forceful movement your body makes. however, in rare cases, it could potentially be a sign of something more serious like a heart condition or a herniated disc, since similar symptoms may appear under those conditions. it'd be best to consult with a healthcare professional to accurately diagnose your symptoms and ensure that you receive the correct treatment."
N2,response_24,"pain in your arms after sneezing could be linked to several issues. one of the most common is nerve compression, especially in the neck area, which can be temporarily exacerbated by the violent movement of a sneeze. however, it's also important that you rule out any cardiovascular issues, as pain in the arms can sometimes be a symptom of heart disease. 

given your former smoking history and current weight, it would be a good idea to visit your doctor to discuss this symptom. they may want to conduct some tests, including an electrocardiogram to measure your heart's electrical activity. 

while it's likely nothing serious, it's better to get it checked out. in the meantime, maintain a balanced diet, regular physical activity, and a healthy weight to reduce the risk of cardiovascular complications. don't panic, but do seek further medical advice about this issue."
N2,response_25,"experiencing arm pain after sneezing is not typically a cause fore concern. it can be due to increased pressure on the nerves located in your neck, chest or spine. when you sneeze, you tense up your body. if a nerve is squished or irritated, it can cause discomfort or pain in your arms. the same can also happen during coughing or laughing.

however, if the pain is persistent, severe, increasing over time, or is associated with other symptoms like chest pain, shortness of breath, sweating, nausea, dizziness, a change in vision, or a severe headache, you should seek immediate medical attention as these symptoms can sometimes indicate a heart issue.

even if these symptoms are not present, but you are worried, you should consult your doctor for an evaluation, especially since you have smoked in the past. while it's more likely to be nothing serious, it's always better to be safe."
