question_id,response_id,response
N196,response_1,"your results appear to be in line with someone experiencing iron deficiency anemia. this can be supported by lower than normal hemoglobin, hematocrit, mcv, mch, mchc and increased rdw. considerably low iron and ferritin levels also point towards iron deficiency. 

however, it is essential that you contact your health care specialist to evaluate your condition and provide a thorough interpretation of these results. 

as for your urinalysis, the presence of trace ketones, protein, leukocyte esterase, and few bacteria might suggest that your body has not completely recovered from the uti. although your antibiotic regimen may have ended, it is possible that a small amount of bacteria might still be present. 

depending on the severity of your symptoms, another course of antibiotics or a different kind of medication might be necessary. again, consult with your healthcare provider to discuss these symptoms and any potential courses of action."
N196,response_2,"your lab results indeed show signs of iron deficiency anemia. iron deficiency anemia is suspected when hematocrit and hemoglobin are low, and in severe cases, mcv (mean corpuscular volume), mch (mean corpuscular hemoglobin), and mchc (mean corpuscular hemoglobin concentration) can also be lower than normal, like in your case. furthermore, your iron levels and particularly ferritin, which is a storage form of iron, are noticeably below the normal range, further supporting the diagnosis of iron deficiency. in iron deficiency anemia, rdw (red cell distribution width) can be high since the size of red blood cells can vary more. mpv (mean platelet volume) is not specifically linked with iron deficiency anemia, but it can increase with conditions that cause inflammation in the body.

as for the urinalysis, a trace of leukocytes, protein, ketones, and bacteria could indeed be seen after a urinary tract infection (uti), so it's possible that these are remnants from the uti, especially since you recently took antibiotics. trace amounts can sometimes stick around for a while after the infection has cleared. however, it would be best to follow up with your healthcare provider to confirm.

remember, you should interpret lab results in the context of how you're feeling and other clinical findings. if you're still having symptoms, such as fatigue, dizziness, pale skin, or other unusual symptoms, it would be worth discussing more with your doctor. it may be necessary to look further into additional causes or discuss a plan for repleting your iron levels."
N196,response_3,"your results do indicate that you have iron deficiency anemia. your low hemoglobin and hematocrit results mean you have fewer red blood cells than normal, while the low mcv and mch results indicate these cells are smaller and contain less hemoglobin than they should - these are typical signs of iron-deficiency anemia. the high rdw value means there is a large variation in the size of your red blood cells, which can also be a sign of anemia.

besides that, your iron and ferritin levels are also below the normal range, which are further indicators of iron deficiency anemia. ferritin is a protein that stores iron, and low levels often indicate a low level of iron in your body. 

as for your urinalysis results, the presence of leukocyte esterase, bacteria, and trace amounts of protein could indeed suggest that there might be a residual urinary tract infection or that the infection hasn't fully resolved. however, trace ketones might just be indicative of fasting or low carbohydrate diet, but can also be found in diabetes. 

all this said, you should speak to a healthcare provider so you can discuss these results and come up with a plan for how to address these issues. typically, iron deficiency anemia can be treated with dietary changes and supplements. they can also clarify whether your uti has fully resolved or not. 

remember that while seeking advice online can be useful, it does not replace a consultation with a healthcare professional. it's always best to reach out to them with your concerns."
N196,response_4,"as an ai, i can make preliminary assessments based on the information given but i can't replace a thorough evaluation done by a physician who also considers physical findings.

your hemoglobin, hematocrit, mcv (mean corpuscular volume), mch (mean corpuscular hemoglobin), mchc (mean corpuscular hemoglobin concentration) are below the reference range suggesting anemia. the high rdw (red cell distribution width) and low iron and ferritin are typical findings in iron deficiency anemia. the reduced mcv and mch suggest that your cells are smaller and contain less hemoglobin than normal which again is typical for this condition.

regarding the urinalysis, the presence of few bacteria in the urine could potentially mean that you still have a urinary tract infection, especially if you have symptoms such as pain, a burning sensation during urination or need to urinate frequently. however, if you have no symptoms, it might just be a contamination of the urine sample. same applies for protein trace and leukocyte esterase trace - they can be seen in a urinary tract infection but also in other conditions such as kidney disease or inflammation in your body.

you have a ketones trace in your urine which most of the time indicates that your body is burning fat and muscle for energy because it doesn't have enough insulin to use glucose properly. other causes can be fasting, eating a very low carbohydrate diet, or prolonged vomiting.

given your age and without knowing your personal or family medical history, the most probable diagnosis is indeed iron deficiency anemia. however, it's important to find out what caused it in first place and treat accordingly. for women, heavy periods are a common cause, but it can also be due to an underlying condition such as a peptic ulcer, a hiatus hernia, coeliac disease or colorectal cancer. you should discuss these results with your healthcare provider to get appropriate treatment and follow-up."
N196,response_5,"based on the blood results you provided, it seems like you have iron deficiency anemia. this is demonstrated by your low hemoglobin, hematocrit, mcv, mch, mchc, and elevated rdw values. furthermore, your low iron and ferritin levels confirm the deficiency of iron in your body. 

iron deficiency anemia can commonly result due to factors such as inadequate dietary iron, impaired iron absorption, periods of rapid growth, and blood loss.

regarding your urinalysis, trace amounts of ketones, protein, and leukocyte esterase can be normal sometimes. however, it is important to correlate these with your symptoms and clinical condition. if you still symptoms suggestive of a uti, it would be advisable to consult your doctor.

please remember this advice is intended to be general in nature, and specific causes may not apply to your situation. always consult with your healthcare provider for accurate information."
N196,response_6,"blood work results point towards iron deficiency anemia, which can cause low hemoglobin (10.4), low hematocrit (33.2), low mcv (78.9), low mch (24.7), low mchc (31.3), and a high rdw (15.7). your iron (28) and ferritin (3) levels are indeed low, confirming this. 

a trace of ketones and protein in your urine could be associated with dehydration or excessive physical exertion. while trace leukocyte esterase and a few bacteria could potentially indicate a lingering infection, this is not conclusive. if you are still having symptoms of a uti, you should contact your healthcare provider.

remember, these results should be interpreted in the context of your personal medical history, symptoms and clinical examination. it's important to consult with a healthcare professional for formal advice."
N196,response_7,"i'm an ai trained in providing medical information, rather than an actual doctor, but i'll do my best to help you interpret these results.

from your blood results, it seems that you do have anemia (lower-than-normal amounts of red blood cells or hemoglobin), more specifically iron-deficiency anemia. your hemoglobin and hematocrit are a bit low, mcv (mean corpuscular volume), mch (mean corpuscular hemoglobin), and mchc (mean corpuscular hemoglobin concentration) are below range, and rdw (red cell distribution width) is slightly above range which are all suggestive of iron deficiency anemia. your iron levels are low and ferritin, which is a protein that stores iron, is also low, adding to this conclusion.

iron-deficiency anemia can occur as a result of inadequate dietary iron, poor absorption of iron by the body, or ongoing blood loss (for example, heavy periods or a gastrointestinal bleed). please consult with your healthcare provider for appropriate diagnosis and treatment.

in regards to urinalysis, the presence of trace ketones could be a normal finding, particularly if you had fasted before the test or eat a low-carb diet. however, if you're not fasting or on low-carb diet, it may be worth discussing with your doctor. protein can be present in the urine for a variety of reasons, it may be transient, but if persistent, could be a sign of kidney disease. leukocyte esterase and bacteria can be a sign of uti. even though the leukocytes and bacteria are now only in small amounts, it would be wise to schedule a follow up urinalysis to make sure all signs of the uti are gone. 

please do follow up with your primary care provider to discuss these results in-depth as soon as possible."
N196,response_8,"these results are indeed consistent with iron deficiency anemia. iron deficiency anemia is indicated by low hemoglobin, hematocrit, mcv, mch, mchc, and high rdw. in addition, your iron and ferritin levels are also lower than the normal range which further supports the diagnosis. this condition can result from poor intake of iron, poor absorption of iron, or from losing too much iron such as in cases of heavy menstrual periods or gastrointestinal bleeding. 

the urinalysis results may suggest an infection or inflammation in the urinary tract which could be residual from the uti. the presence of trace ketones and protein can be due to various factors including dehydration, diet, or as a stress response. if you have any concerns about these results, or still experiencing symptoms related to uti (like painful urination, fever etc), you should follow up with your healthcare provider. 

please note that this advice is intended to be general in nature, and specific causes may not apply to your situation. always consult with your healthcare provider for accurate information."
N196,response_9,"your lab values indicate you have iron deficiency anemia - this is supported by your low hemoglobin, hematocrit, iron, ferritin, along with your mcv, mch, mchc, and rdw values.  

iron deficiency anemia can be due to a variety of causes such as blood loss, poor absorption of iron from your diet, or insufficient dietary intake. this would be something that you should discuss further with your primary doctor for potential further workup and treatment, such as iron supplementation.

the trace protein and leukocyte esterase in the urine, along with the few bacteria, may suggest that you might have a urinary tract infection or that it has not fully resolved yet from the previous one. if you are still having symptoms like burning during urination, frequent need to urinate, lower abdominal pain, fevers, or back pain, it would be wise to follow up with your doctor about this as well. they may want to start another course of antibiotics or change the antibiotic if the previous one was not effective. 

please take this advice as only a recommendation and consult with a healthcare provider for proper treatment and diagnosis."
N196,response_10,"i'm an ai, and not a doctor, but based on your lab results, these do seem to indicate iron deficiency anemia. the results show a lower iron count, ferritin count (a protein that stores iron), hemoglobin and hematocrit (which help assess the amount of oxygen-carrying protein and proportion of blood volume made up by red blood cells respectively). the mcv, mch, and mchc results further suggest anemia, as these indicate the average size and amount of hemoglobin in your red blood cells are below average. the high rdw (variation in red cell size) also supports this. the mpv result suggests that your body is making larger platelets, which could be a response to inflammation. 

for the urinalysis: trace amounts of ketones, protein and leukocyte esterase, along with the presence of bacteria could possibly indicate a urinary tract infection (uti). however, these traces could also be a result of a recent or resolving one, as you mentioned. 

please reach out to your healthcare provider as soon as you can to discuss these results. they'll be able to provide accurate diagnoses and ways to manage the conditions."
N196,response_11,"i'm an ai developed by openai and while i can give some general information about your laboratory results, please always seek medical advice from a professional healthcare provider, even if you can't do so immediately.

these blood lab results are pretty indicative of iron deficiency anemia. hemoglobin, hematocrit, mcv, mch, mchc are all lower than optimal range. rdw or red blood cell distribution width, is higher than normal - this can suggest varying sizes of your red blood cells, which is common in iron deficiency anemia. also, your iron and ferritin levels are below the normal ranges, this too indicates an iron deficiency. iron deficiency anemia can be caused by variety of factors such as inadequate dietary intake of iron, poor iron absorption, or blood loss.

as for the urinalysis, a uti seems possible given the presence of leukocyte esterase and bacteria, even if they are in trace/few amounts. this could be residue from a recent infection or signify a mild ongoing infection. 'trace' protein can be normal and is usually not concerning unless you're having other urinary symptoms or have a history of kidney disease. note that utis are typically treated with antibiotics and in most cases, it is suggested to do follow up urinalysis after treatment to ensure the infection is completely cleared. you should report these findings to your healthcare provider promptly. 

but again, please talk to your healthcare provider to better understand what these results mean for you as everyone is unique and these results should be interpreted in the context of your overall health condition."
N196,response_12,"i'm an ai developed by openai and i can provide some information based on your lab results, but please consult your doctor to discuss these results. 

from what you've shared, your lower hemoglobin, hematocrit, mcv, mch, mchc and higher rdw and mpv suggest anemia, specifically more indicative of microcytic anemia which might be due to iron deficiency, given your lower iron and ferritin levels.

regarding your urinalysis, the traces of ketones, protein and leukocyte esterase could be a result of your recent urinary tract infection. however, it could also indicate other conditions like diabetes or kidney disease. again, this is only a general information, your doctor is the best person to interpret these lab results. 

never delay seeking medical advice because of something you hear or read online, including this message. it's important to follow up with your healthcare provider."
N196,response_13,"your lab results do show indicators of iron deficiency anemia, which includes low hemoglobin, hematocrit, mcv, mch, mchc, iron, and ferritin. the rdw is also elevated, which is common in iron deficiency anemia as it shows variation in the size of red blood cells. 

your urinalysis results indicate the presence of ketones, protein, and some leukocyte esterase. having small amounts of these substances in your urine may not necessarily indicate a problem, but persistent protein in urine could imply kidney-related problems, while leukocyte esterase could suggest a urinary tract infection. the small amount of bacteria could be the result of a recent uti.

it's advisable to follow-up with your healthcare provider to discuss these results and determine the best course of action. don't worry, iron deficiency anemia is usually treatable with iron supplements and diet modifications. however, you should still consult your physician to rule out any other underlying conditions."
N196,response_14,"your lab results do suggest iron deficiency anemia.
- the lower hemoglobin, hematocrit, mch, mcv, and mchc levels reflect a lower amount of iron in your red blood cells, which can result in anemia.
- the high rdw (which measures variation in red blood cell size) suggests that your body is producing both larger and smaller than normal red blood cells in an effort to compensate for the anemia.
- the low iron and ferritin levels in your blood also suggest an iron deficiency.

the few bacteria and trace leukocyte esterase in your urinalysis results could be remnants from your recent uti, or could potentially indicate a continuing or recurring urinary tract infection. 
trace protein in urine can be a normal finding but it may also suggest a number of different conditions, including kidney disease. trace ketones in the urine can occur for a variety of reasons, including fasting, dieting, exercise or diabetes.

you should definitely discuss these results with your healthcare provider to get a better understanding of what they could mean for your specific situation. please keep in mind this platform is intended to provide general advice and doesn't substitute a consultation with a healthcare professional."
N196,response_15,"ianad, but based on your lab results, it seems likely that you have iron deficiency anemia. your hemoglobin and hematocrit are low, which suggests anemia, and your iron and ferritin levels are also below the normal ranges, which indicates an iron deficiency. 

your mean corpuscular volume (mcv) and mean corpuscular hemoglobin (mch) are below normal which often correlates with iron deficiency anemia. it typically suggests that your red blood cells are smaller and contain less hemoglobin than normal (microcytic and hypochromic), usually due to lack of iron. 

your red cell distribution width (rdw) is higher than normal, which means there is large variability in the size of your red blood cells. this is another common characteristic of iron deficiency anemia.

for the urinalysis results, trace amounts of ketones, protein, and leukocyte esterase may be remnants from the recent uti. however, if you're done with your uti treatment course, and still have these findings in urine, it might be best to inform your doctor as they could indicate persistent or recurrent infection. 

please get in touch with a healthcare professional who can interpret these results for you in the context of your full health history, symptoms and physical exam. they may provide specific treatment options, such as iron supplements, and will be able to monitor your response to treatment. the aim of treating iron deficiency anemia is to restore the iron level in your body and to treat the underlying cause of the iron deficiency, if possible."
N196,response_16,"the lab results you've provided definitely indicate that you have iron deficiency anemia. your hemoglobin, hematocrit, mcv and mch are all below range, which typically suggests a type of microcytic anemia, often caused by iron deficiency. additionally, your iron and ferritin levels are remarkably low. ferritin reflects your body's iron storage and a low level often indicates inadequate iron stores in the body leading to iron deficiency anemia.

the urinalysis suggests that you may still have some traces of a urinary tract infection (uti). bacteria, leukocyte esterase, and protein in urine can be due to a uti. the traces of ketones are not typical for a uti, but they might appear if you are not eating enough, fasting, or if your body is using fat for energy rather than carbohydrates, like during a diet or due to diabetes.

given these results, it's important that you get in touch with your doctor to get comprehensive advice and proper treatment. the anemia can be corrected with iron supplements or diet modification but the apparent uti may need further treatment if it's not completely cleared.  

remember this advice is based on the information provided and for accurate medical advice a thorough evalaution by a healthcare provider is necessary."
N196,response_17,"your cbc results do indicate that you have anemia, and more specifically, it appears to be iron-deficiency anemia based on your low iron and ferritin levels. the high rdw is indicative of variable size of blood cells, which is common in iron-deficiency anemia.

as for the urine analysis, a trace amount of ketones, protein, and leukocyte esterase, and a few bacteria, could possibly be left over from the uti. but usually, antibiotics clear up the bacteria in the urine and leukocyte esterase (given it's an indicator of wbcs present due to infection). if you're not having symptoms, it's likely the infection is fully treated and the urine findings are residual. if you still have uti symptoms, you might need to go back to your doctor for further evaluation. 

remember, though online help can give you ideas about what's going on, you should still reach out to your healthcare provider to discuss. they know you and your health the best."
N196,response_18,"i'm an ai language model and and while i can provide some information based on the lab values you've provided, it's important to get a professional medical opinion. 

your results suggest some degree of anemia, as indicated by lower than normal values for hemoglobin, hematocrit, mcv, mch, and mchc, and the higher than normal rdw value. in addition, your low iron and ferritin values may suggest iron deficiency anemia, but again, a doctor needs to corroborate that.

the abnormal values in your urinalysis could be related to your recent urinary tract infection (uti). the presence of trace leukocyte esterase could hint at the presence of white blood cells, which is common in utis. meanwhile, a trace amount of ketones and protein might not be clinically significant. however, if you're experiencing symptoms like fever, pain during urination, or lower abdominal discomfort, please consult a healthcare professional.

remember, this is not an official diagnosis and it's very necessary for you to consult with your doctor for proper assessment, diagnosis, and treatment."
N196,response_19,"i'm an ai language model and not a doctor, but i can try to give you a general understanding based on your results.

your hemoglobin, hematocrit, mcv, mch, mchc are all lower than the normal range, and rdw is higher than the normal range which could possibly indicate iron-deficiency anemia. iron and ferritin levels being below the normal range further support this.

your urinalysis shows traces of ketones, protein, and leukocyte esterase with few bacteria. this could indeed be indicative of a recent urinary tract infection. even after the infection has cleared, it can take a little bit of time for your urinalysis to return to completely normal.

it's crucial that you have a healthcare professional interpret your lab results, though, since they can consider these in the context of your health history, symptoms, and examination findings. they may also order further tests if needed. please consult with your healthcare provider as soon as you can."
N196,response_20,"the blood results you've posted point to a definite iron deficiency anemia. your hemoglobin, hematocrit, mcv (mean corpuscular volume), mch (mean corpuscular hemoglobin), mchc (mean corpuscular hemoglobin concentration) are all lower than normal and rdw (red cell distribution width) is higher than normal which is consistent with iron deficiency anemia. your iron and ferritin levels are also low which confirm this diagnosis.
 
iron deficiency anemia can have several causes such as poor absorption of iron from diet, inadequate dietary intake, pregnancy, blood loss or certain chronic diseases. in women, heavy menstrual periods are a common cause. it's important to find out the cause to prevent it from recurring after treatment.

as for urinalysis results, the presence of trace ketones could be due to not eating for a while, protein could be a residue from the urinary tract infection (uti), leukocyte esterase and bacteria indicate there still might be an ongoing uti. even a 'few' bacteria can be clinically important, depending on the type of bacteria and symptoms. if you still have symptoms of a uti (such as burning with urination, frequent urination, lower abdominal pain) you should contact your healthcare provider. 

take note that this advice is based solely on the lab results you've posted and does not replace a thorough evaluation by a healthcare provider. 

you should arrange regular check-ups with your doctor about your anemia and complete the treatment as prescribed. your doctor may also suggest some dietary changes or recommend over-the-counter iron tablets. in case of ongoing symptoms of a uti, please seek medical attention in a timely manner."
