question_id,response_id,response
N92,response_1,"you're reporting recurrent episodes of tinnitus (ringing in the ears) and diminished hearing - a symptom known as fluctuating hearing loss. you mentioned an episode where this was accompanied by vertigo. this triad of symptoms (fluctuating hearing, tinnitus, vertigo) may suggest a condition called ménière's disease. however, this condition needs to be diagnosed by a specialist (otologist or otolaryngologist) after conducting specific tests. other conditions that could potentially cause similar symptoms are chronic middle ear infections, acoustic neuroma, otosclerosis, eustachian tube dysfunction, among others.

however, there are also reports of ""transient"" hearing loss or tinnitus associated with certain drugs like metoprolol, which you are taking for your pots. also, tinnitus is linked with postural orthostatic tachycardia syndrome (pots) that you have diagnosed. however, these associations are still being studied and are not fully understood.

furthermore, fmf (familial mediterranen fever) is a genetical disease that might cause inflammation affecting various organs and tissues. including the inner ear, which could in theory cause those symptoms. again, this is a theoretical possibility but not well studied.

in your case, thorough evaluation and tests may be necessary to identify the precise cause. the solution may be as simple as a medication tweak if metoprolol is indeed the cause of your auditory symptoms, but this should be done under the supervision of your doctor.

as far as prevention is concerned, this really depends on identifying the cause of the problem. certain triggers (like salt intake, alcohol, caffeine, stress etc.) are known to exacerbate symptoms in ménière's disease (if this turns out to be your diagnosis). however, this would be under the assumption that you are indeed suffering from ménière's disease, which yet has to be confirmed.

so the best advice is to consult with an ear specialist (otologist or otolaryngologist) as soon as you can."
N92,response_2,"this condition sounds like meniere's disease, a disorder of the inner ear that can lead to dizzy spells (vertigo) and hearing loss. it's often associated with a ringing noise (tinnitus) or a feeling of fullness or congestion in the ear. although the exact cause of meniere's disease is unknown, it's believed to result from an abnormality in the fluid in the inner ear. i recommend asking your doctor about a possible meniere's disease diagnosis and how to manage it. possible treatments could include medication, lifestyle changes (such as dietary adjustments), and physical therapy.

however, in the context of your conditions - familial mediterranean fever (fmf) and postural orthostatic tachycardia syndrome (pots) - it may be a more complex situation. patients with fmf can occasionally have inflammation in different parts of the body and this may involve the inner ear. similarly, metoprolol, a medication you're taking for pots, has tinnitus as a potential side-effect in some individuals. 

it would be very beneficial to discuss these points with your doctor or see an otorhinolaryngologist (ear, nose and throat specialist) and perhaps even consider further diagnostics like an mri of the brain and inner ear structures or an audiogram (hearing test). 

remember that this advice is intended to be general in nature, consult with your healthcare provider for specific healthcare advice. 

disclaimer: this advice is intended to provide general health information based on the description you provided and is not a substitute for a consultation with a medical professional."
N92,response_3,"you may want to consider a possible diagnosis of meniere's disease. meniere's disease is an inner ear disorder that can cause episodes of vertigo, tinnitus (ringing in the ear), hearing loss, and a feeling of fullness in the affected ear. the causes of meniere's disease aren't well-understood, but it's thought to be related to the volume of fluid, or pressure, in the inner ear.

your symptoms of recurrent episodes of hearing loss, tinnitus, and vertigo could potentially be indicative of this condition. in some cases, meniere's disease may also cause other symptoms such as nausea, headache, and sensitivity to sound or light.

the diagnosis is usually made based on clinical symptoms, but you may also need to undergo a hearing test, or more specialized tests such as an mri or ct scan to rule out other conditions. treatment often involves dietary changes, medications such as diuretics, and sometimes surgery in severe cases.

moreover, familial mediterranean fever (fmf) has been associated with various types of hearing loss. however, case reports are rare and more research is needed to fully understand this relationship.

consulting with a specialist like a neurotologist or otolaryngologist (ear, nose, and throat doctor) would be beneficial to get a proper diagnosis and management plan for your symptoms."
N92,response_4,"from what you've described, it's possible that your symptoms could be related to something called meniere's disease. meniere's disease is an inner ear disorder that causes episodes of vertigo, tinnitus (ringing in the ear), a feeling of fullness or congestion in the ear, and fluctuating hearing loss that can progress to permanent deafness. 

however, to make a definite diagnosis, you would need a thorough evaluation by an otolaryngologist (an ear, nose, and throat, or ent, specialist). the evaluation might include audiometric testing, an mri of the brain and inner ear, and other diagnostic tests. 

while your current medications for pots (postural orthostatic tachycardia syndrome) and fmf (familial mediterranean fever) are not commonly associated with these symptoms, any new or unusual symptoms should always be discussed with your healthcare provider. 

it's also worth noting that stress management and a reduction in sodium intake are sometimes recommended for managing symptoms of meniere's disease. if this is what's causing your symptoms, your healthcare provider may recommend these or other lifestyle modifications to help manage your symptoms. 

please consult with your doctor or a specialist for an accurate diagnosis and treatment options. remember, online advice is not a substitute for a healthcare professional's assessment."
N92,response_5,"i'm an ai and not a doctor, but i can suggest several possible causes for your recurrent episodes of tinnitus and decreased hearing that you can discuss with your healthcare provider. this might be due to drug side-effects (metoprolol can sometimes cause tinnitus and vertigo). another possibility is meniere's disease, characterized by episodes of vertigo, tinnitus, and hearing loss. infections or other disorders of the ear and even the autoimmune nature of fmf could also potentially lead to ear issues. blood flow issues related to your pots might also theoretically be playing a role. do keep in mind this is only informational and you should consult with your physician for accurate diagnosis and treatment."
N92,response_6,"while it's difficult to give a definitive answer without taking your overall medical history and performing a physical examination, a few potential explanations for your symptoms could include:

- ménière's disease: this is a disorder that affects the inner ear and can cause vertigo, tinnitus and hearing loss.

- vestibular migraine: this is a type of migraine that can cause problems with balance, dizziness, and hearing loss.

- ear infection: infections can cause hearing loss, tinnitus, and dizziness.

- ototoxicity: certain medications can damage the inner ear resulting in symptoms like tinnitus, hearing loss and vertigo. colchicine, which you are taking, has been reported to cause hearing loss or tinnitus in some rare cases.

these are just possible explanations, and this list is not exhaustive. you should communicate these concerns with your healthcare provider who would be able to guide you to the appropriate specialist for further evaluation, such as an ear, nose, and throat (ent) specialist or a neurologist. 

also, although your condition (postural orthostatic tachycardia syndrome and familial mediterranean fever) could contribute to tinnitus, they typically do not cause sudden bouts of hearing loss. 

lastly, be sure to mention your medications and your hospitalization to your doctor, as these are important details to consider in diagnosis and treatment."
N92,response_7,"tinnitus, sudden deafness, and vertigo that you're experiencing may be ent-related but they can also be symptoms of meniere's disease. this is a disorder of the inner ear that can cause severe dizziness (vertigo), ringing in the ears (tinnitus), hearing loss, and a feeling of fullness or congestion in the ear. it usually affects one ear and might progress over time. 

pots (postural orthostatic tachycardia syndrome) and fmf (familial mediterranean fever) are chronic conditions that could possibly contribute to these symptoms as well. they can both cause inflammation in the body which may have an effect on the inner ear. despite this, your physicians would be more aware of your overall health condition and would be best to guide you in this regard.

make sure you have had a thorough evaluation by an ear, nose and throat (ent) specialist or a neurologist. you might need certain specific tests for the ear like an audiogram or a mri to rule out any underlying pathology. please discuss this with your doctor. it is important to keep your health providers updated about these recurrent issues.

please note that this advice is intended to be general in nature, and specific causes may not apply to your situation. always consult with your healthcare provider."
N92,response_8,"i'm sorry to hear that you are experiencing these unpleasant symptoms. while your doctors have suggested it may be related to high blood pressure, it could also potentially be related to your condition postural orthostatic tachycardia syndrome (pots). some people with pots report similar symptoms such as tinnitus. vertigo could be related to an inner ear problem. 

if you are experiencing a flare of familial mediterranean fever, this inflammation could potentially cause these symptoms, or the symptoms could be a side effect of the medication you are taking. 

however, these are only speculations. it's important that you consult with a doctor for an accurate diagnosis and recommendations. they might be able to suggest some lifestyle changes, therapy options or adjust your medication to help manage these symptoms. 

audiologists are also qualified to help manage and treat hearing and balance disorders, so it might be worth considering a consultation with an audiologist if you haven't seen one already. 

please make sure your doctor is aware of these recent episodes and consider asking for a referral to a specialist in neurotology or otoneurology (specialists in nerve-related conditions of the ear) if your symptoms persist. it's also important to get your hearing checked regularly. 

finally, relaxation techniques and stress management can be useful in managing tinnitus for some people. so you may find it beneficial to explore options like relaxation therapy, counselling or cognitive behavioural therapy. 

please note that this advice is intended to be general in nature, and specific causes may not apply to your situation. always consult with your healthcare provider for accurate information."
N92,response_9,"i'm a language model ai developed by openai and i can tell you the cause of tinnitus is often not identified, but it can potentially be associated with various health conditions like high blood pressure, meniere's disease, tmj disorders, certain medications, allergies and many more. it can get worse with age, but treating an identified underlying cause can help. regarding prevention, here are few tips i can suggest:

1. avoid possible irritants like loud noises that may make your tinnitus worse. 
2. reduce alcohol and caffeine.
3. manage stress as it can worsen tinnitus. some stress-relieving methods like biofeedback, hypnosis or yoga might help.
4. limit intake of some possible trigger foods like salt, artificial sweeteners, sugars, saturated fats, amongst others. 

however, it's always best to consult with your medical practitioner for better understanding and appropriate treatment. this is because tinnitus can sometimes indicate serious medical conditions like vascular disease or tumors that need immediate evaluation and treatment. they could also evaluate for abnormal heart rhythms like your supraventricular tachycardia (svt) that can cause similar symptoms. it would also be good to discuss possible side effects of your current medications."
N92,response_10,"i'm sorry you're having to go through this, it sounds really tough. given the recurrence of these symptoms and the fact they seem to disappear on their own, your condition might be connected to an issue with your inner ear, which is responsible for hearing and maintaining balance. specific conditions that may trigger similar symptoms may involve benign paroxysmal positional vertigo (bppv), ménière's disease, vestibular neuritis, or labyrinthitis. high blood pressure could possibly cause these symptoms, but since you mentioned that your blood pressure is normal, it might be worth exploring other possibilities.

your medications, metoprolol and colchicine, generally do not cause these kind of symptoms according to their known side effects, but you can also discuss this with your doctor. 

given your diagnosis of familial mediterranean fever (fmf) and postural orthostatic tachycardia syndrome (pots), it would be important to mention these recurring symptoms to your treating physician in case they are somehow related to these conditions or need a different approach in management. 

however, because specific diagnosis needs a more comprehensive medical history and possibly a physical examination, it would be best to discuss all of this with your healthcare provider. it may be helpful to see an ear, nose, and throat (ent) specialist, if you haven't already.

please remember this advice is intended to be general in nature, and specific causes may not apply to your situation. always consult with your healthcare provider for appropriate examinations, treatment, testing, and care recommendations."
N92,response_11,"while i'm an ai and can't directly diagnose or treat your condition, i can provide possible paths for your consideration. the symptoms you're describing—tinnitus and vertigo—may suggest a condition called meniere's disease, which affects the inner ear and can lead to these situations. however, it could also be something simple like exacerbated tinnitus from stress or other environmental factors. 

because you have familial mediterranean fever (fmf), the inflammation from that condition could potentially be impacting your ears or surrounding areas. furthermore, postural orthostatic tachycardia syndrome (pots) can also cause tinnitus-like symptoms or vertigo in some cases. 

your situation is complicated, and you may want to seek a consultation with a specialist in ear health like an otolaryngologist.  talk to your primary care provider about this possibility. ideally, repeated, thorough examinations may help identify any underlying cause and provide ways to manage your symptoms."
N92,response_12,"i'm sorry you're going through this. while it's not possible to give you a definitive explanation without a physical examination and more tests, several conditions might lead to these symptoms. these can include sensorineural hearing loss, meniere's disease, or superior canal dehiscence syndrome. these all can cause recurrent episodes of tinnitus and vertigo. it's important to note that both metoprolol and colchicine can potentially have side effects involving the ear, including tinnitus. it may be worthwhile to revisit with your ent specialist or possibly get a second opinion from another one. as for prevention, until the root cause of these episodes is identified, it's difficult to give specific advice. please continue your conversation with your healthcare provider. they can help guide your next steps."
N92,response_13,"i'm really sorry to hear about your difficulties. 

you have a complex medical history and are taking multiple medications with the possibility for various side effects. metoprolol, a medication used to control blood pressure and heart rate, notably can in rare cases cause tinnitus (ringing in the ears) and hearing problems. 

in addition, conditions like ménière's disease, which cause vertigo and tinnitus, can be triggered in patients with pots when they switch positions. 

however, a sudden onset of dizziness or hearing loss can be also a sign of more serious issues such as stroke or transient ischemic attack, especially in combination with other symptoms like weakness on one side of the body, difficulty speaking or difficulty walking. 

you should have a thorough evaluation by a healthcare provider, who may consider referring you to an otolaryngologist (ent), or a neurologist, or possibly both. audiological evaluation, blood tests, brain mri, and tests of balance function may also be required.

meanwhile, lifestyle modifications, such as decreasing the amount of salt and caffeine intake, quitting smoking, engaging in regular physical activity, and controlling blood pressure, can decrease the frequency and intensity of vertigo and tinnitus episodes.

please consult your healthcare provider as soon as possible about this."
N92,response_14,"i'm sorry to hear about your ongoing ear disturbances. tinnitus may be due to numerous potential causes and can be quite difficult to diagnose precisely. apart from high blood pressure, it could be related to a number of factors such as loud noise exposure, ear blockage, some medications, neck or head injuries, or certain disorders like meniere's disease. given that you also experienced vertigo during an episode, an inner ear problem like meniere's disease seems possible. 

pots (postural orthostatic tachycardia syndrome) which you mentioned you have, has also been linked with tinnitus and vertigo. as the blood flow to the ears decreases due to blood pooling in other parts of the body in pots, it can cause these symptoms. 

however, only a healthcare provider can provide a precise diagnosis. 

your doctor may want to refer you to an ear, nose, and throat (ent) specialist or an audiologist for further evaluation. treatment options vary based on the root cause. they may include medications (different from what you're currently using), lifestyle changes, therapeutic noise generators, counseling, or cochlear implants or hearing aids if hearing loss is significant and contributing to the problem. 

moreover, there is no definitive way to prevent tinnitus until the cause is isolated. in general, avoiding excess noise exposure, taking care of your cardiovascular health, and avoiding ototoxic medications, when possible, can help in prevention. please consult your doctors to review your current medications and evaluate further."
N92,response_15,"i'm an ai language model, not a doctor, but i can provide you with some general information about your symptoms. you're experiencing recurrent episodes of tinnitus and temporary hearing loss, which can possibly be related to a condition called meniere's disease. meniere's disease is an inner-ear problem that includes symptoms such as vertigo and tinnitus.

various things can cause tinnitus, including hearing loss, loud noise exposure, earwax blockage, ear bone changes, meniere's disease, tmj disorders, head injuries or neck injuries, acoustic neuroma, eustachian tube dysfunction, muscle spasms in the inner ear, blood vessel diseases, medications, and age.

your doctors may be right in thinking high blood pressure could cause these symptoms, but since your bp is normal, they should consider other possibilities too. stress and anxiety, which are often associated with conditions like pots (postural orthostatic tachycardia syndrome) can also exacerbate symptoms like tinnitus. 

furthermore, metoprolol, which you're taking for your pots, can occasionally cause tinnitus as a side effect. familial mediterranean fever (fmf) isn't typically associated with hearing issues, but inflammation, in general, may exacerbate symptoms like tinnitus.

since your symptoms keep recurring and you are experiencing considerable discomfort, you should reach out to your healthcare provider again to discuss them in detail. maybe a more comprehensive audiological and vestibular examination might help identify the underlying condition. a consultation with an ent (ear, nose and throat) specialist might be beneficial. 

please, this is not medical advice, and it's crucial to consult with your doctor or a healthcare provider."
N92,response_16,"your symptom of suddenly losing hearing and experiencing tinnitus could possibly be due to a condition known as sudden sensorineural hearing loss (sshl). this is hearing loss that happens suddenly or rapidly over a period of up to three days. it's often accompanied by symptoms like a ringing sound (tinnitus) or dizziness (vertigo). however, further diagnostic tests would be needed to confirm this.

sshl is considered a medical emergency. while it can potentially recover on its own, it's best treated promptly. the most typical treatment is high-dose corticosteroids like prednisone. you should consult with an ent specialist for this. 

while the cause of sshl is often unknown, some possible causes include autoimmune diseases, exposure to certain drugs that damage the ear, blood circulation problems, and a neurological disorder. considering you have pots (postural orthostatic tachycardia syndrome) and fmf (familial mediterranean fever), these issues could potentially be linked to your symptoms. 

as to your blood pressure, metoprolol is a drug that's used to treat high blood pressure, and if your blood pressure is normal, that could be because the medicine is effectively managing your condition. 

consultation with your doctor about your symptoms and concerns is strongly recommended. in the meantime, avoid loud noise and take care of your general health, which can help prevent sshl."
N92,response_17,"vertigo accompanied by hearing loss can be a symptom of conditions like meniere's disease or vestibular neuritis. meniere's disease includes episodes of vertigo, temporary hearing loss, tinnitus (a ringing or roaring in the ears), and a sensation of fullness or pressure in the ear. vestibular neuritis, on the other hand, is an inflammation of the inner ear usually caused by a viral infection resulting in vertigo. both of these conditions can be diagnosed with imaging tests, balance tests, and hearing tests.

high blood pressure can cause tinnitus, but if your bp is normal it's not likely the cause. several medications could potentially cause tinnitus as a side effect, but metoprolol and colchicine are not typically associated with this. 

preventing these flare-ups would involve treating the underlying cause which isn't clear yet. in the meantime, reducing salt in the diet, ensuring good hydration, and avoidance caffeine, chocolate, and alcohol may help control symptoms if this is related to meniere's. vestibular rehabilitation therapy is often helpful in managing vertigo.

however, it's really critical that you stay in communication with your healthcare providers about these symptoms. more tests may be needed to get a clear diagnosis. you may want to consider making an appointment with an ent specialist (otolaryngologist) to further evaluate your symptoms. opportunities such as getting a second opinion, or even a referral to a tertiary care center with more specialized knowledge of these conditions may be considered as well."
N92,response_18,"you mentioned that you're dealing with postural orthostatic tachycardia syndrome (pots) and familial mediterranean fever (fmf). both of these conditions could contribute to your symptoms. pots can be associated with symptoms like tinnitus (ringing in the ears) and vertigo, due to the body's inability to regulate heart rate and blood pressure when changing positions. fmf, on the other hand, can cause systemic inflammation, which can possibly have effects on the ear.

however, the recurrent and sudden onset deafness you're experiencing does indicate a possibility for another condition, like meniere's disease, which is characterized by episodic vertigo, tinnitus, and hearing loss. sudden sensorineural hearing loss could also be a possibility, although this usually affects one ear at a time.

treatment for these conditions depend on the underlying cause. if this is indeed related to your pots and/or fmf, managing those effectively would be critical in preventing further episodes. meanwhile, if this is a new, separate condition like meniere's disease, different treatments could be prescribed.

to prevent this in the future, it's key to continue to work closely with your doctors. they might track your symptoms and possibly refer you to a specialist, like an ear-nose-throat (ent) specialist, if they haven't already. this could potentially lead to a more definitive diagnosis and treatment plan, reducing the recurrence of your symptoms. remember to keep a detailed symptom diary to help your doctor in their diagnosis.

please remember that this advice is intended to be general in nature, and specific causes may not apply to your situation. always consult with a healthcare provider for accurate information."
