question_id,response_id,response
N105,response_1,"your doctor is correct in wanting to recheck your tsh (thyroid-stimulating hormone) levels. the normal range can depend on the lab, but typically it is around 0.4 - 4.0 miu/l. therefore, 4.9 is slightly elevated, but not necessarily indicative of a serious problem. 

there is no age restriction on thyroid disease. although it is more common in older individuals, younger people can certainly develop thyroid issues as well. many things can cause an elevation in tsh, primarily an underactive thyroid gland (hypothyroidism).

it is not likely that your psoriasis is causing the elevated tsh level. however, both psoriasis and hypothyroidism are autoimmune conditions, where the body's immune system mistakenly attacks its own tissues. people with one autoimmune condition are often at greater risk of having another.

an indoor lifestyle would not have a direct impact on your tsh levels, but getting regular exercise is important for overall heath, including your metabolism, which is regulated by your thyroid.

a diet high in chicken and eggs should contain plenty of protein, but depending on your overall intake and other factors, you could still not be getting enough. underactive thyroid (hypothyroidism) can lead to changes in your metabolism that may alter protein metabolism as well.

again, while a tsh of 4.9 is slightly over the upper limit, it's mildly elevated and doesn't definitively indicate that you have a thyroid disorder. it’s possible that this was an incidental finding and your level could be normal when re-tested in a month. however, if the level is still high upon retesting, it may be worth exploring further with your doctor to understand the root cause and decide on a course of treatment, if necessary."
N105,response_2,"while it's true that thyroid issues are more common as people age, they can actually occur at any age. the upper normal limit for tsh is around 4.0 - 4.5 miu/l so at 4.9, your level is slightly elevated and could suggest an underactive thyroid (hypothyroidism). it doesn't necessarily mean you have a thyroid disorder, but it's a good idea to retest to confirm.

the connection between psoriasis and thyroid diseases is still not well understood, but some studies suggest a possible link. an underactive thyroid has been found in some people with severe psoriasis, but further research is needed.

the protein recommendation may not necessarily be connected to your tsh levels, but more to do with maintaining a balanced diet and supporting overall health. 

lastly, a lack of sunlight can lead to vitamin d deficiency, which is linked to both psoriasis and thyroid disorders. however, this doesn't necessarily mean that lack of sunlight is causing your slightly elevated tsh level. 

as we're not doctors, we would recommend you follow your doctor's advice. retesting is a good idea and will give you a clearer picture of what's going on."
N105,response_3,"the thyroid-stimulating hormone (tsh) level of 4.9 is slightly elevated as the normal range is usually 0.4 to 4.0 miu/l. this can indicate mild hypothyroidism (underactive thyroid), also known as subclinical hypothyroidism, even in people under 30. the thyroid gland can become underactive for various reasons, including autoimmune diseases, certain medications, and stress or some other underlying health condition.

psoriasis is an autoimmune disorder, and having one autoimmune disorder can increase the risk of having other autoimmune diseases, including thyroid disorders.

the relationship between the level of dietary protein intake and tsh levels is relatively unclear. it's not likely associated because the thyroid gland mostly needs iodine and selenium, not proteins, to function properly.

your skin being deprived of sunlight can contribute to vitamin d deficiency, which has been linked to high tsh levels and hypothyroidism in some studies, but it's unclear if supplementation can restore thyroid function.

a doctor would typically want to retest tsh levels a few weeks after your first test to confirm whether it's a temporary fluctuation or truly abnormal. thyroid function can fluctuate due to various factors such as stress, medications, or illness.

remember that only your doctor can accurately interpret your test results and discuss them with you. you should follow their advice about treatment options should the second test also come back high."
N105,response_4,"the tsh test measures the blood level of thyroid-stimulating hormone, a hormone secreted by the pituitary gland. it is used for screening for and monitoring treatment in a number of conditions related to the thyroid gland. tsh levels can sometimes be high if your thyroid gland is not responding normally to tsh's signal to make more thyroid hormones. this could mean you have hypothyroidism, or an underactive thyroid gland.

hypothyroidism can sometimes be part of an autoimmune condition similar to psoriasis, since both are autoimmune conditions. but being indoor or your lifestyle doesn't have a direct effect on tsh level.

in terms of age, while hypothyroidism is indeed more common in older individuals, it can occur in individuals of any age. 

however, tsh 4.9 is at the higher limit but it's not significantly high (0.4-4.5 is considered normal), and it must be interpreted considering your symptoms and other lab results. besides, tsh levels can vary during the day and can increase after exercise, for example. it’s good to have a retest as your doctor suggested.

your protein intake seems adequate if you're eating chicken and eggs regularly. one thing to remember is that, it's not how much protein you consume, but more of how your body utilises it. malabsorption can cause low levels regardless of how much protein you intake.

it's good that you're taking steps to improve your health. keep following up with your doctor's advice and asking questions when you're unsure."
N105,response_5,"tsh (thyroid stimulating hormone) of 4.9 is considered to be at the higher end of the normal range or may be slightly elevated, depending on the reference range used by the lab that analysed your test. the typical normal range for healthy adults is usually around 0.4-5.0 miu/l, but this can vary between labs.

it's not strictly true that thyroid problems usually occur in people over 50 - they can happen at any age. however, it is more common in women and the risk does increase with age.

a high tsh could indicate that your body isn't producing enough thyroid hormone (a condition known as hypothyroidism, or 'underactive thyroid'), so your pituitary gland is producing more tsh to stimulate your thyroid to produce more. hypothyroidism causes symptoms such as fatigue, weight gain, dry skin, and depression.

there are many possible causes of hypothyroidism, including autoimmune disease, certain medications, and radiation therapy. psoriasis is an autoimmune disease but it isn't typically associated with hypothyroidism.

regarding your concern about protein intake, it's not just about quantity, but also quality. while chicken is a good source of protein, it is important to have a varied diet to make sure you get all essential amino acids and nutrients.

your indoor lifestyle factor is a possibility but unlikely a sole cause. vitamin d, which we get from sunlight exposure, plays a vital role in many bodily functions (including, potentially, thyroid function).

it is good that your doctor wants to repeat the test as tsh can be influenced by many factors and a single test might not reflect your true thyroid function. so, it is a good practice to recheck the levels. if tsh remains high, further evaluation should be undertaken to establish the cause. it's worth noting that even if you do have hypothyroidism, it is usually very manageable with medication."
N105,response_6,"thyroid problems are not confined to people over the age of 50, they can occur at any age. a tsh level of 4.9 is slightly elevated, which may suggest that your thyroid is not functioning optimally. the thyroid is a small gland in your neck that produces hormones which regulate your metabolism. an elevation in tsh usually indicates hypothyroidism, a condition in which the thyroid gland does not produce enough thyroid hormone. this can lead to symptoms such as fatigue, weight gain, depression, and cold intolerance. 

a number of factors can contribute to hypothyroidism, including autoimmune conditions, certain medications, and a lack of dietary iodine. your doctor has suggested a retest in a month because tsh levels can fluctuate and a single abnormal result does not necessarily mean you have a long-term thyroid problem.

the link between psoriasis and thyroid disease is not fully understood but some studies have suggested an association. methotrexate, a medication you're taking, does not typically affect thyroid function.

regarding your protein intake, it's not just about quantity, but also quality, digestibility, and variety of sources. while chicken and eggs are good sources, you could also include more legumes, nuts, seeds, dairy, and fish to ensure you're getting all the essential amino acids.

lastly, lack of sunlight does not typically affect your thyroid function directly. however, sunlight is important for your body to produce vitamin d, which has various health benefits. insufficient vitamin d levels have been linked to autoimmune diseases, but not specifically hypothyroidism. 

also, it's crucial that you take adequate rest, manage stress well, and follow regular physical activity, as these too impact your thyroid health positively."
N105,response_7,"thyroid problems can occur at any age, they are just more common in older individuals. your tsh (thyroid stimulating hormone) levels are slightly raised, which may signify underactivity of your thyroid gland (hypothyroidism). it's good that your doctor is planning to retest, as levels can fluctuate and one single result doesn't necessarily indicate a problem.

there are many possible causes for hypothyroidism. autoimmune diseases, such as hashimoto's thyroiditis, are the most common cause. your psoriasis is also an autoimmune condition, so there may be a link - individuals with one autoimmune disease are more likely to develop another. however, it's not a direct cause-and-effect relationship.

your indoor lifestyle and lack of sunlight wouldn't impact your thyroid function directly, but it's always good to get some natural sunlight for vitamin d synthesis. as for your protein intake, it depends not only on the amount, but also on the variety and quality of proteins you're eating. consuming a balanced diet with a mix of various nutrients is always advisable. 

remember, only your doctor can accurately interpret your test results in the context of your full medical history and current health status. so, continue to communicate openly with them to receive the most appropriate care."
N105,response_8,"firstly, tsh stands for thyroid-stimulating hormone. it signals your thyroid gland, a small butterfly-shaped gland in your neck, to produce thyroid hormones, which regulate the body’s metabolism. your tsh level is 4.9, which is slightly above the normal range. in many labs, the normal range of tsh is from 0.4 to 4.5

high tsh levels typically suggest that you have an underactive thyroid, or hypothyroidism. this means your thyroid is not making enough thyroid hormones. 

hypothyroidism can occur at any age, not just above 50. it can be caused by a variety of things, including autoimmune disease (where the body attacks the thyroid gland), certain medications, and it can be genetic.

so far, there's no evidence directly linking psoriasis to thyroid issues. but both psoriasis and hypothyroidism can be due to immune system abnormalities, so it's not impossible that they might be linked in some people.

an indoor lifestyle or lack of sunlight isn't normally associated with high tsh levels.

about your protein intake, the tsh or thyroid function isn't directly related to your protein intake. if your doctor talked about protein, it might be related to your overall nutritional status or if you have any signs of protein-deficiency.

remember, having a single high tsh result doesn't automatically mean you have hypothyroidism. stress, illness, or even the time of day you took the test can affect your tsh levels. 

your doctor is doing the right thing by retesting in a month - this will provide more accurate results to confirm or rule out hypothyroidism. 

please continue to listen to your doctor and follow his advice, he/she knows your history and symptoms best."
N105,response_9,"a tsh (thyroid-stimulating hormone) level of 4.9 may or may not be considered high depending on the lab reference range used. most laboratories consider a range between 0.4 to 4.0 miu/l as normal, so 4.9 is slightly above the upper limit. however, it is not drastically high and is often referred to as ""subclinical hypothyroidism."" 

subclinical hypothyroidism can occur in people of any age, not just those over 50. many factors can cause it, including certain medications, medical conditions, or even mild autoimmune thyroid disease.

regarding your psoriasis, there is some research showing a link between psoriasis and thyroid disease. an autoimmune dysfunction could potentially affect both the skin and thyroid gland, although this is not well understood. however, methotrexate, which you are taking for psoriasis, is not commonly associated with hypothyroidism.

as for your diet, eating protein-rich food like chicken and eggs seems like enough protein intake. however, not eating green leafy vegetables can put you at risk for certain nutrient deficiencies. while this is not directly linked to thyroid function, a well-balanced diet contributes to overall health.

lastly, while sunlight has some impact on certain aspects of our health, it is not directly related to thyroid function. lack of sunlight can lead to vitamin d deficiency, which can indirectly affect many body systems, possibly including the immune system, but its influence on thyroid function specifically is not clear.

walking 2km a day is good, but depending on your activity level, you might need additional exercise. regular exercise can contribute to better overall health and well-being, and can potentially help with better regulation of your thyroid hormones.

please consult with your doctor about these matters, as they have a fuller understanding of your health."
N105,response_10,"tsh (thyroid stimulating hormone) is produced by the pituitary gland and stimulates the thyroid to produce and release thyroid hormones into the blood. a tsh level of 4.9 is slightly elevated, but still within the normal range according to most laboratories which interpret a normal tsh to be between 0.4 to 4.5/5.0 miu/l. high tsh levels may suggest an underactive thyroid (hypothyroidism), but this is usually confirmed with further testing of other thyroid hormones like t3 and t4. 

your doctor is correct in wanting to retest to confirm the results as there can be variability in these levels. tsh can increase with age, but it can also be elevated in younger individuals. there are many causes of hypothyroidism, including autoimmune diseases (like hashimoto's thyroiditis), certain medications, and iodine deficiency. some research suggests that there might be a link between psoriasis and thyroid disease, but it's still not well established.

your diet does not directly affect your tsh level. however, a balanced diet is essential for overall health. your doctor's advice about protein is likely geared toward general health, not specifically related to your tsh level. your indoor lifestyle with limited sunlight could contribute to vitamin d deficiency, which is not directly linked to tsh but is essential for different body functions and for the health of the skin, especially in psoriasis. 

keep up the walking everyday and continue to follow your doctor’s advice about diet and any further testing that might be required."
N105,response_11,"while it's true that thyroid problems are more common in older adults, they can also be seen in younger individuals. age doesn't necessarily protect you from this condition.

a tsh of 4.9 is slightly elevated, with the normal range typically being 0.5 to 4.5. this might indicate that your thyroid gland is working a bit harder than normal to produce thyroid hormone, which can sometimes be an early sign of hypothyroidism (underactive thyroid). however, it's not necessarily indicative of a problem, especially if you have no symptoms.

while psoriasis and hypothyroidism are both autoimmune diseases, it's not clear if having psoriasis increases your chance of developing thyroid problems. there's not much information suggesting a strong link, though some studies suggest an elevated risk.

generally, diet (like protein intake) and exercise have limited impact on your tsh levels. the thyroid gland is largely regulated by the brain (specifically, the pituitary gland) via tsh. however, significant changes in your diet or exercise routine can stress your body, potentially affecting hormone levels.

your lifestyle itself may not affect your thyroid function directly, but can potentially influence the type and severity of symptoms you experience. for example, lack of exercise may contribute to weight gain, which is a common sign of hypothyroidism.

it's good that you're following up with another test. keep in mind, though, that many doctors prefer to wait and see if minor elevations in tsh persist over time before starting medication, unless there are symptoms present.

regarding the protein, your doctor might be suggesting you need more protein for overall health rather than specifically for your thyroid health. while eating chicken daily provides good protein, a balanced diet that includes different food groups including green leafy veggies would also provide other necessary nutrients for your body. 

remember these insights are general in nature. always consult with your healthcare provider for personalized advice."
N105,response_12,"while it's true that thyroid disorders are more commonly diagnosed in older individuals, particularly post-menopausal women, they can actually occur at any age. the normal range for tsh (thyroid stimulating hormone) varies somewhat between labs, but typically a level of 4.9 would be considered on the upper end of normal or slightly elevated. 

it's important to note that an elevated tsh level indicates that your pituitary gland is working harder to stimulate your thyroid gland to produce thyroid hormone. this can sometimes be an early sign of hypothyroidism (an underactive thyroid gland), which might produce symptoms like fatigue, weight gain, depression, or dry skin.

however, tsh levels can also be transiently elevated for a number of reasons including illness, stress, or as a side effect of certain medications. hence the reason your doctor wants to retest before starting any treatment.

as for your question about protein, the amount you eat is not the only factor that determines whether you're getting adequate protein. the quality of protein you consume, your overall diet balance, your body's absorption capabilities, and your overall health status can all affect your protein levels.

as for psoriasis and indoor lifestyle, psoriasis is often associated with other autoimmune disorders, including thyroid diseases. meanwhile, lack of physical activity and lack of sun exposure (vitamin d plays role in immune function and health) could worsen both psoriasis and potential thyroid problems. 

so while these factors might be contributing to your overall health picture, they are not likely the direct cause of an elevated tsh level. 

remember, it's important to have these discussions with your healthcare provider, who can evaluate your symptoms and lab results in the context of your overall health status and devise an optimal treatment plan tailored to you."
N105,response_13,"your doctor seems to be taking the right approach by ordering a retest for your tsh levels, considering that it is slightly elevated from the normal range. a high tsh (thyroid stimulating hormone) level can be a sign of a condition called hypothyroidism, which is when your thyroid gland is not producing enough thyroid hormones.

while it's true that thyroid issues are common in older people, particularly women, they can happen at any age. besides age and gender, factors such as autoimmune diseases, certain medications, radiation therapy, pregnancy, or problems with the pituitary gland can cause hypothyroidism. in your case, the methotrexate for psoriasis might be affecting your tsh levels as it is known to can cause liver problems, and liver plays a role in the conversion of thyroid hormones.

as for your protein intake, it's not just about eating chicken and eggs. other factors such as the cooking method, portion size, and the way your body absorbs and uses protein all play a role. it's good that you're eating a variety of vegetables, but a well-balanced diet would ideally also include lean meats, dairy, whole grains, fruits, and healthy fats.

your indoor lifestyle could also be contributing to your health issues. lack of sunlight can lead to vitamin d deficiency, which has been linked to an increased risk of autoimmune diseases and may affect thyroid function. exercise also helps in regulating metabolism and improving overall health.

it's important to follow up with your test as advised, and if your levels remain high, your doctor may suggest treatment options for hypothyroidism. it's good that you're aware of your health and asking these questions, so keep in communication with your doctor about your concerns and symptoms."
N105,response_14,"tsh stands for thyroid stimulating hormone and is produced by your pituitary gland to stimulate your thyroid to produce thyroid hormones. a normal range for tsh in most laboratories is 0.4 milliunits per liter (mu/l) to 4.0 mu/l. so a value of 4.9 is slightly higher than normal.

an elevated tsh level indicates that your thyroid might not be producing enough thyroid hormones (a condition known as hypothyroidism). this condition is indeed more common in older individuals, but it is certainly not restricted to them. young adults, children, and even newborns can have hypothyroidism. 

symptoms of hypothyroidism can include fatigue, weight gain, dry skin, depression, constipation, and sensitivity to cold. if you are not experiencing these symptoms, your doctor might be inclined to monitor your tsh levels without initiating medication right away.

your doctor might want to perform further tests to confirm the diagnosis of hypothyroidism. these can include measuring your levels of t3 and t4 (the actual thyroid hormones).

it's highly unlikely that your elevated tsh level is due to psoriasis, your diet, or your indoor lifestyle. hypothyroidism is usually caused by an autoimmune disease (where your immune system mistakenly attacks your own body's cells). stress or other illnesses can also cause your pituitary gland to malfunction, leading to elevated tsh levels. 

your doctor would be the best person to guide your treatment based on your particular circumstances. in the meantime, try to maintain a balanced diet, regular exercise routine, and good sleep habits, as these are generally good for your overall health."
N105,response_15,"while it's true that thyroid disorders can often occur in older individuals, they can also occur in younger adults. a tsh (thyroid stimulating hormone) level of 4.9 might be considered slightly higher than the normal range in many labs (typically upper limit is between 4.0 or 4.5 miu/l), which is why your doctor suggested a retest. raised tsh levels could be an indicator of an underactive thyroid, or hypothyroidism, where the thyroid gland does not produce enough thyroid hormone. this can often explain symptoms like fatigue, depression, weight gain, and others, if you experience any.

it's difficult to pinpoint the exact causes of hypothyroidism, which could range from iodine deficiency, an autoimmune disease, certain medications, or damage/birth defects to the thyroid gland. psoriasis is an autoimmune disorder and sometimes patients with one autoimmune disorder may develop another, so there could be a possible link there. 

as for protein, your doctor is likely suggesting it due to its importance in normal bodily functions. high-quality protein could potentially aid your body in the repair and creation of new cells, essential to managing psoriasis. 

finally, sunlight (specifically, uv light) has beneficial effects on psoriasis in many patients, so lack of sunlight could potentially exacerbate psoriasis symptoms. however, it's a balance, because too much sunlight increases the risk for skin cancer.

it's recommended to continue consulting with your doctor about your concerns. they would be best equipped to advise you based on their knowledge of your situation."
