question_id,response_id,response
N187,response_14,"it sounds like you are finding it really hard to manage your daily life with so much sleep. i empathize with your situation. here are some suggestions that might be helpful:

1. seek professional consultation: it's best to discuss this with a health care provider as over-sleeping may have underlying reasons such as thyroid problems, sleep apnea, mental health disorders, oversedation from medications, or narcolepsy. given your other health issues, it might be wise to consult a specialist, such as a neurologist or a psychiatrist, who might be able to address multiple theories at once. 

2. smartphone apps: there are several smartphone apps such as alarmy (sleep if u can), wake n shake, or i can't wake up, that force you to do brain teasers or physical activities to turn off the alarm. 

3. seek support from someone: is there someone in your life who can help you wake up (like your partner) and take you to these appointments? many people find accountability helpful in forcing them to stick to a routine.

4. scheduling: try to schedule your appointments at the time of the day when you are most likely awake, or immediately after you usually wake up.

5. sleep hygiene: try to enforce a routine, wake up and go to bed at the same time every day. avoid screens before bedtime. 

6. food and drink: certain foods and drinks can help wake you up. spicy foods can get your blood pumping and may help you feel less tired. coffee or other caffeinated drinks are also possibilities in moderation.

7. physical activities: engage in moderate physical activity as it can help to reset your body clock. 

8. fight the urge to nap: the more you sleep during the day, the less tired you'll be at night, so it's important to fight the urge to nap during the day. 

communicating your struggle can be helpful with your doctors and therapists. they might be able to suggest how you can better manage this situation or even make special arrangements for you. it may be beneficial to keep a sleep diary to share with healthcare providers to show your commitment.

lastly, telemedicine appointments could help. since they can be done at home, there might be less pressure to be ""presentable,"" which could help in making those appointments. you need professional care and should not attempt to treat your conditions by yourself. it sounds like you're going through a tough time, but don't"
N187,response_15,"it must be really challenging dealing with all these issues. here are few suggestions:

1. switch up your schedule: try booking appointments at later times in the day if that's when your body tends to be awake. 
2. communication: make sure your healthcare providers understand that your sleep disorder and health conditions are the cause of your missed appointments, not a lack of care or commitment. write them a sincere letter or email to explain your conditions and your commitment to your treatment.
3. seek help: consider seeking help from a trusted friend or a family member to assist you in managing your appointments. they could try to wake you up or, if feasible, accompany you to your appointments.
4. lifestyle changes: try implementing lifestyle changes to help shift your sleep schedule, like light therapy (exposure to very bright light first thing upon waking), maintaining very strict sleeping and meal hours or consider talking to your doctor about temporarily using medications to adjust your sleep schedule.
5. sleep specialist: considering the severity of your sleep issues, it may be beneficial to consult a sleep specialist, if you haven't already. they have specialized knowledge and tools to analyze and treat sleep disorders. 
6. mental health professional: your mental health conditions (ptsd, anxiety, depression) might also be contributing to your sleep issues. you might benefit from consulting a psychologist or a psychiatrist who can help manage these conditions better.

remember these are only some general suggestions, it's important to consult your healthcare provider before changing or starting any treatments."
N187,response_16,"i'm really sorry to hear that you're experiencing this. it must be really challenging to manage your healthcare when you're experiencing sleep difficulties of this magnitude. here are some possibilities that might be worth considering:

1. plan for all-nighters: since your body seems to naturally go to sleep in the morning, one possible way to handle appointments is by planning for it and staying awake until the appointment time. this way, you might be able to get around your body's natural sleep cycle. however, this option is far from perfect, as it can make you feel tired and unwell.

2. rescheduling: perhaps it would be possible to reschedule your appointments to a time you know will work better with your natural sleep cycle. not every healthcare provider might be able to accommodate late afternoon or evening appointments, but you may have luck with some.

3. offer explanations: it's crucial that all those involved in your care—your doctors, therapists and other healthcare workers—are aware of your situation. they're the ones who can help you adjust your treatments as necessary.

4. seek sleep specialist: it may be useful to have your sleep disorder formally diagnosed and managed. you could consider seeing a sleep specialist who may be able to offer some treatments or strategies that could be helpful in regulating your sleep schedule.

5. follow good sleep hygiene: establish a regular sleep schedule, avoid caffeine and other stimulants, create a calming sleep environment (dark, quiet, cool), limit daytime naps, regular physical activity, etc.

6. adjust medication times: consult your doctor if adjusting medication times can help. some medications can cause sleep disturbances.

remember these are just suggestions that may work for some people. it also doesn't substitute for advice from a healthcare professional. with the severity of your sleep issues and other health complexities, you really should be under the care of a professional."
N187,response_17,"i'm really sorry to hear that you're having this difficulty. sleep disorders can have so many factors at play and your situation is complicated by your other health conditions. it's really great that you're so determined to get to the bottom of this and i hope i can help you out with some advice.

1. be open about your problem: you should communicate your problem of excessive sleepiness and missed appointments proactively to your healthcare providers. this open communication could lead to better understanding and maybe even some tailored solutions.

2. ask for a later appointment: if available, maybe making appointments in late afternoon or evening when you're most likely to be awake could help.

3. maintain a strict schedule: try to maintain a rigid routine. try to go to bed and wake up at the same time every day even if you do not feel sleepy. this could help reset your biological clock.

4. decrease stimuli before bed: avoid bright lights, loud sounds, work, heavy meals etc. close to bedtime. also, limit consumption of caffeine and alcohol.

5. seek help from those around you: maybe your partner or a family member can be instructed to wake you up early and help you to stay awake until the appointment. 

6.use other aids: there are a variety of alarm apps available that require you to perform certain tasks before it stops ringing. 

7. document your sleep patterns: keeping a sleep diary documenting when you're going to sleep, for how long, and how you feel upon waking up etc. would be very useful. this not only highlights you're proactive regarding your care, but it can also provide valuable information for your clinician regarding your problem.

however, with your current medications, it's important that you discuss your excessive sleepiness with your healthcare provider and whether it could be a side effect. this should take precedence over self-management, as modifying doses or the medicines themselves could resolve much of your issue. 

do get in contact with a sleep specialist for a thorough assessment. a sleep study or polysomnography might be considered to better understand your sleep pattern and what might be causing the excessive sleeping.

remember, it's really important to have a professional opinion about your sleep problems. your health conditions and the medications you take require careful monitoring and adjusting, which can't be done properly without medical guidance."
N187,response_18,"your predicament sounds challenging, but don't lose hope. here are some possible avenues that could help improve your situation:

1. try to schedule your appointments in sync with your sleep schedule: if you tend to be awake at night, see if any healthcare providers or facilities in your area offer late-night or 24-hour services. telemedicine appointments might be a possible avenue if in-person late-night appointments are not available.

2. maintain a sleep diary: document your sleep patterns and habits for a couple of weeks. this record can help your doctor better understand the extent of your problem.
   
3. seek a specialized doctor: if you are not already seeing one, consult a sleep specialist or neurologist who can help you manage your sleeping disorder.

4. medications: discuss with your doctor if any medication could help in sleep regulation

5. improve sleep hygiene: good sleep hygiene habits can set the foundation for better sleep. this includes maintaining a regular sleep schedule, limiting exposure to screens before bedtime, avoiding caffeinated drinks, and more.

6. therapies such as cognitive behavioral therapy (cbt) have been shown effective for many individuals facing sleep issues. reach out to a professional who offers cbt for insomnia.

remember, your health providers have the same goal as you: to see your health improved. being transparent to them about the difficulties you're facing with managing your appointments and regimen might help them understand your situation better. 

good luck with everything, and remember that it's crucial to seek professional help as soon as possible."
N187,response_19,"i'm an ai language model who can't substitute for the expertise of a medical professional but here are few suggestions you may consider:

1. schedule appointments later in the afternoon or evening: you could request that your appointments be set for later in the day, closer to when you typically wake up, which would reduce the chances of you oversleeping and missing them.

2. commit to a regular sleep schedule: it might be difficult because of your sleep issues, but trying to maintain a regular sleep schedule could help regulate your sleeping habits over time. this could involve waking up and going to bed at the same time every day, even on weekends, to train your body to follow a consistent sleep schedule.

3. seek support: you may want to consider asking family members or friends for assistance in ensuring that you wake up in time for your appointments. you can also leverage technology, such as setting multiple alarms or using apps which are designed to wake up heavy sleepers.

4. seek treatment for your sleep issues: you need to speak to your healthcare provider about your sleep problems, as they may be related to your other medical conditions or the medication you’re taking. treating your irregular sleep could significantly improve other aspects of your health as well.

5. document sincerity: if you've documented instances where you've tried to make appointments but had difficulty due to your sleep pattern, and keep notes on everything you're doing to manage your condition(s), it could help show that you're committed to improving your health.

remember, you should always get professional advice from healthcare providers regarding your specific circumstances."
N187,response_20,"it's clear you're dealing with significant health challenges. here are few things that might help:

1. try to schedule appointments for your most alert times whenever possible. 
2. ask a trusted friend or family member to help you maintain your schedule, especially when it comes to attending important medical appointments.
3. discuss your sleep schedule with your healthcare provider. they might be able to adjust your medication timing, or refer you to a sleep specialist who can further examine your sleep disorder.
4. consider an in-home healthcare professional, if you can afford it. this can mitigate the problem of missed appointments.
5.first thing to suggest run you through a sleep study to determine whether there's a physical reason for your extended sleep.
6. keep a sleep diary recording your sleeping and waking times, and share this with your doctor to illustrate the nature and extent of your problem.
7. remain as active as possible during your awake periods, as physical activity promotes healthier sleep-wake cycles.
8. seek counselling/therapy that specializes in insomnia or other sleep disorders.
9. consult with a dietician to see if there might be dietary changes that could improve your energy levels.
10. carry a bottle of water with you at all times for hydration.
11. you could also try electronic reminders (through a smartphone or similar device) to help manage your schedule

one final important note: your health and wellbeing come first. if a certain treatment plan isn't working, don't be afraid to speak up about it. you're not obligated to stick with a program that isn't helping you."
N187,response_21,"your situation sounds very challenging and i can understand how it may caused stress and frustration. here are few steps that might help:

1. communication: first and foremost, ensure that your healthcare providers are aware of your sleep disorder, and its impact on your ability to attend appointments. this is not an excuse but a real health issue that can hinder your care if not addressed.

2. schedule wisely: if possible, arrange for appointments at times when you are most likely to be awake. this may involve a compromise with your healthcare providers as it might be outside of normal working hours.

3. support network: enlist help from family or friends to assist your efforts. they could help with reminders and even waking you up for appointments.

4. sleep hygiene: practices like regular exercise, eating healthy, avoiding excessive use of caffeine, nicotine, and alcohol and setting a consistent sleep/wake time can help regulate your sleep-wake cycle. 

5. consult a sleep specialist: if you haven't already, consider seeking a consultation with a sleep specialist. they could provide a more specific diagnosis, which might help guide treatment more effectively. 

6. daylight exposure: try getting early morning exposure to natural light and avoiding bright lights in the evening to help regulate your body's clock.

7. telehealth: check if telehealth is an option for your appointments. that way, you could be seen from your own home and it might not require such a strict adherence to ""awake"" times.

8. write a letter: explain your willingness and commitment to care, but also express the challenges you are experiencing due to your sleep disorder.

9. seek a second opinion: if your primary care physician is not helpful, consider seeing another doctor. finding the right provider who understands your unique situation can make a difference.

10. professional note: if you have a sleep specialist, request a note from them to address the issue with your other healthcare providers.

the key is to persevere, keep communicating, and actively work towards a solution with your healthcare team. don't lose hope, many have overcome challenging situations like yours."
N187,response_22,"i'm not a doctor, but here are some strategies you can try, but please discuss them with a healthcare professional:

1. scheduling appointments: try to coordinate with your healthcare office to have evening appointments or the last appointment of the day. if possible, have a family member or friend help you get ready and take you to your appointments. 

2. improve sleep hygiene: try to establish a consistent sleep schedule by going to bed and waking up at the same time each day. avoid caffeine and nicotine, especially close to bedtime. try to limit the usage of screens before bed. maintain a dark, quiet, and cool sleep environment.

3. medications: some of your medications like oxcarbazepine can cause drowsiness. discuss your medications with your prescribing doctor if they can adjust your medications' doses or timing to help improve your alertness during the day. you may also discuss if any sleep aides could be beneficial.

4. psychotherapy: cognitive behavioral therapy (cbt) has been shown to be effective for various sleep disorders. seeing a mental health professional who specializes in sleep disorders can be beneficial.

5. evidence of compliance: if you're worried about being labeled non-compliant, discuss this concern with your healthcare providers. ask them for any suggestions they might have on how to demonstrate your commitment to your care. 

once again, please talk to your doctor about these suggestions. it's important to remember that i can't offer medical advice and that in-person consultation with a healthcare provider is always the best course of action."
N187,response_23,"i'm really sorry to hear about your struggles with sleep - it sounds like quite a difficult circumstance to navigate, particularly with already having medical conditions requiring appointments. here are a few suggestions, however i do urge you to discuss these with your doctors to ensure they are fitting for your specific needs:

1. reschedule appointments: if possible, see if you can schedule appointments for times when you typically are awake. for example, if you tend to wake up in late afternoon or evening, try to get appointments scheduled for this time.

2. sleep study: the issues you're having are significant, and you could potentially benefit from a sleep study. sleep studies can often identify the cause of abnormal sleep patterns and provide strategical measures for improving it.

3. adjustments to medications: it may be possible that one or more of your medications are contributing to your excessive sleepiness. discuss this with your doctors. they might be able to adjust dosages or switch you to a different medication that doesn't produce this side effect.

4. seek a caregiver: if you're not already working with a caregiver, consider finding one who can help to ensure you meet your appointments and help manage your medications.

5. plan ahead: if you frequently sleep through alarm clocks, try setting multiple alarms with different tones to see if that helps. if possible, you can ask someone you trust to call or visit you to ensure you wake up for important appointments.

6. documentation: make sure to keep a sleep diary documenting your sleeping patterns as well as how it affects your functioning and mood. this will be helpful in your discussions with your healthcare provider and to show your good faith efforts in managing your health conditions.

in terms of showing your intention, clear and open communication with your healthcare provider is key. explain your situation, show them the steps you are taking to better manage your sleep issues and be upfront about your concerns about being labeled as non-compliant. they should be willing to work with you to find suitable solutions to ensure you're receiving necessary care. 

please prioritize discussing this with your healthcare providers - this is an internet-based assistance and may not have considered all aspects of your personal circumstances."
N187,response_24,"your situation sounds very frustrating and i understand how this could negatively affect you, especially mentally. your sleep issues are quite severe and should be addressed by a professional. here's some advice regarding your questions, but remember i'm an ai and can't replace professional help.

1. you may want to consider scheduling appointments during times when you're typically awake. i know this can be hard due to business hours but it might be worth a try.

2. find a trusted person who can help wake you up and take you to appointments. is there a family member, friend, or partner who would be able to help out in this way?

3. go through a thorough sleep assessment with a sleep specialist. conditions like obstructive sleep apnea and idiopathic hypersomnia can cause excessive daytime sleepiness and/or sleeping for long periods of time, and are manageable with the right treatment.

4. consider the possibility that your medications are contributing to your sleep issues. oxcarbazepine and clonazepam both have sedation as a common side effect. 

5. write a letter or email to your healthcare providers explaining your situation in detail. let them know you're actively trying to resolve these sleep problems, and ask for flexibility and understanding as you work it out.

6. keep a sleep diary. note when you fall asleep and wake up, how easily you fall asleep, your quality of sleep, and anything else that might be related to your sleep (like caffeine, nicotine, and cannabis use). this can potentially provide valuable evidence for your healthcare providers. 

remember, you're dealing with a difficult situation and it's okay to ask for help and understanding. it’s also important to continue your therapy and other treatments, even if you are experiencing severe sleep issues. try to create a consistent sleep routine, avoid caffeine and nicotine before bedtime, and consider seeking help to manage your substance use, if it’s contributing to your sleep issues."
N187,response_25,"sorry to hear about your struggles. i am a language model ai and i can't offer medical solutions but here are a few suggestions that may help:

1. communication: it is crucial to maintain ongoing, open, and candid communication with your healthcare providers. inform them about your struggles with attending appointments due to your sleep issues. they may be able to offer a solution or adjust the appointment timings.

2. ask for the last appointment of the day: considering that most of your active hours happen during the night, it may be more practical to request the last available appointment slot in the day.

3. virtual appointments: consider asking your healthcare providers if they offer telemedicine services. virtual appointments can generally be scheduled outside of traditional office hours, and would not require you to physically travel to the clinic.

4. seek support: if possible, enlist the help of a friend, family member, or caregiver who can help ensure that you wake up and get to your appointments.

5. use multiple alarm systems: use more than one alarm tool (phone alarms, alarm clocks, watches, etc.) and place them in different parts of your living space to help you wake up.

6. sleep disorder therapy: consult with a sleep specialist to discuss therapy and treatments for your sleep issues. this could include cognitive behavioral therapy, medications, sleep hygiene improvements, or light therapy.

7. documentation: if possible, keep a sleep log or diary documenting your sleep patterns, length and quality of sleep, and any disturbances. this can be shared with your healthcare providers to help them understand your condition better.

remember, it's important not to try and self-diagnose or self-treat your condition, but rather to work closely with your healthcare providers. they understand that your situation is unique and will try to tailor their approach to best help you."
