question_id,response_id,response
N13,response_23,"i am sorry to hear about your situation and it's brave of you to seek help for this.

firstly, there are several organisations in australia that offer free or low-cost dental care, which you could contact. such organisations include the australian dental health foundation and the royal flying doctor service. community health centres also may provide dental care at reduced cost.

you could also apply for the public dental system, financed by medicare. however, the waiting lists can be long and the options limited.

if you can't afford these services, you could potentially enter a dental school. student dentists are eager to practice, and the service will be provided at a low or no cost.

as far as the process of going to a dentist is concerned, don't be afraid to ask about the procedure and costs involved before making an appointment. 

here's generally how it works:

1. **find a dentist:** look for dentists in your area and read reviews to find one that suits you.

2. **book an appointment:** make a phone call to the clinic or book online. explain your situation to them and ask about their pricing. some dentists might have a sliding scale based on income or instalment plans.

3. **the appointment:** the first appointment will usually consist of a thorough oral exam, including x-ray to assess your dental health.

4. **treatment plan:** based on the exam, the dentist will then discuss a treatment plan with you. it will include various available treatment options, costs and time required for each one, and you can decide the best one for you based on these factors.

5. **payment:** you have to discuss this beforehand. many clinics have flexible payment options and accept medicare. 

far above everything else, do not hesitate to ask questions until you clearly understand each part of the process and the associated costs.

remember, knowledge is power. the more you know, the more you can make informed decisions about your dental health. take one step at a time. hope this helps!"
N13,response_24,"i’m really sorry to hear about your situation. dental care is incredibly important, and it’s not too late for you to start looking after your oral health. here are some steps and advice for your dental care:

1. find a community health centre: you may be eligible for free or low-cost dental care through a community dental clinic. you can search for a community health centre near you on the health direct australia website.

2. government health care card: if you have a health care card from the government, you may qualify for public dental services, although waiting lists can be long.

3. dental schools: contact dental schools as they sometimes offer reduced cost treatments provided by dental students under supervision. for example, the university of melbourne and the university of sydney both offer dental clinics.

4. payment plans: some private dentists offer payment plans, where you can pay for your dental treatment in instalments. you could discuss this when you make an appointment.

5. the process: generally, when you see a dentist for the first time they will do a dental check up. this usually includes a thorough examination of your teeth, gums and mouth, and possibly x-rays. they will then discuss any problems they find and treatment options. they should also discuss costs before proceeding with treatment, so don't hesitate to ask about the price before committing to anything.

6. insurance: consider getting a basic private health insurance policy that covers dental treatment, but be aware of waiting periods before claims. also, some insurance policies cooperate with specific dental clinics to provide cheaper services.

7. look after your teeth: prevention is better than cure. brush your teeth twice a day, floss at least once a day and limit sugar intake. it might also be worth investing in a good quality toothbrush.

remember, everyone deserves to have a healthy mouth and to feel good about their smile. it's not too late to start taking care of your dental health, it's worth it. best of luck!"
N13,response_25,"i'm really sorry to hear about your challenging circumstances. don't worry, it's great that you're taking measures now to address your dental health. in australia, there are several financial schemes and options that can help you access dental care.

1. public dental services: you could access government-funded dental services in your local area depending on your financial situation and eligibility. this varies by state, so check the health department in your state for details. most of these services address the immediate dental issues first before going for the cosmetic corrections. there might be a waiting period.

2. health care card/pensioner concession card: if you have a low income and hold one of these cards, you might become eligible for reduced-cost or free public dental care services depending upon your state’s policies. 

3. dental schools: some universities and dental schools provide dental treatments at reduced prices as part of student training. the services are supervised by experienced dentists. check with dental schools near your location.

4. medicare's child dental benefits schedule (cdbs): if you have children, they may be eligible to receive up to $1,000 over 2 calendar years for basic dental services.

in terms of your questions about visiting a dentist, usually, you make an appointment, and on your first visit, they will do a complete oral examination. this includes assessing your teeth, gums, jaw, and overall oral health. from there, the dentist will work out a treatment plan based on the urgency of your condition.

be upfront about your financial situation and ask for all costs upfront so there are no surprises. some dentists offer ""pay as you go"" arrangements so you can spread out the cost of your treatments. also, you'll often find dentists are understanding and compassionate. 

remember, taking care of your teeth now can prevent major costs down the line. don't be disheartened, there are options out there for you and professionals willing to help. good luck!"
