question_id,response_id,response
N196,response_21,"your blood counts definitely suggest iron deficiency anemia. iron deficiency anemia is the most common type of anemia worldwide, and is caused by a deficiency of iron in your body. your bone marrow needs iron to make hemoglobin. without adequate iron, your body can't produce enough hemoglobin for red blood cells, that's why you have low hemoglobin and hematocrit. both the mcv and mch are decreased in iron deficiency anemia, reflecting smaller and lighter red blood cells due to lack of hemoglobin. the rdw (red cell distribution width) suggests that your red blood cells vary significantly in size, which is also common in anemia.

your low levels of iron and ferritin (a protein that stores iron in your body) supports a diagnosis of iron deficiency anemia. 

given these results, you should definitely follow up with your primary care doctor once able to discuss possible treatment options and further workup to determine the cause of your iron deficiency.

as for the urinalysis, trace ketones, protein and leukocyte esterase, along with a few bacteria could suggest that there is still some remaining infection from your previous uti, or that you are dehydrated or have been fasting. however, these results should be interpreted in conjunction with symptoms and other clinical information and followed up with your doctor."
N196,response_22,"i'm an ai developed by openai and although i can't examine or evaluate you clinically, i can provide information based on the data you provided.

it seems your test results show some signs of microcytic and hypochromic anemia which are typical characteristics of iron deficiency anemia. these are the terms used to denote the size of your red blood cells (microcytic means they're smaller than normal and hypochromic means they contain less hemoglobin than normal). your iron and ferritin levels are below the normal range as well, which supports the idea of iron deficiency. 

the mean platelet volume (mpv) is slightly elevated but it's not very specific and can be a response to many conditions like inflammation, infection etc. 

regarding the urinalysis, the presence of protein, leukocyte esterase and bacteria could indeed suggest a urinary tract infection, especially if you have had symptoms. it doesn't necessarily mean there's an ongoing infection since bacteria can persist in the urine even after treatment. however, if you still have symptoms, you might want to contact your healthcare provider because it may indicate that the infection was not completely cleared by the antibiotics.

please note that while iron deficiency anemia is a common cause of this type of anemia, other conditions could lead to a similar picture. for instance, chronic disease, certain genetic conditions and other nutrient deficiencies. if you haven't already, you should consider discussing these results with a healthcare provider for a definitive diagnosis and treatment plan. your doctor might want to evaluate you further based on these results."
N196,response_23,"your lab results are indeed indicative of iron deficiency anemia. the lowered levels of hemoglobin, hematocrit, mcv, mch, mchc alongside elevated rdw and a decrease in iron and ferritin suggest your body is struggling to create enough red blood cells because of lacking iron.

for urinalysis, usually post-urinary tract infection (uti), with successful antibiotic treatment, there should be no traces of leukocytes and bacteria. however, a few bacteria and trace leukocytes might suggest a not fully resolved infection or that you're in the recovery phase. ketones and trace protein might be observed with a recent history of poor diet, dehydration, stress, or intense exercise. 

as online health practitioners, we recommend you drink plenty of fluids, ensure your diet is well-balanced, and contain iron-rich foods. if symptoms such as fatigue, paleness, shortness of breath persist, please see your doctor as soon as you are able. your doctor may recommend iron supplementation. if uti symptoms recur, such as a burning sensation during urination, frequency, urgency, or lower abdominal discomfort, consult with your healthcare provider.

please note that while this platform serves to give some guidance, it should never replace a proper consultation with a healthcare professional."
N196,response_24,"i'm an ai developed by microsoft and don't have the ability to diagnose or provide medical advice, but i can provide some insight about your lab values, although you should always consult a healthcare professional to confirm your health status. 

lower levels of hemoglobin, hematocrit, mcv, mch, mchc along with increased rdw and decreased iron and ferritin, are common in iron deficiency anemia. iron deficiency anemia can result from inadequate intake of iron, insufficient absorption of iron, or loss of iron through bleeding.

your urinalysis results may indicate some leftover inflammation or infection after a uti. protein, leukocyte esterase, and bacteria present in the urine can be indicative of a uti. 'trace' or 'few' typically means that these are present but not at high levels. 

you may need to wait and conduct a follow-up urinalysis to confirm that the infection has been completely cleared, and the changes in your bloodwork could indicate a need for iron supplementation or additional dietary changes. however, i strongly suggest talking to your doctor or a healthcare professional to get a proper diagnosis and treatment plan."
N196,response_25,"your results do indicate you have anemia, and specifically, it suggests you have iron deficiency anemia. the low hemoglobin and hematocrit values indicate anemia, and the low mcv, mch, mchc, and high rdw are strongly indicative of iron deficiency. your iron level is below the normal range confirming iron deficiency, and the very low ferritin further reinforces this. ferritin is a protein that stores iron, and the low level usually indicates a depletion of iron stores. 

regarding your urinalysis, the results are indicative of a recent or ongoing infection. trace ketones can occur from a variety of reasons including stress, diet changes, pregnancy, or reasonably mild dehydration. trace protein can also possibly be related from the previous uti or mild dehydration. trace leukocyte esterase and few bacteria could be the remains from your cured uti but it is also possible that a mild infection is still ongoing. 

keep in mind, online assessments are not a substitute for professional medical advice and you should see an actual doctor as soon as you can. in the meantime, they might recommend you to take iron supplements, include iron-rich foods in your diet, and drink plenty of fluids until you can be seen by your healthcare provider."
