question_id,response_id,response
N55,response_1,"these symptoms could indicate nerve damage or irritation, a change in the condition of your brachial plexus injury, or possibly another health issue. muscle twitching and feelings of vibration can sometimes occur when nerves are regenerating or healing, but they can also be a sign of ongoing damage or disease. burning sensations are often associated with nerve pain. 

however, it's also possible these symptoms are unrelated to your brachial plexus injury, and could be due to something else entirely, such as anxiety or a nutritional deficiency. it's definitely something you should have checked out by a medical professional, especially if the symptoms are severe or causing you distress. they should be able to investigate further, offer a diagnosis, and suggest an appropriate treatment plan. 

this doesn't mean the symptoms are necessarily anything harmful, but it's always better to get them checked out, just in case."
N55,response_2,"it's hard to say without a medical evaluation, but the symptoms you're describing could be related to nerve damage or irritation. sometimes when nerves are healing, they can cause unusual sensations, such as burning, twitching, or spasms. however, these symptoms can also be a sign of ongoing nerve damage or potentially other underlying health issues. it's definitely important to discuss them with your doctor, who can help determine the right course of action. it's also important that if the pain becomes unbearable, you should seek immediate medical attention."
N55,response_3,"i'm really sorry to hear about your ongoing discomfort. although i'm just an ai, i can give you a general understanding on the issue. from your description, it seems that issues related to nerve regeneration after a surgery might occur. the burning sensation could be a sign of nerve irritation or inflammation (neuritis) or neuropathic pain. as for muscle twitching or pulsing, it might be due to muscle or nerve fiber overexcitation. the unusual movement connections (like your index finger and chest interaction) could be due to the manner in which nerve pathways were repaired or reconstructed. 

however, keep in mind that it's just a general explanation and not a diagnosis. it would be really important for you to have a discussion with a neurologist or the surgeon who performed your surgery for a more accurate diagnosis and proper treatment."
N55,response_4,"i'm an ai, but from what you're saying, it's possible that what you're experiencing are symptoms of nerve irritation or damage. it could possibly be related to your previous injury, or it could be something new. the burning sensation, for example, is often associated with nerve pain, and the muscle twitching could be caused by nerve impulses. 

the movement you're noticing could potentially be due to signals being sent down the wrong nerve path because of your previous injury - though it's only a guess. it's important that you seek medical attention, however. your doctor will likely want to review your symptoms and history and may recommend testing to determine what's happening. new or worsening symptoms can potentially indicate changes in your condition, and this should always be evaluated by a healthcare professional. please do not hesitate to seek medical attention."
N55,response_5,"it is difficult to say definitively without examination, but the sensations you're experiencing could be related to your brachial plexus injury. nerve damage can result in an array of strange sensations, including pain, burning, and twitching. in some cases, nerves can regenerate and heal over time, which can cause changes or improvements in symptoms. however, nerve regeneration is a complex and slow process.

it's worth discussing these new symptoms with your doctor. they may be able to recommend therapies, pain management strategies, or even additional surgeries to help improve your quality of life and function.

muscle twitches/pulsing and the feeling of certain muscles vibrating could be due to nerve misfires due to the injury/surgery. the unusual movement synchronicity between your index finger and your breast could also be the result of this. the brachial plexus innervates a lot of muscles in the upper body, so it's possible that there might be some cross-talk.

however, changes or worsening in these symptoms could potentially indicate a negative development such as progressive nerve damage, infection, or complications from the previous surgery. also, some might be due to muscle fatigue or overuse, especially if you've recently been using the affected arm/hand more or differently than usual.

so it is definitely a good idea to discuss these changes with your doctor to exclude those negative possibilities and to check if there's some kind of functional recovery going on that could be enhanced through specific therapies."
N55,response_6,"it's really important to discuss these changes and symptoms with a healthcare provider familiar with your medical history. with your past injury and surgery, they would be best positioned to understand the cause of these new sensations you're experiencing. while it's hard to say what could be causing these symptoms without a medical evaluation, it's possible that it may have to do with changes in the condition of your nerves or muscles. for example, the burning pain could be a sign of nerve damage or irritation, while the twitching might be a sign of changes in your muscle function.

the synchronised movement of different body parts (e.g., a finger and chest muscle moving together) suggests some sort of cross-talk or abnormal communication between the nerves that control different muscles. this could be due to the original brachial plexus injury or the subsequent surgery.

however, whether they indicate some form of recovery or worsening can only be determined by a healthcare professional through a physical exam and possibly imaging or electrical studies. follow up appointment with a pain specialist, physical therapist, or a neurologist might be beneficial if you are currently not under the care of these specialists. 

and once again, it's strongly recommended that you see your doctor to discuss these symptoms as soon as possible."
N55,response_7,"i'm an ai and not a doctor, but based on the information available it appears that these new symptoms you are experiencing could be a result of nerve irritation or damage relating to your initial injury. changes in nerve function could explain the variations in movement and new sensations you are experiencing. however, it's important to remember that even if the symptoms seem manageable, they may indicate an underlying issue that requires evaluation. it could be an increased nerve sensitivity or newly damaged nerves. however, this might not necessarily be a good thing. it's recommended that you seek advice from a healthcare professional for a formal diagnosis and advice about what to do next."
N55,response_8,"it is hard to say without a proper, in-person evaluation by a specialist. however, let's consider the possibilities:

firstly, the presence of burning sensation and muscle twitching could be due to nerve irritation or neuropathy. the nerves that were surgically corrected when you were a baby may have developed new issues or complications. this could indicate either nerve damage or nerve regeneration. while nerve regeneration might sound good on the surface, it can actually be quite painful, and the process can cause strange sensations such as twitches or ""zingers"" like you've described.

secondly, the coordinated movement of your breast and finger might be due to reinnervation of the muscles: when the nerve fibers regrow, sometimes they can connect in ways that cause linked or uncontrolled movement. this is generally a process that takes place over a long period of time, though.

given that these symptoms started recently and that you've had a nerve injury, it's really important to see your doctor or a nerve specialist as soon as possible. your symptoms warrant further investigation, which may include physical examination, imaging studies (like an mri or ultrasound), and potentially nerve conduction studies or an emg.

again, please make sure you contact your healthcare provider or a nerve specialist promptly to discuss your symptoms and concerns."
N55,response_9,"it sounds like you are dealing with a complex medical history, and the symptoms you are experiencing could relate to your previous nerve injuries or other neurological issues. the burning sensation, twitching, and odd muscle responses (like your breast moving when you move your finger) could be due to nerve miscommunications, where signals sent along the nerves aren't getting to their intended location correctly or are being sent ""cross-wires"". this can sometimes happen after nerve repair surgeries, as the nerves may not be able to grow back perfectly.

these symptoms could also be signs of nerve irritation or damage worsening, but it's equally possible that they're simply new quirks of your unique nervous system setup. they aren't necessarily good or bad - more just informative. they help paint a picture of what's going on with your nerves and muscles.

however, the severity of the burning pain you're experiencing is concerning, as severe pain usually signifies something problematic. this could be something like neuropathic pain, where the nerves misfire and send pain signals when they shouldn't.

you should definitely consult with your physician or a neurologist about these symptoms. they can evaluate you and possibly recommend treatments to help manage your symptoms, like medications for nerve pain. they may also want to conduct testing, like nerve conduction studies, to investigate what's happening with your nerves."
N55,response_10,"i'm an ai language model, not a doctor, but i can tell you that severe burning or new pulsing sensations may indicate possible nerve impingement or nerve regeneration. since these symptoms have started recently, you should see a neurologist or a specialist dealing with brachial plexus injuries to better understand what's happening. though unusual sensations might sometimes reflect nerve healing or regeneration, they can also indicate a problem, so it's important to get examined by a professional. regarding the movement in your chest when you move your index finger, it's possible that this could be due to nerve pathways that were affected during your surgery. please consult a healthcare professional for a diagnosis. please note that my advice should not replace a consultation with a healthcare professional."
N55,response_11,"i'm really sorry to hear about your discomfort. nerve pain, muscle twitching and the other symptoms you described could be a sign of nerve irritation or damage, which might be related to your underlying brachial plexus injury. it could potentially be due to scarring and adhesions around the surgical site, neurological changes, or it might be unrelated and due to some other cause. it's difficult to say whether these changes could be good or bad without examining you directly. you should definitely get evaluated by your doctor or a neurologist to get a proper assessment. they may suggest treatments like physical therapy, medications, nerve stimulation techniques, or even additional surgery, depending on the cause of your symptoms. no worries, help is available. make sure you make an appointment with a healthcare professional as soon as possible."
N55,response_12,"based on your symptoms, it's essential to contact your healthcare provider. pain, twitching, pulsing, and increased difficulty with movement may suggest that something is not right. it's certainly possible that these could be signs of some regeneration or change in the nerve pathways, but they could also suggest further complication, such as neuropathic pain or nerve inflammation. these symptoms could also potentially be caused by muscle strain or spasm, due to overuse or inappropriate use of other muscles trying to compensate for the ones affected by the brachial plexus injury.

keep in mind, i'm an ai language model and can't diagnose your symptoms. it's always crucial to speak with a healthcare professional when dealing with these kinds of symptoms."
N55,response_13,"i'm sorry to hear you're experiencing these symptoms. these sensations could be due to further nerve damage or nerve inflammation from your brachial plexus injury. however, it's also possible that this could be a sign of your nerves creating new connections.

it's important to note that without a physical examination, it's impossible to make a definitive conclusion. therefore, it's highly recommended you contact your doctor or a neurologist to discuss these new symptoms. they can evaluate and possibly conduct an electromyogram (emg) test or other diagnostic procedures to better understand what's happening. please, ensure you get medical advice."
N55,response_14,"while it's hard to say with certainty, the symptoms you're describing (severe burning, muscle twitching/pulsing) can be indicative of nerve irritation or dysfunction. it's worth noting that these symptoms could be related to your previous brachial plexus injury. however, they can also be signs of other neurological disorders or conditions. it's important to seek medical attention for your symptoms. your doctor may wish to perform some tests to determine the cause of your symptoms and to rule out potentially serious conditions. pain in the arm and twitching in a distant part could possibly indicate impinged or irritated nerves elsewhere in your body as well, for example in your neck. 

remember, any time you experience a significant change in your symptoms or develop new symptoms, it’s a good idea to reach out to a healthcare provider. they have the knowledge and tools to help you understand what’s happening and to devise a treatment plan that’s best for you. 

in terms of whether these changes could be a good sign - it's possible that these could be signs of some regeneration or re-innervation of nerves, but this is rarely associated with discomfort or pain. however, any changes should be evaluated by a healthcare provider."
N55,response_15,"i'm sorry to hear you're experiencing these symptoms; they might be frustrating and concerning. pain or burning sensations as well as muscle twitching could be signs of nerve irritation or damage. when you say you're hoping these symptoms might be ""good,"" it's unclear what you mean. if you're hoping these are signs of healing or regeneration, it's difficult to say without evaluating you directly. 

it might be possible that these sensations might represent some kind of neural activity. however, they could just as likely represent further nerve irritation or injury. it's also important to note that the brain and nervous system can sometimes produce strange sensations or behaviors in response to long-term damage or injury.

the connection between your index finger and chest is noticeable, the nervous system is quite complex and sometimes nerve damage can result in unexpected or unusual connections. 

it's crucial you see a medical professional who can examine you and perhaps conduct tests to learn more about what's happening in your body. depending on the severity of your symptoms and their impact on your daily life, they may also be able to offer treatments to help manage these symptoms. 

again, i strongly recommend you speak with your doctor soon about these issues. they could offer you the most helpful and personalized advice.  

i'm a virtual medical professional specialized in general medical information but i can't replace a personal medical consultation."
N55,response_16,"i'm an ai language model, not a doctor, but i can tell you generally that sensations of nerve pain (like burning) and muscle twitching can be signs that nerves are trying to heal or regenerate, although it is not guaranteed. as the nerves recover there may peripheral nerve stimulation that can result in twitching. but if the symptoms are bothering you or getting worse, it strongly suggested seeing your doctor for a re-evaluation.

they can be however signs of nerve irritability which could be signs of ongoing damage or compression. an evaluation by your neurologist/neurosurgeon or physical medicine and rehabilitation physician would be important to do. following an evaluation, further diagnostic studies like an emg (electromyography) or ncs (nerve conduction studies) might give better insight into the health of your nerves. you should also look into additional rehabilitation therapy, if you haven't yet, as it can often assist in recovery from injuries like yours. 

remember, it's important to consult with a healthcare professional who can evaluate you in person and take into account your medical history and current health status. prescription medications and therapies are sometimes used to manage symptoms."
N55,response_17,"i'm not a doctor, but these changes could potentially signify some sort of shift in your neurological condition. you should definitely consult with a neurologist or a doctor who specializes in brachial plexus injuries. these changes can indicate a variety of things, such as neuropathy, irritation or inflammation of the nerves. exercise might help to reduce these symptoms, but you should not undertake any new exercises without approval from a professional. please seek medical help and keep track of these changes to your body."
N55,response_18,"the symptoms you describe - burning, muscle twitching/pulsing, and unusual muscle movements - are generally considered signs of nerve irritation or dysfunction. they're not typically associated with positive outcomes in terms of nerve recovery or regeneration. 

however, they might indicate some changes in the nerve or muscle functioning around your brachial plexus injury. considering that you had your surgery when you were just a baby, it's hard to predict what could happen over time as your body continues to adapt to the injury.

it's important to discuss these new symptoms with your healthcare provider. they might need to modify your current treatment plan or refer you to a specialist to manage the discomfort and to evaluate these new symptoms. it's possible they might recommend further tests, like an emg/nerve conduction studies, to assess what's exactly going on. 

always reach out to your healthcare provider when you're experiencing new symptoms or when current symptoms worsen for an evaluation. if you're currently not receiving any treatment for your injury, consider looking for healthcare providers who specialize in managing similar conditions. this could be a pain management specialist, neurologist, or a rehabilitation specialist (physiatrist)."
N55,response_19,"it sounds like you're dealing with a lot right now. i'm an ai, so i don't replace professional medical advice, but i can suggest that you contact a healthcare provider to discuss these symptoms. this could indicate a problem, such as a nerve compressing or a condition like fibromyalgia, but it could also possibly be due to muscle overuse or strain. in some cases, your nerves and muscles may be healing or trying to adapt to changes. your healthcare provider should be able to conduct a physical exam and may suggest further testing if necessary."
N55,response_20,"unfortunately, the symptoms you're describing are not typically considered ""good"". they could indicate several things, such as nerve damage or irritation, muscle spasms or weakness, or even stress and anxiety.

if you haven't done so already, i'd recommend consulting a doctor about these symptoms. they could be caused by many different conditions, and it's important to get a proper diagnosis. following that, treatment could potentially improve some of your symptoms and improve your quality of life. it might involve physical therapy, medications, or in some cases, additional surgery.

remember that even though your injury happened at birth and you had surgery then, the nerves and muscles in your arm are still healing and growing as you age. because of this, it's possible to experience changes or new symptoms, even many years after the original injury.

finally, don't lose hope. medical science continues to advance, and even if your condition can't be completely cured right now, that doesn't mean it won't be possible in the future. for now, the most important thing is to stay in close contact with your doctor and follow their advice to manage your symptoms."
N55,response_21,"i'm an ai language model and not a doctor, but i can provide some general information that may help you. if these symptoms are new or worsening, it might indicate changes in your nerve function. this could be due to various causes, such as nerve irritation or compression, changes in blood supply, or a progression of your original condition. however, it might not necessarily mean something harmful; for example, the twitching could represent spontaneous nerve regeneration or adaptation. it's important to discuss your symptoms with your doctor, who can examine you and possibly order tests to determine what's going on. they can guide you on how best to manage your symptoms and make you more comfortable. please seek professional medical advice, this is just general information."
N55,response_22,"i'm an ai, but i can tell you generally that symptoms like burning, muscle twitching, or pulsing could potentially indicate nerve irritation or a change in nerve function. however, it's crucial to consult with a healthcare professional to better understand these symptoms. they may not necessarily be ""good"" or ""bad,"" they're just signs that something has changed. in the context of a prior brachial plexus injury and surgery, it's possible that there is some ongoing nerve healing or regeneration, or potentially some degree of nerve dysfunction. a healthcare professional like a neurologist or a physiatrist (rehabilitation medicine specialist) might be able to provide some answers. you may need a thorough physical exam, and possibly some diagnostic tests like electromyography (emg) or nerve conduction study. don't hesitate to seek medical advice for these symptoms."
N55,response_23,"i'm an ai language model and not a doctor but here's some general advice. your symptoms sound like they could be related to your brachial plexus injury, which can lead to different neurological symptoms and pain. depending on the severity of the injury and the progress of your healing, these symptoms could indicate a variety of potential causes ranging from muscle overuse, to neuropathy, to nerve entrapment or regeneration.

however, it's important to consult with a healthcare professional for an accurate diagnosis and treatment plan. nerve and muscle symptoms can be complex and require specialist evaluation. there might be medication to manage your pain or physical therapy exercises that can help improve function, but you need to discuss these symptoms with your doctor. if there's any change in your condition or if you're experiencing new symptoms, it's important to let your healthcare provider know. 

again, this advice is intended to be general in nature, and specific causes may not apply to your situation. always consult with a healthcare provider for appropriate medical advice."
N55,response_24,"pain, burning sensation, and twitching in your arms and fingers could indicate issues with nerve function. this might be related to your previous brachial plexus injury. however, these symptoms can also be the result of a number of other medical conditions, so they should be evaluated by a healthcare professional. 

the connection between moving your index finger and feeling a sensation in your chest is intriguing. there are many nerves that connect the arm to the chest and neck, which could possibly explain what you are feeling. 

i would recommend speaking to your doctor or a neurologist about these symptoms. they could be a sign that there has been some change in your nerve function, and your doctor might recommend further evaluation, such as an emg/ncs study. a qualified physiotherapist might also prescribe exercises to improve mobility and reduce pain. 

sudden new symptoms could mean changes in your body and it's important to understand those. treatment can be most effective when issues are addressed early, before they escalate. you should not ignore these symptoms as they are impacting your quality of life and causing discomfort."
N55,response_25,"sorry to hear about your discomfort. while these changes could seem alarming, they may not necessarily be a negative sign. the sensations could indicate some nerves beginning to function in new ways, but it's hard to say for sure without a thorough examination. the twitching could be a sign of nerve regeneration. however, it could also be a sign of nerve irritation or other problems. the burning sensation is often associated with nerve pain, which might indicate a problem. it's essential to discuss these changes with your doctor or a specialist, and possibly schedule an appointment for an examination. they can best advise you based on your specific condition and changes. and remember, don't hesitate to seek immediate medical attention if the pain or twitching get worse or if you experience other concerning symptoms."
