question_id,response_id,response
N141,response_17,"what you're proposing wouldn't be an effective method of preventing infection. most oral antibiotics are not designed to be topically applied directly to wounds, injuries or infections. it wouldn't effectively penetrate the tissues and eliminate bacteria there like taking it internally would. 

crushing an antibiotic would only really cover the surface layer and not deliver the compound to the underlying tissues where bacteria can reside. an oral dose allows antibiotic levels in the blood and tissues to reach a therapeutic level which is more effective at treating and reducing infection. 

post extraction dry socket or alveolar osteitis is a risk, and infection too but if you're feeling better, often the antibiotic prescribed post extraction is not needed. it might be better to focus on good mouth hygiene, salt water gargles, gentle brushing to prevent any accumulation of food debris or bacterial growth on the surgical sites. 

if you're not in pain, do not have pus discharge, do not have heavy bleeding, and your surgical sites seem to be healing well with new pink tissue, it is unlikely you have a developing infection.

regarding choice of antibiotics, either penicillin or amoxicillin could be effective in killing bacteria that is sensitive to it. your surgeon probably chose an antibiotic based on the likely type of bacteria he expected in dental infections (usually streptococci).

also, know that it is important to complete antibiotic courses. stopping them early could lead to antibiotic resistance – the bacteria surviving the antibiotic attack, now knowing how to do so more effectively. 

if you feel unsure, reach out to your dentist for an evaluation or any issues or concerns you may have. it's important to communicate these to your healthcare provider.

disclaimer: this advice is based on general medical knowledge and not knowing your complete medical history, health status and cannot replace advice from your healthcare provider."
N141,response_18,"while it's understandable that you are worried about infection and are also concerned about the impact of antibiotics on your gut microbiome, crushing and placing an antibiotic pill onto an extraction site is not recommended. 

the efficacy of such topical antibiotic treatment is not just questionable, it could potentially cause more harm than good. unnecessary exposure of the socket to any substances may also interrupt healthy healing processes, such as the formation and stabilization of the blood clot that leads to the formation of new tissue. moreover, the concentration of antibiotic that is potentially released might not be adequate to have the effect you hope for.

regarding your question about amoxicillin vs. penicillin, both are part of the same family of antibiotics (penicillins) and are typically similarly effective in managing dental infections. your healthcare provider should decide which antibiotic is best for you based on your medical history, your allergy status, and any other medications you may be taking.

most importantly - if you are paranoid about getting an infection, the best thing you can do is to maintain clean oral hygiene, follow the post-extraction instructions provided by your dentist, and keep your follow-up appointments. these measures will do more for preventing infection than self-medicating with antibiotics. at the same time, if you suspect an infection (swelling, fever, increasing pain, gross pus formation, unpleasant taste), get in touch with your medical or dental provider immediately."
N141,response_19,"placing antibiotics directly on the socket is not an effective way to prevent infection and it may lead to other complications. the oral administration of antibiotics is designed to ensure that the antibiotic is properly distributed throughout your body, where it can reach the desired location through your bloodstream. 

antibiotics placed directly in an open wound might not disperse through the tissue effectively and could even promote the growth of antibiotic-resistant bacteria in that site. 

in general, penicillin and amoxicillin are both widely used for dental infections, but your dentist or oral surgeon would be the best source of knowledge on which one would be most effective for your specific surgery site. 

it's also important to remember to take your antibiotics as prescribed even if you are feeling better or the infection seems to have cleared up. this ensures that the infection is fully cleared and helps prevent the development of antibiotic-resistant bacteria. if you're concerned about your gut microbiome, consider adding more fermented foods or a probiotic supplement to your diet to help replenish your beneficial gut bacteria.

however, if you have concerns about your healing process or any symptoms that may indicate an infection, i would recommend contacting your surgeon and discussing these concerns directly. the information i provided is a general guideline rather than a specific treatment plan and should not replace direct advice from your healthcare provider."
N141,response_20,"you should not stop taking antibiotics prematurely without the advice of a healthcare professional. in generally, the benefits of antibiotics often outweigh the risks, even considering the impacts to your gut microbiome. antibiotics are designed to be systemically absorbed and distributed in your body to fight infection, and the doses are calculated based on this principle. crushing and applying them topically on the wound may not provide the desired concentration to fight off any potential infection. 

also, applying crushed antibiotics directly to a healing oral cavity might potentially slow healing or cause more irritation, resulting in oral ulcerations and pain. furthermore, it's essential for antibiotic use to be strictly regulated to avoid development of antibiotic resistant bacteria.

regarding the choice of antibiotics, it really depends on the type of bacteria causing the infection. both penicillin and amoxicillin are in the same class of antibiotics and commonly used in oral infections. your dentist or oral surgeon would be the best to advise you here based on your specific case. 

finally, if you are nervous about potential infection, the best course of action would be to contact your dentist or oral surgeon to express your concerns. they may want to see you in person for a follow-up. it's always better to err on the side of caution, especially with oral surgery.   

note: the use of probiotics after a course of antibiotics may be useful to help restore the gut microbiome. you can also talk to a healthcare provider about this."
N141,response_21,"as a language model ai developed by openai, i would say crushing an antibiotic pill and placing it in your oral wound is not a good idea and is not something that health professionals typically recommend. this is because topical delivery of medicine in this manner lacks controlled delivery, the dosage could be improperly controlled, and may not be as effective. antibiotics are typically prescribed to be taken orally to ensure that they are being distributed evenly throughout your body and attacking bacteria in your entire system, not just one localized area.

it's very crucial to follow your prescribed treatment exactly as advised by your healthcare provider, in order to prevent drug resistance or other potential adverse reactions. if you are worried about the infection returning or have any queries regarding the continuation of antibiotics, reach out to your physician or your oral surgeon. they are well equipped to advise you on next steps and alter your prescription, if necessary.

about your question on which antibiotic is better - penicillin and amoxicillin are both excellent choices to treat infections related to dental procedures. they belong to the same family of antibiotics and both are typically used in this situation. however, the best antibiotic for you would really depend on your individual case, and your doctor would be the one to make that determination.

remember, never change your medication use without consulting a healthcare provider first."
N141,response_22,"it is not advised to crush antibiotic tablets and place them directly on the sockets. the antibiotics need to be in your body's system to be delivered to the site where they are needed. it doesn't matter what route they take (e.g. oral or iv), what is important is the antibiotic concentration in blood.

if you stop eating antibiotic tablets, you give the bacteria a chance to grow back and that can lead to antibiotic resistance. this creates a bigger problem, as next time you have an infection it won't be stopped by the same drug.

to answer your last question - amoxicillin has a broader antibacterial spectrum than penicillin, meaning it can act against more types of bacteria. it really depends on the type of bacteria causing your infection, which in most cases is unknown, unless a swab and culture is taken from the infection and a sensitivity test is performed at the lab. this is rarely done though, as both amoxicillin and penicillin are a good empiric choice for oral infections.

also, it seems like you are obsessing about this a lot. it's good to be informed, but you also need to trust your doctor who has years of education and practical experience. if you have concerns about the medication, it would be best to discuss it with the health provider who prescribed it. it's also important not to self-medicate, as this could be harmful.

regarding your gut microbiome concern: prescriptions of antibiotics should always aim for shortest possible time to not disturb gut microbiome more than necessary. discuss this with your doctor too.

important: this is general information and should not replace the advice of your treating physician who knows your personal/medical history."
N141,response_23,"i'm a medical ai and i'd strongly advise against breaking open a pill and placing it directly into the socket. this is not a recommended way to take antibiotics, and doing so might cause overconcentration of the drug in one spot and it might not be effectively absorbed into the bloodstream to fight the bacteria throughout your body if needed.

antibiotics like amoxicillin and penicillin work best when they're taken orally, as they're designed to be. they need to enter your bloodstream and meet bacteria systemically. moreover, the direct contact to the wound can possibly harm the healing process because of the irritant nature of the drug when not diluted in the blood.

lastly, using antibiotics when they're not needed can contribute to antibiotic resistance, making infections harder to treat in the future. i recommend contacting your healthcare provider to discuss any signs of infection or concerns you may have. they can examine you, determine if an antibiotic is necessary, and prescribe the appropriate course of treatment. as for your question about which is better between amoxicillin and penicillin, it really depends on the specific bacteria, the site of infection and the patient's individual reaction to the drug. both are types of penicillin, but amoxicillin is usually more potent and better absorbed. be sure to discuss this with your healthcare provider."
N141,response_24,"it is not recommended to crush an antibiotic pill and place it directly on a tooth socket or any surgical area for a variety of reasons. 

first, this technique hasn't been scientifically validated and effective doses for this way of applying the antibiotic aren't clear. it may lead to over or under dosing. 

second, putting a crushed antibiotic directly on the wound might damage or irritate the healing tissue. the crushed pill is not sterile and may introduce other bacteria or substances to the site, causing possible additional infection or inflammation. 

lastly, not completing a full course of antibiotics puts you at risk for antibiotic resistance. this happens when bacteria can resist the effects of previously effective medications. if you don't finish your antibiotic course, some bacteria may survive and become resistant to the medication. 

amoxicillin and penicillin work in similar ways. amoxicillin tends to be more potent and typically has fewer side effects. again, always take the entire course of antibiotics unless your doctor suggests otherwise. 

as for the microbiome, you're right - antibiotics can disrupt it. however, the risk of not treating an infection adequately is higher than the risks associated with temporary microbiome disruption. normally, the gut microbiome should recover after you finish the antibiotics. probiotics and a balanced diet can help to speed up the recovery process. 

if you feel uncomfortable with your current treatment plan, consider addressing your concerns with your dentist or oral surgeon who can possibly alter your regimen or recommend alternatives, like a targeted mouth rinse containing antibiotics or antiseptics."
N141,response_25,"taking an antibiotic tablet and crushing it to place directly on the extraction site would not be recommended. not only would it probably not deliver an effective level of the drug to the area, it could irritate the healing tissues and potentially even slow down the healing process. 

as for which antibiotic is better, both amoxicillin and penicillin are effective against the types of bacteria typically involved in oral infections. the choice between the two often depends on the specific bacteria causing the infection, the patient's medical history, and their tolerance of the medication.

in general, taking antibiotics should be done under the guidance of a healthcare provider. 

stopping antibiotics prematurely can potentially lead to antibiotic resistance, which can make future infections harder to treat. if you are genuinely concerned about your gut microbiome, bringing up these concerns with your doctor would be a good idea. they can guide you on how to use antibiotics safely and appropriately and whether there are any alternatives that might suit you better. 

the gut microbiome is definitely an important factor. however, in most cases, it can recover from a short course of antibiotics, particularly if the course is followed with a pro-biotic regimen or a diet relatively rich in fermented foods. 

please discuss this with your doctor before trying any new approach to your health. always remember that self-medication may potentially lead to unwanted complications. 

this advice is based on the information you provided and should not replace a consultation with your doctor. if any new symptoms occur, you should contact your healthcare provider immediately."
