question_id,response_id,response
N52,response_1,"as an ai, i am unable to parse images. however, based on your symptoms and their progressive improvement, it seems like you may be dealing with a common cold or flu, which are usually caused by viruses. antibiotics don't work against viral infections and are typically not prescribed. if your symptoms were getting worse, if you have a persistent high fever, severe cough, shortness of breath, or if they last more than 7-10 days without significant improvement, you should definitely be evaluated by a health professional. in any case, it's always best to consult with a healthcare provider for an accurate diagnosis and treatment."
N52,response_2,"as an ai, i can't view images or directly examine patients. based on the symptoms you've mentioned, it could be just common cold or a sinus infection, which can sometimes produce green mucus. regardless, most of these are caused by viruses meaning antibiotics (which only work on bacterial infections) won't help.

however, it’s important to note that if you're feeling a lot worse or haven't seen improvement in about a week or if the symptoms get severe or you have difficulty swallowing or breathing, i would recommend you visit a doctor. they will examine your symptoms properly, guide you on the required medical tests and then prescribe the right treatment.
it's difficult to diagnose without an actual exam so you should rely on a medical professional's opinion, not an ai's analysis."
N52,response_3,"as an ai, i can't actually view or interpret images. however, based on the symptoms you've described, it sounds like you have an upper respiratory tract infection, which could be bacterial or viral in origin. most such infections, including the common cold, are caused by viruses and do not require antibiotics, as those only work on bacteria. if your symptoms are slowly improving, it's likely that your immune system is handling the infection.

however, the presence of green mucus may suggest a bacterial infection. it's also important to note that serious conditions such as strep throat can initially present with symptoms similar to a common cold.

if you're feeling uncertain, have worsening symptoms, develop a high fever, severe pain, difficulty breathing or swallowing, it's important that you speak with a healthcare provider who can properly evaluate your condition. they might need to perform a quick test or throat culture to verify the type of infection."
N52,response_4,"as an ai, i'm unable to view or interpret images. however, you mentioned having symptoms for the past week, including a sore throat, runny nose, green mucus and a slight fever - these are typical symptoms of a common cold or viral infection, which can't be treated with antibiotics. generally, antibiotics are prescribed for bacterial infections. 

the fact that you're starting to show improvements indicates your immune system is dealing with the infection. stay hydrated, get plenty of rest, and consider over-the-counter remedies to alleviate symptoms if they're causing discomfort.

however, if your symptoms persist beyond 2 weeks, your fever returns or worsens, or you develop new symptoms like chest pain, difficulty breathing, severe headache, or a rash, then you should seek immediate medical attention. 

remember, this advice is intended to be general in nature, and specific causes may vary. always consult with a healthcare provider for accurate information."
N52,response_5,"as an ai, i'm unable to physically examine you or view images. however, based on the symptoms you've described, it could be a common cold or a bacterial infection like strep throat. if your symptoms continue to improve, it might just be a viral infection, which doesn't need antibiotics -- these infections just need time and rest to resolve. however, if your symptoms worsen or persist for more than two weeks, you should seek medical advice. they could then do a throat swab to confirm if it is a bacterial infection like strep, which would need antibiotics.

in the meantime, stay hydrated, rest, and use over-the-counter remedies as needed for symptom relief. if your fever gets very high or you have difficulty breathing, seek medical care urgently."
N52,response_6,"as an ai, i can't physically examine you or interpret images. however, i can give you some general advice. the picture isn't enough to make a diagnosis. a runny nose, green mucus, and sore throat are often signs of a common cold or viral infection. antibiotics are not helpful for viral infections. however, if your symptoms persist, especially the sore throat and fever, or if they worsen over the next few days, it's recommended to see a healthcare provider. they can rule out bacterial infections like streptococcal pharyngitis (strep throat) which would need antibiotics for treatment. in any case, ample rest, hydration, and over-the-counter cold medication can often help alleviate symptoms. in the current covid-19 pandemic scenario, bear in mind that your symptoms may also be suggestive of a mild form of this disease. please consider getting a test if available and necessary according to local standards."
N52,response_7,"as an ai, i can't actually view or interpret pictures. but based on your description, you could be having a common cold or an upper respiratory tract infection. it's a good sign that your condition has been improving. however, only a health professional can definitively diagnose this and decide whether antibiotics are necessary. it's important to contact a healthcare provider if your symptoms persist or get worse. bacterial infections usually require antibiotics, while viral ones do not. some indicators of a bacterial infection might include a high fever, severe throat pain, tonsillitis or bacterial sinusitis. please seek medical attention."
N52,response_8,"as an ai model, i can't directly examine or interpret images provided. however, based on what you've described, it could be anything from a common viral infection like a cold or flu to a bacterial infection such as strep throat or sinusitis that would require antibiotics. green mucus doesn't necessarily indicate a bacterial infection, your body may produce it when fighting off a virus too. if you're finding you're not getting better after a week or symptoms are worsening, you should definitely consider reaching out to a healthcare provider. they may want to run tests to determine the cause. if you have difficulty swallowing or breathing, have a persistently high fever, or if you feel extremely unwell, you should seek immediate medical attention."
N52,response_9,"as an ai, i can't analyze pictures, but given the symptoms you mentioned, you could be dealing with either a common cold or a sinus infection. if your symptoms are lessening, it might just be a common cold. however, if symptoms persist, especially if the mucus remains green or you have persistent fever, a sinus or bacterial throat infection could be the case which might require antibiotics. given the duration of your symptoms, it would be a good idea to consult with a healthcare provider to get a clear diagnosis and treatment plan."
N52,response_10,"as an ai, i can't examine images or diagnose conditions. however, what you're describing could be common symptoms of a cold or sinus infection, which is usually caused by a virus. antibiotics are often not effective against viral infections. if symptoms persist or get worse, you should see a doctor who can make a proper diagnosis and recommend the right treatment."
N52,response_11,"as an ai developed by openai, i can only provide general information about health conditions and can't interpret your personal symptoms or a picture you provided. that said, your symptoms might suggest a common cold, sinusitis, or even a strep throat. both sinusitis and strep throat might require antibiotics if they're bacterial in nature, but not all sinusitis and sore throats are caused by bacteria - they are often caused by viral infections, which don't respond to antibiotics.

a high, persistent fever, severe throat pain, or difficulty swallowing might necessitate a trip to the doctor for a proper evaluation and possible testing. the gold standard for diagnosing strep throat is a throat swab, which your doctor can conduct. this would help in determining whether your infection is viral or bacterial, and thus, whether you need antibiotics.

given your symptoms and the length of time you've been ill, it might be wise to reach out to a healthcare professional and schedule an appointment. please do not self-medicate and consult with a healthcare provider before starting any medication, including antibiotics."
N52,response_12,"as an ai, i can't physically examine you or visually interpret images. from the symptoms you've described, such as sore throat, runny nose, green mucus, and elevated temperature, you may be dealing with a common cold, or possibly a bacterial infection like strep throat or sinusitis.

keep in mind that green mucus is not automatically a sign of a bacterial infection, it can also occur in viral infections.

since your symptoms are gradually improving, your body seems to be handling the infection. however, if your symptoms get worse or don't improve over the next week, you should seek medical attention. you might require antibiotics if it's bacterial - only a healthcare professional can make this decision.

note: this advice is based on the information provided and may not fit your individual health situation. this is not a substitute for personal examination and advice from a healthcare professional."
N52,response_13,"as an ai developed by openai, i don't have the ability to view images. based on the symptoms you've described, it does seem like you have a common cold or perhaps a sinus infection.

most colds are caused by viruses, so antibiotics wouldn't help in these cases. but green mucus and feeling sick for over a week can sometimes be a sign of a bacterial infection like sinusitis or strep throat. 

still, it's important to consult a healthcare professional who can assess your symptoms properly, perform a physical examination, and if necessary, conduct further tests like a throat swab to determine if you have a bacterial infection that requires antibiotics. if you're having trouble swallowing, breathing, or if your symptoms worsen instead of improving, seek medical attention immediately."
N52,response_14,"as an ai, i can't view or interpret images. however, given your description of symptoms, it does sound like a common cold or viral infection. however, these can sometimes lead to bacterial infections which might necessitate antibiotics, like sinusitis or strep throat.

generally, if your symptoms have been steadily improving, it's less concerning, but if there are any new or worsening symptoms, you should consider medical attention. antibiotics are only effective against bacterial infections and wouldn't help a viral infection, which most upper respiratory infections tend to be.

it's crucial to remember that while i can offer general clinical advice, i can't replace a visit to a healthcare provider for a clinical examination. if you're in doubt, please consult your healthcare provider to ensure you get the appropriate treatment."
N52,response_15,"as an ai, i'm unable to view the image or make an actual diagnosis, but the symptoms you're describing (sore throat, runny nose, green mucus, and slightly increased temperature) are consistent with a common upper respiratory tract infection, which can be caused by various viruses or bacteria.

if your symptoms have been improving, that's a good sign and it might show that your body is dealing with it on its own, which is often the case with viral infections. however, if things worsen or there's no improvement after about one to two weeks, or if you come up with new severe symptoms (like high fever, difficulty breathing, or severe pain), you should see a healthcare provider. 

sometimes, bacterial infections can follow viral ones and these may require antibiotics. it's essential to not self-medicate with antibiotics, as misuse can lead to antibiotic resistance. a healthcare provider will be able to evaluate your symptoms, possibly run some tests, and make the best treatment recommendation."
N52,response_16,"as an ai developed by openai, i do not have the ability to view or analyze images. however, from your description, your symptoms seem related to a common respiratory infection. these can be viral, like the common cold or flu, or bacterial, like strep throat or a sinus infection. it's promising that it's been improving, as that usually suggests a viral rather than bacterial cause which would self-resolve. 

regardless, you should reach out to your healthcare provider for a proper diagnosis, especially if the symptoms persist beyond the usual duration of a common cold (around 7-10 days) or are accompanied by other severe symptoms like difficulty breathing or swallowing. antibiotics are only effective against bacterial infections, and viral and bacterial infections need different treatments - overuse of antibiotics can be harmful and lead to antibiotic resistance.

the information i provided is to be utilized as general guidance. this does not substitute a comprehensive evaluation from a healthcare provider."
N52,response_17,"as an ai model, i can't actually see or evaluate pictures. however, based on the symptoms you're describing, it seems like you have a common cold or a mild upper respiratory tract infection, which usually get better within a week or two and are typically caused by a virus. antibiotics are not usually needed for these, as they are ineffective against viruses.

however, if you're still feeling unwell or symptoms worsen (such as persistent fever, difficulty swallowing, or worsening throat pain), it could indicate a more serious bacterial infection like strep throat or sinusitis which may require antibiotics. i would recommend consulting with a healthcare provider in person to get a full examination and appropriate treatment. they may do a throat swab to test for bacterial infections like strep throat. 

notably, body's immune system can sometimes produce green mucus as it fights off an infection, whether it's viral or bacterial. so the color of your mucus is not necessarily an indication you will need antibiotics. if you have other worrisome symptoms like prolonged fever, severe pain or difficulty swallowing, it's definitely time to seek medical attention. your healthcare provider can determine if it's viral or bacterial, and prescribe antibiotics if necessary. 

keep in mind that unnecessary use of antibiotics can contribute to antibiotic resistance, which makes future bacterial infections more difficult to treat. 

remember, this advice is intended to be general in nature, and specific causes may vary. please consult a healthcare provider for advice more tailored to your circumstances."
N52,response_18,"as an ai, i can't personally view or evaluate images. however, it sounds like you may have a viral upper respiratory infection, such as the common cold, which often do improve slowly over the course of a week or so. green mucus and an elevated temperature can be signs of the body fighting an infection, but isn't a surefire sign that you need antibiotics. many viral infections can cause these symptoms and are not treatable with antibiotics. you might want to rest, stay hydrated, and consider over-the-counter cold remedies. if your symptoms get worse, last more than two weeks, or you develop new symptoms such as difficulty breathing or severe pain, do see a doctor."
N52,response_19,"as an ai, i'm unable to view or analyze images. regardless, persisting above symptoms for a week suggests you might have a bacterial infection requiring antibiotic treatment. usually, sore throats are caused by viral infections which don't require antibiotics, but the presence of green mucus suggests possible bacterial involvement. however, only a physical examination and tests like a throat swab culture by a healthcare professional can confirm if you need antibiotics. therefore, if your symptoms persist or worsen, consult with a healthcare provider as soon as possible."
N52,response_20,"as an ai model developed by openai, i can't visually examine the provided picture but can give some advice based on your symptoms. a sore throat, runny nose, and green mucus can be symptoms of a common viral infection, like the common cold. however, if you also have an elevated temperature (fever), it might indicate a bacterial infection, which may require antibiotics.

keep in mind that improvement over time is a good sign, as most viral infections will resolve on their own given enough time and supportive care like rest, hydration, and over-the-counter symptomatic treatments.

if your symptoms continue to persist, worsen, or if you develop new symptoms like difficulty breathing or swallowing, you should seek medical attention. it is always best to consult a healthcare professional since they can provide more accurate advice based on a physical examination and your medical history."
N52,response_21,"as an ai, i can't physically assess your health or interpret images for medical use. however, the symptoms you're describing might be a sign of a common cold or a possible bacterial infection like sinusitis or strep throat, both of which require antibiotics. typically, colds will clear up on their own in a week or two. if you have a temperature over 100.4°f, or if your symptoms last longer than one week or are getting worse, you should definitely consult with a healthcare provider to get evaluated for possible bacterial infection."
N52,response_22,"as an ai, i'm unable to view pictures or diagnose conditions, but i can provide general advice. green mucus could indicate a bacterial infection, though it is also common in viral infections. if your symptoms have been improving, it's possible that your immune system is handling it well on its own. if your fever persists or your symptoms worsen, you should reach out to a healthcare professional for advice. antibiotics are typically used for bacterial infections, not viral ones like the common cold, so they may not be needed or effective unless a bacterial infection is confirmed. you can also try over-the-counter remedies for symptomatic relief."
N52,response_23,"as an ai, i'm not able to view images or diagnose conditions. however, your symptoms sound like a common upper respiratory infection (common cold), which is usually caused by a virus. antibiotics are not effective against viruses and are typically not prescribed for viral infections. you should feel better in a week or two. rest, drink plenty of fluids, try a humidifier, and consider over-the-counter cold remedies. if your symptoms persist or worsen, if you have a high fever, severe headache, chest pain or other worrying symptoms, seek medical attention. always consult with a healthcare provider for the most accurate information."
N52,response_24,"as an ai language model, i'm glad to hear that your symptoms are improving. however, i'm unable to visually diagnose or interpret images. given your symptoms, it is possible that you're experiencing an upper respiratory infection. many of these are caused by viruses, which can't be treated with antibiotics. however, if your symptoms persist or worsen, you should consult with a healthcare provider who can more accurately diagnose you, potentially prescribe antibiotics if they deem it necessary (i.e. if it's a bacterial infection), and provide further advice."
N52,response_25,"as an ai, i can't actually see the linked image, however, these symptoms could be due to an upper respiratory tract infection which can be viral or bacterial in nature. viral infections do not benefit from antibiotics, but bacterial infections do. with symptoms like green mucus and the duration of your symptoms, it's possibly a bacterial infection. however, many such infections also resolve without antibiotics. wait and see approach or symptomatic treatment might be suggested initially. it would be best if you visit a healthcare professional for proper evaluation and management."
