question_id,response_id,response
N13,response_1,"firstly, i just want to say that it's incredibly brave of you to seek help even with everything you've been through. the good news is that it is never too late to start caring for your teeth.

here are a few steps to guide you:

1. look for a public dental service: australia has public dental services that provide free or reduced-fee treatment for eligible people. you can find out your eligibility through your state or territory health department.

2. schedule a check-up: when you first go to a dentist, you will typically have a consultation and a check-up. this involves them asking about your medical and dental history, followed by a full examination of your mouth, teeth, and gums.

3. discuss your dental issues: be honest and upfront about any oral health problems you've encountered and the history of neglect. a good dentist will not judge you for this but will help you find the right treatment.

4. plan your treatment: depending upon the condition of your teeth, the dentist will suggest a treatment plan. this may include cleanings, fillings, extractions, or other procedures. some of these treatments might be costly, especially if you need cosmetic dentistry. 

5. understand the costs: before agreeing to any treatment, ask for a full breakdown of the costs. most dental clinics will be able to give you an estimate of the costs before the treatment begins.

6. dental schools: dental schools offer reduced costs because their students provide the treatment as part of their training (under the supervision of experienced professionals). it can be a good option if your budget is tight.

7. payment plans: many dentists offer payment plans, so ask about this option. keep in mind that you should have a clear understanding of what is included in the plan and how much it will cost in total.

8. look after your oral hygiene: adopt healthy dental habits moving forward. brush twice a day, floss daily, and use mouthwash to maintain oral health. 

remember, it's perfectly okay to feel unsure and afraid. most people aren't exactly thrilled about going to the dentist, but regular dental care is very important for your overall health. and don't be too hard on yourself. what matters now is that you're taking steps to improve your dental health."
N13,response_2,"i'm sorry to hear about your situation. here are some steps that you may want to consider:

1. find a dental clinic: the first step is to find a dental clinic suitable for your needs. this may involve doing a quick google search for ""affordable dental care near me"" or ""low-cost dental clinics in australia"". public dental services in australia are funded by the government and may require a co-payment but are generally more affordable than private clinics. 

2. consultation:  most dental appointments begin with a check-up, during which the dentist evaluates your teeth, gums, and mouth, and recommends if any treatment is required. feel free to discuss your financial concerns with your dentist as well, they may be able to break up necessary treatment over a few stages to make it more affordable. dentists generally display a basic price list but the final cost can vary depending on the complexity of the situation.

3. dental schools: another option is to consider seeking treatment at a dental school clinic. prices at these clinics are typically much lower than at regular dental offices. dental students will be able to perform cleanings, fillings, and other procedures under the direct supervision of their instructors.

4. payment plans: some dentists offer payment plans, which allow you to spread out payments over a series of months or even years. if this is something that could benefit you, don't hesitate to ask about this possibility when you call or visit a dental office.

5. charities/ nonprofits help: many charity organizations and outreach programs provide free or low-cost dental care to those in need. a little research online can provide a list of such organizations operating in australia.

6. prevention: the best way to keep dental costs low is through prevention. brushing and flossing daily, along with regular cleanings and check-ups, can help prevent more serious and expensive dental problems down the line. 

so, in conclusion, remember to clearly communicate your needs and concern to the dentist beforehand. every dental practice operates a little differently, but the common factor is that they all want to help you achieve a healthy mouth and smile. good luck!"
N13,response_3,"i'm sorry to hear you're experiencing these difficulties but here are a few suggestions for getting affordable dental care in australia:

1. public dental services: in australia, both children and adults with health care cards or pensioner concession cards may be eligible for public dentistry through the public dental system. however, due to high demand, there may be waiting lists depending on the severity of your condition. contact your state's health department to find out more.

2. dental schools: dental schools often need patients on which their students can practice their skills. the treatment here would be heavily supervised by a professional, and charges are usually significantly less. some universities with dental schools in australia are the university of melbourne, the university of sydney, and the university of queensland.

3. community health centres: many community health centers offer dental care at a reduced fee. you can search for community health centers or dental clinics in your area and then contact them to find out what services they offer and at what cost.

as for what to expect when visiting a dentist:

- first, you make an appointment. you don't necessarily need to know everything you want to be done beforehand, although if you have a specific concern you'd certainly mention that.
- during your appointment, the dentist will examine your teeth and possibly take x-rays.
- then they will discuss with you what they've found and what treatment(s) they recommend.
- you should ask questions about the cost of the treatment, how necessary it is, if there are any alternatives, and payment plans.

finally, don't be embarrassed about your teeth. dentists are professionals who are there to help you, not to judge you. if you're unsure about anything, don't hesitate to ask them for guidance."
N13,response_4,"i'm really sorry to hear about your situation, and it's completely understandable that the prospect of arranging dental care can be daunting. here are a few things you could consider:

1. **medicare:** in australia, medicare may cover some dental treatments but it's mainly for people who meet specific requirements like being a child in family assistance programs or having a chronic medical condition. however, please check your eligibility as there might be a program you qualify for.

2. **public dental services:** each state in australia offers public dental services, many of them at a reduced cost or free for low-income earners. wait times can be long for non-emergency care however.

    for example:
    - in victoria, there’s the dental health services victoria. 
    - in nsw, there’s the nsw health.
   
   these services have clinics all over the state, so there might be one near you. do a google search to find your local public health department. 

3. **community health centres:** check if there's a community health centre near you. they often offer dental services on a sliding scale, which means they charge based on your income.

4. **dental schools:** there are several dental schools in australia where you can get dental work done by students under supervision. this is often much cheaper than regular care. universities such as the university of melbourne, the university of sydney, and the university of queensland all have dental programs.

5. **free dental days or clinics:** some private dentists hold free dental care days, where you might be able to get some work done for free.


in terms of the process of going to the dentist, it normally involves:

- **booking an appointment:** you usually start by calling the dentist’s office and scheduling an appointment. they will ask for your details and brief information about the reason for your visit. you don't necessarily have to know what treatment you need; that's what the dentist is there to determine.
- **initial consultation:** the dentist will perform a thorough checkup, which usually involves taking x-rays. they will then be able to give you a diagnosis, explain what treatment is necessary, and give you a quote for that treatment.
- **getting the treatment:** if you agree to the treatment and the cost, the dentist will then schedule you for future appointments to have the work done. 

always be sure to ask about costs upfront, and don't be shy about discussing your financial situation and any concerns you have"
N13,response_5,"i'm sorry to hear about your circumstances. your first line of action should be reaching out to the australian dental association (ada) or similar body in your state. they should be able to provide you with information about any reduced-cost dental clinics in your area and/or financial assistance programs that can help cover the cost of your treatment. 

as for appointments, here's a general idea of what to expect during a dental visit:

1. make an appointment: you might want to call up a few different dental practices and ask about pricing and payment options, specifically for people who are in a tough financial situation. some clinics may offer a sliding scale based on income.

2. dental check: once you arrive for your appointment, you will most likely start with an examination. the dentist will look at your teeth, gums, and mouth to assess health and detect any issues. they may also take x-rays to see things that are not immediately visible, like hidden cavities or wisdom teeth.

3. discussion: after the examination, the dentist will discuss the state of your oral health with you. they will lay out a treatment plan if any problems are detected. this is when you should talk about your financial situation and discuss possible options for care. most dentists are understanding and may be able to suggest options that are not as expensive.

4. treatment: treatments could range from simple teeth cleaning to more complex dental procedures. it'll depend on the current state of your oral health. payments for these procedures vary. 

5. follow-ups: depending upon the treatment, you may need follow up visits or continuous treatments. again, discuss this with your dentist and see if there are ways to minimize the costs or spread them over the long term.

remember to ask for a cost estimate of any treatment before it's undertaken. you're entirely within your right to ask about costs before agreeing to a procedure. you may also want to ask your dentist about basic dental hygiene and any specific care you need to follow at home.

this might seem overwhelming, but remember that it's okay to ask for help and take things step by-step. try not to feel embarrassed - dentists are professionals and there to help, no matter what your teeth look like. 

i hope this helps a bit and wish you all the best as you navigate this process!"
N13,response_6,"i'm so sorry to hear that you're struggling. here are a few options for affordable dental care in australia, along with a basic explanation of the dentist process:

1. **public dental services**: australia provides public dental services through the states and territories. these services are either free or low-cost. however, there are long waiting lists and the services are usually limited to people who hold a health care card, a pensioners concession card or are eligible children or young persons.

2. **dental schools**: dental schools in australia often offer discounted services. check dental school clinics in your area. students provide the care but are supervised by experienced, licensed dentists.

3. **payment plans**: many dental clinics offer payment plans, which allow you to spread the cost of your treatment over a longer period of time. some dental offices use third-party companies like afterpay or denticare to handle these plans.

4. **health insurance**: if you can afford it, health insurance can cover part of the cost of dentist visits and treatments. depending on the cover you choose, it might also cover orthodontics and dentures.

5. **charitable organizations**: many charitable organizations offer free or low-cost dental care to those who can't afford it. you can find a list of these organizations in your area by searching online.

6. **shop around**: prices can vary significantly between different dental clinics, so it might be worth calling a few clinics and asking for prices of various treatments to compare.

all dentists will want to conduct an initial consultation to assess your situation and establish a treatment plan. this appointment usually involves taking x-rays and a thorough oral exam. ask them about the total costs, not just the consultation fee, before you book an appointment. 

when you meet with the dentist, be upfront about your financial situation and your concerns. they should be able to provide a cost estimate for any work you need done and may even be able to prioritize the most important treatments. 

remember that taking charge of your own dental care is a big step forward! no matter what, keep up your regular brushing and flossing – even these small actions can make a big difference."
N13,response_7,"i'm sorry to hear about your situation and i'm glad to see you're seeking help. thankfully, australia does have a few options for affordable dental care.

1. **public dental services**: if you hold a current healthcare or pensioner concession card issued by either the department of health and human services or the department of veterans' affairs, you're likely eligible for public dental services. there may be a waiting list for non-emergency procedures, but the cost is low or even free. you can find more information about public dental service availability in your state on the australian government's health website.

2. **dental schools**: dental schools often offer some of the cheapest dental treatments. the work is carried out by dental students under the close supervision of their instructors. you can check with universities in your area to see if they offer this option.

3. **charity organizations**: some charity organizations provide free or low-cost dental work for people in need. in australia, one such organization is the national dental foundation, which coordinates volunteer dentists for events called dental rescue days.

as for the process of going to a dentist, typically, you'll:

- **make an appointment**: you can typically do this over the phone.
- **initial consultation**: the dentist will examine your mouth, ask you about any pain or problems you're experiencing, and will likely take x-rays.
- **form a treatment plan**: based on what the dentist finds during the initial consultation, they will decide on a treatment plan and discuss it with you, including costs and the priority of each treatment.

it's important that you inform the dentist up front about your financial constraints. this way, they can prioritize treatments to address the most severe or urgent issues first while helping you stay within budget.

remember, your oral health is crucial to overall health, so keep practicing daily oral hygiene to prevent further damage - brush your teeth twice a day, floss daily and limit sugary drinks and snacks.

wishing you all the best."
N13,response_8,"i'm sorry to hear about your situation, but take heart knowing you're taking steps in the right direction. here are several options for you:

1. **public dental services in australia**: adults are eligible for public dental services in most states and territories in australia, although waiting times can be long. they are typically provided free, with a small co-payment for some services. you may want to reach out to the dental department of your local hospital.

2. **dental schools**: many dental schools offer discounted or even free services to patients willing to be treated by dental students under professional supervision. you can check if there are any nearby universities offering dental programs.

3. **payment plans**: some dentists offer payment plan options to make the cost of treatment easier to manage.

4. **charities and non-profit organisations**: some charitable and non-profit organisations provide free or low-cost dental care to those in need. you can research this in your local area.

on your first visit, the dentist will conduct an oral examination and discuss your dental history. you should openly discuss your concerns and feel assured that it's their job to help, not judge. if it is a care plan or dental treatment that does require payment, you can discuss a possible payment plan with them.

remember, it's ok to ask questions. ask for an estimate before the work is done so you know what to anticipate. they should be transparent and understand your financial constraints.

it might be scary, but it's much better to tackle dental issues the soonest. dental problems typically worsen over time, so the longer you wait, the more expensive it may become. good luck and i hope this helps!"
N13,response_9,"i'm really sorry to hear about your situation. it's never too late to take care of your dental health. here are some possible ways to get dental care in australia:

1. public dental services: each state in australia provides public dental care for people who need it most and these clinics usually charge on a sliding scale, which means you pay what you can afford based on your income. 

2. university dental clinics: as another option, look for dental schools with clinics where dental students provide treatment under supervision at reduced rates. 

3. non-profit and community clinics: you may also find local non-profit or community health centers that provide free or low-cost healthcare, including dental care. 

4. work and income help: if the cost of dental treatment is making it unaffordable, you may be eligible for work and income assistance. they may be able to help with the cost of urgent dental treatment. 

remember, prevention is better than cure. you can prevent further decay and damage by brushing your teeth with fluoride toothpaste twice a day, flossing daily, and eating a healthy diet.

when going to a dentist for the first time, here's what usually happens:

1. you'll be asked to fill our paperwork regarding your medical history.
2. a dental hygienist will clean your teeth and take x-rays if needed.
3. then, the dentist will meet with you to go over your x-rays and check your teeth and gums for any issues.
4. at the end of the appointment, they will recommend next steps and preventative measures.

before any procedure, make sure to ask how much it will cost so there are no surprises. you can also ask for a detailed treatment plan where they break down the cost for each procedure. some clinics may offer payment plans, so don't hesitate asking about that either.

i hope this helps. don't ever let shame or embarrassment prevent you from seeking help. your past was not your fault, and it's not too late to take control of your health from here on out."
N13,response_10,"i'm sorry to hear about your situation, but please know that you're not alone and it's never too late to start taking care of your dental health. here's the general step-by-step process you can follow:

1. search for local dental services - depending on where you are in australia, there are community health centres and public dental clinics that offer basic dental services at a lower cost. you can also look for dental schools where students treat patients under professional supervision at a discounted rate.

2. make an appointment - once you've identified a suitable clinic, call and make an appointment. explain your situation honestly and ask any questions you might have.

3. initial consultation - at your first appointment, the dentist will examine your teeth, gums, and mouth, and will possibly take some x-rays. they'll identify any existing problems and discuss potential treatment options with you, including their benefits and costs.

4. discuss a treatment plan - it's important to discuss with your dentist to devise a treatment plan that not only addresses your current dental issues but also is financially manageable for you. affordable dental care plans often involve phased treatments over a period of time.

5. post-treatment care and follow-up - proper home care hygiene and regular dental check-ups can help prevent future dental problems.

as for governmental assistance, australian citizens and permanent residents can get help through public dental services provided by each state or territory, though it may involve waiting periods. the child dental benefits schedule (cdbs) provides access to benefits for dental services to about 3 million children aged 2-17.

adults with low income might also be eligible for public dental services, though they could also face waiting periods. some states/territories also have dental vouchers or subsidies given through public dental services.

it might be worth looking into taking out insurance for dental care, especially if you anticipate needing extensive treatment. many health insurance providers in australia offer coverage for dental care.

lastly, your mental health is important too. if you're feeling overwhelmed, consider reaching out to a mental health professional. there are many organizations and helplines in australia that offer free or low-cost mental health services.+"
N13,response_11,"i'm so sorry to hear about your situation but it's never too late to start caring for your teeth. here's an outline of what the dental process is like and some options in australia that may be of help to you.

the process: 

1. you'll first schedule an appointment. you can contact a local dental clinic to do this. usually, you would initially book in for a general checkup where they examine the overall health of your mouth.

2. during the appointment, the dentist will check your teeth, gums and mouth to assess what dental work needs to be done (if any).

3. they may suggest x-rays if they need a more detailed look at your dental condition.

4. after the assessment, the dentist will devise a treatment plan. this refers to any procedures that you might need to fix any issues. 

5. the clinic will give you a quote or estimate for the proposed treatment plan. 

budget-friendly options in australia:

1. public dental services: all states/territories in australia have some form of public dental services that provide free or low-cost services to eligible people. 

2. dental treatment for veterans: if you're a veteran, you might be eligible for specific dental services under the department of veterans’ affairs.

3. community-based dental health programs: some community-based dental health programs offer free or low-cost dental services to people in particular circumstances or areas. 

4. university dental schools: some universities that teach dentistry offer services by students supervised by experienced registered dentists. university of sydney, university of melbourne, university of adelaide, and university of queensland all have this service.

5. dental health programs for children: young adults up to 18 years can get dental care services under the child dental benefits schedule or school dental programs.

to keep costs down, ask for a quote before you agree to the proposed treatment and don't be afraid to get a second opinion if you're unsure. also, let your dentist know about your financial restrictions up front, as they may be able to suggest more budget-friendly treatment options or payment plans. 

it's important to remember good everyday practices (brushing twice a day, flossing) can help maintain the work done by the dentist and minimize future costs. it's not the easiest journey, but every small improvement you make will be a step towards better oral health. good luck!"
