question_id,response_id,response
N15,response_1,"i'm an ai and not a doctor, but the fact that a lump has appeared, combined with the intense bruising and significant pain when you touch it, could suggest a more severe injury, like a fracture or another type of damage. it would be a good idea to see a healthcare professional, who may suggest an x-ray to help get a diagnosis. remember, it's always better to be safe, and prioritize your health."
N15,response_2,"based on your symptoms, it's possible you could have a bone bruise or a small fracture. the intense pain and lump could also signify trauma to soft tissue. it can be hard to tell without seeing it, so it may be worth getting an x-ray just to be safe. you don't want to take the risk of potentially having a small break and letting it heal incorrectly. it's also important to remember that you aren't wasting a doctor's time, it's their job to ensure you're healthy and healing properly."
N15,response_3,"i'm an ai and can't physically examine you, but based on your description, it would be wise to seek medical attention. the intense bruising and lump could indicate a fracture or other injury that may not have fully presented when the accident first occurred. it's always better to be safe and have it checked out if you're having persistent pain, especially if it's severe. the doctor can properly evaluate the situation and may suggest an x-ray if needed."
N15,response_4,"if you have intense bruising, a lump that causes pain when you touch it, and it’s not resolving on its own, it would be a good idea to get it checked out. while it may not necessarily require an x-ray, it's best to let a healthcare professional make that call after a proper physical examination. also, they will provide appropriate advice or treatment. it's better to be safe when it comes to potential bone or tissue injuries."
N15,response_5,"based on your description, it would be best to see a doctor. the odd lump and intense pain when touched indicates that there might be some form of injury which needs medical attention. additionally, sometimes fractures or breaks don't fully inhibit movement, so despite being able to move your wrist and hand, there could still be an issue. it's not a waste of a doctor's time to ensure your health is in check."
N15,response_6,"as an ai developed by openai, i'm not a doctor, but i have knowledge to provide you with suggestions. while you're able to perform normal hand motions and the pain isn't consistent, the fact that you have a ""very intense/odd"" bruise and a new lump on your hand after trauma can be concerning. these could potentially indicate a fracture or other injury. it's advisable to consult with a healthcare provider to see if an x-ray or examination is needed, even if it's just for your own peace of mind. please seek medical assistance for a definitive diagnosis."
N15,response_7,"while i'm an ai language model with no way to provide physical examinations, i can say that your symptoms, including intense bruising, a lump, and pain when the lump is touched, could suggest a possible injury such as a sprain or even a fracture. it's important to check these symptoms with a healthcare professional. they would be in a better position to determine if you need an x-ray. even if you are able to move your fingers and wrist, there could be a less obvious injury that needs attention. it's best not to ignore lumps and severe pain after such an incident. always remember, it's not a waste of time when it comes to your health. your doctor should be understanding and helpful with these needs."
N15,response_8,"i'm an ai language model and not a doctor, but if you're feeling intense pain when you touch a lump and it's come with significant bruising, it might be worth seeking medical attention. it could indicate something like a bone fracture or a hematoma. swelling or lumps following trauma can indicate soft tissue damage like a sprain or strain, but it could also signify a fracture which can be serious. it would be best to get it checked out by a healthcare professional, they can do a physical examination and decide if an x-ray or any other tests are necessary."
N15,response_9,"based on your description, especially the presence of a lump and significant pain when it's touched, it's recommended that you seek medical attention. this doesn't necessarily mean that you automatically need an x-ray. a healthcare professional should be able to evaluate your hand based on a physical examination and your medical history. depending on their assessment, they will determine whether an x-ray, or any other imaging test, is needed. it's always better to be safe and get any suspicious injuries checked out."
N15,response_10,"based on your description, it's not possible to give a definite recommendation over the internet. however, given the intense pain on touching the lump and odd appearing bruise, it would be prudent to get it evaluated by a healthcare provider. you may require an x-ray or further evaluation to rule out any internal damage or bone fracture. it's always better to be thorough when it comes to potential injuries."
N15,response_11,"as an ai, i can't examine or diagnose, but i can suggest that following such an injury with continued pain, lump, and bruising, it may be helpful to get a medical evaluation. they might want to get an x-ray to rule out any underlying bone injury. it could potentially be a minor bone fracture or a hematoma (blood collection). these symptoms aren't normal and you should seek medical advice."
N15,response_12,"i'm an ai and not a real doctor, but it sounds like your symptoms (pain, bruising, a lump) could warrant a medical evaluation. the presence of a lump and the level of pain you described may indicate something more than just a simple bruise, such as a fracture or sprain. you're not wasting a doctor's time. they are there to help diagnose and treat conditions just like this. please make an appointment as soon as possible."
N15,response_13,"i'm an ai developed by openai and can't physically examine you, but based on your description of a highly painful lump and bruising, it may be advisable to seek medical attention. these symptoms might indicate a deeper injury like a fracture or a hematoma (blood clot). while it's possible the lump could be swelling that's not dangerous, you don't want to risk ignoring a more serious injury. at least a telemedicine consultation with a healthcare professional might be beneficial to help you decide what to do next."
N15,response_14,"i'm an ai developed by openai and not a doctor, but i would suggest if you are experiencing intense pain, bruising, and a lump formed after a trauma, it may always be a good idea to get it assessed by a medical professional. the symptoms you mentioned could potentially be related to a bone fracture or some other type of injury. however, only a healthcare provider would be able to provide you with an accurate diagnosis and determine whether an x-ray or further treatment is necessary. please do not delay seeking medical advice based on this text."
N15,response_15,"i'm an ai and not a doctor, but from the details provided, if you have significant bruising and a palpable lump along with pain when you touch it, it’s definitely a good idea to get it checked out by a professional. even if your hand seems to be functional, there could still be a small fracture or other injury that isn't immediately obvious. don't think of it as wasting a doctor’s time; getting a diagnosis and appropriate treatment can help prevent any potential future complications. however, you should communicate with a healthcare professional to get an accurate diagnosis."
N15,response_16,"based on the information provided especially considering the intense pain (7.5 out of 10) and presence of a lump, you may benefit from medical attention. the bruising and lump suggest that there might be an underlying injury, possibly a bone injury, that may need imaging such as an x-ray to properly diagnose. an accurate diagnosis will guide proper treatment. even though you can perform wrist and hand movements, there might be still fracture or other injuries that are not noticed without proper evaluation. it's always better to get seen by a doctor when you have such symptoms after an injury. it doesn't mean you're wasting your time or a doctor's time, rather it's about your own health and well-being."
N15,response_17,"as an ai developed by openai, i am not a doctor but i would highly recommend you visit one in person for a proper examination. the pain, bruising, and lump you're describing could potentially indicate a fracture or contusion, which may or may not be visible without an x-ray. even if there's no immediate danger, the pain you're experiencing indicates that something is wrong. if left untreated, this could possibly lead to longer-term complications. remember, it is always better to be safe than sorry when it comes to your health."
N15,response_18,"i'm an ai so i can't physically examine you, and it's always best to consult with a healthcare professional for medical advice. in general terms, intense bruising, pain, and a lump following trauma could indicate fracture, or be signs of a hematoma, which is a collection of blood from burst blood vessels. that said, if the lump is painful and causing concern, you may want to seek medical help to rule out anything more serious."
N15,response_19,"as an ai developed by openai, i don't have the ability to physically evaluate your condition. however, considering the symptoms you mention - intense bruising, a painful lump, and an injury from falling - it might be wise to get medical attention. while you're able to move your hand and wrist, there's still a possibility of a minor fracture or soft tissue injury that needs treatment. while it may seem like a waste of time, peace of mind and your health are important - it's always better to be safe than sorry."
N15,response_20,"as an ai, i cannot physically examine you, but based on the symptoms you mentioned, i advise that you seek medical attention. a sudden, painful lump with intense bruising could indicate a fracture, soft tissue injury or hematoma that might require treatment. also, pain at 7.5 out of 10 is quite significant. please see a healthcare professional who can examine your hand and make a proper assessment."
N15,response_21,"as an ai, i can't physically examine your hand or make a definitive diagnosis. however, intense bruising and a painful lump could potentially indicate a fracture or other serious injury. it's generally better to err on the side of caution with injuries. therefore, you should consult with a healthcare professional who can properly evaluate your condition and determine if an x-ray is necessary. it's also important to remember that not all medical attention is a waste of time - your health is important!"
N15,response_22,"sorry, but i can't diagnose or provide a definitive answer to this for you. it would be best to seek out a healthcare professional for an examination. in general, it's better to get it checked out if you're worried, especially if you're experiencing pain or noticing unusual lumps. it could be nothing serious, but it could also be a fracture or some kind of internal injury. it's best to be safe and get a professional opinion, they can determine whether an x-ray is needed."
N15,response_23,"while i can't provide a diagnosis or medical advice, i can suggest that anytime you have an injury that results in pain, significant bruising, and a new lump, it's a good idea to get it examined by a healthcare professional. they might recommend an x-ray if they suspect a fracture or if the lump does not resolve. remember, your health and well-being are never a waste of time. please consult with a healthcare professional."
N15,response_24,"i'm an ai language model and can't physically examine you but based on the information provided, it sounds like your injury could possibly be a contusion, hematoma, or even a fracture. ongoing pain and noticeable physical changes like the lump you mentioned suggest the injury may be more than just a minor bruise. 

because the injury is causing you significant pain and there's a notable lump, it would be prudent to have a doctor look at it in person, and they may likely recommend you for an x-ray. even if it turns out to be minor, it's better to be safe. this situation doesn't seem like a waste of time at all. it's important to take care of your health."
N15,response_25,"as an ai developed by openai, i can only provide some general suggestions but not a definitive diagnosis or treatment. if you have severe pain, unexplained lump and intense bruising, it would be wise to get medical attention. any trauma that results in such symptoms could indicate a fracture, dislocation, contusion, or other injury. an x-ray would provide clarity on the situation and the possibility of a serious injury. it's better to be safe and ensure that you receive appropriate treatment. please consult a healthcare professional for advice."
