question_id,response_id,response
N25,response_18,"i am an ai language model developed by openai, and while i can provide some general information, i'm not able to diagnose your symptoms or evaluate your test results, as this requires clinical expertise. however, seeing a gastroenterology specialist can help in getting a clear diagnosis for your gi symptoms. 

your weight loss within the context of increased water intake and persistent diarrhea might be related to gi distress rather than cancer, but only a medical professional can determine this.

most cases of pancreatic cancer are found in individuals over 45, and the average age at the time of diagnosis is 70. however, your risk may be higher if you smoke, have diabetes, or there is a family history of pancreatic cancer. if you're worried, talk to your physician for reassurance and possible further testing.

do note that anxiety can exacerbate gastrointestinal symptoms, creating a cycle of anxiety and physical distress. cognitive behavioral therapy (cbt) or mindfulness-based stress reduction (mbsr) can be effective in breaking this cycle by addressing anxiety directly.

please consult your doctor with your concerns and ensure regular follow-ups for your health condition."
N25,response_19,"while i'm an ai developed by openai and not a doctor, your symptoms may be concerning as diarrhea, bloating, weight loss, etc. can indeed suggest digestive track abnormalities, but they are not very specific symptoms and could be due to a wide variety of problems, not necessarily pancreatic or gi cancer. the fact that you've had all these tests done seems to suggest your doctors are taking your symptoms seriously and doing thorough investigations. 

pancreatic cancer is a serious concern but it's quite rare, especially under the age of 40. this doesn't mean it's impossible, but it does affect the probability. you should share your concern with your healthcare practitioner. 

in terms of weight loss, a drop from 200-203 to 196 lbs could easily be due to dehydration from increased water intake and diarrhea, and it could also be due to dietary changes, exercise or even natural body weight fluctuation.

you should definitely follow up with your doctor with these new developments like weight loss and increased urination. keeping your doctor informed about your health changes can result in earlier detection and better chances of successfully treating any potential health problems - not necessarily just cancer. provide as much information as you can to your doctor so that they could guide you appropriately."
N25,response_20,"it's important to remember that while i am an ai assistant capable of providing general advice, i am not a doctor. please always consult with your healthcare provider. 

the weight fluctuation you're mentioning is not typically what physicians would consider significant enough to raise concerns about cancer. for example, doctors often look for unexplained weight loss of 10% or more of the body weight (for you, that'd be more than 20 pounds) over a period of 6 months to a year.

furthermore, your lab tests and imaging studies are comprehensive and would normally identify signs of cancer, particularly in the pancreas or other digestive organs. the fact that these tests showed no cause for alarm is very reassuring.

your symptoms might be due to a functional gastrointestinal disorder like irritable bowel syndrome (ibs) or a food intolerance. stress and anxiety can also exacerbate these symptoms, creating a sort of a vicious cycle.

however, if your symptoms persist or worsen, or if you notice other symptoms such as pain, vomiting, difficulty swallowing, or severe weight loss, please seek medical attention. it's also good to regularly follow up with your healthcare provider to report new symptoms and monitor existing ones. they can finally help manage the anxiety you're feeling about your health."
N25,response_21,"i'm an ai language model and not a doctor, but from a general perspective, the symptoms you describe could fit a range of gi problems, not just cancer. having diarrhea could merely be due to a stressful lifestyle, dietary changes, or certain medications.

the weight loss may be significant or could be just due to increased fluid intake and frequent urination, or losing water weight from diarrhea. given you say all these tests have been done last year, it would be really helpful to know if any abnormalities have detected. 

moreover, the choice of diagnostic tests you mentioned suggests that your healthcare provider is being very thorough, as many of these tests are used to identify different types of cancer, including pancreatic cancer, as well as numerous other conditions. 

health anxiety is a real issue and can make symptoms seem worse than they are, or create perceived symptoms. it'd be best to talk to your doctor to discuss your symptoms again, providing them all the information. express your worries about cancer since it's clearly causing you a great deal of stress. 

for immediate relief of symptoms, you might consider investigating dietary changes alongside medical treatment. factors like high fat food, smoking, alcohol, and low fiber diet could potentially exacerbate gi issues. 

please consult with your healthcare provides as necessary."
N25,response_22,"i'm an ai with information based on medical knowledge, but i should declare that i'm not a doctor. however, i can share that losing weight without trying can be a sign of various health conditions, including cancer. unexplained weight loss is generally a loss of 5% of your normal body weight over six months, according to the mayo clinic. it's good that you are proactive and concerned about your health, but remember, you've had a substantial amount of medical testing, including tests that often would be used to identify gi cancers, like a ct scan, colonoscopy, and blood tests. there are many less severe potential causes for your symptoms, like irritable bowel syndrome, food intolerances, anxiety, and more. of course, it's important to discuss any ongoing or new symptoms with your doctor who can consider their significance in your specific case."
N25,response_23,"i'm an ai language model, so i can't provide you a diagnosis to your symptoms. however, it seems like you've had extensive tests done that would typically help identify serious conditions like pancreatic cancer or other gi issues. if all of these tests were normal and were done in the last year, it's likely that your symptoms are due to a less serious condition.

irritable bowel syndrome (ibs), chronic pancreatitis, food intolerance, stress, and anxiety can cause the symptoms you're describing. you mentioned anxiety and it can indeed manifest as physical symptoms, including gi ones.

also, minor weight fluctuations are normal and the weight loss you mentioned is not significantly large. it could also be related to your increased water intake and the diarrhea you're experiencing.

still, it's important that you maintain communication with your healthcare provider. if the diarrhea persists, or if you continue to lose weight without trying, make sure to let them know. only a professional healthcare provider can help with the interpretation of your symptoms and the results of your tests.

please note that this advice is intended to be general in nature, and specific causes may not apply to your situation. always consult with a healthcare provider for accurate information."
N25,response_24,"i'm an ai and can't diagnose illness, but the tests you've listed here are typically part of the process to rule out many kinds of diseases, including cancers. if your doctor hasn't mentioned any areas of concern from these tests, that's generally reassuring.

that being said, your symptoms (diarrhea, floating stools, etc.) could be due to a number of different conditions. this could include irritable bowel syndrome, inflammatory bowel disease, a food intolerance, or a gastrointestinal infection, among others. 

your weight loss could potentially be due to your increased water intake and diarrhea. however, unexplained weight loss can be one symptom that doctors look for when determining whether or not they think a person has cancer. although in your case, having conducted such extensive tests, if they were all showing normal results, cancer might be less likely.

again, i'm an ai, and not a doctor so please discuss your symptoms and concerns with a healthcare professional. they've been thoroughly testing you, so they will have a much better understanding of your personal health situation. be sure to let your doctor know if your symptoms continue or get worse."
N25,response_25,"i'm an ai language model and not a doctor, but from a general perspective, it's important to note that anxiety can indeed exacerbate gastrointestinal symptoms. the tests you mentioned are comprehensive for diagnosing many gastrointestinal disorders and malignancies. if these came back negative, it's less likely that your symptoms are due to a severe issue like cancer, especially if these tests were conducted recently.

however, your symptoms can point to many other conditions that are not necessarily cancer, like irritable bowel syndrome (ibs), inflammatory bowel disease (ibd), malabsorption disorders like celiac disease (though you were tested for this), or food intolerances. psychological stressors, including anxiety, can also cause similar symptoms.

the minimal weight loss you mentioned could be related to your increased bowel movements. nevertheless, any sudden change in weight or persistent symptoms should be discussed with your doctor. it's also worth mentioning any lifestyle changes you've experienced, like diet alterations, exercise routines, or increased stress levels, as these can impact digestive health too.

remember to also discuss the increase in your water intake and urination with your doctor.

lastly, smoking is a notable risk factor for several diseases including cancer. if you're worried about your health, it would be beneficial to consider quitting or reducing your smoking habit.

keep in mind this is not medical advice. always consult with a healthcare professional or primary care provider for any health concerns you have."
