question_id,response_id,response
N151,response_1,"i'm an ai language model and not a doctor, but i'd strongly suggest getting medical attention for this. it is possible that you could have an infection from the nail wound, which might be causing systemic symptoms like back pain, chills, and nausea. additionally, you should also inform your doctor about your last tetanus shot being 7-8 years ago, as tetanus can be a serious concern in wounds caused by objects like nails. it's always better to play safe when it comes to your health, so i recommend going to an emergency room or immediate care center as soon as possible."
N151,response_2,"i'm an ai language model and while i can't provide an official medical diagnosis, your symptoms could be cause for concern, especially given the context of stepping on a nail. tetanus, also known as lockjaw, is a bacterial infection that can be contracted through puncture wounds, like from stepping on a nail. symptoms of tetanus can include stiff muscles, difficulty swallowing, fever, and sweating. however, your symptoms might also be related to another type of infection or an unrelated illness. regardless, since puncture wounds can lead to serious infection, it's important to have contact with a healthcare professional. tetanus is very serious but also rare, especially in people who have been vaccinated. you should contact your healthcare professional to discuss the wound and your current symptoms for proper advice."
N151,response_3,"i'm an ai developed by openai, not a doctor, but based on your description it sounds like you could possibly have an infection. this could be localized to your foot or systemic (spread throughout your body), which could potentially be serious. 

nausea, fever, and chills are all common symptoms of a systemic infection. another possibility is tetanus, especially if the nail was rusty. tetanus symptoms can include muscle stiffness and spasms, and could potentially be serious, although usually symptoms start in the jaw. 

regardless, any time a nail penetrates deeply into your body (especially through a shoe, which can carry bacteria), there's a risk of a serious infection. it would be a good idea to seek medical attention as soon as possible. if these symptoms continue or worsen, visit the er. 

this advice is intended to be general in nature, and specific causes may not apply to your situation. always consult with a healthcare provider for appropriate examination, diagnosis, and treatment."
N151,response_4,"i'm an ai and not a doctor, but based on the injury and the symptoms you're describing, i would strongly suggest seeking immediate medical attention. while i can't possibly diagnose you, these symptoms may indicate a severe infection like tetanus-- which requires urgent medical treatment. also, remember tetanus shots only last for about 10 years, and it's highly recommended to get a booster shot after an injury from something like a rusty nail."
N151,response_5,"i'm an ai and not a doctor, but the symptoms you're describing like chills and nausea may be related to an infection from the nail injury, especially if it's not properly treated. this could potentially be serious, as the hardware nail could be tainted with bacteria or even tetanus, especially since it sounds like your tetanus shot might be out of date (generally it's recommended to get one every 10 years, or sooner in the case of a penetrating wound). it's important you seek medical attention promptly. please contact your healthcare provider immediately or visit the er to be on the safe side."
N151,response_6,"i'm an ai language model and not a doctor, but based on the information you provided, it would be a good idea to seek immediate medical attention. 

stepping on a nail can lead to a puncture wound which can lead to infections including tetanus, especially if your last shot was several years ago. tetanus is a serious bacterial infection that affects the nervous system and can cause muscle stiffness and spasms.

symptoms such as a sore back, chills, and nausea, though they might be unrelated, could also potentially be indicative of tetanus or another kind of infection. keep in mind that tetanus symptoms can take time to develop, typically 7 to 10 days after exposure, but they can appear anywhere from a few days to several months after the wound occurred. 

it's very important to go to the er or visit a healthcare professional to discuss these symptoms and get an evaluation. they might need to administer a tetanus shot and give appropriate antibiotics if necessary."
N151,response_7,"i'm an ai language model developed by openai and, though i'm not a doctor, i can share some advice based on general health knowledge. tetanus is a risk after a wound from a nail, especially if it was dirty or rusty. with your last vaccination about 7-8 years ago, you are likely still protected, as tetanus boosters are generally recommended every 10 years. that said, the symptoms you're describing (nausea, chills, sore back) could fit a variety of conditions, not only tetanus. 

it's possible the symptoms are unrelated to the foot injury or they could be signs of an infection. if you have symptoms like redness, swelling, increased pain, or pus at the wound site, then it's important to get checked immediately by a healthcare professional. even without these signs, given your systemic symptoms, it might be a good idea to reach out to a healthcare provider for advice. they might want to physically examine you and possibly order tests to find out what's going on. 

please don't delay seeking professional medical advice based on internet information. the priority is keeping you safe and healthy."
N151,response_8,"i'm an ai and not a doctor, but i can advise you to please seek immediate medical attention. the nail puncture creates a risk of tetanus, especially given the time since your last shot, and your symptoms may potentially indicate an infection. you should get this checked out immediately, particularly because you're developing systemic symptoms such as chills, nausea, and back pain. er is highly advised. also, in the future, any sort of deep wound due to rusty or dirty objects should be seen by a doctor immediately.

in addition to a boost of tetanus immunization, you might also need an antibiotic and wound care. don't delay the treatment and take care. yet, make sure to reach out to a healthcare professional for accurate information. this is only advice and should not be used as a final diagnosis."
N151,response_9,"i'm an ai language model and not a doctor, but it's concerning that you're experiencing these symptoms following a deep puncture wound from a nail. while it's possible you're just experiencing a virus or independent illness, these symptoms could be related to a serious infection such as tetanus, especially if you aren't up-to-date on your vaccine. it's very important that you seek medical attention immediately, ideally visiting the emergency room. the sooner you seek treatment, the better your chances of a full recovery. additionally, note down all symptoms you've experienced since the injury and their timeline to give the doctors a clear case history."
N151,response_10,"i'm an ai language model, not a doctor, but i can tell you that symptoms like yours need immediate medical attention. we can't rule out the possibility that you may have contracted an infection from the nail, which could potentially cause serious complications if left untreated. infections like tetanus or septicemia are rare, but potentially serious in an event like this. plus, your symptoms are concerning: soreness or pain near the wound, fever, chills and nausea. you should seek medical attention immediately. please remember this advice is not a substitute for professional medical advice."
N151,response_11,"i'm an ai language model and while this is not a substitute for professional medical advice, your symptoms may indicate an infection is setting in from the nail wound. this could be serious, since an untreated infection can spread and become life-threatening. i would highly recommend getting medical attention as soon as possible, either at an er or urgent care center. if your back soreness is severe, is getting worse, or causes any weakness or numbness in your legs, go to the er immediately as these symptoms can indicate a medical emergency."
N151,response_12,"it's difficult to provide medical advice without seeing you in person, but your symptoms might be concerning. the kind of injury you described could potentially cause an infection, including tetanus, especially if it has been a while since your last tetanus shot. the symptoms you're describing, especially the chills and nausea, could suggest your body is fighting an infection. considering this, it would be best to get checked out by a doctor as soon as possible. go to an urgent care clinic or an er at the first sign of infection (fever, increasing redness, swelling, or pus).

keep in mind this advice is intended to be general in nature, it's recommended to consult with a healthcare provider for accurate information."
N151,response_13,"i'm an ai developed by openai and not a doctor, but i would still advise seeking medical attention. tetanus is a serious bacterial infection that can be contracted from wounds caused by objects such as nails or contaminated soil. you mention having your last shot 7-8 years ago, and vaccination typically offers protection for about 10 years, but you had a high-risk injury (puncture wound). your symptoms may not be related but it's important to consider all factors. symptoms of tetanus can include muscle stiffness (especially in the jaw and neck) trouble swallowing, restlessness and irritability, and fever. it may not be an emergency, but a visit to a doctor or urgent care is prudent. your doctor will be best able to diagnose and treat your symptom."
N151,response_14,"i'm an ai language model and while i can't replace a doctor's advice, i can tell you that your symptoms might be concerning. the injury with a potentially rusty nail could harbor bacteria that may cause an infection. tetanus shot also needs to be updated every 10 years. since you are already experiencing symptoms like a sore back, chills and nausea, these might be signs of an infection. it's possible that these symptoms are unrelated to the nail puncture, but since there is a potential for a serious problem like tetanus, you should seek medical attention immediately. please visit an er or urgent care facility. it's always better to be safe, your health is important!"
N151,response_15,"i'm an ai language model, not a doctor, but it sounds like you might be experiencing symptoms of tetanus. the bacteria causing tetanus is usually introduced into the body through a wound contaminated by dirt, soil, or feces; stepping on a nail could have introduced this bacteria. symptoms typically develop between 4 days and 3 weeks after infection, and can include muscle stiffness (often starting in the jaw and neck), difficulty swallowing, fever, sweating, elevated heart rate, and high blood pressure.

given your present symptoms, it is best to seek medical attention immediately. tetanus is a serious disease that can result in death if not promptly treated. supportive therapy, wound care, and medications to control symptoms may be provided, but prevention through vaccination is the best approach. please go to the er immediately."
N151,response_16,"i'm an ai developed by openai and while i'm here to provide general health advice, you should always consult a healthcare provider in your area for advice, especially in emergencies.

a nail puncture can introduce bacteria into the body, and can potentially cause infections, including tetanus. tetanus bacteria can cause severe muscle stiffness and spasms, typically beginning in the jaw (which is why tetanus is sometimes called lockjaw). it could also be possible for the bacteria to cause symptoms throughout the body like you are experiencing, such as chills and nausea, but these are less common for a tetanus infection.

other more generic types of infection could result from a puncture wound and may cause similar symptoms. 

given your symptoms, it's important you seek medical attention right away, especially since you can't remember exactly when your last tetanus shot was and because these could be the symptoms of an infection. tetanus is an emergency condition requiring prompt medical intervention."
N151,response_17,"i'm an ai language model, not a doctor, but given your symptoms associated with a puncture wound, it's extremely vital to seek immediate professional medical care. even if the symptoms aren't directly caused by your injury, it could be an unrelated issue that needs to be checked out. 

you described general feelings of unwellness, chills and nausea, which could be a sign of an infection. though tetanus shots generally provide protection for about 10 years, it's always best to confirm with a healthcare provider that you don't need a booster, particularly when faced with a potential exposure like stepping on a nail.

your recent change in wellbeing combined with your injury necessitates professional medical consultation. while waiting to see a doctor, closely monitor your symptoms. if you experience increasing pain, redness, or swelling, or new symptoms such as fever or bleeding, go to the er immediately. do remember that this advice is not a diagnosis, and the best course of action is to consult a healthcare provider."
N151,response_18,"i'm an ai developed by openai and while i'm not able to provide medical advice, i can tell you that stepping on a nail can potentially lead to serious infections, including tetanus, especially if you're not up-to-date on your tetanus vaccination. the symptoms you're experiencing, such as back pain, chills, and nausea, could be signs of an infection. the safest course of action is for you to seek immediate medical attention. please contact a healthcare professional or go to your nearest er as soon as possible. ensure to tell them about your injury and provide full details about your symptoms. it's always better to be safe than sorry when it comes to potential infections."
N151,response_19,"i'm an ai language model and not a doctor, but based on your description, it sounds like you might be experiencing symptoms which could be related to an infection, possibly tetanus, especially if you haven't had a shot in the last 10 years. tetanus is often associated with puncture wounds, like stepping on a nail. symptoms can include muscle stiffness and spasms, which could explain the back pain. flu-like symptoms, such as chills and nausea, can also be signs of systemic infection. 

however, other conditions could also potentially cause these symptoms. ultimately, i think it would be wise to get medical attention given your puncture wound and the development of new symptoms. meanwhile, try to keep the wound clean, well-dressed, and monitor for any signs of local infection, like redness, swelling, and pus. reach out to a healthcare professional or go to the er. they'll be able to provide an accurate diagnosis and treatment plan."
N151,response_20,"i'm an ai language model and not a doctor, but i can give you some general advice based on your situation. symptoms such as a sore back, chills, and feeling nauseous could be a sign of a range of health problems, and they may actually be related to your foot injury. certain symptoms such as fever, redness, swelling, or pus from the wound could indicate an infection, and can require medical attention. it's also worth noting that a risk of tetanus exists for puncture wounds like yours, especially if you haven't been vaccinated in the past 10 years - i.e., a tetanus booster might be necessary. please get in touch with a healthcare provider to discuss your symptoms, so they can give you a more accurate diagnosis or treatment plan."
N151,response_21,"i'm an ai language model and not a doctor, but your symptoms could be related to an infection, possibly even tetanus, which can result from a puncture wound like the one you have. although tetanus is rare, it can be serious if it develops. symptoms include muscle stiffness or spasms, difficulty swallowing, fever, and sweating. it's important to get medical advice as quickly as possible if you're displaying signs of illness after a puncture wound, especially given that it's been a while since your last tetanus shot. please seek emergency medical attention to ensure you get appropriate care."
N151,response_22,"i'm an ai language model, not a doctor, but it's possible that a puncture wound from a rusty object like a nail could potentially lead to an infection or even tetanus, which could theoretically cause the symptoms you're describing. if you haven't had a tetanus shot in the last 5 years (which it seems you haven't), a tetanus booster may be necessary. this is especially the case if the puncture wound is deep, which it sounds like it may have been in your case.

tetanus symptoms can emerge anywhere from 3 days to three weeks after the injury occurs and can include muscle stiffness, difficulty swallowing, fever, and sweating. 

since your symptoms are worsening after stepping on a rusty nail, it would be a good idea to seek medical attention as soon as possible to rule out serious conditions like tetanus or deep tissue infections. if you're experiencing severe back pain and other flu-like symptoms as you've mentioned, i would highly recommend you go to the er or contact a healthcare professional right away. 

please make sure to emphasize the puncture wound from a rusty nail when you seek medical care as it will change their approach to treatment and care. 

just remember: this advice is intended only as a guideline. you should seek professional medical care as soon as possible given your symptoms and recent injury."
N151,response_23,"i'm an ai developed by openai and i can provide general advice, but i cannot substitute professional medical advice. stepping on a nail can lead to serious infections like tetanus, especially if you haven't had a booster shot in the last 10 years. the symptoms you are experiencing may or may not be related, but given that you could be at risk of infection, it's better to be safe than sorry. contact urgent medical help right away, such as your doctor, a local urgent care clinic, or the er. this way, you can be properly examined and treated if necessary. a medical professional is best suited to evaluate your symptoms in context."
N151,response_24,"i'm an ai, not a doctor, but i would highly recommend seeking immediate medical attention. stepping on a dirty nail can lead to an infection, including tetanus, especially if your last shot was quite some time ago. the symptoms you're presenting may be related and it is better to go to the er to be safe. also, remember to update your tetanus shot every 10 years, especially if you're working in an environment where you may be exposed to potential injuries involving dirty objects. please contact a healthcare professional asap."
N151,response_25,"i'm an ai language model, not a doctor, but what you're describing might be symptoms of a severe infection, such as tetanus, which can be contracted through a puncture wound like a nail in the foot. you should definitely seek urgent medical attention to ensure you get proper treatment as soon as possible."
