question_id,response_id,response
N127,response_1,"using smelling salts doesn't seem to be the best approach to waking up. they work by causing irritation to the membranes of the nose and lungs, which triggers an inhalation reflex due to the discomfort. while they can certainly wake you up, it's not exactly a pleasant or gentle way to do so.

instead, consider using multiple alarms or placing your alarm across the room so that you have to get out of bed to turn it off. 

you should also look at improving your sleep hygiene. this includes factors such as reducing exposure to screens before bed, ensuring your sleeping environment is dark and quiet, and trying to go to bed and wake up at the same times every day. 

additionally, consider your caffeine intake - if you consume a lot of caffeine, try reducing your intake or avoiding caffeine in the afternoon and evening as it can interfere with your ability to fall asleep.

finally, while you might like to sleep only 5 hours per night, it's generally recommended to try to get 7-9 hours of sleep per night - more if your day is physically or mentally demanding - such as during exam periods. you might find that getting more sleep actually improves your cognitive function and ability to wake up on time. 

it's always best to speak with a healthcare professional before starting any new health regimen. if you're really struggling with sleep, it may be worth speaking with a doctor or a sleep specialist for tailored advice."
N127,response_2,"using smelling salts to wake up is not a recommended method. regular use of smelling salts for something as simple as waking up can produce harmful side effects (irritation of the respiratory tract, burns to the mucous membrane etc) and potentially cause a dependency on the salts to wake up. it's much safer to maintain a regular sleep schedule, engage in physical activity during the day, limit caffeine, and keep the sleeping environment dark and quiet to encourage quality sleep. if you are struggling to wake up in the morning to study, it may be worth considering changing your study schedule to better suit your natural sleep patterns (perhaps you are more alert in the evenings). if problems persist, it might be worth discussing with a healthcare provider as it could be a symptom of an underlying issue."
N127,response_3,"smelling salts (ammonia inhalants) are typically used to awaken people who have fainted or to revive athletes who have been knocked out. however, these are not meant to be a regular tool to help you wake up as they work by releasing ammonia gas which irritates the nasal and lung membranes when inhaled, thereby stimulating the muscles that control breathing and getting the heart to pump more blood. this can cause undue stress to the system if used for a prolonged period. 

for a healthy person, such as yourself, ensuring you get a good night's rest is the best way to wake up feeling refreshed, however, as a temporary fix, they won't cause any lasting harm if used in moderation. 

if you're finding it difficult to wake up, it would be much better for your overall health to try and address the reasons why you're finding it hard to get out of bed in the morning. could you try adjusting your evening routine so you're getting more rest or perhaps getting tested for sleep disorders? another solution could be to place your alarm clock across the room from your bed - that way, you'll have to get out of bed to turn it off.

remember, this advice doesn't replace face-to-face medical advice and you should contact your doctor if you're concerned about any health issues. good luck with your exams."
N127,response_4,"it's generally safe for a healthy individual to use smelling salts (ammonia inhalants) occasionally, but they should not be relied upon as a primary means of waking up. these can give a quick jolt to the nervous system when inhaled. however, frequent use may lead to dependence and potentially harm your respiratory system over time. 

your situation seems more related to sleep hygiene practices, stress, and possibly lifestyle factors. it would be more beneficial in the long term to address these underlying issues. try to maintain regular bedtime and wake time schedules, create a sleep-friendly environment, avoid caffeine and alcohol close to bedtime, and don't engage in mentally or physically stimulating activities close to bedtime.

if you feel that you're not getting quality sleep or have unexplained daytime fatigue, consider seeking advice from a healthcare provider. they may want to evaluate you for sleep disorders such as sleep apnea, insomnia, or others. 

it's also worth considering the impact of your smoking, even though it is occasional. nicotine is a stimulant and can disrupt sleep, particularly if you smoke close to bedtime. 

lastly, look into stress-management techniques, such as relaxation exercises, meditation, or yoga. these can all help improve quality of sleep."
N127,response_5,"smelling salts can help you regain alertness, but they're normally used in emergency situations, such as when an athlete is knocked unconscious, not as a sleep aid.

regular use of smelling salts can cause breathing problems and can be harmful to the lungs, the lining of the nose, and the whole respiratory system. there are potential side effects like headache, nausea, high blood pressure, and pulmonary edema (fluid buildup in the lungs), which can lead to serious complications.

it's recommended to improve your sleep routine or hygiene first. try different strategies to wake up on time, such as setting multiple alarms, moving the alarm across the room so you have to physically get up to turn it off, or using a wake-up light that mimics sunrise to gradually wake you up. cutting back on alcohol, caffeine, and big meals late at night can also help.

if you're finding it really difficult to wake up despite getting enough hours of sleep, it's a good idea to consult a healthcare provider to rule out any underlining health condition such as sleep apnea, depression, or hypothyroidism. 

lastly, consider talking to a healthcare provider about safer, more sustainable options for staying awake and alert, such as caffeine or better sleep practices, and remember, the best way to function at your best is to get enough sleep regularly."
N127,response_6,"while smelling salts can act as a stimulant, it may not be the best choice for regular use, especially if it's only to wake up in the morning. prolonged use of smelling salts can lead to respiratory issues such as bronchitis or lung damage. 

if you are struggling to wake up on schedule, the best way to fix this is to follow a steady sleep schedule and practice healthy sleep hygiene. this includes making your sleeping area conducive to sleep, avoiding stimulants like caffeine and nicotine before bed, and turning off electronic devices at least a half-hour before bedtime. 

another option is to use multiple alarms – for example you can set an alarm on your phone and also use a separate digital clock or alarm clock. if you place these alarms across the room from your bed, it will force you to physically get up to turn them off, which may help to break the habit of going back to sleep after waking up.

finally, remember the importance of getting enough sleep. while you may feel like you operate well on five hours, many people actually need between seven and nine hours a night. lack of proper rest can have a significant impact on memory, mood, and cognitive function, all of which are important aspects for studying and doing well on exams. make sure you're giving yourself enough downtime and rest during your studying schedule. lack of sleep can increase stress levels, which isn't helpful during exams.
  
however, if you really wish to use something to wake up, consider a light-based alarm clock. these simulate sunrise and can help reset your body's internal clock. you can try using one of these in addition to maintaining good sleep hygiene."
N127,response_7,"while smelling salts can be used to wake you up, it's not really a recommended method for a couple of reasons. first, their primary use is for immediate recovery of consciousness or alertness following a faint or momentary loss of consciousness - it's a bit extreme for just trying to wake up in the morning. second, while they aren't overly dangerous, they can cause side effects like nausea, high blood pressure, and lung damage if used regularly.

rather than resorting to smelling salts, you might want to look into different strategies to make waking up easier. for example, putting your alarm clock across the room from your bed might force you to physically get up to turn it off. this might help break the habit of going back to sleep once you wake up.

given your current sleep schedule, you may want to also consider if you're getting enough sleep for your body. although you said that your preferred average sleep is 5 hours, the general recommendation for adults is 7-9 hours per night. during periods of intense studying (like for finals), your body and brain may require more sleep than usual. 

in conclusion, you should try to regularly incorporate healthier sleeping habits. but if you still need to wake up in an emergency situation, smelling salts could be considered as an option. however, it's not ideal for regular use."
N127,response_8,"in theory, smelling salts could effectively help wake you up since they trigger inhalation and alertness through an involuntary reflex, but they're typically used for rousing consciousness after a person has fainted or had a severe concussion. they're not meant as a daily tool for alertness. more importantly, frequent use might lead to harmful effects like respiratory issues.

thus, relying on smelling salts on a daily basis to wake up is not advisable. instead, a more sustainable approach would be to improve your sleep hygiene and daily routine. try going to bed and getting up at the same time every day, even on weekends, to set your body's internal clock.

also, do check if using stimulants like smelling salts would be against any rules set by your university, you wouldn't want to be caught out unnecessarily.

if you still struggle with sleepiness even after improving your sleep hygiene, you might want to consider getting a medical opinion to rule out any possible sleep disorders or other health issues."
N127,response_9,"smelling salts, which are typically composed of ammonia gas, can shock the body into increased wakefulness due to an involuntary reflex that speeds up the heart rate and triggers inhalation. however, it's not intended for regular use as a wake-up aid. though it might not cause direct harm, regular usage could potentially lead to an increased risk of developing breathing problems or respiratory tract injury. 

furthermore, increasing wakefulness isn't the same as being well-rested. this method might prevent you from getting back into bed, but it won't replace the restorative benefits of sleep, including memory consolidation and physical recovery, which you critically need especially when you're busy with your final exams.

here are some healthier strategies: 

1. set up a consistent sleep schedule. your body has an internal clock and hormones that control sleepiness and wakefulness. go to bed and wake up at the same time every day to program your body's internal clock. 

2. avoid electronics before bed. the blue light emitted by your phone, tablet, computer, or tv is disruptive. you can control your exposure to such light with blue light glasses, or by using device settings to block blue light. 

3. create a better sleep environment. make sure your room is dark, quiet, cool, and comfortable. use earplugs, a sleep mask, or a white noise machine if necessary.

4. avoid caffeine and other stimulants close to bedtime. 

5. incorporate physical activity into your day. regular physical activity can help you fall asleep faster and enjoy deeper sleep.

consulting a trained professional, such as a doctor or psychotherapist who specializes in sleep disorders, could also provide you with significant help."
N127,response_10,"as a disclaimer, this advice should not be taken as a substitute for professional healthcare advice.

using smelling salts to rouse yourself after inadequate or disturbed sleep is not probably the healthiest or most sustainable solution. smelling salts work by releasing ammonia gas, which triggers an inhalation reflex by irritating the mucous membranes of the nose and lungs. it should be reserved for emergencies due to its potential harm to respiratory mucosa.

instead, consider building a consistent and healthy sleep-wake schedule. try and give yourself more time to sleep (7-9 hours is the recommended for adults), which will potentially make waking up a bit easier. practice good sleep hygiene: create a relaxing bedtime routine, go to bed and wake up at the same time each day, and avoid caffeine and electronic screens before bedtime. also consider using a gradual wake up alarm clock or, if you are really struggling, you might want to speak with a sleep specialist.

lastly but importantly, try to avoid dependence on cigarettes, no matter how infrequently, as the negative health implications are well documented. make sure to take breaks, eat healthily and stay hydrated while studying, and remember that it's okay to take care of yourself even during stressful times."
N127,response_11,"smelling salts, or ammonia inhalants, work by releasing ammonia gas that triggers an inhalation reflex by irritating the mucous membranes of the nose and lungs. while it can be a quick way to wake up, using smelling salts is not generally recommended as a regular method of waking up from sleep.

repeated use of smelling salts can cause nausea, headaches, and even damage your respiratory tract, and are primarily used in emergency situations to revive or awaken someone who is fainting or unconscious. 

instead of resorting to this method, try some of these other strategies:
- set multiple alarms, spaced a few minutes apart, to ensure you wake up.
- place your alarm clock or phone on the other side of the room, so you have to get out of bed to turn it off.
- ensure adequate hydration and maintaining a balanced diet, rich in proteins, fruits, and vegetables. improper diet and dehydration often cause fatigue, making it more challenging to wake up.
- limit caffeine intake late in the day as it can interfere with your sleep.
- try to regulate your sleep schedule, going to bed at the same time each night and waking up at the same time each morning.
- avoid stimulating activities (like intense studying) right before bed to help your brain relax and prepare for sleep.

keep in mind that while you may feel okay on less sleep in the short-term, long-term sleep deprivation can have serious impacts on your physical and mental health, including impaired memory and cognitive function – something you certainly don't need during your final exams! despite the pressure of studies, getting adequate rest is vital. try to aim for 7-9 hours of sleep per night as recommended by health professionals. 

if you continue to struggle with waking up or feel excessively tired during the day, you may want to consider talking to a healthcare professional. they can provide additional advice and help rule out any underlying sleep disorders or health issues."
N127,response_12,"from a health perspective, using smelling salts to wake yourself up isn't an ideal or recommended method. smelling salts work by releasing ammonia gas, which triggers an inhalation reflex (by irritating the lining of your nose and lungs) causing the muscles that control breathing to work faster. historically, they have been used to revive people who have fainted. 

however, as a regular method for waking up, it could be potentially dangerous. if misused, it could harm your respiratory system. also, this isn't a solution to the underlying problem which is irregular sleep patterns and difficulty adhering to a wakening schedule. 

making changes to improve your sleep hygiene would be a safer and more sustainable solution in the long term. here are some tips:

1. maintain a regular sleep routine: try to go to bed and wake up at the same time every day, even on weekends.
2. create a restful environment: make sure your bedroom is dark, quiet, and set at a comfortable temperature.
3. physical activity: regular physical activity can help you fall asleep faster and get better sleep.
4. avoid caffeine and nicotine: these substances can interfere with your ability to fall asleep.
5. limit daytime naps: long naps can interfere with night-time sleep. 

as it's the exam time stress that seems to be disrupting your sleep, you can also incorporate some stress management techniques like mindfulness, meditation and deep breathing exercises. good luck with your exams!"
N127,response_13,"while smelling salts could indeed be used to promote alertness and wakefulness, it's generally not recommended as a long-term or regular strategy for waking up. this is mainly due to potential side effects such as respiratory difficulties, skin and eye irritation, or development of a dependency on the salts to wake up.

smelling salts work by causing the inhaler to experience an inhalation reflex in response to their strong, often unpleasant odor, which results in a sharper state of alertness or wakefulness. this is why they are often used in situations where severe drowsiness or unconsciousness needs to be rapidly overcome, such as in sports or emergency situations.

however, if you're having difficulties waking up in the morning, it's recommended to first identify and try to rectify any underlying issues that might be causing this. are you getting enough quality, restful sleep? are you maintaining a consistent sleep schedule, including on weekends? are you taking steps to stay physically healthy, such as getting regular exercise and eating a balanced diet? if these or other potential problems are addressed, you may find your difficulties with waking up in the morning also improve.

if you're still experiencing difficulties waking up after trying these strategies, you may want to consider consulting a healthcare professional or a sleep specialist. other strategies such as practicing good sleep hygiene, avoiding caffeine or alcohol close to bedtime, and using light-based alarms or other natural methods of waking up are also recommended.

in short, while smelling salts could potentially help you wake up, they're not recommended as a long-term or habitual waking mechanism, especially when other potentially more effective and healthier options are available."
N127,response_14,"smelling salts can indeed make you more alert and awake due to the strong and unpleasant smell they emit. they work by irritating the mucous membranes of the nose and lungs, which leads to an inhalation reflex. this triggers the sympathetic nervous system - our 'fight or flight' response - creating a surge of adrenaline.

however, smelling salts are generally used in situations where someone has lost consciousness or experienced light-headedness, such as in contact sports or emergency situations. their habitual use as an 'alarm system' might not be ideal. here's why:

1. tolerance: over time, your body may get familiar with the sensation that smelling salts provide, reducing their effectiveness.

2. dependence: by relying on a strong stimulant to wake up, you may fall into a habit that's hard to break.

3. irritation: habitual use of smelling salts can irritate the respiratory tract, potentially leading to problems such as nasal congestion, coughing, or even lung infection.

so instead of looking for quick solutions like smelling salts, it would be more beneficial to get to the root of your wakefulness issue. here are a few suggestions that could help:

1. sleep schedule: try going to bed and waking up at the same time every day – yes, even on weekends. this can help regulate your body's internal clock and could help you start waking up more naturally.

2. avoid electronics: try to stay away from electronic devices (tv, smartphone, computer, tablet, etc.) for at least an hour before going to bed. the blue light emitted can interfere with your sleep.

3. healthy eating habits: try avoiding large meals, caffeine, and alcohol close to bedtime. these can disrupt your sleep cycle.

4. exercise: regular physical activity can help you fall asleep faster and deepen your sleep.

5. restrict napping: long daytime naps can interfere with nighttime sleep.

in conclusion, smelling salts are not a long-term solution for sleep-related issues. you should consider adopting healthier sleep habits. if these don't help, a healthcare provider should be consulted. they can help identify underlying causes and recommend appropriate treatments. good luck with your exams!"
N127,response_15,"while smelling salts can certainly create a physical reaction that might help wake you up, their long-term use is not widely recommended. they work by releasing small amounts of ammonia gas, which irritates the nasal and lung membranes and triggers an inhalation reflex. this can help wake you up quickly, but can also be unpleasant and may even lead to health complications with prolonged use.

improving sleep hygiene and finding sustainable, healthy ways to stay awake are typically better solutions. try to go to bed earlier, avoid screens an hour before bed, try relaxation techniques to fall asleep, eat breakfast right after waking to help set your internal clock, and keep a consistent sleep schedule, even on weekends. 

consider consulting with a healthcare provider or sleep specialist for personalized advice. despite your busy schedule and need to study, remember that adequate sleep, good nutrition, and regular physical activity are fundamental to cognitive performance and general health. 

proper sleep is essential especially during exam periods for better memory recall and concentration. it is recommended to aim for 7-9 hours of sleep per night for young adults. 

remember, substances such as smelling salts are a short-term solution and often come with risks. they should typically only be used under appropriate supervision, such as in athletic or emergency situations. therefore, it might not be advisable for you to use smelling salts to wake yourself up."
N127,response_16,"consulting a healthcare provider is always the best action for health queries. 

however, from a general perspective, reliance on smelling salts is not a recommended practice. they work by creating a sharp, temporary influx of oxygen into your bloodstream that may jolt you awake, but this can also cause light-headedness or other discomfort.

sleeping 5 hours per night, especially when under the stress of exams, may not be enough for your body and mind to properly rest, hence the struggle to wake up. it's generally recommended that adults get 7-9 hours of sleep per night. 

for healthier wake-up practices, consider maintaining a regular sleep schedule, avoiding stimulating activities before bedtime like phones or tv, setting several alarms out of arm's reach, using alarms with different sounds or vibration patterns, or having a family member or friend wake you. 

if you continue to struggle with sleep/wake cycles, consider consulting with a sleep specialist or a healthcare provider. they can conduct a comprehensive evaluation, and offer guidance tailored to your unique circumstances. 

while some people might be tempted to use smelling salts, these are typically used in emergency situations to revive or stimulate consciousness. they are not intended for routine use, and may have potential side effects. 

it would be more beneficial to try and develop better sleep habits, and perhaps discuss with a healthcare professional about your difficulty waking up, as it could be indicative of a more serious underlying health issue, such as sleep apnea. 

please remember that proper sleep hygiene and habits can aid not only your bodily health, but also your cognitive performance."
N127,response_17,"smelling salts, which are ammonia inhalants, do not cause physical harm when used occasionally but they certainly can irritate the nostrils and lungs if used frequently. they're typically used in sports to provide an extra boost of alertness or to help someone recover from fainting. 

i wouldn't recommend the regular use of smelling salts to wake up. they work by irritating your nostrils, which can lead to nasal damage over a long period of time. remember, the active ingredient in smelling salts is ammonia which is a harsh substance. 

maybe you should consider other wake-up methods such as having a friend call you, using an alarm clock that gradually increases in volume, or getting an alarm clock with a light that gradually increases in intensity to simulate a sunrise. 

also, 5 hours of sleep might not be enough during this high-stress period with your final year law exams. it's recommended that you aim for 7-9 hours per night. adequate sleep may also improve your ability to concentrate and enhance your academic performance. 

limit your intake of caffeine, particularly in the afternoon and evening, and bit of exercise each day can also be beneficial in helping to regulate sleep patterns. however, remember to consult with a healthcare professional or a sleep specialist for further advice regarding this issue."
